1.1	Ἀργιλεωνὶς ἡ Βρασίδου μήτηρ, τελευτήσαντος αὐτῇ τοῦ υἱοῦ, ὼς; παραγενόμενοί τινες τῶν Ἀμφιπολιτῶν εἰς Σπάρτην ἧκον πρὸς αὐτήν, ἠρώτησεν εἰ καλῶς καὶ ἀξίως τῆς Σπάρτης ὁ υἱὸς ἐτελεύτα· μεγαλυνόντων δʼ ἐκείνων ἐκείνων *: ἐκεῖνον cf. p. 219d καὶ λεγόντων ἄριστον ἐν τοῖς τοιούτοις ἔργοις ἁπάντων Λακεδαιμονίων εἶναι, εἶπεν ὦ ξένοι, καλὸς μὲν ἦν κἀγαθὸς ὁ παῖς μου, πολλοὺς δʼ ἄνδρας Λακεδαίμων ἔχει τήνου κάρρονας. 
2.1	Γοργὼ βασιλέως Κλεομένους θυγάτηρ, Ἀρισταγόρου τοῦ Μιλησίου παρακαλοῦντος αὐτὸν ἐπὶ τὸν πρὸς βασιλέα πόλεμον ὑπὲρ Ἰώνων καὶ ὑπισχνουμένου χρημάτων πλῆθος καὶ ὅσῳ ἀντέλεγε πλείονα προστιθέντος, καταφθερεῖ σε ἔφη ὦ πάτερ τὸ ξενύλλιον, ἐὰν μὴ τάχιον αὐτὸν τῆς οἰκίας ἐκβάλῃς. 
2.2	προστάξαντος δέ ποτε αὐτῇ τοῦ πατρὸς δοῦναί τινι σῖτον εἰς μισθοῦ λόγον, καὶ προστιθέντος ἐδίδαξε γάρ με τὸν οἶνον χρηστὸν ποιεῖν, οὐκοῦν, ὦ πάτερ ἔφη ὃ τʼ οἶνος πλείων ἐκποθήσεται καὶ οἱ πίνοντες θρυπτικώτεροι καὶ χείρονες ἔσονται. 
2.3	τὸν δʼ Ἀρισταγόραν ὑπό τινος τῶν οἰκετῶν ὑποδούμενον θεασαμένη πάτερ ἔφη ὁ ξένος χεῖρας οὐκ ἔχει. 
2.4	ξένου δέ τινος μαλακῶς καὶ καὶ X. Mihi μαλακῶς glossema vid. σχολῇ προσάγοντος, προσάγοντος *: προσαγαγόντος παρωσαμένη αὐτὸν οὐκ ἄπει ἐντεῦθεν εἶπεν οὐδὲ οὐδὲ *: οὔτε τὰ τῆς γυναικὸς δυνάμενος;ʼ 
2.5	ἐρωτηθεῖσα δὲ ὑπό τινος Ἀττικῆς διὰ τί ὑμεῖς ἄρχετε μόναι τῶν ἀνδρῶν αἱ Λάκαιναι; Λάκαιναι *: λάκωναι ὅτι ἔφη καί τίκτομεν μόναι ἄνδρας. 
2.6	Προτρεπομένη δὲ τὸν ἄνδρα Λεωνίδαν ἐξιόντα εἰς Θερμοπύλας ἄξιον τῆς Σπάρτης φανῆναι, ἠρώτα τί χρὴ πράττειν· ὁ δὲ ἔφη ἀγαθὸν γαμεῖν καὶ ἀγαθά τίκτειν. 
3.1	Γυρτιάς, Ἀκροτάτου ποτὲ τοῦ θυγατριδοῦ αὐτῆς ἔκ τινος τῶν παίδων μάχης πολλὰς πληγὰς λαβόντος καὶ ἀπενεχθέντος οἴκαδε ὡς τεθνηκότος, κλαιόντων τῶν οἰκείων τε καὶ γνωρίμων, οὐ σιωπήσετε; ἔφη· ἔδειξε γὰρ οἵου αἵματος ἦν, καὶ οὐκ ἔφη δεῖν τοὺς ἀγαθοὺς βοᾶν ἀλλʼ ἰατρεύεσθαι .
3.2	ὅτε ἄγγελος ἦλθεν ἐκ Κρήτης τὸν Ἀκροτάτου θάνατον ἀπαγγέλλων, οὐκ ἔμελλεν ἔφη πρὸς τοὺς πολεμίους ἥκων ἢ αὐτὸς ὑπʼ ἐκείνων ἀποθανεῖσθαι ἢ κατακανεῖν κατακανεῖν ] Cobetus: κατακάνειν ἐκείνους; ἥδιον δʼ ἀκούειν ὅτι ἀπέθανε καὶ ἑαυτῆς καὶ τῆς πόλεως ἀξίως καὶ τῶν προγόνων, ἢ εἰ ἔζη τὸν ἅπαντα χρόνον κακὸς ὤν. 
4.1	Δαματρία τὸν υἱὸν δειλὸν καὶ ἀνάξιον ἑαυτῆς ἀκούσασα, παραγενόμενον ἀνεῖλε τὸ δʼ ἐπίγραμμα ἐπʼ αὐτῆς τόδε τὸν παραβάντα νόμους Δαμάτριον ἔκτανε μάτηρ, Anthol. Pal. VII 433 ἁ Λακεδαιμονία τὸν Λακεδαιμόνιον. 
5.1	ἑτέρα Λάκαινα τὸν υἱὸν λιποτακτήσαντα λιποτακτήσαντα *: λειποτακτήσαντα ὡς ἀνάξιον τῆς πατρίδος ἀνεῖλεν, εἰποῦσα οὐκ ἐμὸν τὸ φίτυμα ἐφʼ ἧς τὸ ἐπίγραμμα τόδε ʼἔρρε κακὸν φίτυμα διὰ σκότος, οὗ διὰ μῖσος Εὐρώτας δειλαῖς μηδʼ ἐλάφοισι ῥέοι. Anthol. Pal. VII 433 ἀχρεῖον σκυλάκευμα, κακὰ μερίς, ἔρρε ποθʼ Ἅιδαν, ἔρρε· τὸ μὴ Σπάρτας ἄξιον οὐδʼ ἔτεκον. 
5.2	ἄλλη ἀκούσασα τὸν υἱὸν ἐν παρατάξει πεσόντα ἔφη δειλοὶ κλαιέσθωσαν· ἐγὼ δέ σε, τέκνον, ἄδακρυς καὶ ἱλαρὰ θάπτω τὸν καὶ ἐμὸν καὶ Λακεδαιμόνιον. 
5.3	ἀκούσασά τις τὸν υἱὸν σεσῳσμένον καὶ πεφευγότα ἐκ τῶν πολεμίων, γράφει αὐτῷ κακὰ φάμα τευ κακκέχυται· ἢ ταύταν νῦν ἔκνιψαι ἢ μὴ ἔσο. 
5.4	ἄλλη, τῶν υἱῶν φυγόντων ἐκ μάχης καὶ παραγενομένων ὡς αὐτήν, ποῖ ποῖ *: ποῦ φησὶν ἥκετε δραπετεύσαντες, κακὰ ἀνδράποδα; ἢ δεῦρο ὅθεν ἐξέδυτε καταδυσόμενοι ἀνασυραμένη καὶ ἐπιδείξασα αὐτοῖς τὴν κοιλίαν. τὴν κοιλίαν ] om. mei. codd.
5.5	προσάγοντά τις τὸν υἱὸν θεασαμένη ἐπύθετο τί πράσσει ἡ πατρίς· εἰπόντος δὲ πάντες ἀπολώλασι, κεραμίδα ἄρασα ἐπαφῆκεν αὐτῷ καὶ ἀνεῖλεν, εἰποῦσα σὲ οὖν κακάγγελον ἔπεμψαν ἡμῖν;ʼ 
5.6	διηγουμένου τινὸς τῇ μητρὶ γενναῖον θάνατον τοῦ ἀδελφοῦ, εἶτʼ οὐκ αἰσχρόν εἶπε τῆς τοιαύτης συνοδίας ἀποτυχείν 
5.7	ἐκπέμψασά τις τοὺς υἱοὺς αὑτῆς πέντε ὄντας ἐπὶ πόλεμον, ἐν τοῖς προαστείοις εἱστήκει καραδοκοῦσα τί ἐκ τῆς μάχης ἀποβήσοιτο· ὡς· δὲ παραγενόμενός τις πυθομένῃ ἀπήγγειλε τοὺς παῖδας ἅπαντας τετελευτηκέναι, ἀλλʼ οὐ τοῦτο ἐπυθόμην εἶπε κακὸν ἀνδράποδον, ἀλλὰ τί πράσσει ἡ πατρίς. φήσαντος δὲ ὅτι νικᾷ, ἀσμένη τοίνυν εἶπε δέχομαι καὶ τὸν τῶν παίδων θάνατον 
5.8	Θάπτουσά τις τὸν υἱόν, ὡς γραΐδιον εὐτελὲς προσελθὸν αὐτῇ ὦ γύναι τᾶς τύχας εἶπε, νὴ τὼ σιὼ ἀλλὰ τᾶς καλᾶς γʼ ἔφη· καὶ γὰρ αὐτὸν οὗ οὗ *: ὧν ἕνεκεν ἔτεκον, ἵνʼ ὑπὲρ τᾶς Σπάρτας ἀποθάνῃ, τοῦτὸ μοι συνέβη 
5.9	Σεμνυνομένης γυναικός τινος Ἰωνικῆς ἐπί τινι τῶν ἑαυτῆς ὑφασμάτων ὄντι πολυτελεῖ, Λάκαινα ἐπιδείξασα τοὺς τέσσαρας υἱοὺς ὄντας κοσμιωτάτους, τοιαῦτα ἔφη δεῖ εἶναι τὰ τῆς καλῆς καὶ ἀγαθῆς γυναικὸς ἔργα καὶ ἐπὶ τούτοις ἐπαίρεσθαι καὶ μεγαλαυχεῖν. καὶ μεγαλαυχεῖν ] deleverim
5.10	ἄλλη ἀκούσασα περὶ τοῦ υἱοῦ, ὡς κακῶς ἐπὶ τῆς ξένης ἀναστρέφοιτο, ἔγραψε κακά τευ τευ Cobetus: τοι φάμα κακκέχυται· ἢ ταύταν ἢ ταύταν * ταύταν ἀπόθευ ἢ μὴ ἔσο. 
5.11	παραπλησίως δὲ καὶ Χίων φυγάδες; ἐλθόντες εἰς Σπάρτην πολλὰ Παιδαρήτου κατηγόρουν· μεταπεμψαμένη δὲ αὐτὸν ἡ μήτηρ αὐτοῦ Τελευτία καὶ ἀκούσασα ὧν ἐνεκάλουν, ἐπεὶ ἐδόκει αὐτῇ ἁμαρτάνειν ὁ υἱός, ἐπέστειλεν ἁ μάτηρ Παιδαρήτῳ. ἢ βελτίονα πρᾶσσε ἢ αὖθι μένε, ἀπογνοὺς τὰν ἐς Σπάρταν σωτηρίαν. 
5.12	ἑτέρα ἐπʼ ἀδικήματι τῷ παιδὶ κρινομένῳ τέκνον εἶπεν ἢ τᾶς αἰτίας; ἢ σεαυτὸν τοῦ ζῆν ἢ τὰς αἰτίας - ζῆν ] malim ἢ τᾶς αἰτίας σεαυτὸν ἢ τοῦ ζῆν ἀπόλυσον. 
5.13	ἄλλη χωλὸν υἱὸν ἐπὶ παράταξιν προπέμπουσα, τέκνον εἶπε κατὰ βῆμα τῆς ἀρετῆς μέμνησο. 
5.14	ἄλλη, τοῦ παιδὸς αὐτῇ ἀφικομένου ἀπὸ παρατάξεως τετρωμένου τὸν πόδα καὶ σφόδρα ἀλγοῦντος, ἐὰν τῆς ἀρετῆς εἶπε μέμνῃ, ὦ τέκνον, καὶ ἄπονος ἔσῃ καὶ θαρρήσεις. 
5.15	Λάκων τρωθεὶς ἐν πολέμῳ καὶ βαδίζειν μὴ δυνάμενος, τετραποδιστὶ ὥδευεν. αἰσχυνομένῳ δʼ αὐτῷ ἐπὶ τῷ ἐπὶ τῷ W: ἐν γελοίῳ ἡ μήτηρ καὶ πόσῳ βέλτιον, ὦ τέκνον εἶπε μᾶλλον ἐπὶ τῇ ἀνδρείᾳ γεγηθέναι ἢ αἰσχύνεσθαι ἐπὶ γέλωτι ἀνοήτῳ; 
5.16	ἄλλη προσαναδιδοῦσα τῷ παιδὶ τὴν ἀσπίδα καὶ παρακελευομένη τέκνον ἔφη ἢ ταύταν ἢ ἐπὶ ταύτας. 
5.17	ἄλλη προϊόντι τῷ υἱῷ ἐπὶ πόλεμον ἀναδιδοῦσα τὴν ἀσπίδα ταύτην ἔφη ὁ πατήρ σοι ἀεὶ ἔσῳζε· καὶ σὺ οὖν ἢ ταύτην σῷζε ἢ μὴ ἔσο. 
5.18	ἄλλη πρὸς τὸν υἱὸν λέγοντα μικρὸν ἔχειν τὸ ξίφος εἶπε καὶ βῆμα πρόσθες. 
5.19	ἄλλη ἀκούσασα, ὅτι ὁ υἱὸς αὐτῆς ἐν παρατάξει ἀνδραγαθήσας ἀπέθανεν, ἐμὸς γὰρ ἦν εἶπε· περὶ δὲ τοῦ ἑτέρου τοῦ ἑτέρου ] του ἑτέρου W πυθομένη ὅτι ἀποδειλιάσας σῴζεται, οὐ γὰρ ἦν ἐμός ἔφη.
5.20	ἑτέρα ἀκούσασα ὅτι ὁ υἱὸς αὑτῆς τέθνηκεν ἐν μάχῃ καθάπερ ἐτέτακτο κάτθετεαὐτόν ἔφη, ἀναπληρωσάτω δὲ τὴν ἐκείνου τάξιν ὁ ἀδελφός. 
5.21	ἄλλη πομπὴν τελοῦσα πάνδημον ἤκουσεν ἐπὶ τῆς παρατάξεως νικᾶν τὸν υἱόν, ἐκ δὲ τῶν τραυμάτων πολλῶν γενομένων θνήσκειν. οὐ περιελομένη οὖν τὸν στέφανον, ἀλλὰ σεμνυνθεῖσα πρὸς τὰς πλησίον εἶπεν ὡς πολλῷ κάλλιον, ὦ φίλαι, ἐστὶν ἐν παρατάξει νικῶντα τελευτᾶν ἢ τὰ Ὀλύμπια περιγινόμενον ζῆν. 
5.22	διηγουμένου τινὸς τῇ ἀδελφῇ γενναῖον θάνατον τοῦ παιδὸς αὐτῆς, ἐκείνη εἶπεν ὅτι ὅσον ἐπʼ ἐκείνῳ γέγηθα, τοσοῦτον ἐπὶ σοὶ ἄχθομαι, ἐναρέτου συνοδίας ἀπολειφθέντι. 
5.23	Λακαίνῃ τις προσέπεμψεν, εἰ φθορᾷ συνεπινεύει. ἡ δʼ ἔφη παῖς μὲν οὖσα ἔμαθον τῷ πατρὶ πείθεσθαι, καὶ τοῦτο ἔπραξα· γυνὴ δὲ γενομένη τῷ ἀνδρί· εἰ οὖν δίκαιά με παρακαλεῖ, τούτῳ φανερὸν ποιησάτω πρῶτον. 
5.24	παρθένος πενιχρὰ ἐρωτηθεῖσα τίνα δίδωσι τῷ γαμοῦντι προῖκα, τὴν πάτριον ἔφη σωφροσύνην .
5.25	Λάκαινα ἐρωτηθεῖσα εἰ ἀνδρὶ προσελήλυθεν, οὐκ ἐγώ εἶπεν ἀλλʼ ὁ ἀνὴρ ἐμοί. 
5.26	κρύφα τις διαπαρθενευθεῖσα καὶ διαφθείρασα τὸ βρέφος οὕτως ἐνεκαρτέρησε μηδεμίαν προενεγκαμένη φωνήν, ὥστε καὶ τὸν πατέρα καὶ ἄλλους πλησίον ὄντας λαθεῖν ἀποκυήσασα· τὸ γὰρ μέγεθος τῶν ἀλγηδόνων τῇ ἀσχημοσύνῃ τὸ εὔσχημον εὔχξημον *: ἄσξημον . Ordo verborum vid. esse: τὸ εὔσχημον προσπεσὸν τῇ ἀσχημ. ἐνίκ. τὸ μέγ. τ. ἀλγ. προσπεσὸν ἐνίκησε.
5.27	Λάκαινα πιπρασκομένη καὶ ἐρωτωμένη τί ἐπίσταται, ἔφη πιστὰ ἦμεν. 
5.28	ἄλλη αἰχμαλωτευθεῖσα καὶ ἐρωτωμένη παραπλησίως εὖ οἰκεῖν οἶκον ἔφη.
5.29	ἐρωτηθεῖσά τις ὑπό τινος, εἰ ἔσται ἀγαθή, ἂν αὐτὴν ἀγοράσῃ, εἶπε κἂν μὴ ἀγοράσῃς. 
5.30	ἄλλη πιπρασκομένη, τοῦ κήρυκος πυνθανομένου τί ἐπίσταται, ἐλευθέρα εἶπεν ἦμεν. ὡς δὲ ὁ ὠνησάμενος προσέτασσέ τινα αὐτῇ οὐχ ἁρμόζοντα ἐλευθέρᾳ, εἰποῦσα οἰμώξῃ φθονήσας σεαυτῷ τοιούτου κτήματος ἐξήγαγεν ἑαυτήν.
