20	ταῦτα σχεδόν ἐστι τοῦ μύθου τὰ κεφάλαια τῶν δυσφημοτάτων ἐξαιρεθέντων, οἷόν ἐστι τὸ περὶ τὸν ʼ· Ὥρου τὸν τοῦ Ὡρου ? διαμελισμὸν καὶ τὸν Ἴσιδος ἀποκεφαλισμόν. ὅτι μὲν οὖν, εἰ ταῦτα περὶ τῆς μακαρίας καὶ ἀφθάρτου φύσεως, καθʼ ἣν μάλιστα νοεῖται τὸ θεῖον, ὡς ἀληθῶς πραχθέντα καὶ συμπεσόντα δοξάζουσι καὶ λέγουσιν, ἀποπτύσαι δεῖ καὶ καθήρασθαι στόμα στόμα R: τὸ στόμα κατʼ Αἰσχύλον, Αἰσχύλον ] Nauck. p. 84 οὐδὲν δεῖ λέγειν πρὸς; σέ. καὶ γὰρ αὐτὴ δυσκολαίνεις τοῖς οὕτω παρανόμους καὶ βαρβάρους δόξας περὶ θεῶν ἔχουσιν. ὅτι δʼ οὐκ ἔοικε ταῦτα κομιδῇ μυθεύμασιν ἀραιοῖς καὶ διακένοις πλάσμασιν, οἷα ποιηταὶ καὶ λογογράφοι καθάπερ οἱ ἀράχναι γεννῶντες ἀφʼ ἑαυτῶν ἀπʼ ἀρχῆς ἀνυποθέτου ἀπʼ α0ρχῆς ἀνυποθέτου Marklandus: ἀπαρξὰς ἀνυποθέτους ὑφαίνουσι ὑφαίνουσι ] συνυφαίνουσι ? καὶ ἀποτείνουσιν, ἀλλʼ ἔχει τινὰς ἱστορίας καὶ παθῶν διηγήσεις, οἶσθʼ οἶσθʼ * αὐτή, καὶ καθάπερ οἱ μαθηματικοὶ τὴν ἶριν ἔμφασιν εἶναι τοῦ ἡλίου λέγουσι ποικιλλομένην τῇ πρὸς τὸ νέφος ἀναχωρήσει ἀναχρωρήσει ] ἀνακλάσει R. ἀναχρώσει W τῆς ὄψεως, οὕτως μῦθος ἐνταῦθα λόγου τινὸς; ἔμφασίς ἐστιν ἀνακλῶντος ἐπʼ ἄλλα τὴν διάνοιαν, ὡς ὑποδηλοῦσιν αἵ τε θυσίαι τὸ πένθιμον ἔχουσαι καὶ σκυθρωπὸν ἐμφαινόμενον, αἵ τε τῶν ναῶν διαθέσεις πῆ μὲν ἀνειμένων εἰς πτερὰ καὶ δρόμους ὑπαιθρίους καὶ καθαρούς, πῆ δὲ κρυπτὰ καὶ σκότια κατὰ γῆς ἐχόντων στολιστήρια Θηβαίοις Θηβαίοις ] θηκαίοις Bouhierus ἐοικότα καὶ σηκοῖς· καὶ σηκοῖς ] fort. σηκοῖς , ut sit θηκαίοις ἐοικότα σηκοῖς οὐχ ἥκιστα δʼ ἡ τῶν Ὀσιρείων δόξα, πολλαχοῦ κεῖσθαι λεγομένου τοῦ σώματος· τὴν τε γὰρ Διοχίτην Διοχίτην Holwerda: ἐχειτῖνον . cf. St. Byzantius ὀνομάζεσθαι πολίχνην λέγουσιν, ὡς μόνην τὸν ἀληθινὸν ἔχουσαν, ἒν τʼ Ἀβύδῳ τοὺς εὐδαίμονας τῶν Αἰγυπτίων καὶ δυνατοὺς μάλιστα θάπτεσθαι, φιλοτιμουμένους ὁμοτάφους; εἶναι τοῦ σώματος Ὀσίριδος, ἐν δὲ Μέμφει τρέφεσθαι τὸν Ἆπιν, εἴδωλον ὄντα τῆς ἐκείνου ψυχῆς, ὅπου καὶ τὸ σῶμα κεῖσθαι· καὶ τὴν μὲν πόλιν οἱ μὲν ὅρμον ἀγαθῶν ἑρμηνεύουσιν, οἱ δʼ ἰδίως ἰδίως W: ὡς τάφον Ὀσίριδος. τὴν δὲ πρὸς Φιλαῖς Φίλαις Squirius: πύλας νιστιτάνην νιστιτάνην ] νησίδα τὴν Aldina. νησίδα Duebnerus. Scribendum vid. νησῖδα **, ut nomen insulae suppleatur ἄλλως μὲν ἄβατον ἅπασι καὶ ἀπροσπέλαστον εἶναι καὶ μηδʼ ὄρνιθας· ἐπʼ αὐτὴν καταίρειν καταίρειν X: καρτερεῖν μηδʼ ἰχθῦς προσπελάζειν, ἑνὶ δὲ καιρῷ τοὺς ἱερεῖς διαβαίνοντας ἐναγίζειν καὶ καταστέφειν τὸ σῆμα μηθίδης μηθίδης ] μίνθης ? φυτῷ περισκιαζόμενον, ὑπεραίροντι πάσης ἐλαίας μέγεθος. 
21	Εὔδοξος δέ, πολλῶν τάφων ἐν Αἰγύπτῳ λεγομένων, ἐν Βουσίριδι τὸ σῶμα κεῖσθαι· καὶ γὰρ πατρίδα ταύτην γεγονέναι τοῦ Ὀσίριδος οὐκέτι μέντοι λόγου δεῖσθαι τὴν Ταφόσιριν· αὐτὸ γὰρ φράζειν τοὔνομα ταφὴν Ὀσίριδος. αἰνῶ αἰνῶ ] ἐῶ W δὲ τομὴν ξύλου καὶ σχίσιν λίνου καὶ χοὰς χεομένας διὰ τὸ πολλὰ τῶν μυστικῶν ἀναμεμῖχθαι τούτοις. οὐ μόνον δὲ τούτων τούτων ] τούτου Baxterus οἱ ἱερεῖς λέγουσιν, ἀλλὰ καὶ τῶν ἄλλων θεῶν, ὅσοι μὴ ἀγέννητοι ἀγένητοι ? μηδʼ ἄφθαρτοι, τὰ μὲν σώματα παρʼ αὐτοῖς κεῖσθαι καμόντα καὶ θεραπεύεσθαι, τὰς δὲ ψυχὰς ἐν οὐρανῷ λάμπειν ἄστρα, καὶ καλεῖσθαι κύνα μὲν τὴν Ἴσιδος ὑφʼ Ἑλλήνων, ὑπʼ Αἰγυπτίων δὲ Σῶθιν Ὠρίωνα δὲ τὴν Ὥρου, τὴν Ὡρου X: τὸν ὥρον τὴν δὲ Τυφῶνος ἄρκτον, εἰς δὲ τὰς ταφὰς ταφὰς Salmasius: γραφὰς τῶν τιμωμένων ζῴων τοὺς μὲν ἄλλους συντεταγμένα τελεῖν, μόνους δὲ μὴ διδόναι τοὺς Θηβαΐδα κατοικοῦντας, ὡς θνητὸν θεὸν οὐδένα νομίζοντας, ἀλλʼ ὃν ἀλλʼ ἢ ὃν ? καλοῦσιν αὐτοὶ Κνήφ, ἀγέννητον ἀγένητον ? ὄντα καὶ ἀθάνατον. 
22	πολλῶν δὲ τοιούτων λεγομένων καὶ δεικνυμένων, οἱ μὲν οἰόμενοι βασιλέων ταῦτα καὶ τυράννων, διʼ ἀρετὴν ὑπερφέρουσαν ἢ δύναμιν ἀξίωμα τῇ δόξῃ τῇ δόξῃ ] ἢ δόξαν Duebnerus θεότητος ἐπιγραψαμένων εἶτα χρησαμένων τύχαις, ἔργα καὶ πάθη δεινὰ καὶ μεγάλα διαμνημονεύεσθαι, ῥᾴστῃ μὲν ἀποδράσει τοῦ λόγου χρῶνται καὶ τὸ δύσφημον οὐ φαύλως ἀπὸ τῶν θεῶν ἐπʼ ἀνθρώπους μεταφέρουσι, καὶ ταύτας ἔχουσιν ἀπὸ τῶν ἱστορουμένων βοηθείας. ἱστοροῦσι γὰρ Αἰγύπτιοι τὸν μὲν Ἑρμῆν τῷ σώματι γενέσθαι γαλιάγκωνα, τὸν δὲ Τυφῶνα τῇ χρόᾳ πυρρόν, λευκὸν δὲ τὸν Ὧρον καὶ μελάγχρουν τὸν Ὄσιριν, ὡς τῇ φύσει γεγονότας ἀνθρώπους. ἔτι δὲ καὶ στρατηγὸν ὀνομάζουσιν Ὄσιριν, καὶ κυβερνήτην Κάνωβον, οὗ φασιν ἐπώνυμον γεγονέναι τὸν ἀστέρα· καὶ τὸ πλοῖον, ὃ καλοῦσιν Ἕλληνες Ἀργώ, τῆς Ὀσίριδος νεὼς εἴδωλον ἐπὶ τιμῇ κατηστερισμένον, οὐ μακρὰν φέρεσθαι τοῦ Ὠρίωνος καὶ τοῦ Κυνός, ὧν τὸ μὲν Ὥρου τὸ τὸ - τὸ ] τὸν - τὸν R δʼ Ἴσιδος ἱερὸν Αἰγύπτιοι νομίζουσιν. 
23	ὀκνῶ δέ, μὴ τοῦτʼ τὰ ἀκίνητα κινεῖν καὶ πολεμεῖν οὐ τῷ πολλῷ χρόνῳ κατὰ Σιμωνίδην Σιμωνίδην ] Bergk. 3 p. 522 μόνον, πολλοῖς δʼ ἀνθρώπων ἔθνεσι καὶ γένεσι κατόχοις ὑπὸ τῆς πρὸς τοὺς θεοὺς τούτους ὁσιότητος, οὐδὲν ἀπολιπόντας ἐξ ἐξ ] τοῦ ἐξ Baxterus οὐρανοῦ μεταφέρειν ἐπὶ γῆν ὀνόματα τηλικαῦτα, καὶ τιμὴν καὶ πίστιν ὀλίγου δεῖν ἅπασιν ἐκ πρώτης γενέσεως ἐνδεδυκυῖαν ἐξιστάναι καὶ ἀναλύειν, μεγάλας μὲν τῷ ἀθέῳ λεῲ κλισιάδας ἀνοίγοντας καὶ ἐξανθρωπίζοντας ἐξανθρωπίζοντας Marklandus: ἐξανθρωπίζοντι τὰ θεῖα, λαμπρὰν δὲ τοῖς Εὐημέρου τοῦ Μεσσηνίου φενακισμοῖς παρρησίαν διδόντας, ὃς αὐτὸς ἀντίγραφα συνθεὶς ἀπίστου καὶ ἀνυπάρκτου μυθολογίας πᾶσαν ἀθεότητα κατασκεδάννυσι τῆς οἰκουμένης, τοὺς νομιζομένους θεοὺς πάντας ὁμαλῶς διαγράφων εἰς ὀνόματα ὀνόματα Baxterus: ὄνομα στρατηγῶν καὶ ναυάρχων καὶ βασιλέων ὡς δὴ πάλαι γεγονότων, ἐν δὲ Πάγχοντι γράμμασι χρυσοῖς ἀναγεγραμμένων, ἀναγεγραμμένων Salmasius: ἀναγεγραμμένοις οἷς οὔτε βάρβαρος οὐδεὶς οὔθʼ Ἕλλην, ἀλλὰ μόνος Εὐήμερος, ὡς ἔοικε, πλεύσας εἰς τοὺς μηδαμόθι γῆς γεγονότας μηδʼ ὄντας Παγχώους Παγχωόυς ] Παγχαίους ? καὶ Τριφύλλους ἐντετυχήκει. ἐντετύχηκε R 
24	 καίτοι μεγάλαι μὲν ὑμνοῦνται πράξεις ἐν Ἀσσυρίοις Σεμιράμιος, μεγάλαι δʼ αἱ Σεσώστριος ἐν Αἰγύπτῳ· Φρύγες δὲ μέχρι νῦν τὰ λαμπρὰ καὶ θαυμαστὰ τῶν ἔργων Μανικὰ καλοῦσι διὰ τὸ Μάνην Μάνην Salmasius: μάνιν τινὰ τῶν πάλαι βασιλέων ἀγαθὸν ἄνδρα καὶ δυνατὸν γενέσθαι παρʼ αὐτοῖς, ὃν ἔνιοι Μάσδην καλοῦσι· Κῦρος δὲ Πέρσας Μακεδόνας δʼ Ἀλέξανδρος ὀλίγου δεῖν ἐπὶ πέρας τῆς γῆς κρατοῦντας προήγαγον· ἀλλʼ ὄνομα καὶ μνήμην βασιλέων ἀγαθῶν ἔχουσιν. εἰ δέ τινες ἐξαρθέντες ἐξαρθέντες X: ἐξαρθέντες X: ἐξαιρεθέντες ὑπὸ μεγαλαυχίας ὥς φησιν ὁ Πλάτων Πλάτων ] Legg. p. 716 a ἅμα νεότητι καὶ ἀνοίᾳ ἀνοίᾳ Plato: ἀγνοίᾳ φλεγόμενοι τὴν ψυχὴν μεθʼ ὕβρεως ἐδέξαντο θεῶν ἐπωνυμίας καὶ ναῶν ἱδρύσεις, βραχὺν ἤνθησεν ἡ δόξα χρόνον, εἶτα κενότητα καὶ ἀλαζονείαν μετʼ ἀσεβείας καὶ παρανομίας προσοφλόντες. ὠκύμοροι καπνοῖο δίκην ἀρθέντες ἀπέπταν, Mullach. 1 p. 2 καὶ νῦν ὥσπερ ἀγώγιμοι δραπέται τῶν ἱερῶν καὶ τῶν βωμῶν ἀποσπασθέντες οὐδὲν ἀλλʼ ἢ τὰ μνήματα καὶ τοὺς τάφους ἔχουσιν. ὅθεν Ἀντίγονος ὁ γέρων, Ἑρμοδότου τινὸς ἐν ποιήμασιν αὐτὸν Ἡλίου ἡλίου ] Bergk. 3 p. 637 παῖδα καὶ θεὸν ἀναγορεύοντος, οὐ τοιαῦτά μοι εἶπεν ὁ λασανοφόρος σύνοιδεν εὖ δὲ καὶ Λύσιππος ὁ πλάστης Ἀπελλῆν ἐμέμψατο τὸν ζωγράφον, ὅτι τὴν Ἀλεξάνδρου γράφων εἰκόνα κεραυνὸν ἐνεχείρισεν αὐτὸς δὲ λόγχην, ἧς τὴν δόξαν οὐδὲ εἷς ἀφαιρήσεται χρόνος ἀληθινὴν καὶ ἰδίαν οὖσαν. 
25	βέλτιον οὖν οἱ τὰ περὶ τὸν Τυφῶνα καὶ Ὄσιριν καὶ Ἶσιν ἱστορούμενα μήτε θεῶν παθήματα μήτʼ ἀνθρώπων, ἀλλὰ δαιμόνων μεγάλων εἶναι νομίζοντες, οὓς οὓς X ex Euseb. Praep. Ev. 5, 5: ὡς καὶ Πλάτων καὶ Πυθαγόρας; καὶ Ξενοκράτης καὶ Χρύσιππος, ἑπόμενοι τοῖς πάλαι θεολόγοις, ἐρρωμενεστέρους μὲν ἀνθρώπων γεγονέναι λέγουσι καὶ πολὺ πολὺ Eusebius: πολλῇ τῇ δυνάμει τὴν φύσιν ὑπερφέροντας ἡμῶν, τὸ δὲ θεῖον οὐκ ἀμιγὲς οὐδʼ ἄκρατον ἔχοντας, ἀλλὰ καὶ ψυχῆς; φύσει καὶ σώματος· αἰσθήσει αἰσθήσει X: αἰσθήσει ἐν φύσει - αἰσθήσει ] φύσεως - αἰσθήσεως Baxterus συνειληχός, ἡδονὴν δεχόμενον δεχόμενον Eusebius: δεχομένην καὶ πόνον, καὶ ὅσα ταύταις ἐγγενόμενα ταῖς μεταβολαῖς πάθη τοὺς μὲν μᾶλλον τοὺς δʼ ἧττον ἐπιταράττει. γίγνονται γὰρ ὡς ἐν ἀνθρώποις, καὶ δαίμοσιν, ἀρετῆς διαφοραὶ καὶ κακίας. τὰ γὰρ Γιγαντικὰ καὶ Τιτανικὰ παρʼ Ἕλλησιν ᾀδόμενα καὶ Κρόνου Κρόνου ] πολλαὶ idem τινὲς X ex Eusebio: τινὸς τινὲς ἄθεσμοι πράξεις καὶ Πύθωνος ἀντιτάξεις πρὸς; Ἀπόλλωνα, φυγαί φυγαί X ex eodem: φθόγγοι τε Διονύσου καὶ πλάναι, Δήμητρος οὐδὲν ἀπολείπουσι τῶν Ὀσιριακῶν καὶ Τυφωνικῶν, ἄλλων θʼ ὧν πᾶσιν πᾶσιν ] παρὰ πᾶσιν Eusebius ἔξεστιν ἀνέδην μυθολογουμένων ἀκούειν· ὅσα τε μυστικοῖς ἱεροῖς περικαλυπτόμενα περικαλυπτόμενα ] παρακαλυπτόμενα idem καὶ τελεταῖς ἄρρητα διασῴζεται καὶ ἀθέατα πρὸς τοὺς πολλούς, ὅμοιον ἔχει λόγον. 
26	 ἀκούομεν δὲ καὶ Ὁμήρου τοὺς μὲν ἀγαθοὺς διαφόρως θεοειδέας ἑκάστοτε καλοῦντος καλοῦντος R καὶ ἀντιθέους καί θεῶν ἄπο μήδεʼ ἔχοντας· τῷ δʼ ἀπὸ τῶν δαιμόνων προσρήματι χρωμένου κοινῶς ἐπί τε χρηστῶν καὶ φαύλων, δαιμόνιε σχεδὸν ἐλθέ· τίη δειδίσσεαι οὕτως Home. N 810 Ἀργείους;ʼ καὶ πάλιν ἀλλʼ ὅτε δὴ τὸ τέταρτον ἐπέσσυτο δαίμονι ἶσος· id. E 438 καὶ δαιμονίη, τί νύ σε Πρίαμος Πριάμοιό τε παῖδες id. Δ 31 τόσσα κακὰ ῥέζουσιν, ὅ,τʼ ἀσπερχὲς μενεαίνεις Ἰλίου ἐξαλαπάξαι ἐυκτίμενον πτολίεθρον; ὡς τῶν δαιμόνων μικτὴν καὶ ἀνώμαλον φύσιν ἐχόντων καὶ προαίρεσιν. ὅθεν ὁ μὲν Πλάτων Πλάτων ] Legg. p. 717a Ὀλυμπίοις θεοῖς τὰ δεξιὰ καὶ περιττὰ τὰ δʼ ἀντίφωνα τούτων δαίμοσιν ἀποδίδωσιν. ὁ δὲ Ξενοκράτης καὶ τῶν ἡμερῶν τὰς ἀποφράδας καὶ τῶν ἑορτῶν, ὅσαι πληγάς τινας ἢ κοπετοὺς ἢ νηστείας ἢ δυσφημίας· ἢ αἰσχρολογίαν ἔχουσιν, οὔτε θεῶν τιμαῖς οὔτε δαιμόνων οἴεται προσήκειν χρηστῶν, ἀλλʼ εἶναι φύσεις ἐν τῷ περιέχοντι μεγάλας μὲν καὶ ἰσχυράς, δυστρόπους δὲ καὶ σκυθρωπάς, αἳ χαίρουσι τοῖς τοιούτοις, καὶ τυγχάνουσαι πρὸς οὐθὲν ἄλλο χεῖρον τρέπονται· τοὺς δὲ χρηστοὺς πάλιν καὶ ἀγαθοὺς ὅ θʼ Ἡσίοδος Ησίοδος ] OD 126 ἁγνοὺς δαίμονας καὶ φύλακας ἀνθρώπων προσαγορεύει, πλουτοδότας καὶ τοῦτο γέρας βασιλήιον ἔχοντας. ὅ τε Πλάτων Πλάτων ] Symp. p. 202 e ἑρμηνευτικὸν τὸ τοιοῦτον ὀνομάζει γένος καὶ διακονικὸν ἐν μέσῳ θεῶν καὶ ἀνθρώπων, εὐχὰς μὲν ἐπεῖ καὶ δεήσεις ἀνθρώπων ἀναπέμποντας, ἐκεῖθεν δὲ μαντεῖα δεῦρο καὶ δόσεις ἀγαθῶν φέροντας, Ἐμπεδοκλῆς Ἐμπεδοκλῆς ] Mullach 1 p. 2 δὲ καὶ δίκας φησὶ διδόναι τοὺς δαίμονας ὧν ἂν ἂν add. Duebnerus ex Eusebio ἐξαμάρτωσι καὶ πλημμελήσωσιν, αἰθέριον μὲν γάρ σφε μένος πόντονδε διώκει, πόντος δʼ ἐς χθονὸς οὖδας ἀπέπτυσε, γαῖα δʼ ἐς αὐγὰς αὐγὰς X: αὖθις ἠελίου ἀκάμαντος, ὁ δʼ αἰθέρος ἔμβαλε δίναις· ἄλλος δʼ ἐξ ἄλλου δέχεται, στυγέουσι δὲ πάντες· ἄχρι οὗ κολασθέντες οὕτω καὶ καθαρθέντες αὖθις τὴν κατὰ φύσιν χώραν καὶ τάξιν ἀπολάβωσι. 
27	 τούτων δὲ καὶ τῶν τοιούτων ἀδελφὰ λέγεσθαί φασι περὶ Τυφῶνος, ὡς δεινὰ μὲν ὑπὸ φθόνου καὶ δυσμενείας εἰργάσατο, καὶ πάντα πράγματα ταράξας ἐνέπλησε κακῶν γῆν ὁμοῦ τι τι R: τε πᾶσαν καὶ θάλασσαν, εἶτα δίκην ἔδωκεν. ἡ δὲ τιμωρὸς Ὀσίριδος ἀδελφὴ καὶ γυνὴ τὴν Τυφῶνος σβέσασα καὶ καταπαύσασα μανίαν καὶ λύσσαν οὐ περιεῖδε τοὺς; ἄθλους καὶ τοὺς ἀγῶνας, οὓς ἀνέτλη, καὶ πλάνας αὑτῆς· καὶ πολλὰ μὲν ἔργα σοφίας πολλὰ δʼ ἀνδρείας, ἀμνηστίαν ὑπολαβοῦσαν ὑπολαβοῦσαν M: ὑπολαβοῦσα καὶ σιωπήν, ἀλλὰ ταῖς ἁγιωτάταις· ἀναμίξασα τελεταῖς εἰκόνας καὶ ὑπονοίας καὶ μιμήματα μιμήματα Baxterus: μίμημα τῶν τότε παθημάτων, εὐσεβείας ὁμοῦ δίδαγμα καὶ παραμύθιον ἀνδράσι καὶ γυναιξὶν ὑπὸ συμφορῶν ἐχομένοις ὁμοίων καθωσίωσεν. αὐτὴ δὲ καὶ Ὄσιρις ἐκ δαιμόνων ἀγαθῶν διʼ ἀρετὴν ἀρετὴν R: ἀρετῆς εἰς θεοὺς μεταβαλόντες, ὡς ὕστερον Ἡρακλῆς καὶ Διόνυσος, ἅμα καὶ θεῶν καὶ δαιμόνων οὐκ ἀπὸ τρόπου μεμιγμένας τιμὰς ἔχουσι, πανταχοῦ μέν, ἐν δὲ τοῖς τοῖς X: τούτοις ὑπὲρ γῆν καὶ ὑπὲρ γῆν καὶ ] del. X ὑπὸ γῆν δυνάμενοι μέγιστον, οὐ γὰρ ἄλλον εἶναι Σάραπιν ἢ τὸν Πλούτωνά φασι, καὶ Ἶσιν τὴν τὴν ] ἢ τὴν R Περσέφασσαν, ὡς Ἀρχέμαχος Ἀρχέμαχος ] Mueller. 4 p. 215 εἴρηκεν ὁ Εὐβοεύς, καὶ ὁ Ποντικὸς Ἡρακλείδης Ἡερακλείδης X: ἡράκλειτος τὸ χρηστήριον ἐν Κανώβῳ Πλούτωνος ἡγούμενος εἶναι. 
28	Πτολεμαῖος δʼ ὁ Σωτὴρ ὄναρ εἶδε ὄναρ εἶδε Baxterus: ἀνεῖλε τὸν ἐν Σινώπῃ τοῦ Πλούτωνος κολοσσόν, οὐκ ἐπιστάμενος οὐδʼ ἑωρακὼς πρότερον οἷος τὴν μορφὴν ἦν, ἧν R κελεύοντα κομίσαι τὴν ταχίστην αὐτὸν εἰς Ἀλεξάνδρειαν. ἀγνοοῦντι δʼ αὐτῷ καὶ ἀποροῦντι, ποῦ καθίδρυται, καὶ διηγουμένῳ τοῖς φίλοις τὴν ὄψιν, εὑρέθη πολυπλανὴς πολυπλανὴς Duebnerus: πολυπλάνης ἄνθρωπος; ὄνομα Σωσίβιος, ἐν Σινώπῃ φάμενος ἑωρακέναι τοιοῦτον κολοσσόν, οἷον ὁ βασιλεὺς ἰδεῖν ἔδοξεν. ἔπεμψεν οὖν Σωτέλη καὶ Διονύσιον, Διονύσιον p. 981 a: διόνυσον οἳ χρόνῳ πολλῷ καὶ μόλις, οὐκ ἄνευ μέντοι θείας προνοίας , ἤγαγον ἐκκλέψαντες. ἐπεὶ δὲ κομισθεὶς; ὤφθη, συμβαλόντες οἱ περὶ Τιμόθεον τὸν ἐξηγητὴν καὶ Μανέθωνα τὸν Σεβεννύτην Πλούτωνος ὂν ἄγαλμα, τῷ Κερβέρῳ τεκμαιρόμενοι καὶ τῷ δράκοντι, πείθουσι τὸν Πτολεμαῖον, ὡς ἑτέρου θεῶν οὐδενὸς ἀλλὰ ἀλλὰ ] ἀλλʼ ἢ Σαράπιδός ἐστιν. οὐ γὰρ ἐκεῖθεν οὕτως οὕτως Marklandus: οὑτος ὀνομαζόμενος ἧκεν, ἀλλʼ εἰς Ἀλεξάνδρειαν κομισθεὶς τὸ παρʼ Αἰγυπτίοις ὄνομα τοῦ Πλούτωνος ἐκτήσατο τὸν Σάραπιν. καὶ μέντοι μέντοι ] add. τὰ Schellensius Ἡρακλείτου τοῦ φυσικοῦ λέγοντος Ἅιδης καὶ Διόνυσος ωὑτὸς ωὑτός W: οὗτος ὅτεῳ μαίνονται καὶ ληναΐζουσιν,ʼ ὅτεῳ - ληναϊζουσιν scripsi ex Clem. Alex. Protr. p. 30 Pott.: ὅτε οὐν - ληραίνουσιν εἰς ταύτην ὑπάγουσι τὴν δόξαν. οἱ γὰρ ἀξιοῦντες Ἅιδην λέγεσθαι τὸ σῶμα τῆς ψυχῆς οἷον παραφρονούσης καὶ μεθυούσης ἐν αὐτῷ, γλίσχρως ἀλληγοροῦσι. βέλτιον δὲ τὸν Ὄσιριν εἰς ταὐτὸ συνάγειν τῷ Διονύσῳ, τῷ τʼ Ὀσίριδι τὸν Σάραπιν, ὅτε τὴν φύσιν μετέβαλε, ταύτης τυχόντι τυχόντι Squirius: τυχόντα τῆς προσηγορίας;. διὸ πᾶσι κοινὸς ὁ Σάραπίς ἐστι, ὡς δὴ δὴ *: δὲ τὸν Ὄσιριν οἱ τῶν ἱερῶν μεταλαβόντες ἴσασιν. 
