63	ἐμφαίνει καὶ καὶ ] δὲ καὶ R τὸ σεῖστρον, ὅτι σείεσθαι δεῖ τὰ ὄντα καὶ μηδέποτε παύεσθαι φορᾶς, ἀλλʼ οἷον ἐξεγείρεσθαι καὶ κλονεῖσθαι καταδαρθάνοντα καὶ μαραινόμενα. τὸν γὰρ Τυφῶνά φασι τοῖς σείστροις ἀποτρέπειν καὶ ἀποκρούεσθαι, δηλοῦντες· ὅτι τῆς φθορᾶς συνδεούσης καὶ ἱστάσης, αὖθις ἀναλύει τὴν φύσιν καὶ ἀνίστησι διὰ τῆς κινήσεως ἡ γένεσις. τοῦ δὲ σείστρου περιφεροῦς ἄνωθεν ὄντος, ἡ ἁψὶς ἁψὶς Leonicus: ὄψις περιέχει τὰ σειόμενα τέτταρα. καὶ γὰρ ἡ γεννωμένη καὶ φθειρομένη μοῖρα τοῦ κόσμου περιέχεται μὲν ὑπὸ τῆς σεληνιακῆς σφαίρας, κινεῖται δʼ ἐν αὐτῇ πάντα καὶ μεταβάλλεται διὰ τῶν τεττάρων στοιχείων, πυρὸς καὶ γῆς καὶ ὕδατος καὶ ἀέρος. τῇ δʼ ἁψῖδι. τοῦ σείστρου κατὰ κορυφὴν ἐντορεύουσιν αἴλουρον ἀνθρώπου πρόσωπον ἔχοντα, κάτω δʼ ὑπὸ τὰ σειόμενα πῆ μὲν Ἴσιδος πῆ δὲ Νέφθυος πρόσωπον, αἰνιττόμενοι τοῖς μὲν προσώποις γένεσιν καὶ τελευτὴν αὗται γάρ εἰσι τῶν στοιχείων μεταβολαὶ καὶ κινήσεις, τῷ δʼ αἰλούρῳ τὴν σελήνην διὰ τὸ ποικίλον καὶ νυκτουργὸν καὶ γόνιμον τοῦ θηρίου. λέγεται γὰρ ἓν τίκτειν, εἶτα δύο καὶ τρία καὶ τέσσαρα καὶ πέντε· καὶ καθʼ ἓν οὕτως ἄχρι τῶν ἑπτὰ προστίθησιν, ὥστʼ ὀκτὼ καὶ εἴκοσι τὰ πάντα τίκτειν, ὅσα καὶ τῆς σελήνης φῶτʼ ἔστιν. τοῦτο μὲν οὖν ἴσως μυθωδέστερον αἱ δʼ ἐν τοῖς ὄμμασιν αὐτοῦ κόραι πληροῦσθαι μὲν καὶ πλατύνεσθαι δοκοῦσιν ἐν πανσελήνῳ, λεπτύνεσθαι δὲ καὶ μαραυγεῖν ἐν ταῖς μειώσεσι τοῦ ἄστρου. τῷ δʼ ἀνθρωπομόρφῳ τοῦ αἰλούρου τὸ νοερὸν καὶ λογικὸν ἐμφαίνεται τῶν περὶ τὴν σελήνην μεταβολῶν. 
64	συνελόντι δʼ εἰπεῖν οὔθʼ ὕδωρ οὔθʼ ἥλιον οὔτε γῆν οὔτʼ οὐρανὸν Ὄσιριν ἢ Ἶσιν ὀρθῶς ἔχει νομίζειν, οὐδὲ πῦρ Τυφῶνα πάλιν οὐδʼ οὐδὲ - οὐδʼ Halmius: οὔτε - οὔτʼ αὐχμὸν οὐδὲ θάλατταν, ἀλλʼ ἁπλῶς ὅσον ἐστὶν ἐν τούτοις ἄμετρον καὶ ἄτακτον ὑπερβολαῖς ἢ ἐνδείαις Τυφῶνι προσνέμοντες, τὸ δὲ κεκοσμημένον καὶ ἀγαθὸν καὶ ὠφέλιμον ὡς Ἴσιδος μὲν ἔργον εἰκόνα δὲ καὶ μίμημα καὶ λόγον Ὀσίριδος σεβόμενοι καὶ τιμῶντες, οὐκ ἂν ἁμαρτάνοιμεν. ἀλλὰ καὶ τὸν Εὔδοξον ἀπιστοῦντα παύσομεν καὶ διαποροῦντα, πῶς οὔτε Δήμητρι τῆς τῶν ἐρωτικῶν ἐπιμελείας μέτεστιν ἀλλʼ Ἴσιδι· τόν τε Διόνυσον οὔτε τὸν οὔτε τὸν *: οὐ τὸν Νεῖλον αὔξειν οὔτε τῶν τεθνηκότων ἄρχειν δυνάμενον. δυνάμενον ] διανοούμενον sc. Εὔδοξαν Marklandus ἑνὶ γὰρ λόγῳ κοινῷ τοὺς θεοὺς τούτους περὶ περὶ ] ἐπὶ R πᾶσαν ἀγαθοῦ μοῖραν ἡγούμεθα τετάχθαι· καὶ πᾶν ὅσον ἔνεστι τῇ φύσει καλὸν καὶ ἀγαθὸν διὰ τούτους ὑπάρχειν, τὸν μὲν διδόντα τὰς ἀρχάς, τὴν δʼ ὑποδεχομένην καὶ διανέμουσαν. 
65	οὕτω δὲ καὶ τοῖς πολλοῖς καὶ φορτικοῖς ἐπιχειρήσομεν, εἴτε ταῖς καθʼ ὥραν μεταβολαῖς τοῦ περιέχοντος εἴτε ταῖς καρπῶν γενέσεσι καὶ σποραῖς καὶ ἀρότοις χαίρουσι τὰ περὶ τοὺς θεοὺς τούτους τούτοις Madvigius: τούτους συνοικειοῦντες , καὶ λέγοντες θάπτεσθαι μὲν τὸν Ὄσιριν, ὅτε κρύπτεται τῇ γῇ τῇ γῇ Bentleius: τῆς γῆς σπειρόμενος; ὁ καρπός, αὖθις δʼ ἀναβιοῦσθαι καὶ ἀναφαίνεσθαι, ὅτε βλαστήσεως ἀρχή. διὸ καὶ λέγεσθαι τὴν Ἶσιν αἰσθομένην ὅτι κύει περιάψασθαι φυλακτήριον ἕκτῃ μηνὸς ἱσταμένου Φαωφί· τίκτεσθαι δὲ τὸν Ἁρποκράτην περὶ τροπὰς χειμερινὰς ἀτελῆ καὶ νεαρὸν ἐν τοῖς προανθοῦσι καὶ προβλαστάνουσι. διὸ καὶ φακῶν αὐτῷ φυομένων ἀπαρχὰς ἐπιφέρουσι, τὰς δὲ λοχείους ἡμέρας ἑορτάζειν ἑορτάζειν ] ἑορτάζει sc. Ἁρποκράτης Madvigius μετὰ τὴν ἐαρινὴν ἰσημερίαν. ταῦτα γὰρ ἀκούοντες ἀγαπῶσι καὶ πιστεύουσιν, αὐτόθεν ἐκ τῶν προχείρων καὶ συνήθων τὸ πιθανὸν ἕλκοντες. 
66	καὶ δεινὸν οὐδέν, ἂν πρῶτον μὲν ἡμῖν τοὺς θεοὺς φυλάττωσι κοινοὺς καὶ μὴ ποιῶσιν Αἰγυπτίων ἰδίους, μηδὲ Νεῖλον ἥν τε Νεῖλος ἄρδει μόνην χώραν τοῖς ὀνόμασι τούτοις καταλαμβάνοντες, μηδʼ ἕλη μηδὲ λωτοὺς μὴ θεοποιίαν μὴ θεοποιίαν ] corrupta. μηδὲ χέδροπα Emperius. Fort. μηδʼ ὁποιοῦν vel potius μηδʼ ὁτιοῦν λέγοντες ἀποστερῶσι μεγάλων θεῶν τοὺς ἄλλους ἀνθρώπους, οἷς Νεῖλος μὲν οὐκ ἔστιν οὐδὲ Βοῦτος οὐδὲ Μέμφις· Ἶσιν δὲ καὶ τοὺς περὶ αὐτὴν θεοὺς ἔχουσι καὶ γιγνώσκουσιν ἅπαντες, ἅπαντας W ἐνίους μὲν οὐ πάλαι τοῖς παρʼ Αἰγυπτίων ὀνόμασι καλεῖν μεμαθηκότες , ἑκάστου δὲ τὴν δύναμιν ἐξ ἀρχῆς ἐπιστάμενοι καὶ τιμῶντες. δεύτερον, ὃ μεῖζόν ἐστιν, ὅπως σφόδρα προσέξουσι καὶ φοβήσονται, μὴ λάθωσιν εἰς πνεύματα καὶ ῥεύματα καὶ σπόρους καὶ ἀρότους καὶ πάθη γῆς καὶ μεταβολὰς ὡρῶν διαγράφοντες τὰ θεῖα καὶ διαλύοντες· ὥσπερ οἱ Διόνυσον τὸν οἶνον, Ἥφαιστον δὲ τὴν φλόγα· Φερσεφόνην δὲ φησί που Κλεάνθης τὸ διὰ τῶν καρπῶν φερόμενον καὶ φονευόμενον πνεῦμα. ποιητὴς δέ τις ἐπὶ τῶν θεριζόντων τῆμος ὅτʼ αἰζηοὶ Δημήτερα κωλοτομεῦσιν cf. Ps. Plut. de vita Homeri s 23 οὐδὲν γὰρ οὗτοι διαφέρουσι τῶν ἱστία καὶ κάλους κάλως X: κάλους καὶ ἄγκυραν ἡγουμένων κυβερνήτην, καὶ νήματα καὶ κρόκας ὑφάντην καὶ σπονδεῖον σπονδεῖον ] σπογγίον R ἢ μελίκρατον ἢ πτισάνην ἰατρόν· ἀλλὰ ἀλλὰ ] ἅμα δὲ Bentleius δεινὰς καὶ ἀθέους ἐμποιοῦσι φύσεσι καὶ πράγμασιν ὀνόματα θεῶν ἐπιφέροντες. ταῦτα μὲν γὰρ αὐτὰ νοῆσαι θεοὺς οὐκ ἔστιν. οὐδὲν γὰρ οὗτοι διαφέρουσι τῶν ἱστία καὶ κάλως κρόκας ὑφάντην, καὶ σπονδεῖον ἢ μελίκρατον ἢ δόξας, ἀναισθήτοις καὶ ἀψύχοις καὶ φθειρομέναις ἀναγκαίως ὑπʼ ἀνθρώπων δεομένων καὶ χρωμένων 
67	οὐ γὰρ ἄνουν ἄνουν R: οὖν οὐδʼ οὐδʼ posterius add. Bentleius ἄψυχον οὐδʼ ἀνθρώποις ὁ θεὸς ὑποχείριον· ἀπὸ τούτων δὲ τοὺς χρωμένοις χρωμένοις (i.e. ἡμῖν ) αὐτοῖς (sc. τοῖς καρποῖς ) *: χρωμένους αὐτοὺς καὶ αὐτοῖς δωρουμένους ἡμῖν καὶ παρέχοντας ἀέναα ἀέναα *: ἀένναα καὶ διαρκῆ θεοὺς ἐνομίσαμεν, οὐχ ἑτέρους παρʼ ἑτέροις οὐδὲ βαρβάρους καὶ Ἕλληνας οὐδὲ νοτίους καὶ βορείους· ἀλλʼ ὥσπερ ἥλιος καὶ σελήνη καὶ οὐρανὸς καὶ γῆ καὶ θάλασσα κοινὰ πᾶσιν, ὀνομάζεται δʼ ἄλλως ὑπʼ ἄλλων, οὕτως ἑνὸς λόγου τοῦ ταῦτα κοσμοῦντος καὶ μιᾶς προνοίας ἐπιτροπευούσης καὶ δυνάμεων ὑπουργῶν ἐπὶ πάντα πάντα Marklandus: πάντας τεταγμένων, ἕτεραι παρʼ ἑτέροις κατὰ νόμους γεγόνασι τιμαὶ καὶ προσηγορίαι· καὶ συμβόλοις χρῶνται καθιερωμένοις καθιερωμένοις οἱ μὲν Salmasius: καθιερωμένοι μὲν οἱ μὲν ἀμυδροῖς οἱ δὲ τρανοτέροις, ἐπὶ τὰ θεῖα τὴν νόησιν ὁδηγοῦντες οὐκ ἀκινδύνως. ἔνιοι γὰρ ἀποσφαλέντες παντάπασιν εἰς δεισιδαιμονίαν ὤλισθον, οἱ δὲ φεύγοντες ὥσπερ ἕλος τὴν δεισιδαιμονίαν ἔλαθον αὖθις ὥσπερ εἰς κρημνὸν ἐμπεσόντες τὴν ἀθεότητα. 
68	διὸ δεῖ μάλιστα πρὸς ταῦτα λόγον ἐκ φιλοσοφίας μυσταγωγὸν ἀναλαβόντας ὁσίως διανοεῖσθαι τῶν λεγομένων καὶ δρωμένων ἕκαστον· ἵνα μή, καθάπερ Θεόδωρος εἶπε, τοὺς λόγους αὐτοῦ τῇ δεξιᾷ προτείνοντος, ἐνίους τῇ ἀριστερᾷ δέχεσθαι τῶν ἀκροωμένων, οὕτως ἡμεῖς ἃ καλῶς οἱ νόμοι περὶ τὰς θυσίας καὶ τὰς ἑορτὰς ἔταξαν ἑτέρως ὑπολαμβάνοντες ἐξαμάρτωμεν. ὅτι γὰρ ἐπὶ τὸν λόγον ἀνοιστέον ἅπαντα, καὶ παρʼ αὐτῶν ἐκείνων ἔστι λαβεῖν. τῇ μὲν γὰρ ἐνάτῃ ἐπὶ δέκα τοῦ πρώτου μηνὸς ἑορτάζοντες τῷ Ἑρμῇ μέλι καὶ σῦκον ἐσθίουσιν, ἐπιλέγοντες γλυκὺ ἡ ἀλήθεια τὸ δὲ τῆς Ἴσιδος φυλακτήριον , ὃ περιάπτεσθαι μυθολογοῦσιν αὐτήν, ἐξερμηνεύεται φωνὴ ἀληθής. τὸν δʼ Ἁρποκράτην οὔτε θεὸν ἀτελῆ καὶ νήπιον οὔτε χεδρόπων χεδρόπων Emperius: χεδροπῶν τινὰ νομιστέον, ἀλλὰ τοῦ περὶ θεῶν ἐν ἀνθρώποις λόγου νεαροῦ καὶ ἀτελοῦς καὶ ἀδιαρθρώτου προστάτην καὶ σωφρονιστὴν διὸ τῷ στόματι τὸν δάκτυλον ἔχει προσκείμενον ἐχεμυθίας καὶ σιωπῆς σύμβολον ἐν δὲ τῷ Μεσορὴ μηνὶ τῶν χεδρόπων ἐπιφέροντες λέγουσιν γλῶσσα τύχη , γλῶσσα δαίμων τῶν δʼ ἐν Αἰγύπτῳ φυτῶν μάλιστα τῇ θεῷ καθιερῶσθαι λέγουσι τὴν περσέαν, ὅτι καρδίᾳ μὲν ὁ καρπὸς αὐτῆς, γλώττῃ δὲ τὸ φύλλον ἔοικεν. οὐδὲν γὰρ ὧν ἄνθρωπος ἔχειν πέφυκε θειότερον λόγου καὶ μάλιστα τοῦ περὶ θεῶν, οὐδὲ μείζονα ῥοπὴν ἔχει πρὸς εὐδαιμονίαν. διὸ τῷ μὲν εἰς τὸ χρηστήριον ἐνταῦθα κατιόντι παρεγγυῶμεν ὅσια φρονεῖν, εὔφημα εὔφημα M: εὔσχημα λέγειν. οἱ δὲ πολλοὶ γελοῖα δρῶσιν ἐν ταῖς πομπαῖς καὶ ταῖς ἑορταῖς εὐφημίαν προκηρύττοντες, εἶτα περὶ τῶν θεῶν αὐτῶν τὰ δυσφημότατα καὶ λέγοντες καὶ διανοούμενοι. 
69	πῶς οὖν χρηστέον ἐστὶ ταῖς σκυθρωπαῖς; καὶ ἀγελάστοις καὶ πενθίμοις θυσίαις, εἰ μήτε παραλείπειν παραλείπειν *: παραλιπεῖν τὰ νενομισμένα καλῶς ἔχει μήτε φύρειν τὰς περὶ θεῶν δόξας καὶ συνταράττειν ὑποψίαις ἀτόποις; καὶ παρʼ Ἕλλησιν ὅμοια πολλὰ γίγνεται περὶ τὸν αὐτὸν ὁμοῦ τι χρόνον, οἷς Αἰγύπτιοι δρῶσιν ἐν τοῖς ὁσίοις. ὁσίοις ] ὁσιρείοις R καὶ γὰρ Ἀθήνησι νηστεύουσιν αἱ γυναῖκες ἐν Θεσμοφορίοις χαμαὶ καθήμεναι. καὶ Βοιωτοὶ τὰ τῆς Ἀχαίας Ἀχαίας *: ἀχαιᾶς μέγαρα κινοῦσιν, ἐπαχθῆ τὴν ἑορτὴν ἐκείνην ὀνομάζοντες, ὡς διὰ τὴν τῆς Κόρης κάθοδον ἐν ἄχει τῆς Δήμητρος οὔσης;. ἔστι δʼ ὁ μὴν οὗτος περὶ Πλειάδας Πλειάδας Halmius: πλειάδα σπόριμος, ὃν Ἀθὺρ Αἰγύπτιοι, Πυανεψιῶνα δʼ Ἀθηναῖοι Βοιωτοὶ δὲ Δαμάτριον καλοῦσι. τοὺς δὲ πρὸς ἑσπέραν οἰκοῦντας ἱστορεῖ Θεόπομπος Θεόπομπος ] Mueller. 1 p. 328 ἡγεῖσθαι καὶ καλεῖν τὸν μὲν χειμῶνα Κρόνον, τὸ δὲ θέρος Ἀφροδίτην, τὸ δʼ ἔαρ Περσεφόνην ἐκ δὲ Κρόνου καὶ Ἀφροδίτης γεννᾶσθαι πάντα. Φρύγες δὲ τὸν θεὸν οἰόμενοι χειμῶνος καθεύδειν, θέρους δʼ ἐγρηγορέναι, τοτὲ μὲν κατευνασμούς, τοτὲ δʼ ἀνεγέρσεις βακχεύοντες αὐτῷ τελοῦσι. Παφλαγόνες δὲ καταδεῖσθαι καὶ καθείργνυσθαι χειμῶνος, ἦρος δὲ κινεῖσθαι καὶ ἀναλύεσθαι φάσκουσι. 
70	 καὶ δίδωσιν ὁ καιρὸς ὑπόνοιαν ἐπὶ τῶν καρπῶν τῇ ἀποκρύψει γενέσθαι τὸν σκυθρωπασμόν, οὓς οἱ παλαιοὶ θεοὺς μὲν οὐκ ἐνόμιζον, ἀλλὰ δῶρα θεῶν ἀναγκαῖα καὶ μεγάλα πρὸς τὸ μὴ ζῆν ἀγρίως καὶ θηριωδῶς. καθʼ ἣν δὴ δὴ Squirius: δὲ ὥραν τοὺς μὲν ἀπὸ ἀπὸ ] ἀπὸ τῶν R δένδρων ἑώρων ἀφανιζομένους παντάπασιν καὶ ἀπολείποντας, οὓς δὲ καὶ αὐτοὶ κατέσπειραν κατέσπειραν ὄντας *: κατασπείραντες ὄντας ἔτι γλίσχρους καὶ ἀπόρους, γλίσχρους καὶ ἀπόρους Baxterus: γλίσχρως καὶ ἀπόρως διαμώμενοι ταῖς χερσὶ τὴν γῆν καὶ περιστέλλοντες αὖθις, ἐπʼ ἀδήλῳ τῷ πάλιν ἐκτελεῖσθαι καὶ συντέλειαν ἕξειν ἀποθέμενοι, πολλὰ θάπτουσιν ὅμοια καὶ πενθοῦσιν ἔπραττον. εἶθʼ ὥσπερ ἡμεῖς τὸν ὠνούμενον βιβλία Πλάτωνος ὠνεῖσθαί φαμεν Πλάτωνα, καὶ Μένανδρον ὑποκρίνεσθαι τὸν ὑποκρίνεσθαι τὸν Basileensis: τὸν ὑποκρίνεσθαι τὰ Μενάνδρου ποιήμαθʼ ὑποτιθέμενον, οὕτως ἐκεῖνοι τοῖς τῶν θεῶν ὀνόμασι τὰ τῶν θεῶν δῶρα καὶ ποιήματα καλεῖν οὐκ ἐφείδοντο, τιμῶντες ὑπὸ χρείας καὶ σεμνύνοντες. οἱ δʼ ὕστερον ἀπαιδεύτως δεχόμενοι καὶ ἀμαθῶς ἀναστρέφοντες ἐπὶ τοὺς θεοὺς τὰ πάθη τῶν καρπῶν, καὶ τὰς παρουσίας τῶν ἀναγκαίων καὶ ἀποκρύψεις θεῶν γενέσεις καὶ φθορὰς οὐ προσαγορεύοντες μόνον ἀλλὰ καὶ νομίζοντες, ἀτόπων καὶ παρανόμων καὶ τεταραγμένων δοξῶν αὑτοὺς ἐνέπλησαν, καίτοι τοῦ παραλόγου τὴν ἀτοπίαν ἐν ὀφθαλμοῖς ἔχοντες. εὖ μὲν οὖν εὖ μὲν οὖν *: οὐ μόνον Ξενοφάνης ὁ Κολοφώνιος ἠξίωσε ἠξίωσε W: ἢ ἑξῆς οἱ τοὺς Αἰγυπτίους, εἰ θεοὺς νομίζουσι, μὴ θρηνεῖν, εἰ δὲ θρηνοῦσι, θεοὺς μὴ νομίζειν ἀλλʼ ὅτι γελοῖον γελοῖον ] sc. ἐστι ἅμα θρηνοῦντας εὔχεσθαι τοὺς καρποὺς πάλιν ἀναφαίνειν καὶ τελειοῦν ἑαυτοῖς, ὅπως πάλιν ἀναλίσκωνται καὶ θρηνῶνται·. 
71	τὸ δʼ τὸ δʼ ] cf. Vit. Cic. c. 13, ubi corr. οἱ δʼ (pro οἵδʼ ) ἀπελθόντες οὐκ ἔστι τοιοῦτον, ἀλλὰ θρηνοῦσι μὲν τοὺς καρπούς , εὔχονται δὲ τοῖς αἰτίοις καὶ δοτῆρσι θεοῖς ἑτέρους; πάλιν νέους ποιεῖν καὶ ἀναφύειν ἀντὶ τῶν ἀπολλυμένων. ὅθεν ἄριστα λέγεται παρὰ τοῖς φιλοσόφοις τὸ τοὺς μὴ μανθάνοντας ὀρθῶς ἀκούειν ὀνομάτων κακῶς χρῆσθαι καὶ τοῖς πράγμασιν· ὥσπερ Ἑλλήνων οἱ τὰ χαλκᾶ καὶ τὰ γραπτὰ καὶ λίθινα μὴ μαθόντες μηδʼ ἐθισθέντες ἀγάλματα καὶ τιμὰς θεῶν, ἀλλὰ θεοὺς καλεῖν, εἶτα τολμῶντες λέγειν, ὅτι τὴν Ἀθηνᾶν Λαχάρης ἐξέδυσε, τὸν δʼ Απόλλωνα χρυσοῦς βοστρύχους ἔχοντα Διονύσιος ἀπέκειρεν δὲ Ζεὺς ὁ Καπετώλιος περὶ τὸν ἐμφύλιον πόλεμον ἐνεπρήσθη καὶ διεφθάρη, λανθάνουσι λανθάνουσι Baxterus: μανθάνουσι συνεφελκόμενοι συνεφελκόμενοι *: οὖν ἐφελκόμενοι καὶ παραδεχόμενοι δόξας πονηρὰς ἑπομένας τοῖς ὀνόμασιν. τοῦτο δʼ οὐχ ἥκιστα πεπόνθασιν Αἰγύπτιοι περὶ τὰ τιμώμενα τῶν ζῴων. Ἕλληνες μὲν γὰρ ἔν γε τούτοις λέγουσιν ὀρθῶς καὶ νομίζουσιν ἱερὸν Ἀφροδίτης ζῷον εἶναι τὴν περιστερὰν καὶ τὸν δράκοντα τῆς Ἀθηνᾶς καὶ τὸν κόρακα τοῦ Ἀπόλλωνος καὶ τὸν κύνα τῆς Ἀρτέμιδος, ὡς Εὐριπίδης Ἑκάτης ἄγαλμα φωσφόρου κύων ἔσῃ. ἔσῃ X: ἐσσίν Nauck. p. 525 Αἰγυπτίων δʼ οἱ πολλοὶ θεραπεύοντες αὐτὰ τὰ ζῷα καὶ περιέποντες ὡς θεοὺς οὐ γέλωτος μόνον οὐδὲ χλευασμοῦ καταπεπλήκασι τὰς ἱερουργίας ἀλλὰ τοῦτο τοῦτο ] τοῦτο μὲν R τῆς ἀβελτερίας ἀβελτερίας *: ἀβελτηρίας ἐλάχιστόν ἐστι κακόν· δόξα δʼ ἐμφύεται δεινή, τοὺς μὲν ἀσθενεῖς καὶ ἀκάκους εἰς ἄκρατον ὑπερείπουσα ὑπερείπουσα R: ὑπερείδουσι τὴν δεισιδαιμονίαν, τοῖς δὲ δριμυτέροις καὶ θρασυτέροις εἰς ἀθέους ἐκπίπτουσα ἐκπίπτουσα R: ἐμπίπτουσα καὶ θηριώδεις λογισμούς;. καὶ ᾗ X: ἢ περὶ τούτων τὰ εἰκότα διελθεῖν οὐκ ἀνάρμοστόν ἐστι. 
