38	τῶν τʼ ἄστρων τὸν σείριον Ἴσιδος Ἰσιδος ] Ὀσίριδος Squirius νομίζουσιν, Ἰσιδος νομίζουσιν ] syllabas δος νομι in rasura habet E, cuius pr. manus dedisse vid. Ἰσιν ὀνομάζουσι ὑδραγωγὸν ὄντα. καὶ τὸν λέοντα τιμῶσι καὶ χάσμασι λεοντείοις τὰ τῶν ἱερῶν θυρώματα κοσμοῦσιν, ὅτι πλημμυρεῖ Νεῖλος ἠελίου τὰ πρῶτα συνερχομένοιο λέοντι. Arati Phaenom. 351 ὡς δὲ Νεῖλον Ὀσίριδος ἀπορροήν, οὕτως Ἴσιδος; σῶμα γῆν ἔχουσι ἔχουσι ] λέγουσι W καὶ νομίζουσιν νομίζουσι ] ὀνομάζουσι Marklandus οὐ πᾶσαν, ἀλλʼ ἧς ὁ Νεῖλος ἐπιβαίνει σπερμαίνων καὶ μιγνύμενος· ἐκ δὲ τῆς· συνουσίας ταύτης γεννῶσι τὸν Ὧρον. ἔστι δʼ Ὧρος ἡ πάντα σῴζουσα καὶ τρέφουσα τοῦ περιέχοντος ὥρα καὶ κρᾶσις ἀέρος, ὃν ἐν τοῖς ἕλεσι τοῖς περὶ Βοῦτον ὑπὸ Λητοῦς τραφῆναι λέγουσιν· ἡ γὰρ ὑδατώδης καὶ διάβροχος γῆ μάλιστα τὰς σβεννυούσας καὶ χαλώσας τὴν ξηρότητα καὶ τὸν αὐχμὸν ἀναθυμιάσεις τιθηνεῖται. Νέφθυν δὲ καλοῦσι τῆς γῆς τὰ ἔσχατα καὶ παρόρια καὶ ψαύοντα τῆς θαλάττης· διὸ καὶ Τελευτὴν Τελευτὴν Squirius: τελευταίην ἐπονομάζουσι τὴν Νέφθυν καὶ Τυφῶνι δὲ συνοικεῖν λέγουσιν. ὅταν δʼ ὑπερβαλὼν καὶ πλεονάσας ὁ Νεῖλος ἐπέκεινα πλησιάσῃ τοῖς ἐσχατεύουσι, τοῦτο μῖξιν Ὀσίριδος πρὸς Νέφθυν καλοῦσιν, ὑπὸ τῶν ἀναβλαστανόντων φυτῶν ἐλεγχομένην· ὧν καὶ τὸ μελίλωτόν ἐστιν, οὗ φησι μῦθος ἀπορρυέντος; καὶ ἀπολειφθέντος αἴσθησιν γενέσθαι Τυφῶνι τῆς περὶ τὸν γάμον ἀδικίας. ὅθεν ἡ μὲν Ἶσις ἔτεκε γνησίως τὸν Ὧρον, ἡ δὲ Νέφθυς σκότιον τὸν Ἄνουβιν. ἐν μέντοι ταῖς διαδοχαῖς τῶν βασιλέων ἀναγράφουσι τὴν Νέφθυν Τυφῶνι γημαμένην πρώτην γενέσθαι στεῖραν· εἰ δὲ τοῦτο μὴ περὶ γυναικὸς ἀλλὰ περὶ τῆς θεοῦ λέγουσιν, αἰνίττονται τὸ παντελὲς παντελὲς ] ἀλιτενὲς W. Nihil opus, cum τὸ παντελὲς ἄγονον idem valeat ac τὴν παντελῆ ἀγονίαν τῆς γῆς ἄγονον καὶ ἄκαρπον ὑπὸ στειρότητος. στειρότητος W: στερρότητος 
39	ἡ δὲ Τυφῶνος ἐπιβουλὴ καὶ τυραννὶς αὐχμοῦ δύναμις ἦν ἐπικρατήσαντος καὶ διαφορήσαντος τήν τε γεννῶσαν ὑγρότητα τὸν Νεῖλον καὶ αὔξουσαν. ἡ δὲ συνεργὸς αὐτοῦ βασιλὶς Αἰθιόπων αἰνίττεται πνοὰς νοτίους ἐξ Αἰθιοπίας· ὅταν γὰρ αὗται τῶν ἐτησίων ἐπικρατήσωσι τὰ νέφη πρὸς τὴν Αἰθιοπίαν ἐλαυνόντων, καὶ κωλύσωσι τοὺς τὸν Νεῖλον αὔξοντας ὄμβρους καταρραγῆναι, κατέχων ὁ Τυφὼν ἐπιφλέγει, καὶ τότε κρατήσας παντάπασι τὸν Νεῖλον εἰς ἑαυτὸν ἑαυτὸν Bentleius: ἐναντίον ὑπʼ ἀσθενείας συσταλέντα καὶ ῥυέντα κοῖλον καὶ ταπεινὸν ἐξέωσεν εἰς τὴν θάλασσαν. ἡ γὰρ λεγομένη κάθειρξις εἰς τὴν σορὸν Ὀσίριδος οὐδὲν ἔοικεν ἀλλʼ ἢ κρύψιν ὕδατος καὶ ἀφανισμὸν αἰνίττεσθαι· διὸ μηνὸς Ἀθὺρ ἀφανισθῆναι τὸν Ὄσιριν λέγουσιν, ὅτε τῶν ἐτησίων ἀπολειπόντων παντάπασιν ὁ μὲν Νεῖλος ὑπονοστεῖ, γυμνοῦται δʼ ἡ χώρα· μηκυνομένης δὲ τῆς νυκτός, αὔξεται αὔξεται ] ὅτε αὔξεται Squirius τὸ σκότος, ἡ δὲ τοῦ φωτὸς μαραίνεται καὶ κρατεῖται δύναμις, οἱ οἱ ] οἱ δὲ W. Possis etiam καὶ οἱ ἱερεῖς ἄλλα τε δρῶσι σκυθρωπὰ καὶ βοῦν διάχρυσον ἱματίῳ μέλανι βυσσίνῳ περιβάλλοντες ἐπὶ πένθει τῆς θεοῦ δεικνύουσι ʽ βοῦν γὰρ Ἴσιδος εἰκόνα καὶ γῆν καὶ γῆν ] αἰσθητὴν Marklandus νομίζουσιν’ ἐπὶ τέσσαρας ἡμέρας ἀπὸ τῆς ἑβδόμης; ἐπὶ δέκα ἑξῆς. καὶ γὰρ τὰ πενθούμενα τέσσαρα, πρῶτον μὲν ὁ Νεῖλος ἀπολείπων καὶ ὑπονοστῶν, δεύτερον δὲ τὰ βόρεια πνεύματα κατασβεννύμενα κομιδῇ τῶν νοτίων ἐπικρατούντων, τρίτον δὲ τὸ τὴν ἡμέραν ἐλάττονα γίγνεσθαι τῆς νυκτός, ἐπὶ πᾶσι δʼ πᾶσι δʼ *: πᾶσιν ἡ τῆς γῆς ἀπογύμνωσις ἅμα τῇ τῶν φυτῶν ψιλότητι τηνικαῦτα φυλλορροούντων. τῇ δʼ ἐνάτῃ ἐπὶ δέκα νυκτὸς ἐπὶ θάλασσαν κατίασι· κατίασι Baxterus: κάτεισι καὶ τὴν ἱερὰν κίστην, οἱ στολισταὶ καὶ οἱ ἱερεῖς ἐκφέρουσι χρυσοῦν ἐντὸς ἔχουσαν κιβώτιον, εἰς ὃ ποτίμου λαβόντες ὕδατος ἐγχέουσι, καὶ γίγνεται κραυγὴ τῶν παρόντων ὡς εὑρημένου τοῦ Ὀσίριδος· εἶτα γῆν γῆν X: τὴν κάρπιμον φυρῶσι τῷ ὕδατι, καὶ συμμίξαντες ἀρώματα καὶ θυμιάματα τῶν πολυτελῶν ἀναπλάττουσι μηνοειδὲς ἀγαλμάτιον καὶ τοῦτο στολίζουσι καὶ κοσμοῦσιν, ἐμφαίνοντες ὅτι γῆς οὐσίαν καὶ ὕδατος τοὺς θεοὺς τούτους νομίζουσι. 
40	τῆς δʼ Ἴσιδος πάλιν ἀναλαμβανούσης τὸν Ὄσιριν καὶ αὐξανούσης τὸν Ὧρον, ἀναθυμιάσεσι καὶ ὁμίχλαις καὶ νέφεσι ῥωννύμενον, ἐκρατήθη μέν, οὐκ ἀνῃρέθη δʼ ὁ Τυφών. οὐ γὰρ εἴασεν ἡ κυρία τῆς γῆς θεὸς ἀναιρεθῆναι παντάπασι τὴν ἀντικειμένην τῇ ὑγρότητι φύσιν, ἀλλʼ ἐχάλασε καὶ ἀνῆκε βουλομένη διαμένειν τὴν κρᾶσιν· κρᾶσιν X: κρίσιν οὐ γὰρ ἦν κόσμον κόσμον ] to\n ko/smon εἶναι τέλειον, ἐκλιπόντος ἐκλιπόντος idem: ἐκλείποντος καὶ ἀφανισθέντος τοῦ πυρώδους. εἰ δὲ ταῦτα μὴ μὴ ] δὴ W λέγεται παρὰ τὸ εἰκός , παρὰ τὸ εἰκός *: παρʼ αὐτοῖς εἰκότως εἰκότως ] ἀπεικότως Bentleius οὐδʼ ἐκεῖνον ἄν τις ἀπορρίψειε τὸν λόγον, ὡς Τυφὼν μὲν ἐκράτει πάλαι τῆς Ὀσίριδος μοίρας θάλασσα γὰρ ἦν ἡ Αἴγυπτος διὸ πολλὰ μὲν ἐν τοῖς μετάλλοις καὶ τοῖς ὄρεσιν εὑρίσκεται μέχρι νῦν κογχύλια ἔχειν ἔχειν ] ἐκεῖ Marklandus. Sex c. Plat. de Legg. p. 699 b. Herod. I 125 πᾶσαι δὲ πηγαὶ καὶ φρέατα πάντα, πολλῶν ὑπαρχόντων, ἁλμυρὸν ὕδωρ καὶ πικρὸν ἔχουσιν, ὡς ἂν ὑπόλειμμα τῆς πάλαι θαλάσσης; ἕωλον ἐνταυθοῖ συνερρυηκός. συνερρυηκός Bentleius: συνερρυηκότος ὁ δʼ Ὧρος; χρόνῳ τοῦ Τυφῶνος ἐπεκράτησε τουτέστιν εὐκαιρίας ὄμβρων ὄμβρων R: ὀμβρίων γενομένης, ὁ Νεῖλος ἐξεώσας ἐξεώσας ] ἐξώσας W τὴν θάλασσαν ἀνέφηνε τὸ πεδίον καὶ ἀνεπλήρωσε ταῖς; προσχώσεσιν. ὃ δὴ μαρτυροῦσαν ἔχει τὴν αἴσθησιν ὁρῶμεν γὰρ ἔτι νῦν ἐπιφέροντι τῷ ποταμῷ νέαν ἰλὺν καὶ προάγοντι προάγοντι *: προαγαγόντι τὴν γῆν κατὰ μικρὸν ὑποχωροῦν ὀπίσω τὸ πέλαγος, καὶ τὴν θάλασσαν, ὕψος τῶν ἐν βάθει λαμβανόντων διὰ τὰς· προσχώσεις, ἀπορρέουσαν· τὴν δὲ Φάρον, ἣν Ὅμηρος Ὁμηρος ] δ 355 ᾔδει δρόμον ἡμέρας ἀπέχουσαν Αἰγύπτου, νῦν μέρος οὖσαν αὐτῆς, οὐκ αὐτὴν ἀναδραμοῦσαν οὐδὲ προσαναβᾶσαν, ἀλλὰ τῆς μεταξὺ θαλάττης ἀναπλάττοντι τῷ ποταμῷ καὶ τρέφοντι τὴν ἤπειρον ἀνασταλείσης. ἀλλὰ ταῦτα μὲν ὅμοια τοῖς ὑπὸ τῶν Στωικῶν θεολογουμένοις ἐστί· · καὶ γὰρ ἐκεῖνοι τὸ μὲν γόνιμον πνεῦμα καὶ τρόφιμον Διόνυσον εἶναι λέγουσι, τὸ πληκτικὸν δὲ καὶ διαιρετικὸν Ἡρακλέα, τὸ δὲ δεκτικὸν Ἄμμωνα, Δήμητρα Δήμητρα *: δήμετραν δὲ καὶ Κόρην τὸ διὰ τῆς γῆς καὶ τῶν καρπῶν διῆκον, Ποσειδῶνα δὲ τὸ διὰ τῆς θαλάττης. 
41	οἱ δὲ τοῖσδε τοῖς φυσικοῖς καὶ τῶν ἀπʼ ἀστρολογίας μαθηματικῶν μαθηματικῶν ] μαθημάτων Marklandus ἔνια μιγνύντες Τυφῶνα μὲν οἴονται τὸν ἡλιακὸν κόσμον, Ὄσιριν δὲ τὸν σεληνιακὸν λέγεσθαι. τὴν μὲν γὰρ σελήνην γόνιμον τὸ φῶς καὶ ὑγροποιὸν ἔχουσαν εὐμενῆ καὶ γοναῖς ζῴων καὶ φυτῶν εἶναι βλαστήσεσι· τὸν δʼ ἥλιον ἀκράτῳ πυρὶ καὶ σκληρῷ καταθάλπειν καὶ σκληρῷ καταθάλπειν Madvigius: κεκληρωκότα θάλπειν τε καὶ καταυαίνειν τὰ φυόμενα καὶ τεθηλότα, καὶ τὸ πολὺ μέρος τῆς γῆς παντάπασιν ὑπὸ φλογμοῦ ποιεῖν ἀοίκητον καὶ κατακρατεῖν πολλαχοῦ καὶ τῆς σελήνης. διὸ τὸν Τυφῶνα Σὴθ ἀεὶ ἀεὶ ] del. Squirius Αἰγύπτιοι καλοῦσιν, ὅπερ ἐστὶ καταδυναστεῦον ἢ καταβιαζόμενον. καὶ τῷ μὲν ἡλίῳ τὸν Ἡρακλέα μυθολογοῦσιν ἐνιδρυμένον συμπεριπολεῖν, τῇ δὲ σελήνῃ τὸν Ἑρμῆν. λόγου γὰρ ἔργοις ἔοικε καὶ περισσῆς περισσῆς R: περὶ σοφίας τὰ τῆς σελήνης, τὰ δʼ ἡλίου πληγαῖς ὑπὸ βίας καὶ ῥώμης περαινομένοις. περαινομένοις sc. ἔργοις Halmius: περαινομένης οἱ δὲ Στωικοὶ τὸν μὲν ἥλιον ἐκ θαλάττης ἀνάπτεσθαι καὶ τρέφεσθαί φασι, τῇ δὲ σελήνῃ τὰ κρηναῖα καὶ λιμναῖα νάματα γλυκεῖαν ἀναπέμπειν καὶ μαλακὴν ἀναθυμίασιν. 
42	ἑβδόμῃ ἐπὶ δʼ ἐπὶ ? δέκα τὴν Ὀσίριδος γενέσθαι τελευτὴν Αἰγύπτιοι μυθολογοῦσιν, ἐν μάλιστα γίγνεται πληρουμένη κατάδηλος ἡ πανσέληνος. διὸ καὶ τὴν ἡμέραν ταύτην ἀντίφραξιν οἱ Πυθαγόρειοι καλοῦσι, καὶ ὅλως τὸν ἀριθμὸν τοῦτον ἀφοσιοῦνται. τοῦ γὰρ ἑξκαίδεκα τετραγώνου καὶ τοῦ ὀκτωκαίδεκα ἑτερομήκους, οἷς μόνοις ἀριθμῶν ἐπιπέδων συμβέβηκε τὰς περιμέτρους ἴσας ἔχειν τοῖς περιεχομένοις ὑπʼ αὐτῶν χωρίοις, μέσος ὁ τῶν ἑπτακαίδεκα παρεμπίπτων ἀντιφράττει καὶ διαζεύγνυσιν ἀπʼ ἀλλήλων, καὶ διαιρεῖ διαιρεῖ ] διατηρεῖ X τὸν τὸν ] κατὰ τὸν W ἐπόγδοον λόγον εἰς ἄνισα διαστήματα τεμνόμενος. ἐτῶν δʼ ἀριθμὸν οἱ μὲν βιῶσαι τὸν Ὄσιριν οἱ δὲ βασιλεῦσαι λέγουσιν ὀκτὼ καὶ εἴκοσι τοσαῦτα γὰρ ἔστι φῶτα τῆς σελήνης καὶ κἀν ? τοσαύταις ἡμέραις τὸν αὑτῆς κύκλον ἐξελίσσει. τὸ δὲ ξύλον ἐν ταῖς λεγομέναις Ὀσίριδος ταφαῖς τέμνοντες κατασκευάζουσι λάρνακα μηνοειδῆ διὰ τὸ τὴν σελήνην, ὅταν τῷ ἡλίῳ πλησιάζῃ, μηνοειδῆ γιγνομένην ἀποκρύπτεσθαι. τὸν δʼ εἰς δεκατέσσαρα μέρη τοῦ Ὀσίριδος διασπασμὸν αἰνίττονται πρὸς τὰς ἡμέρας, ἐν αἷς φθίνει μετὰ πανσέληνον ἄχρι νουμηνίας τὸ ἄστρον. ἡμέραν δέ, ἐν ᾗ φαίνεται πρῶτον ἐκφυγοῦσα τὰς αὐγὰς καὶ παρελθοῦσα τὸν ἣλιον, ἀτελὲς ἀγαθόν προσαγορεύουσιν. ὁ γὰρ Ὄσιρις ἀγαθοποιός, καὶ τοὔνομα πολλὰ φράζει, οὐχ ἥκιστα δὲ κράτος ἐνεργοῦν ἐνεργοῦν ] εὐεργὸν ? καὶ ἀγαθοποιὸν ὃ λέγουσι. τὸ δʼ ἕτερον ὃ δὲ λέγουσιν ἕτερον κἑ ? ὄνομα τοῦ θεοῦ τὸν Ὄμφιν Ὀμφιν ] Ὀνουφιν Partheius εὐεργέτην ὁ Ἑρμαῖός Ἑρμέας R φησι δηλοῦν ἑρμηνευόμενον. 
43	οἴονται δὲ πρὸς τὰ φῶτα τῆς σελήνης ἔχειν τινὰ λόγον τοῦ Νείλου τὰς ἀναβάσεις. ἡ μὲν γὰρ μεγίστη περὶ τὴν Ἐλεφαντίνην ὀκτὼ γίγνεται καὶ εἴκοσι πήχεων, ὅσα φῶτα καὶ μέτρα τῶν ἐμμήνων περιόδων ἑκάστης ἔστιν ἡ δὲ περὶ Μένδητα καὶ Ξόιν βραχυτάτη πήχεων ἓξ ἓξ ] ἑπτὰ Squirius πρὸς τὴν διχότομον· ἡ δὲ μέση περὶ Μέμφιν, ὅταν δικαία, δεκατεσσάρων πήχεων πήχεων *: πηχῶν πρὸς τὴν πανσέληνον. τὸν δʼ Ἆπιν Ἀπιν ] add. φασιν Baxterus εἰκόνα μὲν Ὀσίριδος ἔμψυχον εἶναι, γίγνεσθαι γίγνεσθαι *: γενέσθαι δέ, ὅταν φῶς ἐρείσῃ γόνιμον ἀπὸ τῆς σελήνης καὶ καθάψηται βοὸς ὀργώσης. διὸ καὶ τοῖς τῆς σελήνης σχήμασιν ἔοικε πολλὰ τοῦ Ἄπιδος, περιμελαινομένου τὰ λαμπρὰ τοῖς σκιεροῖς;. ἔτι δὲ ἔτι δὲ Baxterus: ὅτι τῇ νουμηνίᾳ τοῦ Φαμενὼθ μηνὸς ἑορτὴν ἄγουσιν, ἔμβασιν Ὀσίριδος εἰς τὴν σελήνην ὀνομάζοντες, ἔαρος ἀρχὴν οὖσαν. οὕτω τὴν Ὀσίριδος δύναμιν ἐν τῇ σελήνῃ τιθέντες τὴν Ἶσιν αὐτῷ γένεσιν οὖσαν συνεῖναι λέγουσι. διὸ καὶ μητέρα τὴν σελήνην τοῦ κόσμου καλοῦσι καὶ φύσιν ἔχειν ἀρσενόθηλυν οἴονται, πληρουμένην ὑφʼ ἡλίου καὶ κυισκομένην, αὐτὴν δὲ πάλιν εἰς τὸν ἀέρα προϊεμένην γεννητικὰς ἀρχὰς καὶ κατασπείρουσαν· οὐ γὰρ ἀεὶ τὴν φθορὰν ἐπικρατεῖν τὴν τυφώνειον, πολλάκις δὲ κρατουμένην ὑπὸ τῆς γενέσεως; καὶ συνδεομένην αὖθις ἀναλύεσθαι ἀναλύεσθαι W: ἀναδύεσθαι καὶ διαμάχεσθαι πρὸς τὸν Ὧρον. ἔστι δʼ οὗτος; ὁ περίγειος κόσμος οὔτε φθορᾶς ἀπαλλαττόμενος παντάπασιν οὔτε γενέσεως. 
44	ἔνιοι δὲ καὶ τῶν ἐκλειπτικῶν αἴνιγμα ποιοῦνται τὸν μῦθον. ἐκλείπει μὲν γὰρ ἡ σελήνη πανσέληνος, ἐναντίαν τοῦ ἡλίου στάσιν ἔχοντος πρὸς αὐτὴν, εἰς τὴν σκιὰν ἐμπίπτουσα τῆς γῆς, ὥσπερ φασὶ τὸν Ὄσιριν εἰς τὴν σορόν. αὐτὴ δὲ πάλιν ἀποκρύπτει καὶ ἀφανίζει scr. vid. ἀναιρεῖ kai\ ταῖς τριακάσιν, οὐ μὴν ἀναιρεῖται παντάπασι τὸν ἥλιον, ὥσπερ οὐδὲ τὸν Τυφῶνα ἡ Ἶσις. γεννώσης τῆς Νέφθυος τὸν Ἄνουβιν, Ἶσις ὑποβάλλεται. Νέφθυς γάρ ἐστι τὸ ὑπὸ γῆν καὶ ἀφανές, Ἶσις δὲ τὸ ὑπὲρ τὴν γῆν τὴν γ͂ν ] γῆν ? καὶ φανερόν. ὁ δὲ τούτων τούτων Bentleius: τούτῳ ὑποψαύων καὶ καλούμενος ὁρίζων κύκλος, ἐπίκοινος ὢν ἀμφοῖν, Ἄνουβις κέκληται καὶ κυνὶ τὸ εἶδος ἀπεικάζεται· καὶ γὰρ ὁ κύων χρῆται τῇ ὄψει νυκτός τε καὶ ἡμέρας ὁμοίως καὶ ταύτην ἔχειν δοκεῖ παρʼ Αἰγυπτίοις τὴν δύναμιν ὁ Ἄνουβις, οἵαν ἡ Ἑκάτη παρʼ Ἕλλησι, χθόνιος ὢν ὁμοῦ καὶ ὀλύμπιος. ἐνίοις δὲ δοκεῖ Κρόνος ὁ Ἄνουβις εἶναι· διὸ πάντα τίκτων ἐξ ἑαυτοῦ καὶ κύων ἐν ἑαυτῷ τὴν τοῦ κυνὸς ἐπίκλησιν ἔσχεν, ἔστι ἔστι R: ἐ?τι δʼ οὖν ] γοῦν W δʼ οὖν τοῖς σεβομένοις τὸν Ἄνουβιν ἀπόρρητόν τι· καὶ πάλαι πάλαι ] γὰρ πάλαι ? μὲν τὰς μεγίστας ἐν Αἰγύπτῳ τιμὰς ὁ κύων ἔσχεν· ἐπεὶ δὲ Καμβύσου τὸν Ἆπιν ἀνελόντος καὶ ῥίψαντος οὐδὲν προσῆλθεν οὐδʼ ἐγεύσατο τοῦ σώματος ἀλλʼ ἢ μόνος ὁ κύων, ἀπώλεσε τὸ πρῶτος εἶναι καὶ μάλιστα τιμᾶσθαι τῶν ἑτέρων ζῴων. εἰσὶ δέ τινες οἱ τὸ σκίασμα τῆς γῆς, εἰς ὃ τὴν σελήνην ὀλισθάνουσαν ἐκλείπειν νομίζουσι, Τυφῶνα καλοῦντες. 
45	ὅθεν οὐκ ἀπέοικεν εἰπεῖν, ὡς ἰδίᾳ μὲν οὐκ ὀρθῶς ἕκαστος, ὁμοῦ δὲ πάντες ὀρθῶς λέγουσιν. οὐ γὰρ αὐχμὸν οὐδʼ ἄνεμον οὐδὲ θάλατταν οὐδὲ σκότος, ἀλλὰ πᾶν ὅσον ἡ φύσις βλαβερὸν καὶ φθαρτικὸν ἔχει, μόριον τοῦ Τυφῶνος ἔστιν. ἐστιν ] εἶναι Baxterus. ἔστιν εἰπεῖν ? οὔτε γὰρ ἐν ἀψύχοις σώμασι τὰς τοῦ παντὸς ἀρχὰς θετέον, ὡς Δημόκριτος καὶ Ἐπίκουρος, οὔτʼ ἀποίου ἀποίου M: ἄποιον δημιουργὸν ὕλης ἕνα λόγον καὶ μίαν πρόνοιαν, ὡς οἱ Στωικοί, περιγιγνομένην ἁπάντων καὶ κρατοῦσαν. ἀδύνατον γὰρ ἢ φλαῦρον ὁτιοῦν, ὅπου πάντων, ἢ χρηστόν, ὅπου μηδενὸς ὁ θεὸς αἴτιος, ἐγγενέσθαι. παλίντονος γάρ ἁρμονίη κόσμου, ὅκωσπερ ὅκωσπερ W: ὅπωσπερ λύρης καὶ τόξου καθʼ Ἡράκλειτον· Ἡεράκλειτον ] Mullach. 1 p. 319 καὶ κατʼ Εὐριπίδην Εὐριπίδην ] Nauck. p. 294 οὐκ ἂν γένοιτο χωρὶς ἐσθλὰ καὶ κακά, ἀλλʼ ἔστι τις σύγκρασις ὥστʼ ἔχειν καλῶς. διὸ καὶ παμπάλαιος αὕτη κάτεισιν ἐκ θεολόγων καὶ νομοθετῶν εἴς τε ποιητὰς καὶ φιλοσόφους δόξα, τὴν ἀρχὴν ἀδέσποτον ἔχουσα, τὴν δὲ πίστιν ἰσχυρὰν καὶ δυσεξάλειπτον, οὐκ ἐν λόγοις μόνον οὐδʼ ἐν φήμαις, ἀλλʼ ἔν τε τελεταῖς ἔν τε θυσίαις καὶ βαρβάροις καὶ Ἕλλησι πολλαχοῦ περιφερομένη, περιφερομέην Holwerda: περιφερομένην ὡς οὔτʼ ἄνουν καὶ ἄλογον καὶ ἀκυβέρνητον αἰωρεῖται τῷ αὐτομάτῳ τὸ πᾶν, οὔθʼ εἷς ἐστιν ὁ κρατῶν καὶ κατευθύνων ὥσπερ οἴαξιν ἤ τισι πειθηνίοις χαλινοῖς λόγος, ἀλλὰ πολλὰ καὶ μεμιγμένα κακοῖς καὶ ἀγαθοῖς· μᾶλλον δὲ μηδὲν ὡς ἁπλῶς εἰπεῖν ἄκρατον ἐνταῦθα τῆς φύσεως φερούσης, οὐ δυεῖν πίθων εἷς ταμίας ὥσπερ νάματα τὰ πράγματα καπηλικῶς διανέμων ἀνακεράννυσιν ἡμῖν ἀλλʼ ἀπὸ δυεῖν ἐναντίων ἀρχῶν καὶ δυεῖν ἀντιπάλων δυνάμεων τῆς μὲν ἐπὶ τὰ δεξιὰ καὶ κατʼ εὐθεῖαν ὑφηγουμένης, τῆς δʼ ἔμπαλιν ἀναστρεφούσης καὶ ἀνακλώσης, ὅ τε βίος μικτὸς ὅ τε κόσμος, εἰ καὶ μὴ πᾶς, ἀλλʼ ὁ περίγειος οὗτος καὶ μετὰ σελήνην ἀνώμαλος καὶ ποικίλος γέγονε καὶ μεταβολὰς πάσας δεχόμενος;. εἰ γὰρ οὐδὲν ἀναιτίως πέφυκε γίγνεσθαι, γίγνεσθαι *: γενέσθαι αἰτίαν δὲ κακοῦ τἀγαθὸν οὐκ ἂν παράσχοι, δεῖ γένεσιν ἰδίαν καὶ ἀρχὴν ὥσπερ ἀγαθοῦ καὶ κακοῦ τὴν φύσιν ἔχειν. 
