0	
377	ἐς αὖθις, ὡς ἥξουσʼ ἐς Ἄργος αὖ πάλιν.
378	ὦ τλῆμον, εἰ τέθνηκας, ἐξ οἵων καλῶν
379	ἔρρεις, Ὀρέστα, καὶ πατρὸς ζηλωμάτων — 
380	τὰ τῆς θεοῦ δὲ μέμφομαι σοφίσματα,
381	ἥτις βροτῶν μὲν ἤν τις ἅψηται φόνου,
382	ἢ καὶ λοχείας ἢ νεκροῦ θίγῃ χεροῖν,
383	βωμῶν ἀπείργει, μυσαρὸν ὡς ἡγουμένη,
384	αὐτὴ δὲ θυσίαις ἥδεται βροτοκτόνοις.
385	οὐκ ἔσθʼ ὅπως ἔτεκεν ἂν ἡ Διὸς δάμαρ
386	Λητὼ τοσαύτην ἀμαθίαν. ἐγὼ μὲν οὖν
387	τὰ Ταντάλου θεοῖσιν ἑστιάματα
388	ἄπιστα κρίνω, παιδὸς ἡσθῆναι βορᾷ,
389	τοὺς δʼ ἐνθάδʼ, αὐτοὺς ὄντας ἀνθρωποκτόνους,
390	ἐς τὴν θεὸν τὸ φαῦλον ἀναφέρειν δοκῶ·
391	οὐδένα γὰρ οἶμαι δαιμόνων εἶναι κακόν.
392	κυάνεαι κυάνεαι
393	σύνοδοι θαλάσσας, ἵνʼ οἶ-
394	στρος ὁ πετόμενος Ἀργόθεν ἄ-
395	ξενον ἐπʼ οἶδμα διεπέρασεν — 
396	Ἀσιήτιδα γαῖαν
397	Εὐρώπας διαμείψας.
399	τίνες ποτʼ ἄρα τὸν εὔυδρον δονακόχλοα
400	λιπόντες Εὐρώταν ἢ
401	ῥεύματα σεμνὰ Δίρκας
402	ἔβασαν ἔβασαν ἄμεικτον αἶαν, ἔνθα κούρᾳ
403	δίᾳ τέγγει
405	βωμοὺς καὶ περικίονας
406	ναοὺς αἷμα βρότειον;
407	ἦ ῥοθίοις εἰλατίνας
408	δικρότοισι κώπας ἔπλευ-
409	σαν ἐπὶ πόντια κύματα, νά-
410	ιον ὄχημα λινοπόροις αὔραις,
411	φιλόπλουτον ἅμιλλαν
412	αὔξοντες μελάθροισιν;
414	φίλα γὰρ ἐλπίς γʼ, ἐπί τε πήμασιν βροτῶν
415	ἄπληστος ἀνθρώποις, ὄλ-
416	βου βάρος οἳ φέρονται
417	πλάνητες ἐπʼ οἶδμα πόλεις τε βαρβάρους περῶντες,
418	κοινᾷ δόξᾳ·
419	γνώμα δʼ οἷς μὲν ἄκαιρος ὄλ-
420	βου, τοῖς δʼ ἐς μέσον ἥκει.
421	πῶς πέτρας τὰς συνδρομάδας,
422	πῶς Φινεϊδᾶν ἀΰ-
423	πνους ἀκτὰς ἐπέρασαν
424	παρʼ ἅλιον
425	αἰγιαλὸν ἐπʼ Ἀμφιτρί-
426	τας ῥοθίῳ δραμόντες,
427	ὅπου πεντήκοντα κορᾶν
428	Νηρῄδων χοροὶ
429	μέλπουσιν ἐγκύκλιοι,
430	πλησιστίοισι πνοαῖς
431	συριζόντων κατὰ πρύμναν
432	εὐναίων πηδαλίων
433	αὔραις σὺν νοτίαις
434	ἢ πνεύμασι Ζεφύρου,
435	τὰν πολυόρνιθον ἐπʼ αἶ-
436	αν, λευκὰν ἀκτάν, Ἀχιλῆ-
437	ος δρόμους καλλισταδίους,
438	ἄξεινον κατὰ πόντον;
439	εἴθʼ εὐχαῖσιν δεσποσύνοις
439a	Λήδας Ἑλένα φίλα
440	παῖς ἐλθοῦσα τύχοι τὰν
441	Τρῳάδα λι-
442	ποῦσα πόλιν, ἵνʼ ἀμφὶ χαί-
443	τᾳ δρόσον αἱματηρὰν
444	ἑλιχθεῖσα λαιμοτόμῳ
445	δεσποίνας χειρὶ θάνοι
446	ποινὰς δοῦσʼ ἀντιπάλους.
447	ἁδίσταν δʼ ἀγγελίαν
448	δεξαίμεσθʼ, Ἑλλάδος ἐκ γᾶς
449	πλωτήρων εἴ τις ἔβα,
450	δουλείας ἐμέθεν
451	δειλαίας παυσίπονος·
452	κἀν γὰρ ὀνείροισι συνεί-
453	ην δόμοις πόλει τε πατρῴ-
454	ᾳ, τερπνῶν ὕπνων ἀπόλαυ-
455	σιν, κοινὰν χάριν ὄλβου.
456	ἀλλʼ οἵδε χέρας δεσμοῖς δίδυμοι
457	συνερεισθέντες χωροῦσι, νέον
458	πρόσφαγμα θεᾶς· σιγᾶτε, φίλαι.
459	τὰ γὰρ Ἑλλήνων ἀκροθίνια δὴ
460	ναοῖσι πέλας τάδε βαίνει·
461	οὐδʼ ἀγγελίας ψευδεῖς ἔλακεν
462	βουφορβὸς ἀνήρ.
463	ὦ πότνιʼ, εἴ σοι τάδʼ ἀρεσκόντως
464	πόλις ἥδε τελεῖ, δέξαι θυσίας,
465	ἃς ὁ παρʼ ἡμῖν νόμος οὐχ ὁσίας
466	Ἕλλησι διδοὺς ἀναφαίνει.
467	εἶἑν·
467a	τὰ τῆς θεοῦ μὲν πρῶτον ὡς καλῶς ἔχῃ
468	φροντιστέον μοι. μέθετε τῶν ξένων χέρας,
469	ὡς ὄντες ἱεροὶ μηκέτʼ ὦσι δέσμιοι.
470	ναοῦ δʼ ἔσω στείχοντες εὐτρεπίζετε
471	ἃ χρὴ ʼπὶ τοῖς παροῦσι καὶ νομίζεται.
472	φεῦ·
472a	τίς ἆρα μήτηρ ἡ τεκοῦσʼ ὑμᾶς ποτε
473	πατήρ τʼ; ἀδελφή τʼ, εἰ γεγῶσα τυγχάνει — 
474	οἵων στερεῖσα διπτύχων νεανιῶν
475	ἀνάδελφος ἔσται. — τὰς τύχας τίς οἶδʼ ὅτῳ
476	τοιαίδʼ ἔσονται; πάντα γὰρ τὰ τῶν θεῶν
477	ἐς ἀφανὲς ἕρπει, κοὐδὲν οἶδʼ οὐδεὶς κακὸν
477a	
478	ἡ γὰρ τύχη παρήγαγʼ ἐς τὸ δυσμαθές.
479	πόθεν ποθʼ ἥκετʼ, ὦ ταλαίπωροι ξένοι;
480	ὡς διὰ μακροῦ μὲν τήνδʼ ἐπλεύσατε χθόνα,
481	μακρὸν δʼ ἀπʼ οἴκων χρόνον ἔσεσθʼ ἀεὶ κάτω.
482	τί ταῦτʼ ὀδύρῃ, κἀπὶ τοῖς μέλλουσι νῷν
483	κακοῖσι λυπεῖς, ἥτις εἶ ποτʼ, ὦ γύναι;
484	οὔτοι νομίζω σοφόν, ὃς ἂν μέλλων κτενεῖν
485	οἴκτῳ τὸ δεῖμα τοὐλέθρου νικᾶν θέλῃ.
486	οὐχ ὅστις Ἅιδην ἐγγὺς ὄντʼ οἰκτίζεται
487	σωτηρίας ἄνελπις· ὡς δύʼ ἐξ ἑνὸς
488	κακὼ συνάπτει, μωρίαν τʼ ὀφλισκάνει
489	θνῄσκει θʼ ὁμοίως· τὴν τύχην δʼ ἐᾶν χρεών.
490	ἡμᾶς δὲ μὴ θρήνει σύ· τὰς γὰρ ἐνθάδε
491	θυσίας ἐπιστάμεσθα καὶ γιγνώσκομεν.
492	πότερος ἄρʼ ὑμῶν ἐνθάδʼ ὠνομασμένος
493	Πυλάδης κέκληται; τόδε μαθεῖν πρῶτον θέλω.
494	ὅδʼ, εἴ τι δή σοι τοῦτʼ ἐν ἡδονῇ μαθεῖν.
495	ποίας πολίτης πατρίδος Ἕλληνος γεγώς;
496	τί δʼ ἂν μαθοῦσα τόδε πλέον λάβοις, γύναι;
497	πότερον ἀδελφὼ μητρός ἐστον ἐκ μιᾶς;
498	φιλότητί γʼ· ἐσμὲν δʼ οὐ κασιγνήτω, γύναι.
499	σοὶ δʼ ὄνομα ποῖον ἔθεθʼ ὁ γεννήσας πατήρ;
500	τὸ μὲν δίκαιον Δυστυχὴς καλοίμεθʼ ἄν.
501	οὐ τοῦτʼ ἐρωτῶ· τοῦτο μὲν δὸς τῇ τύχῃ.
502	ἀνώνυμοι θανόντες οὐ γελῴμεθʼ ἄν.
503	τί δὲ φθονεῖς τοῦτο; ἦ φρονεῖς οὕτω μέγα;
504	τὸ σῶμα θύσεις τοὐμόν, οὐχὶ τοὔνομα.
505	οὐδʼ ἂν πόλιν φράσειας ἥτις ἐστί σοι;
506	ζητεῖς γὰρ οὐδὲν κέρδος, ὡς θανουμένῳ.
507	χάριν δὲ δοῦναι τήνδε κωλύει τί σε;
508	τὸ κλεινὸν Ἄργος πατρίδʼ ἐμὴν ἐπεύχομαι.
509	πρὸς θεῶν, ἀληθῶς, ὦ ξένʼ, εἶ κεῖθεν γεγώς;
510	ἐκ τῶν Μυκηνῶν γʼ , αἵ ποτʼ ἦσαν ὄλβιαι.
511	φυγὰς δʼ ἀπῆρας πατρίδος, ἢ ποίᾳ τύχῃ;
512	φεύγω τρόπον γε δή τινʼ οὐχ ἑκὼν ἑκών.
513	ἆρʼ ἄν τί μοι φράσειας ὧν ἐγὼ θέλω;
514	ὡς ἐν παρέργῳ τῆς ἐμῆς δυσπραξίας.
515	καὶ μὴν ποθεινός γʼ ἦλθες ἐξ Ἄργους μολών.
516	οὔκουν ἐμαυτῷ γʼ· εἰ δὲ σοί, σὺ τοῦτʼ ἔρα.
517	Τροίαν ἴσως οἶσθʼ, ἧς ἁπανταχοῦ λόγος.
518	ὡς μήποτʼ ὤφελόν γε μηδʼ ἰδὼν ὄναρ.
519	φασίν νιν οὐκέτʼ οὖσαν οἴχεσθαι δορί.
520	ἔστιν γὰρ οὕτως οὐδʼ ἄκραντʼ ἠκούσατε.
521	Ἑλένη δʼ ἀφῖκται δῶμα Μενέλεω πάλιν;
522	ἥκει, κακῶς γʼ ἐλθοῦσα τῶν ἐμῶν τινι.
523	καὶ ποῦ ʼστι; κἀμοὶ γάρ τι προυφείλει κακόν.
524	Σπάρτῃ ξυνοικεῖ τῷ πάρος ξυνευνέτῃ.
525	ὦ μῖσος εἰς Ἕλληνας, οὐκ ἐμοὶ μόνῃ.
526	ἀπέλαυσα κἀγὼ δή τι τῶν κείνης γάμων.
527	νόστος δʼ Ἀχαιῶν ἐγένεθʼ, ὡς κηρύσσεται;
528	ὡς πάνθʼ ἅπαξ με συλλαβοῦσʼ ἀνιστορεῖς.
529	πρὶν γὰρ θανεῖν σε, τοῦδʼ ἐπαυρέσθαι θέλω.
530	ἔλεγχʼ, ἐπειδὴ τοῦδʼ ἐρᾷς· λέξω δʼ ἐγώ.
531	Κάλχας τις ἦλθε μάντις ἐκ Τροίας πάλιν;
532	ὄλωλεν, ὡς ἦν ἐν Μυκηναίοις λόγος.
533	ὦ πότνιʼ, ὡς εὖ. — τί γὰρ ὁ Λαέρτου γόνος;
534	οὔπω νενόστηκʼ οἶκον, ἔστι δʼ, ὡς λόγος.
535	ὄλοιτο, νόστου μήποτʼ ἐς πάτραν τυχών.
536	μηδὲν κατεύχου· πάντα τἀκείνου νοσεῖ.
537	Θέτιδος δʼ ὁ τῆς Νηρῇδος ἔστι παῖς ἔτι;
538	οὐκ ἔστιν· ἄλλως λέκτρʼ ἔγημʼ ἐν Αὐλίδι.
539	δόλια γάρ, ὡς ἴσασιν οἱ πεπονθότες.
540	τίς εἶ ποθʼ; ὡς εὖ πυνθάνῃ τἀφʼ Ἑλλάδος.
541	ἐκεῖθέν εἰμι· παῖς ἔτʼ οὖσʼ ἀπωλόμην.
542	ὀρθῶς ποθεῖς ἄρʼ εἰδέναι τἀκεῖ, γύναι.
543	τί δʼ ὁ στρατηγός, ὃν λέγουσʼ εὐδαιμονεῖν;
544	τίς; οὐ γὰρ ὅν γʼ ἐγᾦδα τῶν εὐδαιμόνων.
545	Ἀτρέως ἐλέγετο δή τις Ἀγαμέμνων ἄναξ.
546	οὐκ οἶδʼ· ἄπελθε τοῦ λόγου τούτου, γύναι.
547	μὴ πρὸς θεῶν, ἀλλʼ εἴφʼ, ἵνʼ εὐφρανθῶ, ξένε.
548	τέθνηχʼ ὁ τλήμων, πρὸς δʼ ἀπώλεσέν τινα.
549	τέθνηκε; ποίᾳ συμφορᾷ; τάλαινʼ ἐγώ.
550	τί δʼ ἐστέναξας τοῦτο; μῶν προσῆκέ σοι;
551	τὸν ὄλβον αὐτοῦ τὸν πάροιθʼ ἀναστένω.
552	δεινῶς γὰρ ἐκ γυναικὸς οἴχεται σφαγείς.
553	ὦ πανδάκρυτος ἡ κτανοῦσα χὡ κτανών.
554	παῦσαί νυν ἤδη μηδʼ ἐρωτήσῃς πέρα.
555	τοσόνδε γʼ, εἰ ζῇ τοῦ ταλαιπώρου δάμαρ.
556	οὐκ ἔστι· παῖς νιν ὃν ἔτεχʼ, οὗτος ὤλεσεν.
557	ὦ συνταραχθεὶς οἶκος. ὡς τί δὴ θέλων;
558	πατρὸς θανόντος τήνδε τιμωρούμενος.
559	φεῦ·
559a	ὡς εὖ κακὸν δίκαιον εἰσεπράξατο.
560	ἀλλʼ οὐ τὰ πρὸς θεῶν εὐτυχεῖ δίκαιος ὤν.
561	λείπει δʼ ἐν οἴκοις ἄλλον Ἀγαμέμνων γόνον;
562	λέλοιπεν Ἠλέκτραν γε παρθένον μίαν.
563	τί δέ; σφαγείσης θυγατρὸς ἔστι τις λόγος;
564	οὐδείς γε, πλὴν θανοῦσαν οὐχ ὁρᾶν φάος.
565	τάλαινʼ ἐκείνη χὡ κτανὼν αὐτὴν πατήρ.
566	κακῆς γυναικὸς χάριν ἄχαριν ἀπώλετο.
567	ὁ τοῦ θανόντος δʼ ἔστι παῖς Ἄργει πατρός;
568	ἔστʼ, ἄθλιός γε, κοὐδαμοῦ καὶ πανταχοῦ.
569	ψευδεῖς ὄνειροι, χαίρετʼ· οὐδὲν ἦτʼ ἄρα.
570	οὐδʼ οἱ σοφοί γε δαίμονες κεκλημένοι
571	πτηνῶν ὀνείρων εἰσὶν ἀψευδέστεροι.
572	πολὺς ταραγμὸς ἔν τε τοῖς θείοις ἔνι
573	κἀν τοῖς βροτείοις· ἓν δὲ λυπεῖται μόνον,
574	ὃς οὐκ ἄφρων ὢν μάντεων πεισθεὶς λόγοις
575	ὄλωλεν — ὡς ὄλωλε τοῖσιν εἰδόσιν.
576	φεῦ φεῦ· τί δʼ ἡμεῖς οἵ τʼ ἐμοὶ γεννήτορες;
577	ἆρʼ εἰσίν; ἆρʼ οὐκ εἰσί; τίς φράσειεν ἄν;
578	ἀκούσατʼ· ἐς γὰρ δή τινʼ ἥκομεν λόγον,
579	ὑμῖν τʼ ὄνησιν, ὦ ξένοι, σπουδῆς ἅμα
580	κἀμοί. τὸ δʼ εὖ μάλιστά γʼ οὕτω γίγνεται,
581	εἰ πᾶσι ταὐτὸν πρᾶγμʼ ἀρεσκόντως ἔχει.
582	θέλοις ἄν, εἰ σῴσαιμί σʼ, ἀγγεῖλαί τί μοι
583	πρὸς Ἄργος ἐλθὼν τοῖς ἐμοῖς ἐκεῖ φίλοις,
584	δέλτον τʼ ἐνεγκεῖν, ἥν τις οἰκτίρας ἐμὲ
585	ἔγραψεν αἰχμάλωτος, οὐχὶ τὴν ἐμὴν
586	φονέα νομίζων χεῖρα, τοῦ νόμου δʼ ὕπο
587	θνῄσκειν τὰ τῆς θεοῦ, τάδε δίκαιʼ ἡγουμένης;
588	οὐδένα γὰρ εἶχον ὅστις ἀγγείλαι μολὼν
589	ἐς Ἄργος αὖθις, τάς τʼ ἐμὰς ἐπιστολὰς
590	πέμψειε σωθεὶς τῶν ἐμῶν φίλων τινί.
591	σὺ δʼ — εἶ γάρ, ὡς ἔοικας, οὔτε δυσμενὴς
592	καὶ τὰς Μυκήνας οἶσθα χοὓς κἀγὼ θέλω — 
593	σώθητι, καὶ σὺ μισθὸν οὐκ αἰσχρὸν λαβών,
594	κούφων ἕκατι γραμμάτων σωτηρίαν.
595	οὗτος δʼ, ἐπείπερ πόλις ἀναγκάζει τάδε,
596	θεᾷ γενέσθω θῦμα χωρισθεὶς σέθεν.
597	καλῶς ἔλεξας τἄλλα πλὴν ἕν, ὦ ξένη·
598	τὸ γὰρ σφαγῆναι τόνδε μοι βάρος μέγα.
599	ὁ ναυστολῶν γάρ εἰμʼ ἐγὼ τὰς συμφοράς,
600	οὗτος δὲ συμπλεῖ τῶν ἐμῶν μόχθων χάριν.
601	οὔκουν δίκαιον ἐπʼ ὀλέθρῳ τῷ τοῦδʼ ἐμὲ
602	χάριν τίθεσθαι καὐτὸν ἐκδῦναι κακῶν.
603	ἀλλʼ ὣς γενέσθω· τῷδε μὲν δέλτον δίδου·
604	πέμψει γὰρ Ἄργος, ὥστε σοι καλῶς ἔχειν·
605	ἡμᾶς δʼ ὁ χρῄζων κτεινέτω. τὰ τῶν φίλων
606	αἴσχιστον ὅστις καταβαλὼν ἐς ξυμφορὰς
607	αὐτὸς σέσῳσται. τυγχάνει δʼ ὅδʼ ὢν φίλος,
608	ὃν οὐδὲν ἧσσον ἢ ʼμὲ φῶς ὁρᾶν θέλω.
609	ὦ λῆμʼ ἄριστον, ὡς ἀπʼ εὐγενοῦς τινος
610	ῥίζης πέφυκας τοῖς φίλοις τʼ ὀρθῶς φίλος.
611	τοιοῦτος εἴη τῶν ἐμῶν ὁμοσπόρων
612	ὅσπερ λέλειπται. καὶ γὰρ οὐδʼ ἐγώ, ξένοι,
613	ἀνάδελφός εἰμι, πλὴν ὅσʼ οὐχ ὁρῶσά νιν.
614	ἐπεὶ δὲ βούλῃ ταῦτα, τόνδε πέμψομεν
615	δέλτον φέροντα, σὺ δὲ θανῇ· πολλὴ δέ τις
616	προθυμία σε τοῦδʼ ἔχουσα τυγχάνει.
617	θύσει δὲ τίς με καὶ τὰ δεινὰ τλήσεται;
618	ἐγώ· θεᾶς γὰρ τῆσδε προστροπὴν ἔχω.
619	ἄζηλά γʼ, ὦ νεᾶνι, κοὐκ εὐδαίμονα.
620	ἀλλʼ εἰς ἀνάγκην κείμεθʼ, ἣν φυλακτέον.
621	αὐτὴ ξίφει θύουσα θῆλυς ἄρσενας;
622	οὔκ, ἀλλὰ χαίτην ἀμφὶ σὴν χερνίψομαι.
623	ὁ δὲ σφαγεὺς τίς; εἰ τάδʼ ἱστορεῖν με χρή.
624	ἔσω δόμων τῶνδʼ εἰσὶν οἷς μέλει τάδε.
625	τάφος δὲ ποῖος δέξεταί μʼ, ὅταν θάνω;
626	πῦρ ἱερὸν ἔνδον χάσμα τʼ εὐρωπὸν πέτρας.
627	φεῦ·
627a	πῶς ἄν μʼ ἀδελφῆς χεὶρ περιστείλειεν ἄν;
628	μάταιον εὐχήν, ὦ τάλας, ὅστις ποτʼ εἶ,
629	ηὔξω· μακρὰν γὰρ βαρβάρου ναίει χθονός.
630	οὐ μήν, ἐπειδὴ τυγχάνεις Ἀργεῖος ὤν,
631	ἀλλʼ ὧν γε δυνατὸν οὐδʼ ἐγὼ λείψω χάριν.
632	πολύν τε γάρ σοι κόσμον ἐνθήσω τάφῳ,
633	ξανθῷ τʼ ἐλαίῳ σῶμα σὸν κατασβέσω,
634	καὶ τῆς ὀρείας ἀνθεμόρρυτον γάνος
635	ξουθῆς μελίσσης ἐς πυρὰν βαλῶ σέθεν.
636	ἀλλʼ εἶμι δέλτον τʼ ἐκ θεᾶς ἀνακτόρων
637	οἴσω· τὸ μέντοι δυσμενὲς μὴ ʼμοὶ λάβῃς.
638	φυλάσσετʼ αὐτούς, πρόσπολοι, δεσμῶν ἄτερ — 
639	ἴσως ἄελπτα τῶν ἐμῶν φίλων τινὶ
640	πέμψω πρὸς Ἄργος, ὃν μάλιστʼ ἐγὼ φιλῶ,
641	καὶ δέλτος αὐτῷ ζῶντας οὓς δοκεῖ θανεῖν
642	λέγουσα πιστὰς ἡδονὰς ἀπαγγελεῖ.
644	κατολοφύρομαι σὲ τὸν χερνίβων
645	ῥανίσι μελόμενον αἱμακταῖς.
646	οἶκτος γὰρ οὐ ταῦτʼ, ἀλλὰ χαίρετʼ, ὦ ξέναι.
647	σὲ δὲ τύχας μάκαρος, ὦ
648	νεανία, σεβόμεθʼ, ἐς
649	πάτραν ὅτι ποτʼ ἐπεμβάσῃ.
650	ἄζηλά τοι φίλοισι, θνῃσκόντων φίλων.
651	ὦ σχέτλιοι πομπαί.
652	φεῦ φεῦ, διόλλυσαι.
653	αἰαῖ αἰαῖ. πότερος ὁ μᾶλλον;
655	ἔτι γὰρ ἀμφίλογα δίδυμα μέμονε φρήν,
656	σὲ πάρος ἢ σὲ ἀναστενάξω γόοις.
658	Πυλάδη, πέπονθας ταὐτὸ πρὸς θεῶν ἐμοί;
659	οὐκ οἶδʼ· ἐρωτᾷς οὐ λέγειν ἔχοντά με.
660	τίς ἐστὶν ἡ νεᾶνις; ὡς Ἑλληνικῶς
661	ἀνήρεθʼ ἡμᾶς τούς τʼ ἐν Ἰλίῳ πόνους
662	νόστον τʼ Ἀχαιῶν τόν τʼ ἐν οἰωνοῖς σοφὸν
663	Κάλχαντʼ Ἀχιλλέως τʼ ὄνομα, καὶ τὸν ἄθλιον
664	Ἀγαμέμνονʼ ὡς ᾤκτιρʼ ἀνηρώτα τέ με
665	γυναῖκα παῖδάς τε. ἔστιν ἡ ξένη γένος
666	ἐκεῖθεν Ἀργεία τις· οὐ γὰρ ἄν ποτε
667	δέλτον τʼ ἔπεμπε καὶ τάδʼ ἐξεμάνθανεν,
668	ὡς κοινὰ πράσσουσʼ, Ἄργος εἰ πράσσει καλῶς.
669	ἔφθης με μικρόν· ταὐτὰ δὲ φθάσας λέγεις,
670	πλὴν ἕν· τὰ γὰρ τῶν βασιλέων παθήματα
671	ἴσασι πάντες, ὧν ἐπιστροφή τις ἦν.
672	ἀτὰρ διῆλθον χἅτερον λόγον τινά.
673	τίνʼ; ἐς τὸ κοινὸν δοὺς ἄμεινον ἂν μάθοις.
674	αἰσχρὸν θανόντος σοῦ βλέπειν ἡμᾶς φάος·
675	κοινῇ τʼ ἔπλευσα δεῖ με καὶ κοινῇ θανεῖν.
676	καὶ δειλίαν γὰρ καὶ κάκην κεκτήσομαι
677	Ἄργει τε Φωκέων τʼ ἐν πολυπτύχῳ χθονί,
678	δόξω δὲ τοῖς πολλοῖσι — πολλοὶ γὰρ κακοί — 
679	προδοὺς σεσῷσθαί σʼ αὐτὸς εἰς οἴκους μόνος
680	ἢ καὶ φονεύσας ἐπὶ νοσοῦσι δώμασι
681	ῥάψαι μόρον σοι σῆς τυραννίδος χάριν,
682	ἔγκληρον ὡς δὴ σὴν κασιγνήτην γαμῶν.
683	ταῦτʼ οὖν φοβοῦμαι καὶ διʼ αἰσχύνης ἔχω,
684	κοὐκ ἔσθʼ ὅπως οὐ χρὴ συνεκπνεῦσαί μέ σοι
685	καὶ σὺν σφαγῆναι καὶ πυρωθῆναι δέμας,
686	φίλον γεγῶτα καὶ φοβούμενον ψόγον.
687	εὔφημα φώνει· τἀμὰ δεῖ φέρειν κακά,
688	ἁπλᾶς δὲ λύπας ἐξόν, οὐκ οἴσω διπλᾶς.
689	ὃ γὰρ σὺ λυπρὸν κἀπονείδιστον λέγεις,
690	ταὔτʼ ἔστιν ἡμῖν, εἴ σε συμμοχθοῦντʼ ἐμοὶ
691	κτενῶ· τὸ μὲν γὰρ εἰς ἔμʼ οὐ κακῶς ἔχει,
692	πράσσονθʼ ἃ πράσσω πρὸς θεῶν, λῦσαι βίον.
693	σὺ δʼ ὄλβιός τʼ εἶ, καθαρά τʼ, οὐ νοσοῦντʼ, ἔχεις
694	μέλαθρʼ, ἐγὼ δὲ δυσσεβῆ καὶ δυστυχῆ.
695	σωθεὶς δέ, παῖδας ἐξ ἐμῆς ὁμοσπόρου
696	κτησάμενος, ἣν ἔδωκά σοι δάμαρτʼ ἔχειν — 
697	ὄνομά τʼ ἐμοῦ γένοιτʼ ἄν, οὐδʼ ἄπαις δόμος
698	πατρῷος οὑμὸς ἐξαλειφθείη ποτʼ ἄν.
699	ἀλλʼ ἕρπε καὶ ζῆ καὶ δόμους οἴκει πατρός.
700	ὅταν δʼ ἐς Ἑλλάδʼ ἵππιόν τʼ Ἄργος μόλῃς,
701	πρὸς δεξιᾶς σε τῆσδʼ ἐπισκήπτω τάδε·
702	τύμβον τε χῶσον κἀπίθες μνημεῖά μοι,
703	καὶ δάκρυʼ ἀδελφὴ καὶ κόμας δότω τάφῳ.
704	ἄγγελλε δʼ ὡς ὄλωλʼ ὑπʼ Ἀργείας τινὸς
705	γυναικός, ἀμφὶ βωμὸν ἁγνισθεὶς φόνῳ.
706	καὶ μὴ προδῷς μου τὴν κασιγνήτην ποτέ,
707	ἔρημα κήδη καὶ δόμους ὁρῶν πατρός.
708	καὶ χαῖρʼ· ἐμῶν γὰρ φίλτατόν σʼ ηὗρον φίλων,
709	ὦ συγκυναγὲ καὶ συνεκτραφεὶς ἐμοί,
710	ὦ πόλλʼ ἐνεγκὼν τῶν ἐμῶν ἄχθη κακῶν.
711	ἡμᾶς δʼ ὁ Φοῖβος μάντις ὢν ἐψεύσατο·
712	τέχνην δὲ θέμενος ὡς προσώταθʼ Ἑλλάδος
713	ἀπήλασʼ, αἰδοῖ τῶν πάρος μαντευμάτων.
714	ᾧ πάντʼ ἐγὼ δοὺς τἀμὰ καὶ πεισθεὶς λόγοις,
715	μητέρα κατακτὰς αὐτὸς ἀνταπόλλυμαι.
716	ἔσται τάφος σοι, καὶ κασιγνήτης λέχος
717	οὐκ ἂν προδοίην, ὦ τάλας, ἐπεί σʼ ἐγὼ
718	θανόντα μᾶλλον ἢ βλέπονθʼ ἕξω φίλον.
719	ἀτὰρ τὸ τοῦ θεοῦ σʼ οὐ διέφθορέν γέ πω
720	μάντευμα· καίτοι γʼ ἐγγὺς ἕστηκας φόνου.
721	ἀλλʼ ἔστιν, ἔστιν, ἡ λίαν δυσπραξία
722	λίαν διδοῦσα μεταβολάς, ὅταν τύχῃ.
723	σίγα· τὰ Φοίβου δʼ οὐδὲν ὠφελεῖ μʼ ἔπη·
724	γυνὴ γὰρ ἥδε δωμάτων ἔξω περᾷ.
725	ἀπέλθεθʼ ὑμεῖς καὶ παρευτρεπίζετε
726	τἄνδον μολόντες τοῖς ἐφεστῶσι σφαγῇ.
727	δέλτου μὲν αἵδε πολύθυροι διαπτυχαί,
728	ξένοι, πάρεισιν· ἃ δʼ ἐπὶ τοῖσδε βούλομαι,
729	ἀκούσατʼ. οὐδεὶς αὑτὸς ἐν πόνοις τʼ ἀνὴρ
730	ὅταν τε πρὸς τὸ θάρσος ἐκ φόβου πέσῃ.
731	ἐγὼ δὲ ταρβῶ μὴ ἀπονοστήσας χθονὸς
732	θῆται παρʼ οὐδὲν τὰς ἐμὰς ἐπιστολὰς
733	ὁ τήνδε μέλλων δέλτον εἰς Ἄργος φέρειν.
734	τί δῆτα βούλῃ; τίνος ἀμηχανεῖς πέρι;
735	ὅρκον δότω μοι τάσδε πορθμεύσειν γραφὰς
736	πρὸς Ἄργος, οἷσι βούλομαι πέμψαι φίλων.
737	ἦ κἀντιδώσεις τῷδε τοὺς αὐτοὺς λόγους;
738	τί χρῆμα δράσειν ἢ τί μὴ δράσειν; λέγε.
739	ἐκ γῆς ἀφήσειν μὴ θανόντα βαρβάρου.
740	δίκαιον εἶπας· πῶς γὰρ ἀγγείλειεν ἄν;
741	ἦ καὶ τύραννος ταῦτα συγχωρήσεται;
742	ναί.
