0	
742a	πείσω σφε, καὐτὴ ναὸς εἰσβήσω σκάφος.
743	ὄμνυ· σὺ δʼ ἔξαρχʼ ὅρκον ὅστις εὐσεβής.
744	δώσω, λέγειν χρή, τήνδε τοῖσι σοῖς φίλοις.
745	τοῖς σοῖς φίλοισι γράμματʼ ἀποδώσω τάδε.
746	κἀγὼ σὲ σώσω κυανέας ἔξω πέτρας.
747	τίνʼ οὖν ἐπόμνυς τοισίδʼ ὅρκιον θεῶν;
748	Ἄρτεμιν, ἐν ἧσπερ δώμασιν τιμὰς ἔχω.
749	ἐγὼ δʼ ἄνακτά γʼ οὐρανοῦ, σεμνὸν Δία.
750	εἰ δʼ ἐκλιπὼν τὸν ὅρκον ἀδικοίης ἐμέ;
751	ἄνοστος εἴην· τί δὲ σύ, μὴ σῴσασά με;
752	μήποτε κατʼ Ἄργος ζῶσʼ ἴχνος θείην ποδός.
753	ἄκουε δή νυν ὃν παρήλθομεν λόγον.
754	ἀλλʼ αὖθις ἔσται καινός, ἢν καλῶς ἔχῃ.
755	ἐξαίρετόν μοι δὸς τόδʼ, ἤν τι ναῦς πάθῃ,
756	χἡ δέλτος ἐν κλύδωνι χρημάτων μέτα
757	ἀφανὴς γένηται, σῶμα δʼ ἐκσῴσω μόνον,
758	τὸν ὅρκον εἶναι τόνδε μηκέτʼ ἔμπεδον.
759	ἀλλʼ οἶσθʼ ὃ δράσω; πολλὰ γὰρ πολλῶν κυρεῖ·
760	τἀνόντα κἀγγεγραμμένʼ ἐν δέλτου πτυχαῖς
761	λόγῳ φράσω σοι πάντʼ ἀναγγεῖλαι φίλοις.
762	ἐν ἀσφαλεῖ γάρ· ἢν μὲν ἐκσῴσῃς γραφήν,
763	αὐτὴν φράσει σιγῶσα τἀγγεγραμμένα·
764	ἢν δʼ ἐν θαλάσσῃ γράμματʼ ἀφανισθῇ τάδε,
765	τὸ σῶμα σῴσας τοὺς λόγους σῴσεις ἐμοί.
766	καλῶς ἔλεξας τῶν θεῶν ἐμοῦ θʼ ὕπερ.
767	σήμαινε δʼ ᾧ χρὴ τάσδʼ ἐπιστολὰς φέρειν
768	πρὸς Ἄργος ὅ τι τε χρὴ κλύοντα σοῦ λέγειν.
769	ἄγγελλʼ Ὀρέστῃ, παιδὶ τῷ Ἀγαμέμνονος·
770	Ἡ ʼν Αὐλίδι σφαγεῖσʼ ἐπιστέλλει τάδε
771	ζῶσʼ Ἰφιγένεια, τοῖς ἐκεῖ δʼ οὐ ζῶσʼ ἔτι — 
772	ποῦ δʼ ἔστʼ ἐκείνη; κατθανοῦσʼ ἥκει πάλιν;
773	ἥδʼ ἣν ὁρᾷς σύ· μὴ λόγοις ἔκπλησσέ με.
774	Κόμισαί μʼ ἐς Ἄργος, ὦ σύναιμε, πρὶν θανεῖν,
775	ἐκ βαρβάρου γῆς καὶ μετάστησον θεᾶς
776	σφαγίων, ἐφʼ οἷσι ξενοφόνους τιμὰς ἔχω.
777	Πυλάδη, τί λέξω; ποῦ ποτʼ ὄνθʼ ηὑρήμεθα;
778	ἢ σοῖς ἀραία δώμασιν γενήσομαι.
779	Ὀρέστα — ;
779b	ἵνʼ αὖθις ὄνομα δὶς κλύων μάθῃς.
780	ὦ θεοί.
780b	τί τοὺς θεοὺς ἀνακαλεῖς ἐν τοῖς ἐμοῖς;
781	οὐδέν· πέραινε δʼ· ἐξέβην γὰρ ἄλλοσε.
782	τάχʼ οὐκ ἐρωτῶν σʼ εἰς ἄπιστʼ ἀφίξομαι.
783	λέγʼ οὕνεκʼ ἔλαφον ἀντιδοῦσά μου θεὰ
784	Ἄρτεμις ἔσῳσέ μʼ, ἣν ἔθυσʼ ἐμὸς πατήρ,
785	δοκῶν ἐς ἡμᾶς ὀξὺ φάσγανον βαλεῖν,
786	ἐς τήνδε δʼ ᾤκισʼ αἶαν. αἵδʼ ἐπιστολαί,
787	τάδʼ ἐστὶ τἀν δέλτοισιν ἐγγεγραμμένα.
788	ὦ ῥᾳδίοις ὅρκοισι περιβαλοῦσά με,
789	κάλλιστα δʼ ὀμόσασʼ, οὐ πολὺν σχήσω χρόνον,
790	τὸν δʼ ὅρκον ὃν κατώμοσʼ ἐμπεδώσομεν.
791	ἰδού, φέρω σοι δέλτον ἀποδίδωμί τε,
792	Ὀρέστα, τῆσδε σῆς κασιγνήτης πάρα.
793	δέχομαι· παρεὶς δὲ γραμμάτων διαπτυχὰς
794	τὴν ἡδονὴν πρῶτʼ οὐ λόγοις αἱρήσομαι.
795	ὦ φιλτάτη μοι σύγγονʼ, ἐκπεπληγμένος
796	ὅμως σʼ ἀπίστῳ περιβαλὼν βραχίονι
797	ἐς τέρψιν εἶμι, πυθόμενος θαυμάστʼ ἐμοί.
798	ξένʼ, οὐ δικαίως τῆς θεοῦ τὴν πρόσπολον
799	χραίνεις ἀθίκτοις περιβαλὼν πέπλοις χέρα.
800	ὦ συγκασιγνήτη τε κἀκ ταὐτοῦ πατρὸς
801	Ἀγαμέμνονος γεγῶσα, μή μʼ ἀποστρέφου,
802	ἔχουσʼ ἀδελφόν, οὐ δοκοῦσʼ ἕξειν ποτέ.
803	ἐγώ σʼ ἀδελφὸν τὸν ἐμόν; οὐ παύσῃ λέγων;
804	τὸ δʼ Ἄργος αὐτοῦ μεστὸν ἥ τε Ναυπλία.
805	οὐκ ἔστʼ ἐκεῖ σός, ὦ τάλαινα, σύγγονος.
806	ἀλλʼ ἡ Λάκαινα Τυνδαρίς σʼ ἐγείνατο;
807	Πέλοπός γε παιδὶ παιδός, οὗ ʼκπέφυκʼ ἐγώ.
808	τί φῄς; ἔχεις τι τῶνδέ μοι τεκμήριον;
809	ἔχω· πατρῴων ἐκ δόμων τι πυνθάνου.
810	οὐκοῦν λέγειν μὲν χρὴ σέ, μανθάνειν δʼ ἐμέ.
811	λέγοιμʼ ἄν, ἀκοῇ πρῶτον Ἠλέκτρας τάδε·
812	Ἀτρέως Θυέστου τʼ οἶσθα γενομένην ἔριν;
813	ἤκουσα· χρυσῆς ἀρνὸς ἦν νείκη πέρι.
814	ταῦτʼ οὖν ὑφήνασʼ οἶσθʼ ἐν εὐπήνοις ὑφαῖς;
815	ὦ φίλτατʼ, ἐγγὺς τῶν ἐμῶν κάμπτεις φρενῶν.
816	εἰκώ τʼ ἐν ἱστοῖς ἡλίου μετάστασιν;
817	ὕφηνα καὶ τόδʼ εἶδος εὐμίτοις πλοκαῖς.
818	καὶ λούτρʼ ἐς Αὖλιν μητρὸς ἀνεδέξω πάρα;
819	οἶδʼ· οὐ γὰρ ὁ γάμος ἐσθλὸς ὤν μʼ ἀφείλετο.
820	τί γάρ; κόμας σὰς μητρὶ δοῦσα σῇ φέρειν;
821	μνημεῖά γʼ ἀντὶ σώματος τοὐμοῦ τάφῳ.
822	ἃ δʼ εἶδον αὐτός, τάδε φράσω τεκμήρια·
823	Πέλοπος παλαιὰν ἐν δόμοις λόγχην πατρός,
824	ἣν χερσὶ πάλλων παρθένον Πισάτιδα
825	ἐκτήσαθʼ Ἱπποδάμειαν, Οἰνόμαον κτανών,
826	ἐν παρθενῶσι τοῖσι σοῖς κεκρυμμένην.
827	ὦ φίλτατʼ, οὐδὲν ἄλλο, φίλτατος γὰρ εἶ,
828	ἔχω σʼ, Ὀρέστα, τηλύγετον χθονὸς ἀπὸ πατρίδος
830	Ἀργόθεν, ὦ φίλος.
831	κἀγώ σε τὴν θανοῦσαν, ὡς δοξάζεται.
832	κατὰ δὲ δάκρυ, κατὰ δὲ γόος ἅμα χαρᾷ
833	τὸ σὸν νοτίζει βλέφαρον, ὡσαύτως δʼ ἐμόν.
834	τόδʼ ἔτι βρέφος
835	ἔλιπον ἀγκάλαισι νεαρὸν τροφοῦ
836	νεαρὸν ἐν δόμοις.
837	ὦ κρεῖσσον ἢ λόγοισιν εὐτυχοῦσά μου
839	ψυχά, τί φῶ; θαυμάτων
840	πέρα καὶ λόγου πρόσω τάδʼ ἐπέβα.
841	τὸ λοιπὸν εὐτυχοῖμεν ἀλλήλων μέτα.
842	ἄτοπον ἁδονὰν ἔλαβον, ὦ φίλαι·
843	δέδοικα δʼ ἐκ χερῶν με μὴ πρὸς αἰθέρα
844	ἀμπτάμενος φύγῃ·
845	ἰὼ Κυκλωπὶς ἑστία· ἰὼ πατρίς,
846	Μυκήνα φίλα,
847	χάριν ἔχω ζόας, χάριν ἔχω τροφᾶς,
848	ὅτι μοι συνομαίμονα τόνδε δόμοις
849	ἐξεθρέψω φάος.
850	γένει μὲν εὐτυχοῦμεν, ἐς δὲ συμφοράς,
851	ὦ σύγγονʼ, ἡμῶν δυστυχὴς ἔφυ βίος.
852	ἐγᾦδʼ ἁ μέλεος, οἶδʼ, ὅτε φάσγανον
854	δέρᾳ θῆκέ μοι μελεόφρων πατήρ.
855	οἴμοι. δοκῶ γὰρ οὐ παρών σʼ ὁρᾶν ἐκεῖ.
856	ἀνυμέναιος, ὦ σύγγονʼ, Ἀχιλλέως
857	ἐς κλισίαν λέκτρων
859	δολίαν ὅτʼ ἀγόμαν·
860	παρὰ δὲ βωμὸν ἦν δάκρυα καὶ γόοι.
861	φεῦ φεῦ χερνίβων τῶν ἐκεῖ.
862	ᾤμωξα κἀγὼ τόλμαν ἣν ἔτλη πατήρ.
864	ἀπάτορʼ ἀπάτορα πότμον ἔλαχον.
865	ἄλλα δʼ ἐξ ἄλλων κυρεῖ
867	δαίμονος τύχᾳ τινός.
866	εἰ σόν γʼ ἀδελφόν, ὦ τάλαινʼ, ἀπώλεσας.
868	ὦ μελέα δεινᾶς τόλμας. δείνʼ ἔτλαν
870	δείνʼ ἔτλαν, ὤμοι σύγγονε. παρὰ δʼ ὀλίγον
871	ἀπέφυγες ὄλεθρον ἀνόσιον ἐξ ἐμᾶν
872	δαϊχθεὶς χερῶν.
873	ἁ δʼ ἐπʼ αὐτοῖσι τίς τελευτά;
874	τίς τύχα μοι συγχωρήσει;
875	τίνα σοι πόρον εὑρομένα — 
878	πάλιν ἀπὸ πόλεως, ἀπὸ φόνου πέμψω
879	πατρίδʼ ἐς Ἀργείαν,
880	πρὶν ἐπὶ ξίφος αἵματι σῷ πελάσαι;
881	τόδε τόδε σόν, ὦ μελέα ψυχά,
882	χρέος ἀνευρίσκειν.
884	πότερον κατὰ χέρσον, οὐχὶ ναΐ — ;
885	ἀλλὰ ποδῶν ῥιπᾷ
886	θανάτῳ πελάσεις ἄρα βάρβαρα φῦλα
887	καὶ διʼ ὁδοὺς ἀνόδους στείχων· διὰ κυανέας μὴν
890	στενοπόρου πέτρας μακρὰ κέλευθα να-
891	ΐοισιν δρασμοῖς.
894	τάλαινα, τάλαινα.
895	τίς ἂν οὖν τάδʼ ἂν ἢ θεὸς ἢ βροτὸς ἢ
896	τί τῶν ἀδοκήτων,
897	πόρον ἄπορον ἐξανύσας, δυοῖν
898	τοῖν μόνοιν Ἀτρείδαιν φαίνοι 
899	κακῶν ἔκλυσιν;
900	ἐν τοῖσι θαυμαστοῖσι καὶ μύθων πέρα
901	τάδʼ εἶδον αὐτὴ κοὐ κλύουσʼ ἀπαγγελῶ.
902	τὸ μὲν φίλους ἐλθόντας εἰς ὄψιν φίλων,
903	Ὀρέστα, χειρῶν περιβολὰς εἰκὸς λαβεῖν·
904	λήξαντα δʼ οἴκτων κἀπʼ ἐκεῖνʼ ἐλθεῖν χρεών,
905	ὅπως τὸ κλεινὸν ὄνομα τῆς σωτηρίας
906	λαβόντες ἐκ γῆς βησόμεσθα βαρβάρου.
907	σοφῶν γὰρ ἀνδρῶν ταῦτα, μὴ ʼκβάντας τύχης,
908	καιρὸν λαβόντας, ἡδονὰς ἄλλας λαβεῖν.
909	καλῶς ἔλεξας· τῇ τύχῃ δʼ οἶμαι μέλειν
910	τοῦδε ξὺν ἡμῖν· ἢν δέ τις πρόθυμος ᾖ,
911	σθένειν τὸ θεῖον μᾶλλον εἰκότως ἔχει.
912	μηδέν μʼ ἐπίσχῃ γʼ· οὐδʼ ἀποστήσει λόγου,
913	πρῶτον πυθέσθαι τίνα ποτʼ Ἠλέκτρα πότμον
914	εἴληχε βιότου· φίλα γὰρ ἔστε πάντʼ ἐμοί.
915	τῷδε ξυνοικεῖ βίον ἔχουσʼ εὐδαίμονα.
916	οὗτος δὲ ποδαπὸς καὶ τίνος πέφυκε παῖς;
917	Στρόφιος ὁ Φωκεὺς τοῦδε κλῄζεται πατήρ.
918	ὁ δʼ ἐστί γʼ Ἀτρέως θυγατρός, ὁμογενὴς ἐμός;
919	ἀνεψιός γε, μόνος ἐμοὶ σαφὴς φίλος.
920	οὐκ ἦν τόθʼ οὗτος ὅτε πατὴρ ἔκτεινέ με.
921	οὐκ ἦν· χρόνον γὰρ Στρόφιος ἦν ἄπαις τινά.
922	χαῖρʼ ὦ πόσις μοι τῆς ἐμῆς ὁμοσπόρου.
923	κἀμός γε σωτήρ, οὐχὶ συγγενὴς μόνον.
924	τὰ δεινὰ δʼ ἔργα πῶς ἔτλης μητρὸς πέρι;
925	σιγῶμεν αὐτά· πατρὶ τιμωρῶν ἐμῷ.
926	ἡ δʼ αἰτία τίς ἀνθʼ ὅτου κτείνει πόσιν;
927	ἔα τὰ μητρός· οὐδὲ σοὶ κλύειν καλόν.
928	σιγῶ· τὸ δʼ Ἄργος πρὸς σὲ νῦν ἀποβλέπει;
929	Μενέλαος ἄρχει· φυγάδες ἐσμὲν ἐκ πάτρας.
930	οὔ που νοσοῦντας θεῖος ὕβρισεν δόμους;
931	οὔκ, ἀλλʼ Ἐρινύων δεῖμά μʼ ἐκβάλλει χθονός.
932	ταῦτʼ ἆρʼ ἐπʼ ἀκταῖς κἀνθάδʼ ἠγγέλης μανείς;
933	ὤφθημεν οὐ νῦν πρῶτον ὄντες ἄθλιοι.
934	ἔγνωκα· μητρός σʼ οὕνεκʼ ἠλάστρουν θεαί.
935	ὥσθʼ αἱματηρὰ στόμιʼ ἐπεμβαλεῖν ἐμοί.
936	τί γάρ ποτʼ ἐς γῆν τήνδʼ ἐπόρθμευσας πόδα;
937	Φοίβου κελευσθεὶς θεσφάτοις ἀφικόμην.
938	τί χρῆμα δράσειν; ῥητὸν ἢ σιγώμενον;
939	λέγοιμʼ ἄν· ἀρχαὶ δʼ αἵδε μοι πολλῶν πόνων.
940	ἐπεὶ τὰ μητρὸς ταῦθʼ ἃ σιγῶμεν κακὰ
941	ἐς χεῖρας ἦλθε, μεταδρομαῖς Ἐρινύων
942	ἠλαυνόμεσθα φυγάδες, ἔνθεν μοι πόδα
943	ἐς τὰς Ἀθήνας δῆτʼ ἔπεμψε Λοξίας,
944	δίκην παρασχεῖν ταῖς ἀνωνύμοις θεαῖς.
945	ἔστιν γὰρ ὁσία ψῆφος, ἣν Ἄρει ποτὲ
946	Ζεὺς εἵσατʼ ἔκ του δὴ χερῶν μιάσματος.
947	ἐλθὼν δʼ ἐκεῖσε — πρῶτα μέν μʼ οὐδεὶς ξένων
948	ἑκὼν ἐδέξαθʼ, ὡς θεοῖς στυγούμενον·
949	οἳ δʼ ἔσχον αἰδῶ, ξένια μονοτράπεζά μοι
950	παρέσχον, οἴκων ὄντες ἐν ταὐτῷ στέγει,
951	σιγῇ δʼ ἐτεκτήναντʼ ἀπόφθεγκτόν μʼ, ὅπως
952	δαιτὸς γενοίμην πώματός τʼ αὐτοῖς δίχα,
953	ἐς δʼ ἄγγος ἴδιον ἴσον ἅπασι βακχίου
954	μέτρημα πληρώσαντες εἶχον ἡδονήν.
955	κἀγὼ ʼξελέγξαι μὲν ξένους οὐκ ἠξίουν,
956	ἤλγουν δὲ σιγῇ κἀδόκουν οὐκ εἰδέναι,
957	μέγα στενάζων οὕνεκʼ ἦ μητρὸς φονεύς.
958	κλύω δʼ Ἀθηναίοισι τἀμὰ δυστυχῆ
959	τελετὴν γενέσθαι, κἄτι τὸν νόμον μένειν,
960	χοῆρες ἄγγος Παλλάδος τιμᾶν λεών.
961	ὡς δʼ εἰς Ἄρειον ὄχθον ἧκον, ἐς δίκην
962	ἔστην, ἐγὼ μὲν θάτερον λαβὼν βάθρον,
963	τὸ δʼ ἄλλο πρέσβειρʼ ἥπερ ἦν Ἐρινύων.
964	εἰπὼν δʼ ἀκούσας θʼ αἵματος μητρὸς πέρι,
965	Φοῖβός μʼ ἔσῳσε μαρτυρῶν, ἴσας δέ μοι
966	ψήφους διηρίθμησε Παλλὰς ὠλένῃ·
967	νικῶν δʼ ἀπῆρα φόνια πειρατήρια.
968	ὅσαι μὲν οὖν ἕζοντο πεισθεῖσαι δίκῃ,
969	ψῆφον παρʼ αὐτὴν ἱερὸν ὡρίσαντʼ ἔχειν·
970	ὅσαι δʼ Ἐρινύων οὐκ ἐπείσθησαν νόμῳ,
971	δρόμοις ἀνιδρύτοισιν ἠλάστρουν μʼ ἀεί,
972	ἕως ἐς ἁγνὸν ἦλθον αὖ Φοίβου πέδον,
973	καὶ πρόσθεν ἀδύτων ἐκταθείς, νῆστις βορᾶς,
974	ἐπώμοσʼ αὐτοῦ βίον ἀπορρήξειν θανών,
975	εἰ μή με σώσει Φοῖβος, ὅς μʼ ἀπώλεσεν.
976	ἐντεῦθεν αὐδὴν τρίποδος ἐκ χρυσοῦ λακὼν
977	Φοῖβός μʼ ἔπεμψε δεῦρο, διοπετὲς λαβεῖν
978	ἄγαλμʼ Ἀθηνῶν τʼ ἐγκαθιδρῦσαι χθονί.
979	ἀλλʼ ἥνπερ ἡμῖν ὥρισεν σωτηρίαν,
980	σύμπραξον· ἢν γὰρ θεᾶς κατάσχωμεν βρέτας,
981	μανιῶν τε λήξω καὶ σὲ πολυκώπῳ σκάφει
982	στείλας Μυκήναις ἐγκαταστήσω πάλιν.
983	ἀλλʼ, ὦ φιληθεῖσʼ, ὦ κασίγνητον κάρα,
984	σῷσον πατρῷον οἶκον, ἔκσῳσον δʼ ἐμέ·
985	ὡς τἄμʼ ὄλωλε πάντα καὶ τὰ Πελοπιδῶν,
986	οὐράνιον εἰ μὴ ληψόμεσθα θεᾶς βρέτας.
987	δεινή τις ὀργὴ δαιμόνων ἐπέζεσε
988	τὸ Ταντάλειον σπέρμα διὰ πόνων τʼ ἄγει.
989	τὸ μὲν πρόθυμον, πρίν σε δεῦρʼ ἐλθεῖν, ἔχω
990	Ἄργει γενέσθαι καὶ σέ, σύγγονʼ, εἰσιδεῖν.
991	θέλω δʼ ἅπερ σύ, σέ τε μεταστῆσαι πόνων
992	νοσοῦντά τʼ οἶκον, οὐχὶ τῷ κτανόντι με
993	θυμουμένη, πατρῷον ὀρθῶσαι· θέλω·
994	σφαγῆς τε γὰρ σῆς χεῖρʼ ἀπαλλάξαιμεν ἂν
995	σῴσαιμί τʼ οἴκους. τὴν θεὸν δʼ ὅπως λάθω
996	δέδοικα καὶ τύραννον, ἡνίκʼ ἂν κενὰς
997	κρηπῖδας εὕρῃ λαΐνας ἀγάλματος.
998	πῶς δʼ οὐ θανοῦμαι; τίς δʼ ἔνεστί μοι λόγος;
999	ἀλλʼ, εἰ μὲν — ἕν τι — τοῦθʼ ὁμοῦ γενήσεται,
1000	ἄγαλμά τʼ οἴσεις κἄμʼ ἐπʼ εὐπρύμνου νεὼς
1001	ἄξεις, τὸ κινδύνευμα γίγνεται καλόν·
1002	τούτου δὲ χωρισθεῖσʼ — ἐγὼ μὲν ὄλλυμαι,
1003	σὺ δʼ ἂν τὸ σαυτοῦ θέμενος εὖ νόστου τύχοις.
1004	οὐ μήν τι φεύγω γʼ, οὐδέ σʼ εἰ θανεῖν χρεὼν
1005	σῴσασαν· οὐ γὰρ ἀλλʼ ἀνὴρ μὲν ἐκ δόμων
1006	θανὼν ποθεινός, τὰ δὲ γυναικὸς ἀσθενῆ.
1007	οὐκ ἂν γενοίμην σοῦ τε καὶ μητρὸς φονεύς·
1008	ἅλις τὸ κείνης αἷμα· κοινόφρων δὲ σοὶ
1009	καὶ ζῆν θέλοιμʼ ἂν καὶ θανὼν λαχεῖν ἴσον.
1010	ἄξω δέ γʼ, ἤνπερ καὐτὸς ἐνταυθοῖ περῶ,
1011	πρὸς οἶκον, ἢ σοῦ κατθανὼν μενῶ μέτα.
1012	γνώμης δʼ ἄκουσον· εἰ πρόσαντες ἦν τόδε
1013	Ἀρτέμιδι, πῶς ἂν Λοξίας ἐθέσπισε
1014	κομίσαι μʼ ἄγαλμα θεᾶς πόλισμʼ ἐς Παλλάδος
1014a	
1015	καὶ σὸν πρόσωπον εἰσιδεῖν; ἅπαντα γὰρ
1016	συνθεὶς τάδʼ εἰς ἓν νόστον ἐλπίζω λαβεῖν.
1017	πῶς οὖν γένοιτʼ ἂν ὥστε μήθʼ ἡμᾶς θανεῖν,
1018	λαβεῖν θʼ ἃ βουλόμεσθα; τῇδε γὰρ νοσεῖ
1019	νόστος πρὸς οἴκους· ἡ δὲ βούλησις πάρα.
1020	ἆρʼ ἂν τύραννον διολέσαι δυναίμεθʼ ἄν;
1021	δεινὸν τόδʼ εἶπας, ξενοφονεῖν ἐπήλυδας.
1022	ἀλλʼ, εἰ σὲ σώσει κἀμέ, κινδυνευτέον.
1023	οὐκ ἂν δυναίμην· τὸ δὲ πρόθυμον ᾔνεσα.
1024	τί δʼ, εἴ με ναῷ τῷδε κρύψειας λάθρα;
1025	ὡς δὴ σκότον λαβόντες ἐκσωθεῖμεν ἄν;
1026	κλεπτῶν γὰρ ἡ νύξ, τῆς δʼ ἀληθείας τὸ φῶς.
1027	εἴσʼ ἔνδον ἱεροὶ φύλακες, οὓς οὐ λήσομεν.
1028	οἴμοι, διεφθάρμεσθα· πῶς σωθεῖμεν ἄν;
1029	ἔχειν δοκῶ μοι καινὸν ἐξεύρημά τι.
1030	ποῖόν τι; δόξης μετάδος, ὡς κἀγὼ μάθω.
1031	ταῖς σαῖς ἀνίαις χρήσομαι σοφίσμασι.
1032	δειναὶ γὰρ αἱ γυναῖκες εὑρίσκειν τέχνας.
1033	φονέα σε φήσω μητρὸς ἐξ Ἄργους μολεῖν.
1034	χρῆσαι κακοῖσι τοῖς ἐμοῖς, εἰ κερδανεῖς.
1035	ὡς οὐ θέμις γε λέξομεν θύειν θεᾷ,
1036	τίνʼ αἰτίαν ἔχουσʼ; ὑποπτεύω τι γάρ.
1037	οὐ καθαρὸν ὄντα· τὸ δʼ ὅσιον δώσω φόβῳ.
1038	τί δῆτα μᾶλλον θεᾶς ἄγαλμʼ ἁλίσκεται;
1039	πόντου σε πηγαῖς ἁγνίσαι βουλήσομαι,
1040	ἔτʼ ἐν δόμοισι βρέτας, ἐφʼ ᾧ πεπλεύκαμεν.
1041	κἀκεῖνο νίψαι, σοῦ θιγόντος ὥς, ἐρῶ.
1042	ποῖ δῆτα; πόντου νοτερὸν εἶπας ἔκβολον;
1043	οὗ ναῦς χαλινοῖς λινοδέτοις ὁρμεῖ σέθεν.
1044	σὺ δʼ ἤ τις ἄλλος ἐν χεροῖν οἴσει βρέτας;
1045	ἐγώ· θιγεῖν γὰρ ὅσιόν ἐστʼ ἐμοὶ μόνῃ.
1046	Πυλάδης δʼ ὅδʼ ἡμῖν ποῦ τετάξεται πόνου;
1047	ταὐτὸν χεροῖν σοὶ λέξεται μίασμʼ ἔχων.
1048	λάθρα δʼ ἄνακτος ἢ εἰδότος δράσεις τάδε;
1049	πείσασα μύθοις· οὐ γὰρ ἂν λάθοιμί γε.
1050	καὶ μὴν νεώς γε πίτυλος εὐήρης πάρα.
1051	σοὶ δὴ μέλειν χρὴ τἄλλʼ ὅπως ἕξει καλῶς.
1052	ἑνὸς μόνου δεῖ, τάσδε συγκρύψαι τάδε.
1053	ἀλλʼ ἀντίαζε καὶ λόγους πειστηρίους
1054	εὕρισκʼ· ἔχει τοι δύναμιν εἰς οἶκτον γυνή.
1055	τὰ δʼ ἄλλʼ ἴσως — . ἅπαντα συμβαίη καλῶς.
1056	ὦ φίλταται γυναῖκες, εἰς ὑμᾶς βλέπω,
1057	καὶ τἄμʼ ἐν ὑμῖν ἐστιν ἢ καλῶς ἔχειν
1058	ἢ μηδὲν εἶναι καὶ στερηθῆναι πάτρας
1059	φίλου τʼ ἀδελφοῦ φιλτάτης τε συγγόνου.
1060	καὶ πρῶτα μέν μοι τοῦ λόγου τάδʼ ἀρχέτω·
1061	γυναῖκές ἐσμεν, φιλόφρον ἀλλήλαις γένος
1062	σῴζειν τε κοινὰ πράγματʼ ἀσφαλέσταται.
1063	σιγήσαθʼ ἡμῖν καὶ συνεκπονήσατε
1064	φυγάς. καλόν τοι γλῶσσʼ ὅτῳ πιστὴ παρῇ.
1065	ὁρᾶτε δʼ ὡς τρεῖς μία τύχη τοὺς φιλτάτους,
1066	ἢ γῆς πατρῴας νόστον ἢ θανεῖν ἔχει.
1067	σωθεῖσα δʼ, ὡς ἂν καὶ σὺ κοινωνῇς τύχης,
1068	σώσω σʼ ἐς Ἑλλάδʼ. ἀλλὰ πρός σε δεξιᾶς
1069	σὲ καὶ σὲ ἱκνοῦμαι, σὲ δὲ φίλης παρηίδος,
1070	γονάτων τε καὶ τῶν ἐν δόμοισι φιλτάτων
1071	μητρὸς πατρός τε καὶ τέκνων ὅτῳ κυρεῖ.
1072	τί φατέ; τίς ὑμῶν φησιν ἢ τίς οὐ θέλειν — 
1073	φθέγξασθε — ταῦτα; μὴ γὰρ αἰνουσῶν λόγους
1074	ὄλωλα κἀγὼ καὶ κασίγνητος τάλας.
1075	θάρσει, φίλη δέσποινα, καὶ σῴζου μόνον·
1076	ὡς ἔκ γʼ ἐμοῦ σοι πάντα σιγηθήσεται — 
1077	ἴστω μέγας Ζεύς — ὧν ἐπισκήπτεις πέρι.
1078	ὄναισθε μύθων καὶ γένοισθʼ εὐδαίμονες.
1079	σὸν ἔργον ἤδη καὶ σὸν ἐσβαίνειν δόμους·
1080	ὡς αὐτίχʼ ἥξει τῆσδε κοίρανος χθονός,
1081	θυσίαν ἐλέγχων εἰ κατείργασται ξένων.
1082	>ὦ πότνιʼ, ἥπερ μʼ Αὐλίδος κατὰ πτυχὰς
1083	δεινῆς ἔσωσας ἐκ πατροκτόνου χερός,
1084	σῶσόν με καὶ νῦν τούσδε τʼ· ἢ τὸ Λοξίου
1085	οὐκέτι βροτοῖσι διὰ σὲ ἐτήτυμον στόμα.
1086	ἀλλʼ εὐμενὴς ἔκβηθι βαρβάρου χθονὸς
1087	ἐς τὰς Ἀθήνας· καὶ γὰρ ἐνθάδʼ οὐ πρέπει
1088	ναίειν, παρόν σοι πόλιν ἔχειν εὐδαίμονα.
1089	ὄρνις, ἃ παρὰ πετρίνας
1090	πόντου δειράδας, ἀλκυών,
1091	ἔλεγον οἶτον ἀείδεις,
1092	εὐξύνετον ξυνετοῖς βοάν,
1093	ὅτι πόσιν κελαδεῖς ἀεὶ μολπαῖς,
1094	ἐγώ σοι παραβάλλομαι
1095	θρήνους, ἄπτερος ὅρνις,
1096	ποθοῦσʼ Ἑλλάνων ἀγόρους,
1097	ποθοῦσʼ Ἄρτεμιν λοχίαν,
1098	ἃ παρὰ Κύνθιον ὄχθον οἰ-
1099	κεῖ φοίνικά θʼ ἁβροκόμαν
1100	δάφναν τʼ εὐερνέα καὶ
1101	γλαυκᾶς θαλλὸν ἱερὸν ἐλαί-
