0	
1102	ας, Λατοῦς ὠδῖνα φίλαν,
1103	λίμναν θʼ εἱλίσσουσαν ὕδωρ
1104	κύκλιον, ἔνθα κύκνος μελῳ-
1105	δὸς Μούσας θεραπεύει.
1106	ὦ πολλαὶ δακρύων λιβάδες,
1107	αἳ παρηίδας εἰς ἐμὰς
1108	ἔπεσον, ἁνίκα πύργων
1109	ὀλομένων ἐν ναυσὶν ἔβαν
1110	πολεμίων ἐρετμοῖσι καὶ λόγχαις.
1111	ζαχρύσου δὲ διʼ ἐμπολᾶς
1112	νόστον βάρβαρον ἦλθον,
1113	ἔνθα τᾶς ἐλαφοκτόνου
1114	θεᾶς ἀμφίπολον κόραν
1115	παῖδʼ Ἀγαμεμνονίαν λατρεύ-
1116	ω βωμούς τʼ οὐ μηλοθύτας,
1117	ζηλοῦσʼ ἄταν διὰ παν-
1118	τὸς δυσδαίμονʼ· ἐν γὰρ ἀνάγ-
1119	καις οὐ κάμνεις σύντροφος ὤν.
1120	μεταβάλλει δυσδαιμονία·
1121	τὸ δὲ μετʼ εὐτυχίας κακοῦ-
1122	σθαι θνατοῖς βαρὺς αἰών.
1123	καὶ σὲ μέν, πότνιʼ, Ἀργεία
1124	πεντηκόντορος οἶκον ἄξει·
1125	συρίζων θʼ ὁ κηροδέτας
1126	κάλαμος οὐρείου Πανὸς
1127	κώπαις ἐπιθωΰξει,
1128	ὁ Φοῖβός θʼ ὁ μάντις ἔχων
1129	κέλαδον ἑπτατόνου λύρας
1130	ἀείδων ἄξει λιπαρὰν
1131	εὖ σʼ Ἀθηναίων ἐπὶ γᾶν.
1132	ἐμὲ δʼ αὐτοῦ λιποῦσα
1133	βήσῃ ῥοθίοισι πλάταις·
1134	ἀέρι δὲ ἱστία πρότονοι κατὰ πρῷραν ὑ-
1135	πὲρ στόλον ἐκπετάσουσι πόδα
1136	ναὸς ὠκυπόμπου.
1138	λαμπροὺς ἱπποδρόμους βαίην,
1139	ἔνθʼ εὐάλιον ἔρχεται πῦρ·
1140	οἰκείων δʼ ὑπὲρ θαλάμων
1141	πτέρυγας ἐν νώτοις ἁμοῖς
1142	λήξαιμι θοάζουσα·
1143	χοροῖς δʼ ἑσταίην, ὅθι καὶ
1144	παρθένος, εὐδοκίμων γάμων,
1145	παρὰ πόδʼ εἱλίσσουσα φίλας
1146	ματρὸς ἡλίκων θιάσους,
1147	χαρίτων εἰς ἁμίλλας,
1148	χαίτας ἁβρόπλουτον ἔριν,
1149	ὀρνυμένα, πολυποίκιλα φάρεα
1150	καὶ πλοκάμους περιβαλλομένα
1151	γένυσιν ἐσκίαζον.
1153	ποῦ ʼσθʼ ἡ πυλωρὸς τῶνδε δωμάτων γυνὴ
1154	Ἑλληνίς; ἤδη τῶν ξένων κατήρξατο;
1155	ἀδύτοις ἐν ἁγνοῖς σῶμα λάμπονται πυρί;
1156	ἥδʼ ἐστίν, ἥ σοι πάντʼ, ἄναξ, ἐρεῖ σαφῶς.
1157	ἔα·
1157a	τί τόδε μεταίρεις ἐξ ἀκινήτων βάθρων,
1158	Ἀγαμέμνονος παῖ, θεᾶς ἄγαλμʼ ἐν ὠλέναις;
1159	ἄναξ, ἔχʼ αὐτοῦ πόδα σὸν ἐν παραστάσιν.
1160	τί δʼ ἔστιν, Ἰφιγένεια, καινὸν ἐν δόμοις;
1161	ἀπέπτυσʼ· Ὁσίᾳ γὰρ δίδωμʼ ἔπος τόδε.
1162	τί φροιμιάζῃ νεοχμόν; ἐξαύδα σαφῶς.
1163	οὐ καθαρά μοι τὰ θύματʼ ἠγρεύσασθʼ, ἄναξ.
1164	τί τοὐκδιδάξαν τοῦτό σʼ; ἢ δόξαν λέγεις;
1165	βρέτας τὸ τῆς θεοῦ πάλιν ἕδρας ἀπεστράφη.
1166	αὐτόματον, ἤ νιν σεισμὸς ἔστρεψε χθονός;
1167	αὐτόματον· ὄψιν δʼ ὀμμάτων ξυνήρμοσεν.
1168	ἡ δʼ αἰτία τίς; ἦ τὸ τῶν ξένων μύσος;
1169	ἥδʼ, οὐδὲν ἄλλο· δεινὰ γὰρ δεδράκατον.
1170	ἀλλʼ ἦ τινʼ ἔκανον βαρβάρων ἀκτῆς ἔπι;
1171	οἰκεῖον ἦλθον τὸν φόνον κεκτημένοι.
1172	τίνʼ; εἰς ἔρον γὰρ τοῦ μαθεῖν πεπτώκαμεν.
1173	μητέρα κατειργάσαντο κοινωνῷ ξίφει.
1174	Ἄπολλον, οὐδʼ ἐν βαρβάροις ἔτλη τις ἄν.
1175	πάσης διωγμοῖς ἠλάθησαν Ἑλλάδος.
1176	ἦ τῶνδʼ ἕκατι δῆτʼ ἄγαλμʼ ἔξω φέρεις;
1177	σεμνόν γʼ ὑπʼ αἰθέρʼ, ὡς μεταστήσω φόνου.
1178	μίασμα δʼ ἔγνως τοῖν ξένοιν ποίῳ τρόπῳ;
1179	ἤλεγχον, ὡς θεᾶς βρέτας ἀπεστράφη πάλιν.
1180	σοφήν σʼ ἔθρεψεν Ἑλλάς, ὡς ᾔσθου καλῶς.
1181	καὶ μὴν καθεῖσαν δέλεαρ ἡδύ μοι φρενῶν.
1182	τῶν Ἀργόθεν τι φίλτρον ἀγγέλλοντέ σοι;
1183	τὸν μόνον Ὀρέστην ἐμὸν ἀδελφὸν εὐτυχεῖν.
1184	ὡς δή σφε σῴσαις ἡδοναῖς ἀγγελμάτων.
1185	καὶ πατέρα γε ζῆν καὶ καλῶς πράσσειν ἐμόν.
1186	σὺ δʼ ἐς τὸ τῆς θεοῦ γʼ ἐξένευσας εἰκότως.
1187	πᾶσάν γε μισοῦσʼ Ἑλλάδʼ, ἥ μʼ ἀπώλεσεν.
1188	τί δῆτα δρῶμεν, φράζε, τοῖν ξένοιν πέρι;
1189	τὸν νόμον ἀνάγκη τὸν προκείμενον σέβειν.
1190	οὔκουν ἐν ἔργῳ χέρνιβες ξίφος τε σόν;
1191	ἁγνοῖς καθαρμοῖς πρῶτά νιν νίψαι θέλω.
1192	πηγαῖσιν ὑδάτων ἢ θαλασσίᾳ δρόσῳ;
1193	θάλασσα κλύζει πάντα τἀνθρώπων κακά.
1194	ὁσιώτερον γοῦν τῇ θεῷ πέσοιεν ἄν.
1195	καὶ τἀμά γʼ οὕτω μᾶλλον ἂν καλῶς ἔχοι.
1196	οὔκουν πρὸς αὐτὸν ναὸν ἐκπίπτει κλύδων;
1197	ἐρημίας δεῖ· καὶ γὰρ ἄλλα δράσομεν.
1198	ἄγʼ ἔνθα χρῄζεις· οὐ φιλῶ τἄρρηθʼ ὁρᾶν.
1199	ἁγνιστέον μοι καὶ τὸ τῆς θεοῦ βρέτας.
1200	εἴπερ γε κηλὶς ἔβαλέ νιν μητροκτόνος.
1201	οὐ γάρ ποτʼ ἄν νιν ἠράμην βάθρων ἄπο.
1202	δίκαιος ηὑσέβεια καὶ προμηθία.
1203	οἶσθά νυν ἅ μοι γενέσθω;
1203b	σὸν τὸ σημαίνειν τόδε.
1204	δεσμὰ τοῖς ξένοισι πρόσθες.
1204b	ποῖ δέ σʼ ἐκφύγοιεν ἄν;
1205	πιστὸν Ἑλλὰς οἶδεν οὐδέν.
1205b	ἴτʼ ἐπὶ δεσμά, πρόσπολοι.
1206	κἀκκομιζόντων δὲ δεῦρο τοὺς ξένους — 
1206b	ἔσται τάδε.
1207	κρᾶτα κρύψαντες πέπλοισιν.
1207b	ἡλίου πρόσθεν φλογός.
1208	σῶν τέ μοι σύμπεμπʼ ὀπαδῶν.
1208b	οἵδʼ ὁμαρτήσουσί σοι.
1209	καὶ πόλει πέμψον τινʼ ὅστις σημανεῖ — 
1209b	ποίας τύχας;
1210	ἐν δόμοις μίμνειν ἅπαντας.
1210b	μὴ συναντῷεν φόνῳ;
1211	μυσαρὰ γὰρ τὰ τοιάδʼ ἐστί.
1211b	στεῖχε καὶ σήμαινε σύ — 
1212	μηδένʼ εἰς ὄψιν πελάζειν.
1212b	εὖ γε κηδεύεις πόλιν.
1213	καὶ φίλων γʼ οὓς δεῖ μάλιστα.
1213b	τοῦτʼ ἔλεξας εἰς ἐμέ.
1214	
1214b	ὡς εἰκότως σε πᾶσα θαυμάζει πόλις.
1215	σὺ δὲ μένων αὐτοῦ πρὸ ναῶν τῇ θεῷ — 
1215b	τί χρῆμα δρῶ;
1216	ἅγνισον πυρσῷ μέλαθρον.
1216b	καθαρὸν ὡς μόλῃς πάλιν.
1217	ἡνίκʼ ἂν δʼ ἔξω περῶσιν οἱ ξένοι — 
1217b	τί χρή με δρᾶν;
1218	πέπλον ὀμμάτων προθέσθαι.
1218b	μὴ παλαμναῖον λάβω.
1219	ἢν δʼ ἄγαν δοκῶ χρονίζειν — 
1219b	τοῦδʼ ὅρος τίς ἐστί μοι;
1220	θαυμάσῃς μηδέν.
1220b	τὰ τῆς θεοῦ πρᾶσσʼ — ἐπεὶ σχολή — καλῶς.
1221	εἰ γὰρ ὡς θέλω καθαρμὸς ὅδε πέσοι.
1221b	συνεύχομαι.
1222	τούσδʼ ἄρʼ ἐκβαίνοντας ἤδη δωμάτων ὁρῶ ξένους
1223	καὶ θεᾶς κόσμους νεογνούς τʼ ἄρνας, ὡς φόνῳ φόνον
1224	μυσαρὸν ἐκνίψω, σέλας τε λαμπάδων τά τʼ ἄλλʼ ὅσα
1225	προυθέμην ἐγὼ ξένοισι καὶ θεᾷ καθάρσια.
1226	ἐκποδὼν δʼ αὐδῶ πολίταις τοῦδʼ ἔχειν μιάσματος,
1227	εἴ τις ἢ ναῶν πυλωρὸς χεῖρας ἁγνεύει θεοῖς
1228	ἢ γάμον στείχει συνάψων ἢ τόκοις βαρύνεται,
1229	φεύγετʼ, ἐξίστασθε, μή τῳ προσπέσῃ μύσος τόδε.
1230	ὦ Διὸς Λητοῦς τʼ ἄνασσα παρθένʼ, ἢν νίψω φόνον
1231	τῶνδε καὶ θύσωμεν οὗ χρή, καθαρὸν οἰκήσεις δόμον,
1232	εὐτυχεῖς δʼ ἡμεῖς ἐσόμεθα. τἄλλα δʼ οὐ λέγουσʼ, ὅμως
1233	τοῖς τὰ πλείονʼ εἰδόσιν θεοῖς σοί τε σημαίνω, θεά.
1234	εὔπαις ὁ Λατοῦς γόνος,
1235	τόν ποτε Δηλιὰς ἐν καρποφόροις γυάλοις
1236	ἔτικτε, χρυσοκόμαν
1238	ἐν κιθάρᾳ σοφόν, ἅ τʼ ἐπὶ τόξων
1239	εὐστοχίᾳ γάνυται· φέρε δʼ αὐτά
1240	νιν ἀπὸ δειράδος εἰναλίας,
1241	λοχεῖα κλεινὰ λιποῦσα μά-
1242	τηρ, τὰν ἀστάκτων ὑδάτων
1243	βακχεύουσαν Διονύ-
1244	σῳ Παρνάσιον κορυφάν·
1244a	ὅθι ποικιλόνωτος οἰ-
1245	νωπὸς δράκων,
1246	σκιερᾷ κατάχαλκος εὐ-
1247	φύλλῳ δάφνᾳ,
1248	γᾶς πελώριον τέρας, ἄμφεπε μαντεῖ-
1248a	ον Χθόνιον.
1249	ἔτι μιν ἔτι βρέφος, ἔτι φίλας
1250	ἐπὶ ματέρος ἀγκάλαισι θρῴσκων
1251	ἔκανες, ὦ Φοῖβε, μαντείων δʼ ἐπέβας ζαθέων,
1254	τρίποδί τʼ ἐν χρυσέῳ θάσσεις, ἐν ἀψευδεῖ θρόνῳ
1255	μαντείας βροτοῖς θεσφάτων νέμων
1257	ἀδύτων ὕπο, Κασταλίας ῥεέθρων γείτων, μέσον
1258	γᾶς ἔχων μέλαθρον.
1259	Θέμιν δʼ ἐπεὶ γᾶς ἰὼν
1260	παῖδʼ ἀπενάσσατο Πυθῶνος ἀπὸ ζαθέων
1261	χρηστηρίων, νύχια
1262	Χθὼν ἐτεκνώσατο φάσματʼ ὀ νείρων ,
1263	οἳ πολέσιν μερόπων τά τε πρῶτα, τά τʼ
1265	ἔπειθʼ, ὅσσα τʼ ἔμελλε τυχεῖν,
1266	ὕπνου κατὰ δνοφερὰς γᾶς εὐ-
1267	νὰς ἔφραζον· Γαῖα δὲ τὰν
1268	μαντεῖον ἀφείλετο τι-
1269	μὰν Φοῖβον, φθόνῳ θυγατρός.
1270	ταχύπους δʼ ἐς Ὄλυμπον ὁρ-
1271	μαθεὶς ἄναξ
1271a	χέρα παιδνὸν ἕλιξεν ἐκ
1272	Διὸς θρόνων
1273	Πυθίων δόμων χθονίαν ἀφελεῖν μῆ-
1273a	νιν θεᾶς. νυχίους τʼ ἐνοπὰς.
1274	γέλασε δʼ, ὅτι τέκος ἄφαρ ἔβα
1275	πολύχρυσα θέλων λατρεύματα σχεῖν·
1276	ἐπὶ δʼ ἔσεισεν κόμαν, παῦσαι νυχίους ἐνοπάς,
1277	ἀπὸ δʼ ἀλαθοσύναν νυκτωπὸν ἐξεῖλεν βροτῶν,
1280	καὶ τιμὰς πάλιν θῆκε Λοξίᾳ,
1281	πολυάνορι δʼ ἐν ξενόεντι θρόνῳ θάρση βροτοῖς
1282	θεσφάτων ἀοιδαῖς.
1284	ὦ ναοφύλακες βώμιοί τʼ ἐπιστάται,
1285	Θόας ἄναξ γῆς τῆσδε ποῦ κυρεῖ βεβώς;
1286	καλεῖτʼ ἀναπτύξαντες εὐγόμφους πύλας
1287	ἔξω μελάθρων τῶνδε κοίρανον χθονός.
1288	τί δʼ ἔστιν, εἰ χρὴ μὴ κελευσθεῖσαν λέγειν;
1289	βεβᾶσι φροῦδοι δίπτυχοι νεανίαι
1290	Ἀγαμεμνονείας παιδὸς ἐκ βουλευμάτων
1291	φεύγοντες ἐκ γῆς τῆσδε καὶ σεμνὸν βρέτας
1292	λαβόντες ἐν κόλποισιν Ἑλλάδος νεώς.
1293	ἄπιστον εἶπας μῦθον· ὃν δʼ ἰδεῖν θέλεις
1294	ἄνακτα χώρας, φροῦδος ἐκ ναοῦ συθείς.
1295	ποῖ; δεῖ γὰρ αὐτὸν εἰδέναι τὰ δρώμενα.
1296	οὐκ ἴσμεν· ἀλλὰ στεῖχε καὶ δίωκέ νιν
1297	ὅπου κυρήσας τούσδʼ ἀπαγγελεῖς λόγους.
1298	ὁρᾶτʼ, ἄπιστον ὡς γυναικεῖον γένος·
1299	μέτεστι χὑμῖν τῶν πεπραγμένων μέρος.
1300	μαίνῃ· τί δʼ ἡμῖν τῶν ξένων δρασμοῦ μέτα;
1301	οὐκ εἶ κρατούντων πρὸς πύλας ὅσον τάχος;
1302	οὔ, πρίν γʼ ἂν εἴπῃ τοὔπος ἑρμηνεὺς ὅδε,
1303	εἴτʼ ἔνδον εἴτʼ οὐκ ἔνδον ἀρχηγὸς χθονός.
1304	ὠή, χαλᾶτε κλῇθρα, τοῖς ἔνδον λέγω,
1305	καὶ δεσπότῃ σημήναθʼ οὕνεκʼ ἐν πύλαις
1306	πάρειμι, καινῶν φόρτον ἀγγέλλων κακῶν.
1307	τίς ἀμφὶ δῶμα θεᾶς τόδʼ ἵστησιν βοήν,
1308	πύλας ἀράξας καὶ ψόφον πέμψας ἔσω;
1309	φεῦ·
1309a	πῶς ἔλεγον αἵδε, καί μʼ ἀπήλαυνον δόμων,
1310	ὡς ἐκτὸς εἴης· σὺ δὲ κατʼ οἶκον ἦσθʼ ἄρα.
1311	τί προσδοκῶσαι κέρδος ἢ θηρώμεναι;
1312	αὖθις τὰ τῶνδε σημανῶ· τὰ δʼ ἐν ποσὶ
1313	παρόντʼ ἄκουσον. ἡ νεᾶνις ἣ ʼνθάδε
1314	βωμοῖς παρίστατʼ, Ἰφιγένειʼ, ἔξω χθονὸς
1315	σὺν τοῖς ξένοισιν οἴχεται, σεμνὸν θεᾶς
1316	ἄγαλμʼ ἔχουσα· δόλια δʼ ἦν καθάρματα.
1317	πῶς φῄς; τί πνεῦμα συμφορᾶς κεκτημένη;
1318	σῴζουσʼ Ὀρέστην· τοῦτο γὰρ σὺ θαυμάσῃ.
1319	τὸν ποῖον; ἆρʼ ὃν Τυνδαρὶς τίκτει κόρη;
1320	ὃν τοῖσδε βωμοῖς θεὰ καθωσιώσατο.
1321	ὦ θαῦμα — πῶς σε μεῖζον ὀνομάσας τύχω;
1322	μὴ ʼνταῦθα τρέψῃς σὴν φρένʼ, ἀλλʼ ἄκουέ μου·
1323	σαφῶς δʼ ἀθρήσας καὶ κλύων ἐκφρόντισον
1324	διωγμὸς ὅστις τοὺς ξένους θηράσεται.
1325	λέγʼ· εὖ γὰρ εἶπας· οὐ γὰρ ἀγχίπλουν πόρον
1326	φεύγουσιν, ὥστε διαφυγεῖν τοὐμὸν δόρυ.
1327	ἐπεὶ πρὸς ἀκτὰς ἤλθομεν θαλασσίας,
1328	οὗ ναῦς Ὀρέστου κρύφιος ἦν ὡρμισμένη,
1329	ἡμᾶς μέν, οὓς σὺ δεσμὰ συμπέμπεις ξένων
1330	ἔχοντας, ἐξένευσʼ ἀποστῆναι πρόσω
1331	Ἀγαμέμνονος παῖς, ὡς ἀπόρρητον φλόγα
1332	θύουσα καὶ καθαρμὸν ὃν μετῴχετο,
1333	αὐτὴ δʼ ὄπισθε δέσμʼ ἔχουσα τοῖν ξένοιν
1334	ἔστειχε χερσί. καὶ τάδʼ ἦν ὕποπτα μέν,
1335	ἤρεσκε μέντοι σοῖσι προσπόλοις, ἄναξ.
1336	χρόνῳ δʼ, ἵνʼ ἡμῖν δρᾶν τι δὴ δοκοῖ πλέον,
1337	ἀνωλόλυξε καὶ κατῇδε βάρβαρα
1338	μέλη μαγεύουσʼ, ὡς φόνον νίζουσα δή.
1339	ἐπεὶ δὲ δαρὸν ἦμεν ἥμενοι χρόνον,
1340	ἐσῆλθεν ἡμᾶς μὴ λυθέντες οἱ ξένοι
1341	κτάνοιεν αὐτὴν δραπέται τʼ οἰχοίατο.
1342	φόβῳ δʼ ἃ μὴ χρῆν εἰσορᾶν καθήμεθα
1343	σιγῇ· τέλος δὲ πᾶσιν ἦν αὑτὸς λόγος
1344	στείχειν ἵνʼ ἦσαν, καίπερ οὐκ ἐωμένοις.
1345	κἀνταῦθʼ ὁρῶμεν Ἑλλάδος νεὼς σκάφος
1346	ταρσῷ κατήρει πίτυλον ἐπτερωμένον,
1347	ναύτας τε πεντήκοντʼ ἐπὶ σκαλμῶν πλάτας
1348	ἔχοντας, ἐκ δεσμῶν δὲ τοὺς νεανίας
1349	ἐλευθέρους πρύμνηθεν ἑστῶτας νεώς.
1350	κοντοῖς δὲ πρῷραν εἶχον, οἳ δʼ ἐπωτίδων
1351	ἄγκυραν ἐξανῆπτον· οἳ δέ, κλίμακας
1352	σπεύδοντες, ἦγον διὰ χερῶν πρυμνήσια,
1353	πόντῳ δὲ δόντες τοῖν ξένοιν καθίεσαν.
1354	ἡμεῖς δʼ ἀφειδήσαντες, ὡς ἐσείδομεν
1355	δόλια τεχνήματʼ, εἰχόμεσθα τῆς ξένης
1356	πρυμνησίων τε, καὶ διʼ εὐθυντηρίας
1357	οἴακας ἐξῃροῦμεν εὐπρύμνου νεώς.
1358	λόγοι δʼ ἐχώρουν· Τίνι λόγῳ πορθμεύετε
1359	κλέπτοντες ἐκ γῆς ξόανα καὶ θυηπόλους;
1360	τίνος τίς ὢν σὺ τήνδʼ ἀπεμπολᾷς χθονός;
1361	ὁ δʼ εἶπʼ· Ὀρέστης, τῆσδʼ ὅμαιμος, ὡς μάθῃς,
1362	Ἀγαμέμνονος παῖς, τήνδʼ ἐμὴν κομίζομαι
1363	λαβὼν ἀδελφήν, ἣν ἀπώλεσʼ ἐκ δόμων.
1364	ἀλλʼ οὐδὲν ἧσσον εἰχόμεσθα τῆς ξένης
1365	καὶ πρὸς σὲ ἕπεσθαι διεβιαζόμεσθά νιν·
1366	ὅθεν τὰ δεινὰ πλήγματʼ ἦν γενειάδων.
1367	κεῖνοί τε γὰρ σίδηρον οὐκ εἶχον χεροῖν
1368	ἡμεῖς τε· πυγμαί τʼ ἦσαν ἐγκροτούμεναι,
1369	καὶ κῶλʼ ἀπʼ ἀμφοῖν τοῖν νεανίαιν ἅμα
1370	ἐς πλευρὰ καὶ πρὸς ἧπαρ ἠκοντίζετο,
1371	ὡς τῷ ξυνάπτειν καὶ συναποκαμεῖν μέλη.
1372	δεινοῖς δὲ σημάντροισιν ἐσφραγισμένοι
1373	ἐφεύγομεν πρὸς κρημνόν, οἳ μὲν ἐν κάρᾳ
1374	κάθαιμʼ ἔχοντες τραύμαθʼ, οἳ δʼ ἐν ὄμμασιν·
1375	ὄχθοις δʼ ἐπισταθέντες εὐλαβεστέρως
1376	ἐμαρνάμεσθα καὶ πέτρους ἐβάλλομεν.
1377	ἀλλʼ εἶργον ἡμᾶς τοξόται πρύμνης ἔπι
1378	σταθέντες ἰοῖς, ὥστʼ ἀναστεῖλαι πρόσω.
1379	κἀν τῷδε — δεινὸς γὰρ κλύδων ὤκειλε ναῦν
1380	πρὸς γῆν, φόβος δʼ ἦν παρθένῳ τέγξαι πόδα — 
1381	λαβὼν Ὀρέστης ὦμον εἰς ἀριστερόν,
1382	βὰς ἐς θάλασσαν κἀπὶ κλίμακος θορών,
1383	ἔθηκʼ ἀδελφὴν ἐντὸς εὐσήμου νεώς,
1384	τό τʼ οὐρανοῦ πέσημα, τῆς Διὸς κόρης
1385	ἄγαλμα. ναὸς δʼ ἐκ μέσης ἐφθέγξατο
1386	βοή τις· ὦ γῆς Ἑλλάδος ναῦται, νεὼς
1387	λάβεσθε κώπαις ῥόθιά τʼ ἐκλευκαίνετε·
1388	ἔχομεν γὰρ ὧνπερ οὕνεκʼ ἄξενον πόρον
1389	Συμπληγάδων ἔσωθεν εἰσεπλεύσαμεν.
1390	οἳ δὲ στεναγμὸν ἡδὺν ἐκβρυχώμενοι
1391	ἔπαισαν ἅλμην. ναῦς δʼ, ἕως μὲν ἐντὸς ἦν
1392	λιμένος, ἐχώρει στόμια, διαπερῶσα δὲ
1393	λάβρῳ κλύδωνι συμπεσοῦσʼ ἠπείγετο·
1394	δεινὸς γὰρ ἐλθὼν ἄνεμος ἐξαίφνης νεὼς
1395	ὠθεῖ παλίμπρυμνʼ ἱστίʼ· οἳ δʼ ἐκαρτέρουν
1396	πρὸς κῦμα λακτίζοντες· ἐς δὲ γῆν πάλιν
1397	κλύδων παλίρρους ἦγε ναῦν. σταθεῖσα δὲ
1398	Ἀγαμέμνονος παῖς ηὔξατʼ· ὦ Λητοῦς κόρη
1399	σῷσόν με τὴν σὴν ἱερέαν πρὸς Ἑλλάδα
1400	ἐκ βαρβάρου γῆς καὶ κλοπαῖς σύγγνωθʼ ἐμαῖς.
1401	φιλεῖς δὲ καὶ σὺ σὸν κασίγνητον, θεά·
1402	φιλεῖν δὲ κἀμὲ τοὺς ὁμαίμονας δόκει.
1403	ναῦται δʼ ἐπευφήμησαν εὐχαῖσιν κόρης
1404	παιᾶνα, γυμνὰς ἐκ πέπλων ἐπωμίδας
1405	κώπῃ προσαρμόσαντες ἐκ κελεύσματος.
1406	μᾶλλον δὲ μᾶλλον πρὸς πέτρας ᾔει σκάφος·
1407	χὣ μέν τις ἐς θάλασσαν ὡρμήθη ποσίν,
1408	ἄλλος δὲ πλεκτὰς ἐξανῆπτεν ἀγκύλας.
1409	κἀγὼ μὲν εὐθὺς πρὸς σὲ δεῦρʼ ἀπεστάλην,
1410	σοὶ τὰς ἐκεῖθεν σημανῶν, ἄναξ, τύχας.
1411	ἀλλʼ ἕρπε, δεσμὰ καὶ βρόχους λαβὼν χεροῖν·
1412	εἰ μὴ γὰρ οἶδμα νήνεμον γενήσεται,
1413	οὐκ ἔστιν ἐλπὶς τοῖς ξένοις σωτηρίας.
1414	πόντου δʼ ἀνάκτωρ Ἴλιόν τʼ ἐπισκοπεῖ
1415	σεμνὸς Ποσειδῶν, Πελοπίδαις ἐναντίος,
1416	καὶ νῦν παρέξει τὸν Ἀγαμέμνονος γόνον
1417	σοὶ καὶ πολίταις, ὡς ἔοικεν, ἐν χεροῖν
1418	λαβεῖν, ἀδελφήν θʼ, ἣ φόνον τὸν Αὐλίδι
1419	ἀμνημόνευτον θεᾷ προδοῦσʼ ἁλίσκεται.
1420	ὦ τλῆμον Ἰφιγένεια, συγγόνου μέτα
1421	θανῇ πάλιν μολοῦσα δεσποτῶν χέρας.
1422	ὦ πάντες ἀστοὶ τῆσδε βαρβάρου χθονός,
1423	οὐκ εἶα πώλοις ἐμβαλόντες ἡνίας
1424	παράκτιοι δραμεῖσθε κἀκβολὰς νεὼς
1425	Ἑλληνίδος δέξεσθε, σὺν δὲ τῇ θεῷ
1426	σπεύδοντες ἄνδρας δυσσεβεῖς θηράσετε,
1427	οἳ δʼ ὠκυπομποὺς ἕλξετʼ ἐς πόντον πλάτας;
1428	ὡς ἐκ θαλάσσης ἔκ τε γῆς ἱππεύμασι
1429	λαβόντες αὐτοὺς ἢ κατὰ στύφλου πέτρας
1430	ῥίψωμεν, ἢ σκόλοψι πήξωμεν δέμας.
1431	ὑμᾶς δὲ τὰς τῶνδʼ ἴστορας βουλευμάτων,
1432	γυναῖκες, αὖθις, ἡνίκʼ ἂν σχολὴν λάβω,
1433	ποινασόμεσθα· νῦν δὲ τὴν προκειμένην
1434	σπουδὴν ἔχοντες οὐ μενοῦμεν ἥσυχοι.
1435	ποῖ ποῖ διωγμὸν τόνδε πορθμεύεις, ἄναξ
1436	Θόας; ἄκουσον τῆσδʼ Ἀθηναίας λόγους.
1437	παῦσαι διώκων ῥεῦμά τʼ ἐξορμῶν στρατοῦ·
1438	πεπρωμένος γὰρ θεσφάτοισι Λοξίου
1439	δεῦρʼ ἦλθʼ Ὀρέστης, τόν τʼ Ἐρινύων χόλον
1440	φεύγων ἀδελφῆς τʼ Ἄργος ἐσπέμψων δέμας
1441	ἄγαλμά θʼ ἱερὸν εἰς ἐμὴν ἄξων χθόνα,
1441b	τῶν νῦν παρόντων πημάτων ἀναψυχάς.
1442	πρὸς μὲν σὲ ὅδʼ ἡμῖν μῦθος· ὃν δʼ ἀποκτενεῖν
1443	δοκεῖς Ὀρέστην ποντίῳ λαβὼν σάλῳ,
1444	ἤδη Ποσειδῶν χάριν ἐμὴν ἀκύμονα
1445	πόντου τίθησι νῶτα πορθμεύειν πλάτῃ.
1446	μαθὼν δʼ, Ὀρέστα, τὰς ἐμὰς ἐπιστολάς — 
1447	κλύεις γὰρ αὐδὴν καίπερ οὐ παρὼν θεᾶς — 
1448	χώρει λαβὼν ἄγαλμα σύγγονόν τε σήν.
1449	ὅταν δʼ Ἀθήνας τὰς θεοδμήτους μόλῃς,
1450	χῶρός τις ἔστιν Ἀτθίδος πρὸς ἐσχάτοις
1451	ὅροισι, γείτων δειράδος Καρυστίας,
1452	ἱερός, Ἁλάς νιν οὑμὸς ὀνομάζει λεώς·
1453	ἐνταῦθα τεύξας ναὸν ἵδρυσαι βρέτας,
1454	ἐπώνυμον γῆς Ταυρικῆς πόνων τε σῶν,
1455	οὓς ἐξεμόχθεις περιπολῶν καθʼ Ἑλλάδα
1456	οἴστροις Ἐρινύων. Ἄρτεμιν δέ νιν βροτοὶ
