0	
1	Πέλοψ ὁ Ταντάλειος ἐς Πῖσαν μολὼν
2	θοαῖσιν ἵπποις Οἰνομάου γαμεῖ κόρην,
3	ἐξ ἧς Ἀτρεὺς ἔβλαστεν· Ἀτρέως δὲ παῖς
4	Μενέλαος Ἀγαμέμνων τε· τοῦ δʼ ἔφυν ἐγώ
5	τῆς Τυνδαρείας θυγατρὸς Ἰφιγένεια παῖς,
6	ἣν ἀμφὶ δίναις ἃς θάμʼ Εὔριπος πυκναῖς
7	αὔραις ἑλίσσων κυανέαν ἅλα στρέφει,
8	ἔσφαξεν Ἑλένης οὕνεχʼ, ὡς δοκεῖ, πατὴρ
9	Ἀρτέμιδι κλειναῖς ἐν πτυχαῖσιν Αὐλίδος.
10	ἐνταῦθα γὰρ δὴ χιλίων ναῶν στόλον
11	Ἑλληνικὸν συνήγαγʼ Ἀγαμέμνων ἄναξ,
12	τὸν καλλίνικον στέφανον Ἰλίου θέλων
13	λαβεῖν Ἀχαιοῖς τούς θʼ ὑβρισθέντας γάμους
14	Ἑλένης μετελθεῖν, Μενέλεῳ χάριν φέρων.
15	δεινῆς δʼ ἀπλοίας πνευμάτων τε τυγχάνων,
16	ἐς ἔμπυρʼ ἦλθε, καὶ λέγει Κάλχας τάδε·
17	ὦ τῆσδʼ ἀνάσσων Ἑλλάδος στρατηγίας,
18	Ἀγάμεμνον, οὐ μὴ ναῦς ἀφορμίσῃ χθονός,
19	πρὶν ἂν κόρην σὴν Ἰφιγένειαν Ἄρτεμις
20	λάβῃ σφαγεῖσαν· ὅ τι γὰρ ἐνιαυτὸς τέκοι
21	κάλλιστον, ηὔξω φωσφόρῳ θύσειν θεᾷ.
22	παῖδʼ οὖν ἐν οἴκοις σὴ Κλυταιμήστρα δάμαρ
23	τίκτει — τὸ καλλιστεῖον εἰς ἔμʼ ἀναφέρων — 
24	ἣν χρή σε θῦσαι. καί μʼ Ὀδυσσέως τέχναις
25	μητρὸς παρείλοντʼ ἐπὶ γάμοις Ἀχιλλέως.
26	ἐλθοῦσα δʼ Αὐλίδʼ ἡ τάλαινʼ ὑπὲρ πυρᾶς
27	μεταρσία ληφθεῖσʼ ἐκαινόμην ξίφει·
28	ἀλλʼ ἐξέκλεψεν ἔλαφον ἀντιδοῦσά μου
29	Ἄρτεμις Ἀχαιοῖς, διὰ δὲ λαμπρὸν αἰθέρα
30	πέμψασά μʼ ἐς τήνδʼ ᾤκισεν Ταύρων χθόνα,
31	οὗ γῆς ἀνάσσει βαρβάροισι βάρβαρος
32	Θόας, ὃς ὠκὺν πόδα τιθεὶς ἴσον πτεροῖς
33	ἐς τοὔνομʼ ἦλθε τόδε ποδωκείας χάριν.
34	ναοῖσι δʼ ἐν τοῖσδʼ ἱερέαν τίθησί με·
35	ὅθεν νόμοισι τοῖσιν ἥδεται θεὰ
36	Ἄρτεμις, ἑορτῆς, τοὔνομʼ ἧς καλὸν μόνον — 
37	τὰ δʼ ἄλλα σιγῶ, τὴν θεὸν φοβουμένη — 
38	θύω γὰρ ὄντος τοῦ νόμου καὶ πρὶν πόλει,
39	ὃς ἂν κατέλθῃ τήνδε γῆν Ἕλλην ἀνήρ.
40	κατάρχομαι μέν, σφάγια δʼ ἄλλοισιν μέλει
41	ἄρρητʼ ἔσωθεν τῶνδʼ ἀνακτόρων θεᾶς.
42	ἃ καινὰ δʼ ἥκει νὺξ φέρουσα φάσματα,
43	λέξω πρὸς αἰθέρʼ, εἴ τι δὴ τόδʼ ἔστʼ ἄκος.
44	ἔδοξʼ ἐν ὕπνῳ τῆσδʼ ἀπαλλαχθεῖσα γῆς
45	οἰκεῖν ἐν Ἄργει, παρθένοισι δʼ ἐν μέσαις
46	εὕδειν, χθονὸς δὲ νῶτα σεισθῆναι σάλῳ,
47	φεύγειν δὲ κἄξω στᾶσα θριγκὸν εἰσιδεῖν
48	δόμων πίτνοντα, πᾶν δʼ ἐρείψιμον στέγος
49	βεβλημένον πρὸς οὖδας ἐξ ἄκρων σταθμῶν.
50	μόνος λελεῖφθαι στῦλος εἷς ἔδοξέ μοι
51	δόμων πατρῴων, ἐκ δʼ ἐπικράνων κόμας
52	ξανθὰς καθεῖναι, φθέγμα δʼ ἀνθρώπου λαβεῖν,
53	κἀγὼ τέχνην τήνδʼ ἣν ἔχω ξενοκτόνον
54	τιμῶσʼ ὑδραίνειν αὐτὸν ὡς θανούμενον,
55	κλαίουσα. τοὔναρ δʼ ὧδε συμβάλλω τόδε·
56	τέθνηκʼ Ὀρέστης, οὗ κατηρξάμην ἐγώ.
57	στῦλοι γὰρ οἴκων παῖδές εἰσιν ἄρσενες·
58	θνῄσκουσι δʼ οὓς ἂν χέρνιβες βάλωσʼ ἐμαί.
59	οὐδʼ αὖ συνάψαι τοὔναρ ἐς φίλους ἔχω·
60	Στροφίῳ γὰρ οὐκ ἦν παῖς, ὅτʼ ὠλλύμην ἐγώ.
61	νῦν οὖν ἀδελφῷ βούλομαι δοῦναι χοὰς
62	παροῦσʼ ἀπόντι — ταῦτα γὰρ δυναίμεθʼ ἄν — 
63	σὺν προσπόλοισιν, ἃς ἔδωχʼ ἡμῖν ἄναξ
64	Ἑλληνίδας γυναῖκας. ἀλλʼ ἐξ αἰτίας
65	οὔπω τίνος πάρεισιν; εἶμʼ ἔσω δόμων
66	ἐν οἷσι ναίω τῶνδʼ ἀνακτόρων θεᾶς.
67	ὅρα, φυλάσσου μή τις ἐν στίβῳ βροτῶν.
68	ὁρῶ, σκοποῦμαι δʼ ὄμμα πανταχῆ στρέφων.
69	Πυλάδη, δοκεῖ σοι μέλαθρα ταῦτʼ εἶναι θεᾶς
70	ἔνθʼ Ἀργόθεν ναῦν ποντίαν ἐστείλαμεν;
71	ἔμοιγʼ, Ὀρέστα· σοὶ δὲ συνδοκεῖν χρεών.
72	καὶ βωμός, Ἕλλην οὗ καταστάζει φόνος;
73	ἐξ αἱμάτων γοῦν ξάνθʼ ἔχει τριχώματα.
74	θριγκοῖς δʼ ὑπʼ αὐτοῖς σκῦλʼ ὁρᾷς ἠρτημένα;
75	τῶν κατθανόντων γʼ ἀκροθίνια ξένων.
76	ἀλλʼ ἐγκυκλοῦντʼ ὀφθαλμὸν εὖ σκοπεῖν χρεών.
77	ὦ Φοῖβε, ποῖ μʼ αὖ τήνδʼ ἐς ἄρκυν ἤγαγες
78	χρήσας, ἐπειδὴ πατρὸς αἷμʼ ἐτεισάμην,
79	μητέρα κατακτάς, διαδοχαῖς δʼ Ἐρινύων
80	ἠλαυνόμεσθα φυγάδες ἔξεδροι χθονὸς
81	δρόμους τε πολλοὺς ἐξέπλησα καμπίμους,
82	ἐλθὼν δέ σʼ ἠρώτησα πῶς τροχηλάτου
83	μανίας ἂν ἔλθοιμʼ ἐς τέλος πόνων τʼ ἐμῶν,
84	οὓς ἐξεμόχθουν περιπολῶν καθʼ Ἑλλάδα — 
85	σὺ δʼ εἶπας ἐλθεῖν Ταυρικῆς μʼ ὅρους χθονός,
86	ἔνθʼ Ἄρτεμίς σοι σύγγονος βωμοὺς ἔχοι,
87	λαβεῖν τʼ ἄγαλμα θεᾶς, ὅ φασιν ἐνθάδε
88	ἐς τούσδε ναοὺς οὐρανοῦ πεσεῖν ἄπο·
89	λαβόντα δʼ ἢ τέχναισιν ἢ τύχῃ τινί,
90	κίνδυνον ἐκπλήσαντʼ, Ἀθηναίων χθονὶ
91	δοῦναι — τὸ δʼ ἐνθένδʼ οὐδὲν ἐρρήθη πέρα — 
92	καὶ ταῦτα δράσαντʼ ἀμπνοὰς ἕξειν πόνων.
93	ἥκω δὲ πεισθεὶς σοῖς λόγοισιν ἐνθάδε
94	ἄγνωστον ἐς γῆν, ἄξενον. σὲ δʼ ἱστορῶ,
95	Πυλάδη — σὺ γάρ μοι τοῦδε συλλήπτωρ πόνου — 
96	τί δρῶμεν; ἀμφίβληστρα γὰρ τοίχων ὁρᾷς
97	ὑψηλά· πότερα δωμάτων προσαμβάσεις
98	ἐκβησόμεσθα; πῶς ἂν οὖν λάθοιμεν ἄν;
99	ἢ χαλκότευκτα κλῇθρα λύσαντες μοχλοῖς — 
100	ὧν οὐδὲν ἴσμεν; ἢν δʼ ἀνοίγοντες πύλας
101	ληφθῶμεν ἐσβάσεις τε μηχανώμενοι,
102	θανούμεθʼ. ἀλλὰ πρὶν θανεῖν, νεὼς ἔπι
103	φεύγωμεν, ᾗπερ δεῦρʼ ἐναυστολήσαμεν.
104	φεύγειν μὲν οὐκ ἀνεκτὸν οὐδʼ εἰώθαμεν,
105	τὸν τοῦ θεοῦ δὲ χρησμὸν οὐ κακιστέον·
106	ναοῦ δʼ ἀπαλλαχθέντε κρύψωμεν δέμας
107	κατʼ ἄντρʼ ἃ πόντος νοτίδι διακλύζει μέλας — 
108	νεὼς ἄπωθεν, μή τις εἰσιδὼν σκάφος
109	βασιλεῦσιν εἴπῃ κᾆτα ληφθῶμεν βίᾳ.
110	ὅταν δὲ νυκτὸς ὄμμα λυγαίας μόλῃ,
111	τολμητέον τοι ξεστὸν ἐκ ναοῦ λαβεῖν
112	ἄγαλμα πάσας προσφέροντε μηχανάς.
113	ὅρα δέ γʼ εἴσω τριγλύφων ὅποι κενὸν
114	δέμας καθεῖναι· τοὺς πόνους γὰρ ἁγαθοὶ
115	τολμῶσι, δειλοὶ δʼ εἰσὶν οὐδὲν οὐδαμοῦ.
116	οὔ τοι μακρὸν μὲν ἤλθομεν κώπῃ πόρον,
117	ἐκ τερμάτων δὲ νόστον ἀροῦμεν πάλιν.
118	ἀλλʼ εὖ γὰρ εἶπας, πειστέον· χωρεῖν χρεὼν
119	ὅποι χθονὸς κρύψαντε λήσομεν δέμας.
120	οὐ γὰρ τὸ τοῦ θεοῦ γʼ αἴτιον γενήσεται
121	πεσεῖν ἄχρηστον θέσφατον· τολμητέον·
122	μόχθος γὰρ οὐδεὶς τοῖς νέοις σκῆψιν φέρει.
123	εὐφαμεῖτʼ, ὦ
124	πόντου δισσὰς συγχωρούσας
125	πέτρας Ἀξείνου ναίοντες.
126	ὦ παῖ τᾶς Λατοῦς,
127	Δίκτυννʼ οὐρεία,
128	πρὸς σὰν αὐλάν, εὐστύλων
129	ναῶν χρυσήρεις θριγκούς,
130	πόδα παρθένιον ὅσιον ὁσίας
131	κλῃδούχου δούλα πέμπω,
132	Ἑλλάδος εὐίππου πύργους
134	καὶ τείχη χόρτων τʼ εὐδένδρων
135	ἐξαλλάξασʼ Εὐρώπαν,
136	πατρῴων οἴκων ἕδρας.
137	ἔμολον· τί νέον; τίνα φροντίδʼ ἔχεις;
138	τί με πρὸς ναοὺς ἄγαγες ἄγαγες,
139	ὦ παῖ τοῦ τᾶς Τροίας πύργους
140	ἐλθόντος κλεινᾷ σὺν κώπᾳ
141	χιλιοναύτα
142	μυριοτευχοῦς Ἀτρείδα; τῶν κλεινῶν; 
143	ἰὼ δμωαί,
144	δυσθρηνήτοις ὡς θρήνοις
145	ἔγκειμαι, τᾶς οὐκ εὐμούσου
146	μολπᾶς βοὰν ἀλύροις ἐλέγοις, αἰαῖ,
147	αἰαῖ, κηδείοις οἴκτοισιν·
148	αἵ μοι συμβαίνουσʼ ἆται,
149	σύγγονον ἁμὸν κατακλαιομένα
150	ζωᾶς, οἵαν οἵαν ἰδόμαν
151	ὄψιν ὀνείρων
152	νυκτός, τᾶς ἐξῆλθʼ ὄρφνα.
152a	ὀλόμαν ὀλόμαν·
153	οὐκ εἴσʼ οἶκοι πατρῷοι·
154	οἴμοι μοι φροῦδος γέννα.
155	φεῦ φεῦ τῶν Ἄργει μόχθων.
156	ἰὼ δαῖμον,
157	μόνον ὅς με κασίγνητον συλᾷς
159	Ἀίδᾳ πέμψας, ᾧ τάσδε χοὰς
160	μέλλω κρατῆρά τε τὸν φθιμένων
161	ὑδραίνειν γαίας ἐν νώτοις
162	πηγάς τʼ οὐρείων ἐκ μόσχων
164	Βάκχου τʼ οἰνηρὰς λοιβὰς
165	ξουθᾶν τε πόνημα μελισσᾶν,
166	ἃ νεκροῖς θελκτήρια κεῖται.
168	ἀλλʼ ἔνδος μοι πάγχρυσον
169	τεῦχος καὶ λοιβὰν Ἅιδα.
170	ὦ κατὰ γαίας Ἀγαμεμνόνιον
171	θάλος, ὡς φθιμένῳ τάδε σοι πέμπω·
172	δέξαι δʼ· οὐ γὰρ πρὸς τύμβον σοι
173	ξανθὰν χαίταν, οὐ δάκρυʼ οἴσω.
175	τηλόσε γὰρ δὴ σᾶς ἀπενάσθην
176	πατρίδος καὶ ἐμᾶς, ἔνθα δοκήμασι
177	κεῖμαι σφαχθεῖσʼ ἁ τλάμων.
178	ἀντιψάλμους ᾠδὰς ὕμνων τʼ
180	Ἀσιητᾶν σοι βάρβαρον ἀχὰν
181	δεσποίνᾳ γʼ ἐξαυδάσω,
183	τὰν ἐν θρήνοισιν μοῦσαν
184	νέκυσι μελομέναν, τὰν ἐν μολπαῖς
185	Ἅιδας ὑμνεῖ δίχα παιάνων.
186	οἴμοι, τῶν Ἀτρειδᾶν οἴκων·
187	ἔρρει φῶς σκήπτρων, οἴμοι,
188	πατρῴων οἴκων.
189	ἦν ἐκ τῶν εὐόλβων Ἄργει
190	βασιλέων ἀρχά,
191	μόχθος δʼ ἐκ μόχθων ᾄσσει·
192	δινευούσαις ἵπποισι ῥιφαὶ
193	Πέλοπος πταναῖς· ἀλλάξας δʼ ἐξ
194	ἕδρας ἱερὸν ἱερὸν ὄμμʼ αὐγᾶς
195	ἅλιος. ἄλλαις δʼ ἄλλα προσέβα
196	χρυσέας ἀρνὸς μελάθροις ὀδύνα,
197	φόνος ἐπὶ φόνῳ, ἄχεα ἄχεσιν
199	ἔνθεν τῶν πρόσθεν δμαθέντων
200	Τανταλιδᾶν ἐκβαίνει ποινά γʼ
201	εἰς οἴκους, σπεύδει δʼ ἀσπούδαστʼ
202	ἐπὶ σοὶ δαίμων.
203	ἐξ ἀρχᾶς μοι δυσδαίμων
204	δαίμων τᾶς ματρὸς ζώνας
205	καὶ νυκτὸς κείνας· ἐξ ἀρχᾶς
206	λόχιαι στερρὰν παιδείαν
207	Μοῖραι ξυντείνουσιν θεαί,
208	τᾷ μναστευθείσᾳ ʼξ Ἑλλάνων,
209	ἃν πρωτόγονον θάλος ἐν θαλάμοις
210	Λήδας ἁ τλάμων κούρα
211	σφάγιον πατρῴᾳ λώβᾳ
212	καὶ θῦμʼ οὐκ εὐγάθητον
213	ἔτεκεν, ἔτρεφεν εὐκταίαν·
214	ἱππείοις δʼ ἐν δίφροισι
215	ψαμάθων Αὐλίδος ἐπέβασαν
216	νύμφαιον, οἴμοι, δύσνυμφον
217	τῷ τᾶς Νηρέως κούρας, αἰαῖ.
218	νῦν δʼ ἀξείνου πόντου ξείνα
219	δυσχόρτους οἴκους ναίω,
220	ἄγαμος ἄτεκνος ἄπολις ἄφιλος,
221	οὐ τὰν Ἄργει μέλπουσʼ Ἥραν
222	οὐδʼ ἱστοῖς ἐν καλλιφθόγγοις
223	κερκίδι Παλλάδος Ἀτθίδος εἰκὼ
224	καὶ Τιτάνων ποικίλλουσʼ, ἀλλʼ
225	αἱμόρραντον δυσφόρμιγγα
226	ξείνων αἱμάσσουσʼ ἄταν βωμούς,
227	οἰκτράν τʼ αἰαζόντων αὐδὰν
228	οἰκτρόν τʼ ἐκβαλλόντων δάκρυον.
229	καὶ νῦν κείνων μέν μοι λάθα,
230	τὸν δʼ Ἄργει δμαθέντα κλαίω
232	σύγγονον, ὃν ἔλιπον ἐπιμαστίδιον,
233	ἔτι βρέφος, ἔτι νέον, ἔτι θάλος
234	ἐν χερσὶν ματρὸς πρὸς στέρνοις τʼ
235	Ἄργει σκηπτοῦχον Ὀρέσταν.
236	καὶ μὴν ὅδʼ ἀκτὰς ἐκλιπὼν θαλασσίους
237	βουφορβὸς ἥκει σημανῶν τί σοι νέον.
238	Ἀγαμέμνονός τε καὶ Κλυταιμήστρας τέκνον,
239	ἄκουε καινῶν ἐξ ἐμοῦ κηρυγμάτων.
240	τί δʼ ἔστι τοῦ παρόντος ἐκπλῆσσον λόγου;
241	ἥκουσιν ἐς γῆν, κυανέαν Συμπληγάδα
242	πλάτῃ φυγόντες, δίπτυχοι νεανίαι,
243	θεᾷ φίλον πρόσφαγμα καὶ θυτήριον
244	Ἀρτέμιδι. χέρνιβας δὲ καὶ κατάργματα
245	οὐκ ἂν φθάνοις ἂν εὐτρεπῆ ποιουμένη.
246	ποδαποί; τίνος γῆς σχῆμʼ ἔχουσιν οἱ ξένοι;
247	Ἕλληνες· ἓν τοῦτʼ οἶδα κοὐ περαιτέρω.
248	οὐδʼ ὄνομʼ ἀκούσας οἶσθα τῶν ξένων φράσαι;
249	Πυλάδης ἐκλῄζεθʼ ἅτερος πρὸς θατέρου.
250	τοῦ ξυζύγου δὲ τοῦ ξένου τί τοὔνομʼ ἦν;
251	οὐδεὶς τόδʼ οἶδεν· οὐ γὰρ εἰσηκούσαμεν.
252	πῶς δʼ εἴδετʼ αὐτοὺς κἀντυχόντες εἵλετε;
253	ἄκραις ἐπὶ ῥηγμῖσιν ἀξένου πόρου — 
254	καὶ τίς θαλάσσης βουκόλοις κοινωνία;
255	βοῦς ἤλθομεν νίψοντες ἐναλίᾳ δρόσῳ.
256	ἐκεῖσε δὴ ʼπάνελθε, πῶς νιν εἵλετε
257	τρόπῳ θʼ ὁποίῳ· τοῦτο γὰρ μαθεῖν θέλω.
258	χρόνιοι γὰρ ἥκουσʼ· οὐδέ πω βωμὸς θεᾶς
259	Ἑλληνικαῖσιν ἐξεφοινίχθη ῥοαῖς.
260	ἐπεὶ τὸν ἐσρέοντα διὰ Συμπληγάδων
261	βοῦς ὑλοφορβοὺς πόντον εἰσεβάλλομεν,
262	ἦν τις διαρρὼξ κυμάτων πολλῷ σάλῳ
263	κοιλωπὸς ἀγμός, πορφυρευτικαὶ στέγαι.
264	ἐνταῦθα δισσοὺς εἶδέ τις νεανίας
265	βουφορβὸς ἡμῶν, κἀπεχώρησεν πάλιν
266	ἄκροισι δακτύλοισι πορθμεύων ἴχνος.
267	ἔλεξε δʼ· Οὐχ ὁρᾶτε; δαίμονές τινες
268	θάσσουσιν οἵδε. — θεοσεβὴς δʼ ἡμῶν τις ὢν
269	ἀνέσχε χεῖρα καὶ προσηύξατʼ εἰσιδών·
270	ὦ ποντίας παῖ Λευκοθέας, νεῶν φύλαξ,
271	δέσποτα Παλαῖμον, ἵλεως ἡμῖν γενοῦ,
272	εἴτʼ οὖν ἐπʼ ἀκταῖς θάσσετον Διοσκόρω,
273	ἢ Νηρέως ἀγάλμαθʼ, ὃς τὸν εὐγενῆ
274	ἔτικτε πεντήκοντα Νηρῄδων χορόν.
275	ἄλλος δέ τις μάταιος, ἀνομίᾳ θρασύς,
276	ἐγέλασεν εὐχαῖς, ναυτίλους δʼ ἐφθαρμένους
277	θάσσειν φάραγγʼ ἔφασκε τοῦ νόμου φόβῳ,
278	κλύοντας ὡς θύοιμεν ἐνθάδε ξένους.
279	ἔδοξε δʼ ἡμῶν εὖ λέγειν τοῖς πλείοσι,
280	θηρᾶν τε τῇ θεῷ σφάγια τἀπιχώρια.
281	κἀν τῷδε πέτραν ἅτερος λιπὼν ξένοιν
282	ἔστη κάρα τε διετίναξʼ ἄνω κάτω
283	κἀπεστέναξεν ὠλένας τρέμων ἄκρας,
284	μανίαις ἀλαίνων, καὶ βοᾷ κυναγὸς ὥς·
285	Πυλάδη, δέδορκας τήνδε; τήνδε δʼ οὐχ ὁρᾷς
286	Ἅιδου δράκαιναν, ὥς με βούλεται κτανεῖν
287	δειναῖς ἐχίδναις εἰς ἔμʼ ἐστομωμένη;
288	ἣ δʼ ἐκ χιτώνων πῦρ πνέουσα καὶ φόνον
289	πτεροῖς ἐρέσσει, μητέρʼ ἀγκάλαις ἐμὴν
290	ἔχουσα — πέτρινον ὄχθον, ὡς ἐπεμβάλῃ.
291	οἴμοι, κτενεῖ με· ποῖ φύγω;
291a	παρῆν δʼ ὁρᾶν
292	οὐ ταῦτα μορφῆς σχήματʼ, ἀλλʼ ἠλλάσσετο
293	φθογγάς τε μόσχων καὶ κυνῶν ὑλάγματα,
294	ἃς φᾶσʼ Ἐρινῦς ἱέναι μιμήματα.
295	ἡμεῖς δὲ συσταλέντες, ὡς θαμβούμενοι,
296	σιγῇ καθήμεθʼ· ὃ δὲ χερὶ σπάσας ξίφος,
297	μόσχους ὀρούσας ἐς μέσας λέων ὅπως,
298	παίει σιδήρῳ λαγόνας ἐς πλευράς θʼ ἱείς,
299	δοκῶν Ἐρινῦς θεὰς ἀμύνεσθαι τάδε,
300	ὡς αἱματηρὸν πέλαγος ἐξανθεῖν ἁλός.
301	κἀν τῷδε πᾶς τις, ὡς ὁρᾷ βουφόρβια
302	πίπτοντα καὶ πορθούμενʼ, ἐξωπλίζετο,
303	κόχλους τε φυσῶν συλλέγων τʼ ἐγχωρίους·
304	πρὸς εὐτραφεῖς γὰρ καὶ νεανίας ξένους
305	φαύλους μάχεσθαι βουκόλους ἡγούμεθα.
306	πολλοὶ δʼ ἐπληρώθημεν ἐν μακρῷ χρόνῳ.
307	πίπτει δὲ μανίας πίτυλον ὁ ξένος μεθείς,
308	στάζων ἀφρῷ γένειον· ὡς δʼ ἐσείδομεν
309	προύργου πεσόντα, πᾶς ἀνὴρ ἔσχεν πόνον
310	βάλλων ἀράσσων. ἅτερος δὲ τοῖν ξένοιν
311	ἀφρόν τʼ ἀπέψη σώματός τʼ ἐτημέλει
312	πέπλων τε προυκάλυπτεν εὐπήνους ὑφάς,
313	καραδοκῶν μὲν τἀπιόντα τραύματα,
314	φίλον δὲ θεραπείαισιν ἄνδρʼ εὐεργετῶν.
315	ἔμφρων δʼ ἀνᾴξας ὁ ξένος πεσήματος
316	ἔγνω κλύδωνα πολεμίων προσκείμενον
317	καὶ τὴν παροῦσαν συμφορὰν αὐτοῖν πέλας,
318	ᾤμωξέ θʼ· ἡμεῖς δʼ οὐκ ἀνίεμεν πέτροις
319	βάλλοντες, ἄλλος ἄλλοθεν προσκείμενοι.
320	οὗ δὴ τὸ δεινὸν παρακέλευσμʼ ἠκούσαμεν·
321	Πυλάδη, θανούμεθʼ, ἀλλʼ ὅπως θανούμεθα
322	κάλλισθʼ· ἕπου μοι, φάσγανον σπάσας χερί. — 
323	ὡς δʼ εἴδομεν δίπαλτα πολεμίων ξίφη,
324	φυγῇ λεπαίας ἐξεπίμπλαμεν νάπας.
325	ἀλλʼ, εἰ φύγοι τις, ἅτεροι προσκείμενοι
326	ἔβαλλον αὐτούς· εἰ δὲ τούσδʼ ὠσαίατο,
327	αὖθις τὸ νῦν ὑπεῖκον ἤρασσεν πέτροις.
328	ἀλλʼ ἦν ἄπιστον· μυρίων γὰρ ἐκ χερῶν
329	οὐδεὶς τὰ τῆς θεοῦ θύματʼ εὐτύχει βαλών.
330	μόλις δέ νιν τόλμῃ μὲν οὐ χειρούμεθα,
331	κύκλῳ δὲ περιβαλόντες ἐξεκλέψαμεν
332	πέτροισι χειρῶν φάσγανʼ, ἐς δὲ γῆν γόνυ
333	καμάτῳ καθεῖσαν. πρὸς δʼ ἄνακτα τῆσδε γῆς
334	κομίζομέν νιν. ὃ δʼ ἐσιδὼν ὅσον τάχος
335	ἐς χέρνιβάς τε καὶ σφαγεῖʼ ἔπεμπέ σοι.
336	ηὔχου δὲ τοιάδʼ, ὦ νεᾶνί, σοι ξένων
337	σφάγια παρεῖναι· κἂν ἀναλίσκῃς ξένους
338	τοιούσδε, τὸν σὸν Ἑλλὰς ἀποτείσει φόνον
339	δίκας τίνουσα τῆς ἐν Αὐλίδι σφαγῆς.
340	θαυμάστʼ ἔλεξας τὸν μανένθʼ, ὅστις ποτὲ
341	Ἕλληνος ἐκ γῆς πόντον ἦλθεν ἄξενον.
342	εἶἑν· σὺ μὲν κόμιζε τοὺς ξένους μολών,
343	τὰ δʼ ἐνθάδʼ ἡμεῖς ὅσια φροντιούμεθα — 
344	ὦ καρδία τάλαινα, πρὶν μὲν ἐς ξένους
345	γαληνὸς ἦσθα καὶ φιλοικτίρμων ἀεί,
346	ἐς θοὑμόφυλον ἀναμετρουμένη δάκρυ,
347	Ἕλληνας ἄνδρας ἡνίκʼ ἐς χέρας λάβοις.
348	νῦν δʼ ἐξ ὀνείρων οἷσιν ἠγριώμεθα,
349	δοκοῦσʼ Ὀρέστην μηκέθʼ ἥλιον βλέπειν,
350	δύσνουν με λήψεσθʼ, οἵτινές ποθʼ ἥκετε.
351	καὶ τοῦτʼ ἄρʼ ἦν ἀληθές, ᾐσθόμην, φίλαι·
352	οἱ δυστυχεῖς γὰρ τοῖσι δυστυχεστέροις
353	αὐτοὶ κακῶς πράξαντες οὐ φρονοῦσιν εὖ.
354	ἀλλʼ οὔτε πνεῦμα Διόθεν ἦλθε πώποτε,
355	οὐ πορθμίς, ἥτις διὰ πέτρας Συμπληγάδας
356	Ἑλένην ἀπήγαγʼ ἐνθάδʼ, ἥ μʼ ἀπώλεσεν,
357	Μενέλεών θʼ, ἵνʼ αὐτοὺς ἀντετιμωρησάμην,
358	τὴν ἐνθάδʼ Αὖλιν ἀντιθεῖσα τῆς ἐκεῖ,
359	οὗ μʼ ὥστε μόσχον Δαναΐδαι χειρούμενοι
360	ἔσφαζον, ἱερεὺς δʼ ἦν ὁ γεννήσας πατήρ.
361	οἴμοι — κακῶν γὰρ τῶν τότʼ οὐκ ἀμνημονῶ — 
362	ὅσας γενείου χεῖρας ἐξηκόντισα
363	γονάτων τε τοῦ τεκόντος, ἐξαρτωμένη,
364	λέγουσα τοιάδʼ· ὦ πάτερ, νυμφεύομαι
365	νυμφεύματʼ αἰσχρὰ πρὸς σέθεν· μήτηρ δʼ ἐμὲ
366	σέθεν κατακτείνοντος Ἀργεῖαί τε νῦν
367	ὑμνοῦσιν ὑμεναίοισιν, αὐλεῖται δὲ πᾶν
368	μέλαθρον· ἡμεῖς δʼ ὀλλύμεσθα πρὸς σέθεν.
369	Ἅιδης Ἀχιλλεὺς ἦν ἄρʼ, οὐχ ὁ Πηλέως,
370	ὅν μοι προσείσας πόσιν, ἐν ἁρμάτων ὄχοις
371	ἐς αἱματηρὸν γάμον ἐπόρθμευσας δόλῳ.
372	ἐγὼ δὲ λεπτῶν ὄμμα διὰ καλυμμάτων
373	ἔχουσʼ, ἀδελφόν τʼ οὐκ ἀνειλόμην χεροῖν,
374	— ὃς νῦν ὄλωλεν — οὐ κασιγνήτῃ στόμα
375	συνῆψʼ ὑπʼ αἰδοῦς, ὡς ἰοῦσʼ ἐς Πηλέως
376	μέλαθρα· πολλὰ δʼ ἀπεθέμην ἀσπάσματα
