1.0.1	 τὸ μισέω μνάμονα συμπόταν Bergk. 3 p. 734 ὦ Σόσσιε Σενεκίων, ἔνιοι πρὸς τοὺς ἐπιστάθμους εἰρῆσθαι λέγουσι, φορτικοὺς ἐπιεικῶς καὶ ἀναγώγους ἐν τῷ πίνειν ὄντας· οἱ γὰρ ἐν Σικελίᾳ Δωριεῖς ὡς ἔοικε τὸν ἐπίσταθμον μνάμονα προσηγόρευον. ἔνιοι δὲ τὴν παροιμίαν οἴονται τοῖς παρὰ πότον λεγομένοις καὶ πραττομένοις ἀμνηστίαν ἐπάγειν διὸ τήν τε λήθην οἱ πάτριοι λόγοι καὶ τὸν νάρθηκα τῷ θεῷ συγκαθιεροῦσιν, ὡς ἢ μηδενὸς δέον μνημονεύειν τῶν ἐν οἴνῳ πλημμεληθέντων ἢ παντελῶς ἐλαφρᾶς καὶ παιδικῆς νουθεσίας δεομένων. ἐπεὶ δὲ καὶ σοὶ δοκεῖ τῶν μὲν ἀτόπων ἡ λήθη τῷ ὄντι σοφὴ κατʼ Εὐριπίδην Εὐριπίδην ] cf. Plut. Fragm. 22, 4 et Eur. Or. 213 εἶναι· τὸ δʼ ὅλως ἀμνημονεῖν τῶν ἐν οἴνῳ μὴ μόνον τῷ φιλοποιῷ λεγομένῳ μάχεσθαι τῆς τραπέζης, ἀλλὰ καὶ τῶν φιλοσόφων τοὺς ἐλλογιμωτάτους ἀντιμαρτυροῦντας ἔχειν, Πλάτωνα καὶ Ξενοφῶντα καὶ Ἀριστοτέλην καὶ Σπεύσιππον, Ἐπίκουρόν Ἐπίκουρον ] cf. Usener. p. 115 τε καὶ Πρύτανιν καὶ Ἱερώνυμον καὶ Δίωνα τὸν ἐξ Ἀκαδημείας Ἀκαδημείας * hic et infra: ἀκαδημίας , ὡς ἄξιόν τινος σπουδῆς πεποιημένους ἔργον ἀναγράψασθαι λόγους παρὰ πότον γενομένους· ᾠήθης τε δεῖν ἡμᾶς τῶν σποράδην πολλάκις ἔν τε Ῥώμῃ ἔν τε Ῥώμῃ M: ἐν ἑτέρῳ μὴ μεθʼ ὑμῶν καὶ παρʼ ἡμῖν ἐν τῇ Ἑλλάδι, παρούσης ἅμα τραπέζης καὶ κύλικος, φιλολογηθέντων συναγαγεῖν τἀπιτήδεια τἀπιτ́δεια *: τὰ ἐπιτήδεια · πρὸς τοῦτο γενόμενος τρία μὲν ἢδη σοι πέπομφα τῶν βιβλίων, ἑκάστου δέκα προβλήματα περιέχοντος· πέμψω δὲ καὶ τὰ λοιπὰ ταχέως, ἂν ταῦτα δόξῃ μὴ παντελῶς ἄμουσα μηδʼ ἀπροσδιόνυσʼ εἶναι.
1.1.1	 πρῶτον δὲ πάντων τέτακται τὸ περὶ τοῦ φιλοσοφεῖν παρὰ πότον. μέμνησαι γὰρ ὅτι, ζητήσεως Ἀθήνησι μετὰ δεῖπνον γενομένης εἰ χρηστέον ἐν οἴνῳ φιλοσόφοις λόγοις καὶ τί μέτρον ἔστι χρωμένοις, ἀρίστων παρών εἰσὶ γάρ ἔφησε πρὸς τῶν θεῶν οἱ φιλοσόφοις χώραν χῶρον mei ἐπʼ οἴνῳ ἐν οἴνῳ ? μὴ διδόντες; ἐγὼ δʼ εἶπον ἀλλ οὐ γὰρ εἰσίν, ὦ ἑταῖῤ, οἳ οἵ ] om. mei καὶ πάνυ γε σεμνῶς κατειρωνευόμενοι λέγουσι μὴ δεῖν ὥσπερ οἰκοδέσποιναν ἐν οἴνῳ φθέγγεσθαι φιλοσοφίαν· καὶ τοὺς Πέρσας Πέρσας ] Πάρθους Macrobius 7, 1, 3 ὀρθῶς φασι μὴ ταῖς γαμεταῖς ἀλλὰ ταῖς παλλακίσι συμμεθύσκεσθαι καὶ συνορχεῖσθαι; ταὐτὸ δὴ καὶ ἡμᾶς ἀξιοῦσι ποιεῖν εἰς τὰ συμπόσια τὴν μουσικὴν καὶ τὴν ὑποκριτικὴν ἐπεισάγοντας φιλοσοφίαν δὲ μὴ κινοῦντας, ὡς οὔτε συμπαίζειν ἐκείνην ἐπιτήδειον οὖσαν οὔθʼ ἡμᾶς τηνικαῦτα σπουδαστικῶς ἔχοντας· οὐδὲ γὰρ Ἰσοκράτη τὸν σοφιστὴν ὑπομεῖναι δεομένων εἰπεῖν τι παρʼ οἶνον ἀλλʼ ἢ τοσοῦτον ἐν οἷς μὲν ἐγὼ δεινός, οὐχ ὁ νῦν καιρός· ἐν οἷς ἐν οἷς ] οἷς Cobetus δʼ ὁ νῦν καιρός, οὐκ ἐγὼ δεινός.
1.1.2	καὶ ὁ Κράτων ἀνακραγών εὖ γʼ εἶπε νὴ τὸν Διόνυσον ἐξώμνυτο τὸν λόγον, εἰ τοιαύτας ἔμελλε περαίνειν περιόδους, αἷς ἔμελλε Χαρίτων ἀνάστατον γενήσεσθαι συμπόσιον τὸ συμπόσιον ? . οὐχ ὅμοιον δʼ οἶμαι ῥητορικὸν ἐξαιρεῖν ἐξαιρεῖν Emperius: ἐξαίρειν συμποσίου λόγον καὶ φιλόσοφον· ἀλλʼ ἕτερόν ἐστι τὸ φιλοσοφίας, ἐστί τι τὸ τῆς φιλοσοφίας R ἣν τέχνην περὶ βίον οὖσαν οὔτε τινὸς παιδιᾶς οὔτε τινὸς ἡδονῆς διαγωγὴν ἐχούσης ἀποστατεῖν εἰκὸς ἀλλὰ πᾶσι παρεῖναι τὸ μέτρον καὶ τὸν καιρὸν ἐπιφέρουσαν· ἐπιφαίνουσαν Doehnerus ἢ μηδὲ σωφροσύνην μηδὲ δικαιοσύνην οἰώμεθα δεῖν εἰς τοὺς πότους δέχεσθαι, κατειρωνευόμενοι τὸ σεμνὸν αὐτῶν. εἰ μὲν οὖν, ὥσπερ οἱ τὸν Ὀρέστην ἑστιῶντες, ἐν Θεσμοθετείῳ θεσμοθετείῳ Turnebus: θεσμοθετίῳ σιωπῇ τρώγειν καὶ πίνειν ἐμέλλομεν, ἦν τι τοῦτο τῆς ἀμαθίας οὐκ ἀτυχὲς ἀτυχὲς X: εὐτυχὲς παραμύθιον· εἰ δὲ πάντων μὲν ὁ Διόνυσος Λύσιός ἐστι καὶ Λυαῖος Λυαῖος R: λύδιος , μάλιστα δὲ τῆς γλώττης ἀφαιρεῖται τὰ χαλινὰ καὶ πλείστην ἐλευθερίαν τῇ φωνῇ δίδωσιν emendavit S: πλεονάζον τὸ ἄκαιρον , ἀβέλτερον οἶμαι καὶ ἀνόητον ἐν λόγοις πλεονάζοντα καιρὸν ἀποστερεῖν τῶν ἀρίστων λόγων, καὶ ζητεῖν μὲν ἐν ταῖς διατριβαῖς περὶ συμποτικῶν καθηκόντων καὶ τίς ἀρετὴ συμπότου καὶ πῶς οἴνῳ χρηστέον, ἐξ αὐτῶν δὲ τῶν συμποσίων ἀναιρεῖν φιλοσοφίαν ὡς ἔργῳ βεβαιοῦν ἃ διδάσκει λόγῳ μὴ δυναμένην.
1.1.3	σοῦ δʼ εἰπόντος οὐκ ἄξιον εἶναι Κράτωνι περὶ τούτων ἀντιλέγειν, ὅρον δέ τινα καὶ χαρακτῆρα τῶν παρὰ πότον φιλοσοφουμένων ζητεῖν ἐκφεύγοντα malim ἐκφεύγοντας τοῦτο δὴ τὸ παιζόμενον οὐκ ἀηδῶς πρὸς τοὺς ἐρίζοντας καὶ σοφιστιῶντας νῦν δʼ ἔρχεσθʼ ἐπὶ δεῖπνον ἵνα ξυνάγωμεν Ἄρηα, ηομ. β 381 καὶ παρακαλοῦντος ἡμᾶς ἐπὶ τὸν λόγον· ἔφην ἐγὼ πρῶτον ὅτι μοι δοκεῖ σκεπτέον εἶναι τὸ τῶν παρόντων· ἂν μὲν γὰρ πλείονας ἔχῃ φιλολόγους τὸ συμπόσιον, ὡς τὸ Ἀγάθωνος Σωκράτας Φαίδρους Παυσανίας Ἐρυξιμάχους, καὶ τὸ Καλλίου Χαρμίδας Ἀντισθένας Ἑρμογένας, ἑτέρους τούτοις παραπλησίους, ἀφήσομεν αὐτοὺς μύθῳ φιλοσοφεῖν μύθῳ φιλοσοφεῖν ] contrarium est ἀπʼ εὐθείας φιλοσοφεῖν (p. 614 c). W iudice μύθῳ incongruum est , οὐχ ἧττον ταῖς Μούσαις τὸν Διόνυσον ἢ ταῖς Νύμφαις κεραννύντας κερανύντες ἐκεῖναι μὲν γὰρ αὐτὸν τοῖς σώμασιν ἵλεων ἵλεων *: ἵλεω καὶ πρᾶον, αὗται δὲ ταῖς ψυχαῖς μειλίχιον ὄντως καὶ χαριδώτην χαριδώτην Lobeckius: χαριδότην ἐπεισάγουσι. καὶ γὰρ ἂν ὀλίγοι τινὲς ἰδιῶται παρῶσιν, ὥσπερ ἄφωνα γράμματα φωνηέντων ἐν μέσῳ πολλῶν τῶν πεπαιδευμένων ἐμπεριλαμβανόμενοι, φθογγῆς τινος οὐ παντελῶς ἀνάρθρου καὶ συνέσεως κοινωνήσουσιν. ἂν δὲ πλῆθος ᾖ τοιούτων ἀνθρώπων, οἳ παντὸς μὲν ὀρνέου παντὸς δὲ νεύρου καὶ ξύλου μᾶλλον ἢ φιλοσόφου φωνὴν ὑπομένουσι, τὸ τοῦ Πεισιστράτου χρήσιμον ἐκεῖνος γὰρ ἐν διαφορᾷ τινι πρὸς τοὺς υἱοὺς γενόμενος, ὡς ᾔσθετο τοὺς ἐχθροὺς χαίροντας, ἐκκλησίαν συναγαγὼν ἔφη βούλεσθαι μὲν αὐτὸς πεῖσαι τοὺς παῖδας, ἐπεὶ δὲ δυσκόλως ἔχουσιν, αὐτὸς αὐτὸς Cobetus: αὐτὸν ἐκείνοις πείσεσθαι καὶ ἀκολουθήσειν. οὕτω δὴ καὶ φιλόσοφος ἀνὴρ ἐν συμπόταις μὴ δεχομένοις τοὺς λόγους αὐτοῦ μεταθέμενος ἕψεται καὶ ἀγαπήσει τὴν ἐκείνων διατριβὴν, ἐφʼ ὅσον μὴ ἐκβαίνει τὸ εὔσχημον· εἰδὼς ὅτι ῥητορεύουσι μὲν ἄνθρωποι διὰ λόγου, φιλοσοφοῦσι δὲ καὶ σιωπῶντες καὶ παίζοντες καὶ νὴ Δία σκωπτόμενοι καὶ σκώπτοντες. οὐ γὰρ μόνον ἀδικίας ἐσχάτης ἐστίν ὥς φησι Πλάτων Πλάτων ] Rep. p. 361 a μὴ ὄντα δίκαιον εἶναι δοκεῖν, ἀλλὰ καὶ συνέσεως ἄκρας φιλοσοφοῦντα μὴ δοκεῖν φιλοσοφεῖν καὶ παίζοντα διαπράττεσθαι τὰ τῶν σπουδαζόντων. ὡς γὰρ αἱ παρʼ Εὐριπίδῃ Εὐριπίδῃ ] Bacch. 736 μαινάδες ἄνοπλοι malim ἄοπλοι καὶ ἀσίδηροι τοῖς θυρσαρίοις παίουσαι τοὺς ἐπιτιθεμένους τραυματίζουσιν, οὕτω τῶν ἀληθινῶν φιλοσόφων καὶ τὰ σκώμματα καὶ οἱ γέλωτες τοὺς μὴ παντελῶς ἀτρώτους κινοῦσιν ἁμωσγέπως καὶ συνεπιστρέφουσιν.
1.1.4	οἶμαι δὲ δὲ ] δὲ καὶ R διηγήσεων εἶναί τι συμποτικὸν γένος, ὧν τὰς μὲν ἱστορία δίδωσι, τὰς δʼ ἐκ τῶν ἀνὰ χεῖρα πραγμάτων λαβεῖν ἔστι, πολλὰ μὲν εἰς φιλοσοφίαν παραδείγματα πολλὰ δʼ εἰς εὐσέβειαν ἐχούσας, ἀνδρικῶν τε πράξεων καὶ μεγαλοθύμων ἐνίας δὲ χρηστῶν καὶ φιλανθρώπων ζῆλον ἐπαγούσας· αἷς ἤν τις ἀνυπόπτως χρώμενος διαπαιδαγωγῇ τοὺς πίνοντας, οὐ τὰ ἐλάχιστα τῶν κακῶν ἀφαιρήσει τῆς μέθης. οἱ μὲν οὖν τὰ βούγλωσσα καταμιγνύντες εἰς τὸν οἶνον καὶ τοῖς ἀποβρέγμασι τῶν περιστερεώνων περιστερεώνων Iunius: ἀριστερέων καὶ ἀδιάντων τὰ ἐδάφη ῥαίνοντες, ὡς τούτων τινὰ τοῖς ἑστιωμένοις εὐθυμίαν καὶ φιλοφροσύνην ἐνδιδόντων, ἀπομιμούμενοι τὴν Ὁμηρικὴν Ομηρικὴν ] δ 220 Ἑλένην ὑποφαρμάττουσαν τὸν ἄκρατον, οὐ συνορῶσιν ὅτι κἀκεῖνος κἀκείνοις R ὁ μῦθος ἐκπεριελθὼν ἀπʼ Αἰγύπτου μακρὰν ὁδὸν εἰς λόγους ἐπιεικεῖς καὶ πρέποντας ἐτελεύτησεν ἡ γὰρ Ἑλένη πίνουσιν αὐτοῖς διηγεῖται περὶ τοῦ Ὀδυσσέως· οἷον τόδʼ τόδʼ Turnebus ἔρεξε καὶ ἔτλη καρτερὸς ἀνήρ, Hom. δ 271, 273 αὐτόν μιν πληγῇσιν ἀεικελίῃσι δαμάσσας· τοῦτο γὰρ ἦν ὡς ἔοικε τὸ νηπενθὲς φάρμακον καὶ ἀνώδυνον, λόγος ἔχων καιρὸν ἁρμόζοντα τοῖς ὑποκειμένοις πάθεσι καὶ πράγμασιν. οἱ δὲ χαρίεντες, κἂν ἀπʼ εὐθείας φιλοσοφῶσι, τηνικαῦτα διὰ τοῦ πιθανοῦ μᾶλλον ἢ βιαστικοῦ τῶν ἀποδείξεων ἄγουσι τὸν λόγον. ὁρᾷς γὰρ ὅτι καὶ Πλάτων ἐν τῷ Συμποσίῳ περὶ τέλους διαλεγόμενος καὶ τοῦ πρώτου ἀγαθοῦ καὶ ὅλως θεολογῶν οὐκ ἐντείνει τὴν ἀπόδειξιν οὐδʼ ὑποκονίεται, τὴν λαβὴν ὥσπερ εἴωθεν εὔτονον ποιῶν καὶ ἄφυκτον, ἀλλʼ ὑγροτέροις λήμμασι καὶ παραδείγμασι καὶ μυθολογίαις προσάγεται τοὺς ἄνδρας.
1.1.5	εἶναι δὲ δεῖ καὶ αὐτὰς τὰς ζητήσεις ὑγροτέρας καὶ γνώριμα τὰ προβλήματα καὶ τὰς πεύσεις πείσεις Madvigius ἐπιεικεῖς καὶ μὴ γλίσχρας, ἵνα μὴ πνίγωσι τοὺς ἀνοητοτέρους μηδʼ ἀποτρέπωσιν. ὥσπερ γὰρ τὰ σώματα σώματα M: συμπόσια πινόντων τῶν πινόντων R διʼ ὀρχήσεως καὶ χορείας νενόμισται σαλεύειν, ἂν δʼ ὁπλομαχεῖν ἀναστάντας ἢ δισκεύειν ἀναγκάζωμεν ἀναγκάζομεν mei αὐτούς, οὐ μόνον ἀτερπὲς ἀλλὰ καὶ βλαβερὸν ἔσται τὸ συμπόσιον· οὕτω τὰς ψυχὰς αἱ μὲν ἐλαφραὶ ζητήσεις ἐμμελῶς καὶ ὠφελίμως κινοῦσιν, ἐριδαντέων δὲ κατὰ Δημόκριτον Δημόκριτον ] Mullach. 1 p. 349 καὶ ἱμαντελικτέων ἐριδανταίων - ἱμαντελικταίων mei. cf. Symb. meas in Strab. p. 8 λόγους ἀφετέον, οἳ αὐτούς τε κατατείνουσιν ἐν πράγμασι γλίσχροις καὶ δυσθεωρήτοις τούς τε παρατυγχάνοντας ἀνιῶσι· δεῖ γὰρ ὡς τὸν οἶνον κοινὸν εἶναι καὶ τὸν λόγον, οὗ πάντες μεθέξουσιν. οἱ δὲ τοιαῦτα προβλήματα καθιέντες οὐδὲν ἂν τῆς Αἰσωπείου γεράνου καὶ ἀλώπεκος ἐπιεικέστεροι πρὸς κοινωνίαν φανεῖεν· ὧν ἡ μὲν ἔτνος τι λιπαρὸν κατὰ λίθου πλατείας καταχεαμένη Anonymus: καταχεαμένην τὴν γέρανον ἐδέξατο οὐκ εὐωχουμένην τὴν γέρανον ἐδέξατʼ οὐκ εὐωχουμένην supplevi , ἀλλὰ γελοῖα γελοῖα Vulcobius: γέλωτα Malim γέλωτος ἄξια cf. p. 814 a πάσχουσαν· ἐξέφευγε γὰρ ὑγρότητι τὸ ἔτνος τὴν λεπτότητα τοῦ στόματος αὐτῆς. ἐν μέρει τοίνυν ἡ γέρανος αὐτῇ καταγγείλασα δεῖπνον ἐν λαγυνίδι προὔθηκε λεπτὸν ἐχούσῃ καὶ μακρὸν τράχηλον, ὥστʼ αὐτὴ *: αὐτὴν μὲν καθιέναι τὸ στόμα ῥᾳδίως καὶ ἀπολαύειν, τὴν δʼ ἀλώπεκα μὴ δυναμένην κομίζεσθαι συμβολὰς πρεπούσας. οὕτω τοίνυν, ὅταν οἱ φιλόσοφοι παρὰ πότον εἰς λεπτὰ καὶ διαλεκτικὰ προβλήματα καταδύντες ἐνοχλῶσι τοῖς πολλοῖς ἕπεσθαι μὴ δυναμένοις, ἐκεῖνοι δὲ πάλιν ἐπʼ ᾠδάς ἐπʼ ᾠδὰς Turnebus: ἐπωδὰς τινας καὶ διηγήματα φλυαρώδη καὶ λόγους βαναύσους καὶ ἀγοραίους ἐμβάλλωσιν *: ἐμβάλωσιν ib. Turnebus: ἑαυτοῖς ἑαυτούς, οἴχεται τῆς συμποτικῆς κοινωνίας τὸ τέλος καὶ καθύβρισται ὁ Διόνυσος. ὥσπερ οὖν, Φρυνίχου καὶ Αἰσχύλου τὴν τραγῳδίαν εἰς μύθους καὶ πάθη προαγόντων, ἐλέχθη τὸ τί ταῦτα πρὸς τὸν Διόνυσον; cf. Leutsch. 1 p. 137. 2 p. 218 οὕτως ἔμοιγε πολλάκις εἰπεῖν παρέστη πρὸς τοὺς ἕλκοντας εἰς τὰ συμπόσια τὸν Κυριεύοντα τὸν κυρίττοντα X ὦ ἄνθρωπε, τί ταῦτα πρὸς τὸν Διόνυσον; ᾄδειν μὲν γὰρ ἴσως ἴσως ] ἔθος W. Sed cod. Vd (=Vindobonensis) m. s. in marg. adscripsit ex regione verbi ἐπιτίθησιν haec: εὔλογον· λόγοις δὲ γλίσχροις παρὰ πότον κεχρῆσθαι , probabiliter τὰ καλούμενα σκόλια, κρατῆρος ἐν μέσῳ προκειμένου καὶ στεφάνων διανεμομένων, οὓς ὁ θεὸς ἐλευθερῶν ἡμᾶς ἐπιτίθησιν, οὐ καλὸν δʼ οὐδὲ συμποτικόν. ἐπεί τοι καὶ τὰ σκόλιά φασιν οὐ γένος ᾀσμάτων εἶναι πεποιημένων ἀσαφῶς, ἀλλʼ ὅτι πρῶτον μὲν ᾖδον ᾠδὴν τοῦ θεοῦ κοινῶς ἅπαντες μιᾷ φωνῇ παιανίζοντες, δεύτερον Turnebus: δευτέραν δʼ ἐφεξῆς ἑκάστῳ μυρσίνης παραδιδομένης, ἣν αἴσακον οἶμαι διὰ τὸ ᾄδειν τὸν δεξάμενον ἐκάλουν· ἐπὶ δὲ τούτῳ λύρας περιφερομένης, ὁ μὲν πεπαιδευμένος ἐλάμβανε καὶ ᾖδεν ἁρμοζόμενος, τῶν δʼ ἀμούσων οὐ προσιεμένων, σκολιὸν ὠνομάσθη τὸ μὴ κοινὸν αὐτοῦ μηδὲ ῥᾴδιον. ἄλλοι δέ φασι τὴν μυρσίνην οὐ καθεξῆς βαδίζειν, ἀλλὰ καθʼ ἕκαστον ἀπὸ ἀπὸ Turnebus: ἐπὶ κλίνης ἐπὶ κλίνην διαφέρεσθαι· τὸν γὰρ πρῶτον ᾄσαντα τῷ πρώτῳ τῆς δευτέρας κλίνης ἀποστέλλειν, ἐκεῖνον δὲ τῷ πρώτῳ τῆς τρίτης, εἶτα τὸν δεύτερον ὁμοίως τῷ δευτέρῳ, καὶ τὸ ποικίλον καὶ πολυκαμπὲς ὡς ἔοικε τῆς περιόδου σκολιὸν ὠνομάσθη.
1.2.1	 Τίμων ὁ ἀδελφὸς ἑστιῶν πλείονας ἕκαστον ἐκέλευε τῶν εἰσιόντων ὅποι βούλεται παρεμβάλλειν καὶ κατακλίνεσθαι, διὰ τὸ καὶ ξένους καὶ πολίτας καὶ συνήθεις ἀσυνήθεις R καὶ οἰκείους; καὶ ὅλως παντοδαποὺς τοὺς κεκλημένους εἶναι. πολλῶν οὖν ἤδη παρόντων, ξένος τις ὥσπερ εὐπάρυφος ἐκ κωμῳδίας ἐσθῆτί τε περιττῇ καὶ ἀκολουθίᾳ παίδων ὑποσολοικότερος, ἧκεν ἄχρι τῶν θυρῶν τοῦ ἀνδρῶνος, καὶ κύκλῳ ταῖς ὄψεσιν ἐπελθὼν τοὺς κατακειμένους οὐκ ἠθέλησεν εἰσελθεῖν ἀλλʼ ᾤχετʼ ἀπιών· καὶ πολλῶν μεταθεόντων, οὐκ ἔφη τὸν ἄξιον ἑαυτοῦ τόπον ὁρᾶν λειπόμενον. ἐκεῖνον μὲν οὖν πολλῷ γέλωτι χαίροντας εὐφημοῦντας ἐκπέμπειν δόμων cf. Kock. 3 p. 428 ἐκέλευον οἱ κατακείμενοι· καὶ γὰρ ἦσαν πολλοὶ μετρίως ὑποπεπωκότες. cf, Plat. Rep. p. 372 d
1.2.2	ἐπεὶ δὲ τὰ περὶ τὸ δεῖπνον τέλος εἶχεν, ὁ πατὴρ ἐμὲ πορρωτέρω κατακείμενον προσειπών Τίμων ἔφη κἀγὼ κριτήν σε πεποιήμεθα διαφερόμενοι· πάλαι γὰρ ἀκούει κακῶς ὑπʼ ἐμοῦ διὰ τὸν ξένον εἰ γὰρ διετάττετο ἀπʼ ἀρχῆς, ὥσπερ ἐκέλευον ἐγώ, τὰς κλίσεις, οὐκ ἂν εὐθύνας ὑπείχομεν ἀταξίας ἀνδρὶ δεινῷ· κοσμῆσαι ἵππους τε καὶ ἀνέρας ἀσπιδιώτας. Hom. B 554 καὶ γὰρ δὴ Παῦλον Αἰμίλιον στρατηγὸν λέγουσιν, ὅτε Περσέα καταπολεμήσας ἐν Μακεδονίᾳ πότους συνεκρότει, κόσμῳ τε θαυμαστῷ περὶ πάντα καὶ τῇ λοιπῇ τάξει χρώμενον, εἰπεῖν ὅτι ταὐτοῦ ταὐτοῖ *: τοῦ αὐτοῦ ἀνδρός ἐστι καὶ φάλαγγα συστῆσαι φοβερωτάτην καὶ συμπόσιον ἣδιστον· ἀμφότερα γὰρ εὐταξίας εἶναι. καὶ τοὺς ἀρίστους καὶ τοὺς βασιλικωτάτους ὁ ποιητὴς εἴωθε κοσμήτορας λαῶν cf. Hom. A 16 et alibi προσαγορεύειν. καὶ τὸν μέγαν θεὸν ὑμεῖς πού φατε τὴν ἀκοσμίαν εὐταξίᾳ μεταβαλεῖν εἰς κόσμον, οὔτʼ ἀφελόντα τῶν ὄντων οὐδὲν οὔτε προσθέντα, τῷ δʼ ἕκαστον ἐπὶ τὴν προσήκουσαν χώραν καταστῆσαι τὸ κάλλιστον ἐξ ἀμορφοτάτου σχῆμα περὶ τὴν φύσιν ἀπεργασάμενον. ἀλλὰ ταῦτα μὲν τὰ σεμνότερα καὶ μείζονα παρʼ ὑμῶν μανθάνομεν αὐτοὶ δὲ καὶ τὴν περὶ τὰ δεῖπνα δαπάνην ὁρῶμεν οὐδὲν ἔχουσαν ἐπιτερπὲς οὐδʼ ἐλευθέριον, εἰ μὴ τάξεως μετάσχοι. διὸ καὶ γελοῖόν ἐστι τοῖς μὲν ὀψοποιοῖς καὶ τραπεζοκόμοις σφόδρα μέλειν τί πρῶτον ἢ τί δεύτερον ἢ μέσον ἢ τελευταῖον ἐπάξουσι, καὶ νὴ Δία μύρου τινὰ καὶ στεφάνων καὶ ψαλτρίας, ἂν τύχῃ παροῦσα, χώραν καὶ τάξιν· εἶναι· τοὺς δʼ ἐπὶ ταῦτα καλουμένους εἰκῆ καὶ ὡς ἔτυχε κατακλίναντα χορτάζειν, μήθʼ ἡλικίᾳ μήτʼ ἀρχῇ μήτʼ ἄλλῳ τινὶ τῶν ὁμοίων τὴν ἁρμόττουσαν ἀποδιδόντα τάξιν, ἐν ᾗ τιμᾶται μὲν ὁ προύχων προύχων *: προέχων ἐθίζεται δʼ ὁ δευτερεύων δὲ δευτερεύειν Doehnerus , γυμνάζεται δʼ ὁ τάττων πρὸς διάκρισιν καὶ στοχασμὸν τοῦ πρέποντος. οὐ γὰρ ἕδρα μὲν ἔστι καὶ στάσις τοῦ κρείττονος, κατάκλισις δʼ οὐκ ἔστιν οὐδὲ προπίεται ἑτέρῳ ἑτέρῳ ] μὲν ἑτέρῳ Benselerus πρὸ ἑτέρου μᾶλλον ὁ ἑστιῶν, περὶ δὲ τὰς κατακλίσεις παρόψεται τὰς διαφοράς, εὐθὺς ἐν ἀρχῇ τὴν λεγομένην μίαν Μύκονον μίαν Μύκονον ] cf. Kock. 3 p. 503 ἀποφήνας τὸ συμπόσιον. ἡ μὲν οὖν τοῦ πατρὸς δικαιολογία τοιαύτη τις ἦν. 
