5.5.1	 τὸ περὶ τὰς κατακλίσεις φαινόμενον ἄτοπον πλείονα λόγον παρέσχεν ἐν ταῖς ὑποδοχαῖς, ἃς ἐποιεῖτο τῶν φίλων ἕκαστος ἑστιῶν ἡμᾶς ἣκοντας ἀπὸ τῆς Ἀλεξανδρείας· ἐκαλοῦντο γὰρ ἀεὶ πολλοὶ τῶν ὁπωσοῦν προσήκειν δοκούντων, καὶ τὰ συμπόσια θορυβώδεις εἶχε τὰς συμπεριφορὰς καὶ τὰς διαλύσεις ταχείας. ἐπειδὴ δʼ Ὀνησικράτης ὁ ἰατρὸς οὐ πολλοὺς ἀλλὰ ἀλλὰ ] ἀλλʼ ἢ ? τοὺς σφόδρα συνήθεις καὶ οἰκειοτάτους παρέλαβεν ἐπὶ τὸ δεῖπνον, ἐφάνη μοι τὸ λεγόμενον ὑπὸ Πλάτωνος Πλάτωνος ] Rep. p. 422 e. 423 b αὐξομένην πόλιν αὐξομένην πόλιν (sc. εἶναι ) Benselerus: αὐξομένῃ πόλει οὐ πόλιν συμποσίω συμποσίῳ idem cum W: συμπόσια δεδόσθαι δεδόσθαι ] λελέχθαι W . καὶ γὰρ συμποσίου μέγεθος ἱκανόν ἐστιν, ἄχρι οὗ συμπόσιον συμπόσιον ἓν Kaltwasserus ἐθέλει μένειν· ἐὰν δʼ ὑπερβάλῃ διὰ πλῆθος, ὡς μηκέτι προσήγορον ἑαυτῷ μηδὲ συμπαθὲς εἶναι ταῖς φιλοφροσύναις μηδὲ γνώριμον, οὐδὲ συμπόσιόν ἐστι. δεῖ γὰρ οὐχ ὥσπερ ἐν στρατοπέδῳ διαγγέλοις οὐδʼ ὥσπερ ἐν τριήρει χρῆσθαι κελευσταῖς· αὐτοὺς δὲ διʼ ἑαυτῶν ἐντυγχάνειν ἀλλήλοις, ὥσπερ χοροῦ τοῦ συμποσίου τὸν κρασπεδίτην τῷ κορυφαίῳ συνήκοον ἔχοντος. 
5.5.2	ἐμοῦ δὲ ταῦτʼ εἰπόντος, εἰς μέσον ἤδη φθεγξάμενος ὁ πάππος ἡμῶν Λαμπρίας ἆρʼ οὖν εἶπεν συνεῖπεν mei οὐ περὶ τὰ δεῖπνα μόνον, ἀλλὰ καὶ περὶ τὰς κλήσεις κλίσεις iidem δεόμεθα τῆς ἐγκρατείας; ἔστι γάρ τις οἶμαι καὶ φιλανθρωπίας ἀκρασία, μηδένα παρερχομένης τῶν συμποτῶν ἀλλὰ πάντας ἑλκούσης ὡς ἐπὶ θέαν ἢ ἀκρόασιν. ἔμοιγʼ οὖν οὔτʼ ἄρτος οὔτʼ οἶνος ἐπιλείπων τοῖς κεκλημένοις οὕτω δοκεῖ τὸν κεκληκότα ποιεῖν γελοῖον, ὡς χώρα καὶ τόπος· ὧν καὶ μὴ κεκλημένοις ἀλλʼ ἐπελθοῦσιν αὐτομάτως ξένοις καὶ ἀλλοτρίοις ἀεὶ παρεσκευασμένην ἀφθονίαν ὑπάρχειν δεῖ. ἔτι δʼ ἄρτου μὲν καὶ οἴνου ἐπιλιπόντων ἐπιλειπόντων ? , ἔστι καὶ τοὺς οἰκέτας ὡς κλέπτοντας αἰτιᾶσθαι· τόπου δὲ πενία καὶ κατανάλωσις εἰς πλῆθος ὀλιγωρία τίς ἐστι τοῦ καλοῦντος. εὐδοκιμεῖ δὲ θαυμαστῶς καὶ Ἡσίοδος Ἡσίοδος Theog. 116 εἰπών ἤτοι μὲν πρώτιστα χάος γένετʼ· χώραν γὰρ ἔδει καὶ τόπον προϋποκεῖσθαι τοῖς γενομένοις, οὐχ ὡς χθὲς οὑμὸς υἱός ἔφη τὸ Ἀναξαγόρειον ἦν ὁμοῦ πάντα χρήματα τὸ σύνδειπνον ἐποίησεν. οὐ μὴν ἀλλὰ κἂν τόπος ὑπάρχῃ καὶ παρασκευή, τὸ πλῆθος αὐτὸ φυλακτέον, ὡς ἄμικτον τὴν συνουσίαν ποιοῦν καὶ ἀπροσήγορον· οἴνου γὰρ ἀνελεῖν ἧττόν ἐστι κακὸν ἢ λόγου κοινωνίαν ἐκ δείπνου. διὸ καὶ Θεόφραστος ἄοινα συμπόσια παίζων ἐκάλει τὰ κουρεῖα διὰ τὴν λαλιὰν τῶν προσκαθιζόντων. λόγων δὲ κοινωνίαν ἀναιροῦσιν οἱ πολλοὺς εἰς ταὐτὸ συμφοροῦντες, μᾶλλον δʼ ὀλίγους ποιοῦσιν ἀλλήλοις συνεῖναι· καὶ κατὰ δύο γὰρ ἢ τρεῖς ἀπολαμβάνοντες ἐντυγχάνουσι καὶ προσδιαλέγονται, τοὺς δὲ πόρρω κατακειμένους οὐδʼ ἴσασιν οὐδὲ προσορῶσιν ἵππου δρόμον ἀπέχοντας ἠμὲν ἐπʼ Αἴαντος κλισίας Τελαμωνιάδαο Hom. Λ 7 ἠδʼ ἐπʼ Ἀχιλλῆος. ὅθεν οὐκ ὀρθῶς οἱ πλούσιοι νεανιεύονται κατασκευάζοντες οἴκους τριακοντακλίνους καὶ μείζους· ἀμίκτων γὰρ αὕτη καὶ ἀφίλων δείπνων ἡ παρασκευὴ καὶ πανηγυριάρχου μᾶλλον ἢ συμποσιάρχου δεομένων. ἀλλʼ ἐκείνοις μὲν ταῦτα συγγνώμη ποιεῖν· ἄπλουτον γὰρ οἴονται τὸν πλοῦτον καὶ τυφλὸν ἀληθῶς καὶ ἀνέξοδον ἀνέξοδον Herwerdenus: ἀδιέξοδον , ἂν μὴ μάρτυρας ἔχῃ, καθάπερ τραγῳδία, θεατάς· ἡμῖν δʼ ἂν ἴαμα γένοιτο τοῦ πολλοὺς ὁμοῦ συνάγειν τὸ πολλάκις κατʼ ὀλίγους παραλαμβάνειν. οἱ γὰρ σπανίως καί διʼ Ἅρματος ἐκ διάρματος S. Sed proverbium esse vid. cf. Eust. p. 266, 41 ὥς φασιν ἑστιῶντες ἀναγκάζονται τὸν ὁπωσοῦν ἐπιτήδειον ἢ γνώριμον καταγράφειν οἱ δὲ συνεχέστερον κατὰ τρεῖς ἤ τέτταρας ἀναλαμβάνοντες, ὥσπερ πορθμεῖα τὰ συμπόσια κοῦφά τε κοῦφά τε ] κουφότερα Herwerdenus ποιοῦσι. ποιεῖ δέ τινα τοῦ πολλοῦ τῶν φίλων πλήθους διάκρισιν καὶ ὁ τῆς αἰτίας διηνεκὴς ἐπιλογισμός· ὡς γὰρ ἐπὶ τὰς χρείας οὐ πάντας ἀλλὰ τοὺς ἁρμόττοντας ἑκάστῃ παρακαλοῦμεν, βουλευόμενοι μὲν τοὺς φρονίμους δικαζόμενοι δὲ τοὺς λέγοντας, ἀποδημοῦντες δὲ τοὺς ἐλαφροὺς μάλιστα τοῖς βιωτικοῖς καὶ σχολὴν ἄγοντας· οὕτως ἐν ταῖς ὑποδοχαῖς ἑκάστοτε τοὺς ἐπιτηδείους Basileensis: ἐπιτηδείως παραληπτέον. ἐπιτήδειοι δὲ τῷ μὲν ἡγεμόνι δειπνίζοντι συνδειπνεῖν οἵ τʼ ἄρχοντες, ἐὰν ὦσι φίλοι, καὶ οἱ πρῶτοι τῆς πόλεως ἐν δὲ γάμοις ἢ καὶ γενεθλίοις οἱ κατὰ γένος προσήκοντες καὶ Διὸς ὁμογνίου κοινωνοῦντες· ἐν δὲ ταῖς τοιαύταις ὑποδοχαῖς ἢ προπομπαῖς τοὺς τοὺς ] ταῖς mei ἐκείνων ἐκείνῳ Turnebus. ἐκείνοις ? μάλιστα κεχαρισμένους εἰς ταὐτὸ συνακτέον. οὐδὲ γὰρ θεῷ θύοντες πᾶσι τοῖς μάλιστα δὲ τοῖς (malim καὶ ) συννάοις R ἄλλοις θεοῖς, μάλιστα καὶ συννάοις καὶ συμβώμοις, κατευχόμεθα, ἀλλὰ τριῶν κρατήρων τριῶν κρατήρων ] cf. Polluc. 6, 15 κιρναμένων, τοῖς μὲν τοῖς μὲν ] τῷ μὲν R ἀπὸ τοῦ πρώτου σπένδομεν τοῖς δʼ ἀπὸ τοῦ δευτέρου τοῖς δʼ ἀπὸ τοῦ τελευταίου· φθόνος γὰρ ἔξω θείου χοροῦ ἵσταται φθόνος - ἵσταται ] ex Plat. Phaedr. p. 247a · θεῖος δέ που καὶ ὁ τῶν φίλων χορὸς εὐγνωμόνως διανεμόμενος ἐν ταῖς συμπεριφοραῖς.
5.6.1	 ῥηθέντων δὲ τούτων, εὐθὺς ἐζητεῖτο περὶ τῆς ἐν ἀρχῇ στενοχωρίας τῶν κατακειμένων εἶτʼ ἀνέσεως· οὗ τοὐναντίον εἰκὸς ἦν συμβαίνειν διὰ τὴν ἀπὸ ἀπὸ M: ἐπὶ τοῦ δείπνου πλήρωσιν. ἔνιοι μὲν οὖν ἡμῶν τὸ σχῆμα τῆς κατακλίσεως ᾐτιῶντο πλατεῖς γὰρ ὡς ἐπίπαν κατακειμένους δειπνεῖν, ἅτε δὴ τὴν δεξιὰν προτείνοντας ἐπὶ τὰς τραπέζας· δειπνήσαντας δʼ ἀναστρέφειν αὑτοὺς αὑτοὺς Vulcobius: αὐτοὺς μᾶλλον ἐπὶ πλευράν, ὀξὺ τὸ σχῆμα ποιοῦντας τοῦ σώματος καὶ οὐκέθʼ ὡς εἰπεῖν κατʼ ἐπίπεδον, ἀλλὰ κατὰ γραμμὴν τῆς χώρας ἁπτομένους· ὥσπερ οὖν οἱ ἀστράγαλοι τόπον ἐλάττω κατέχουσιν ὀρθοὶ πίπτοντες ἢ πρηνεῖς, οὕτως ἡμῶν ἕκαστον ἐν ἀρχῇ μὲν ἐπὶ στόμα προνεύειν ἀποβλέποντα πρὸς τὴν τράπεζαν ὕστερον δὲ μετασχηματίζειν ἐπὶ βάθος ἐκ πλάτους τὴν κατάκλισιν. οἱ δὲ πολλοὶ τὴν συνένδοσιν τῆς στρωμνῆς προυφέροντο *: προεφέροντο · θλιβομένην γὰρ ἐν τῇ κατακλίσει πλατύνεσθαι καὶ διαχωρεῖν, ὥσπερ τῶν ὑποδημάτων τὰ τριβόμενα, κατὰ μικρὸν ἐνδιδόντα em. Hirschigius: ἐπιδιδόντα καὶ χαλῶντα τοῖς πόροις, εὐρυχωρίαν τῷ ποδὶ καὶ ἀναστροφὴν παρέχει. ὁ δὲ πρεσβύτης ἅμα παίζων δύʼ ἔφη ταὐτὸ *: τὸ αὐτὸ συμπόσιον ἀνομοίους ἔχειν ἐπιστάτας τε καὶ ἡγεμόνας, ἐν ἀρχῇ μὲν τὸν λιμὸν ᾧ τῶν τακτικῶν οὐδὲν μέτεστιν, ὕστερον δὲ τὸν Διόνυσον ὃν πάντες ἄριστον γεγονέναι στρατηγὸν ὁμολογοῦσιν ὥσπερ οὖν ὁ Ἐπαμεινώνδας, εἴς τινα δυσχωρίαν τῶν στρατηγῶν ὑπʼ ἀπειρίας εἰσβαλλόντων τὴν φάλαγγα περιπίπτουσαν ἑαυτῇ καὶ ταρασσομένην ὑπολαβών, ἐξέλυσε καὶ κατέστησεν εἰς τάξιν· οὕτως ἡμᾶς ἐν ἀρχῇ συμπεφορημένους ὑπὸ τοῦ λιμοῦ κυνηδὸν ἄρτι παραλαμβάνων ὁ Λυαῖος θεὸς καὶ Χορεῖος εἰς τάξιν ἱλαρὰν καὶ φιλάνθρωπον καθίστησιν. 
5.7.1	 περὶ τῶν καταβασκαίνειν, καὶ βάσκανον ἔχειν ὀφθαλμὸν ἐμπεσόντος λόγου παρὰ δεῖπνον, οἱ μὲν ἄλλοι παντάπασιν ἐξεφλαύριζον em. Turnebus: ἐξεφλυάριζον τὸ πρᾶγμα καὶ κατεγέλων· ὁ δʼ ἑστιῶν ἡμᾶς Μέστριος Vulcobius: μέτριος Φλῶρος ἔφη τὰ μὲν γιγνόμενα τῇ φήμῃ θαυμαστῶς βοηθεῖν· τῷ δʼ αἰτίας ἀπορεῖν ἀπιστεῖσθαι τὴν ἱστορίαν οὐ δικαίως, ὅπου, μυρίων ἐμφανῆ τὴν οὐσίαν ἐχόντων, ὁ τῆς αἰτίας λόγος ἡμᾶς διαπέφευγεν· ὅλως δʼ εἶπεν ὁ ζητῶν ἐν ἑκάστῳ τὸ εὔλογον ἐκ πάντων ἀναιρεῖ τὸ θαυμάσιον. ὅπου γὰρ ὁ τῆς αἰτίας ἐπιλείπει λόγος, ἐκεῖθεν ἄρχεται τὸ ἀπορεῖν, τουτέστι τὸ φιλοσοφεῖν· ὥστε τρόπον τινὰ φιλοσοφίαν ἀναιροῦσιν οἱ τοῖς θαυμασίοις ἀπιστοῦντες. δεῖ δʼ ἔφη τὸ μὲν διὰ τί γίγνεται τῷ λόγῳ μετιέναι Anonymus: μετεῖναι , τὸ δʼ ὅτι γίγνεται παρὰ τῆς ἱστορίας λαμβάνειν. ἱστορεῖται δὲ πολλὰ τοιαῦτα· γιγνώσκομεν γὰρ ἀνθρώπους τῷ καταβλέπειν τὰ παιδία μάλιστα βλάπτοντας, ὑγρότητι τῆς ἕξεως καὶ ἀσθενείᾳ τρεπομένης ὑπʼ αὐτῶν καὶ κινουμένης ἐπὶ τὸ χεῖρον, ἧττον δὲ τῶν στερεῶν καὶ πεπηγότων ἤδη τοῦτο πασχόντων. καίτοι τούς γε περὶ τὸν Πόντον οἰκοῦντας πάλαι Θιβεῖς Θιβεῖς Hesychius: Θηβεῖς cf. Plin. H. N. 7, 2, 17 'in Ponto Thibiorum genus' προσαγορευομένους ἱστορεῖ Φύλαρχος Φύλαρχος ] Mueller. 1 p. 354 οὐ παιδίοις μόνον ἀλλὰ καὶ τελείοις ὀλεθρίους εἶναι· καὶ γὰρ τὸ βλέμμα καὶ τὴν ἀναπνοὴν καὶ τὴν διάλεκτον αὐτῶν παραδεχομένους τήκεσθαι καὶ νοσεῖν· ᾔσθοντο δʼ ὡς ἔοικε τὸ γιγνόμενον οἱ μιγάδες, οἰκέτας οἱ μιγάδας οἰκέτας Valesius ἐκεῖθεν ὠνίους ἐξάγοντες. ἀλλὰ τούτων τὸ μὲν ἴσως ἧττόν ἐστι θαυμαστὸν ἡ γὰρ ἐπαφὴ καὶ συνανάχρωσις ἔχει τινὰ φαινομένην πάθους ἀρχήν· καὶ καθάπερ τὰ τῶν ἄλλων ὀρνέων πτερὰ τοῖς τοῦ ἀετοῦ συντεθέντα διόλλυται ψηχόμενα ψηχόμενα Doehnerus: ψυχόμενα καὶ ἀπανθεῖ τῶν πτίλων μυδώντων, οὕτως οὐδὲν ἀπέχει καὶ ἀνθρώπου ψαῦσιν τὴν μὲν ὠφέλιμον εἶναι τὴν δʼ ἀπηνῆ καὶ βλαβεράν· τὸ δὲ καὶ προσβλεφθέντας ἀδικεῖσθαι συμβαίνει μὲν ὥσπερ εἴρηκα, τῷ δὲ τὴν αἰτίαν ἔχειν δυσθήρατον ἀπιστεῖται.
5.7.2	καὶ μήν ἔφην ἐγώ τρόπον τινὰ τῆς αἰτίας αὐτὸς αὐτὸς X: αὐτοῖς ἴχνος τι καὶ τρίβον ἀνεύρηκας, ἐπὶ τὰς ἀπορροὰς *: ἀπορροίας τῶν σωμάτων ἀφικόμενος· καὶ γὰρ ἡ ὀσμὴ καὶ ἡ φωνὴ καὶ τὸ ῥεῦμα τῆς ἀναπνοῆς ἀποφοραὶ τινές εἰσι τῶν ζῴων καὶ μέρη κινοῦντα τὰς αἰσθήσεις, ὅταν ὑπʼ αὐτῶν προσπεσόντων προπεσόντων mei πάθωσι. πολὺ δὲ μᾶλλον εἰκός ἐστι τῶν ζῴων ἀποφέρεσθαι τὰ τοιαῦτα διὰ τὴν θερμότητα καὶ τὴν κίνησιν, οἱονεί τινα σφυγμὸν καὶ κλόνον ἔχοντος τοῦ πνεύματος, ὑφʼ οὗ τὸ σῶμα κρουόμενον ἐνδελεχῶς ἐκπέμπει τινὰς ἀπορροάς *: ἀπορροίας ;. · μάλιστα δὲ τοῦτο γίγνεσθαι διὰ τῶν ὀφθαλμῶν εἰκός ἐστι· πολυκίνητος γὰρ ἡ ὄψις οὖσα μετὰ πνεύματος αὐγὴν αὐγὴν Turnebus: αὐτὴν ἀφιέντος πυρώδη θαυμαστήν τινα διασπείρει δύναμιν, ὥστε πολλὰ καὶ πάσχειν καὶ ποιεῖν διʼ αὐτῆς τὸν ἄνθρωπον. ἡδοναῖς τε γὰρ συμμέτροις συμμέτροις ] οὐ μετρίοις M. Malim οὐ μετρίαις vel ἀσυμμέτροις καὶ ἀηδίαις ὑπὸ τῶν ὁρατῶν τρεπόμενος συνέχεται· καὶ τῶν ἐρωτικῶν, ἃ δὴ μέγιστα καὶ σφοδρότατα παθήματα τῆς ψυχῆς ἐστιν, ἀρχὴν ἡ ὄψις ἐνδίδωσιν ὥστε ῥεῖν καὶ λείβεσθαι τὸν ἐρωτικόν, ὅταν ἐμβλέπῃ τοῖς καλοῖς, οἷον ἑλκόμενον ἑλκόμενον W: ἐρχόμενον . Num ἐγχεόμενον ? εἰς αὐτούς. διὸ καὶ θαυμάσειεν ἄν· τις οἶμαι μάλιστα τῶν πάσχειν μὲν καὶ κακοῦσθαι τὸν ἄνθρωπον διὰ τῆς ὄψεως οἰομένων, οὐκέτι δὲ δρᾶν καὶ βλάπτειν. αἱ γὰρ ἀντιβλέψεις τῶν ἐν ὥρᾳ καὶ τὸ διὰ τῶν ὀμμάτων ἐκπῖπτον, εἴτʼ ἄρα φῶς εἴτε ῥεῦμα, τοὺς ἐρῶντας ἐκτήκει ἐκτήκει Psellus: ἐντήκει καὶ ἀπόλλυσι μεθʼ ἡδονῆς ἀλγηδόνι μεμιγμένης, ἣν αὐτοὶ γλυκύπικρον ὀνομάζουσιν· οὔτε γὰρ ἁπτομένοις οὔτʼ ἀκούουσιν οὕτω τιτρώσκεσθαι συμβαίνει καὶ πάσχειν, ὡς προσβλεπομένοις καὶ προσβλέπουσι. τοιαύτη γὰρ γίγνεται διάδοσις καὶ ἀνάφλεξις ἀπὸ τῆς ὄψεως, ὥστε παντελῶς ἀπειράτους ἔρωτος ἡγεῖσθαι τοὺς τὸν Μη Μηδικὸν νάφθαν θαυμάζοντας ἐκ διαστήματος ὑπὸ τοῦ πυρὸς ἀναφλεγόμενον αἱ γὰρ τῶν καλῶν ὄψεις, κἂν πάνυ πόρρωθεν ἀντιβλέπωσι idem: ἀντιβλέψωσι , πῦρ ἐν ταῖς τῶν ἐρωτικῶν ψυχαῖς ἀνάπτουσι. καὶ μὴν τό γε τῶν ἰκτερικῶν βοήθημα πολλάκις ἱστοροῦμεν· ἐμβλέποντες γὰρ τῷ χαραδριῷ θεραπεύονται· τοιαύτην ἔοικε τὸ ζῷον φύσιν καὶ κρᾶσιν ἔχειν, ὥσθʼ ἕλκειν καὶ δέχεσθαι τὸ πάθος ἐκπίπτον ἔκλιπτον ( ἔκλειπτον E) mei. Num ἔκλειπτον ab ἐκλείβω ? , ὥσπερ ῥεῦμα, διὰ τῆς ὄψεως· ὅθεν οὐ προσβλέπουσιν οἱ χαραδριοὶ *: χαράδριοι τοὺς τὸν ἴκτερον ἔχοντας οὐδὲ καρτεροῦσιν, ἀλλʼ ἀποστρέφονται καὶ τὰ ὄμματα συγκλείσαντες ἔχουσιν· οὐ φθονοῦντες·, ὡς ἔνιοι νομίζουσι, τῆς ἀπʼ αὐτῶν ἰάσεως ἀλλʼ ὥσπερ ὑπὸ πληγῆς τιτρωσκόμενοι. τῶν δʼ ἄλλων νοσημάτων μάλιστα καὶ τάχιστα τὰς ὀφθαλμίας ἀναλαμβάνουσιν οἱ συνόντες· οὕτω δύναμιν ἔχει ὀξεῖαν ἡ ὄψις ἐνδοῦναι καὶ προσβαλεῖν ἑτέρῳ πάθους ἀρχήν.
5.7.3	καὶ μάλʼ ἔφη λέγεις ὀρθῶς ὁ Πατροκλέας ἐπί γε τῶν σωματικῶν τὰ δὲ τὰ δὲ Turnebus: τάδε τῆς ψυχῆς, ὧν ἐστι καὶ τὸ βασκαίνειν, τίνα τρόπον καὶ πῶς διὰ τῆς ὄψεως τὴν βλάβην εἰς τοὺς ὁρωμένους διαδίδωσιν; οὐκ οἶσθʼ ἔφην ὅτι πάσχουσʼ ἡ ψυχὴ τὸ σῶμα συνδιατίθησιν; ἐπίνοιαι γὰρ ἀφροδισίων ἐγείρουσιν αἰδοῖα, καὶ θυμοὶ κυνῶν ἐν ταῖς πρὸς τὰ θηρία γιγνομέναις ἁμίλλαις ἀποσβεννύουσι τὰς ὁράσεις πολλάκις καὶ τυφλοῦσι· λῦπαι δὲ καὶ φιλαργυρίαι καὶ ζηλοτυπίαι τὰ χρώματα τρέπουσι καὶ καταξαίνουσι τὰς ἕξεις· ὧν οὐδενὸς ὁ φθόνος ἧττον ἐνδύεσθαι τῇ ψυχῇ πεφυκὼς ἀναπίμπλησι καὶ τὸ σῶμα πονηρίας, ἣν οἱ ζωγράφοι καλῶς ἐπιχειροῦσιν ἀπομιμεῖσθαι τὸ τοῦ φθόνου πρόσωπον ὑπογράφοντες. ὅταν οὖν οὕτως ὑπὸ τοῦ φθονεῖν διατεθέντες corr. X: διατιθέντες ἀπερείδωσι τὰς ὄψεις, αἱ δʼ ἔγγιστα τεταγμέναι τῆς ψυχῆς σπάσασαι σπάσωσι τὴν κακίαν ὥσπερ πεφαρμαγμένα βέλη προσπίπτωσιν Turnebus: προπίπτωσιν , οὐδὲν οἶμαι συμβαίνει παράλογον οὐδʼ ἄπιστον, εἰ κινοῦσι εἰ κινοῦσι M: ἐκείνους ὃ τοὺς προσορωμένους· καὶ γὰρ τὰ δήγματα τῶν κυνῶν χαλεπώτερα γίγνεται μετʼ ὀργῆς δακνόντων· καὶ τὰ σπέρματα τῶν ἀνθρώπων μᾶλλον ἅπτεσθαί φασιν, ὅταν ἐρῶντες πλησιάζωσι· καὶ ὅλως τὰ πάθη τὰ τῆς ψυχῆς ἐπιρρώννυσι καὶ ποιεῖ σφοδροτέρας τὰς τοῦ σώματος δυνάμεις. διὸ καὶ τὸ τῶν λεγομένων προβασκανίων γένος οἴονται πρὸς τὸν φθόνον ὠφελεῖν, ἑλκομένης διὰ τὴν ἀτοπίαν τῆς ὄψεως, ὥσθʼ ἧττον ἐπερείδειν τοῖς πάσχουσιν. αὗταί σοι εἶπον ὦ Φλῶρε, συμβολαὶ τῆς εὐωχίας ἀπηριθμήσθωσαν.
5.7.4	 καὶ ὁ Σώκλαρος ἂν γʼ ἔφη πρότερον ἡμεῖς αὐτὰ αὐτὰς R δοκιμάσωμεν· ἔστι γὰρ ὅ τι τοῦ λόγου καταφαίνεται κίβδηλον. εἰ γὰρ ἃ λέγουσι πολλοὶ περὶ τῶν βασκαινομένων ὡς ἀληθῆ τίθεμεν, οὐκ ἀγνοεῖς δήπουθεν ὅτι καὶ φίλους καὶ οἰκείους, ἔνιοι δὲ καὶ πατέρας ἔχειν ὀφθαλμὸν βάσκανον ὑπολαμβάνουσιν, ὥστε μὴ δεικνύναι τὰς γυναῖκας αὐτοῖς τὰ παιδία μηδὲ πολὺν ἐᾶν χρόνον ὑπὸ τῶν τοιούτων καταβλέπεσθαι· πῶς οὖν ἔτι δόξει φθόνου τὸ πάθος εἶναι; τί δʼ, πρὸς τοῦ Διός, ἐρεῖς περὶ τῶν ἑαυτοὺς καταβασκαίνειν λεγομένων; καὶ γὰρ τοῦτʼ ἀκήκοας· εἰ δὲ μή, πάντως ταῦτʼ ἀνέγνωκας καλαὶ μέν ποτʼ ἔσαν, καλαί, φόβαι καλαὶ φόβαι Emperius: καὶ φόβαι Εὐτελίδαο· ἀλλʼ αὑτὸν αὑτὸν X: αὐτὸν βάσκαινεν ἰδὼν ὀλοφώιος ἀνὴρ δίνῃ ἐν ποταμῷ idem: δινήεντι ποταμῷ · τὸν δʼ αὐτίκα νοῦσος ἀεικής ἀεικής ] puncta add. Duebnerus ὁ γὰρ Εὐτελίδας λέγεται, καλὸς ἑαυτῷ φανεὶς· καὶ παθών τι παθόντι mei πρὸς τὴν ὄψιν, ἐκ τούτου νοσῆσαι καὶ τὴν εὐεξίαν μετὰ τῆς ὥρας ἀποβαλεῖν. ἀλλʼ ὅρα πῶς ἔχεις εὑρησιλογίας *: εὐρεσιλογίας πρὸς τὰς τοιαύτας ἀτοπίας.
