3.2.2	πρὸς ταῦθʼ ὁ μὲν Τρύφων ἄφωνος; ἦν, ὅπως ἀντείποι σκεπτόμενος· ὁ δʼ Ἐράτων ἕκαστον ἡμῶν τῶν νέων ἀνακαλούμενος ἐκέλευε βοηθεῖν τῷ Τρύφωνι περὶ περὶ * τῶν στεφάνων ἢ τοὺς στεφάνους ἀποτίθεσθαι· καὶ Ἀμμώνιος; ἔφη παρέχειν ἄδειαν, οὐ γὰρ ἀντερεῖν οἷς ἂν ἡμεῖς; εἴπωμεν. οὕτω δὴ καὶ τοῦ Τρύφωνος ἐπικελεύοντος εἰπεῖν ἔφην ὅτι τὸ μὲν ἀποδεῖξαι εἰπεῖν ἔφην ὅτι τὸ μὲν ἀποδεῖξαι *: εἰπεῖν 4 unus Vd (P) τι τὰς μὲν ἀποδείξεις ψυχρὸν εἶναι τὸν κιττὸν οὐκ ἐμὸν ἦν ἔργον, ἀλλὰ Τρύφωνος· οὗτος γὰρ αὐτῷ ψύχοντι καὶ στύφοντι πολλὰ τὰ πολλὰ ? χρῆται· τῶν δʼ εἰρημένων ἔφην τὸ μὲν μεθύσκειν κιττὸν οἴνῳ μιγνύμενον οὐκ ἀληθές ἐστιν· ὃ γὰρ ἐμποιεῖ ὃ γὰρ ἐμποιεῖ Basileensis: τὸ γὰρ ἐμποιεῖν τοῖς πιοῦσι πάθος οὐ μέθην ἄν τις εἴποι, ταραχὴν δὲ καὶ παραφροσύνην, οἷον ὑοσκύαμος ἐμποιεῖ καὶ πολλὰ ἄλλα ἄλλα * τοιαῦτα τοιαῦτα *: ταῦτα κινοῦντα μανικῶς τὴν διάνοιαν. ὁ δὲ τοῦ κλήματος σπασμὸς; ἄλογός ἐστι· τοιαῦτα γὰρ παρὰ φύσιν ἔργα τῶν κατὰ φύσιν δυνάμεων οὐκ ἔστιν· ἀλλὰ καὶ τὰ ξύλα διαστρέφεται, τοῦ πυρὸς τὸ ὑγρὸν ἕλκοντος ἐξ αὐτῶν βίᾳ, κυρτότητας ἴσχοντα καὶ παραβάσεις παρατάσεις Madvigius · τὸ δὲ συγγενὲς θερμὸν αὔξειν καὶ τρέφειν πέφυκε. σκόπει δὲ μὴ μᾶλλον ἀρρωστία τις καὶ ψυχρότης σώματος σώματος ] πνεύματος R cf. p. 77a τὸ πολυκαμπὲς καὶ χαμαιπετὲς πέφυκεν, προσκρούσεις προσκρούσεις * ex p. 77a: 5-6 Vd 11 E σεις πυκνὰς καὶ καὶ ] om. mei ἀντικοπὰς λαμβάνοντος, ὥσπερ ὁδοιπόρου διʼ ἀσθένειαν πολλάκις ἀποκαθίζοντος εἶτα πάλιν ἐρχομένου· διὸ καὶ περιπλοκῆς δεῖται καὶ στηρίγματος, αὐτὸς ἑαυτὸν ἀνέχειν καὶ ποδηγεῖν ἀδυνατῶν διʼ ἔνδειαν θερμότητος, ἧς; τὸ ἀνωφερὲς em. Turnebus: ἀνωφελὲς δύναμίς ἐστιν. ἡ δὲ χιὼν ἀπορρεῖ καὶ περιτήκεται διʼ ὑγρότητα τοῦ φύλλου τὸ γὰρ ὕδωρ σβέννυσιν αὐτῆς καὶ κόπτει τὴν χαυνότητα διὰ τὸ διὰ τὸ *: ἃτε μικρῶν εἶναι καὶ πυκνῶν ἄθροισμα πομφολύγων ὅθεν οὐχ ἧττον οὐχ ἧττον ] om. mei ἐν τοῖς περιψύκτοις σφόδρα καὶ νοτεροῖς τόποις ἢ τοῖς προσείλοις αἱ χιόνες ῥέουσι. τὸ δʼ ἀειθαλὲς τοῦτο καὶ ὥς φησιν Ἐμπεδοκλῆς Ἐμπεδοκλῆς ] Mullach. 1 p. 13 vs. 435 ἐμπεδόφυλλον οὐκ ἔστι θερμότητος· οὐδὲ γὰρ ψυχρότητος τὸ φυλλορροεῖν. ἡ γοῦν γοῦν R: οὖν μυρρίνη καὶ τὸ ἀδίαντον τὸ ἀδιάλειπτον mei οὐκ ὄντα τῶν θερμῶν ἀλλὰ τῶν ψυχρῶν ἀεὶ τέθηλεν. ἔνιοι μὲν οὖν ὁμαλότητι κράσεως οἴονται παραμένειν τὸ φύλλον· Ἐμπεδοκλῆς Ἐμπεδοκλῆς ] om. Mullachius δὲ πρὸς τούτῳ καὶ πόρων τινὰ συμμετρίαν αἰτιᾶται, τεταγμένως καὶ ὁμαλῶς τὴν τροφὴν διιέντων, ὥστʼ ἀρκούντως ἀρκούντως ] σαρκούντων ] mei ἐπιρρεῖν. τοῖς δὲ φυλλορροοῦσιν οὐκ ἔστι διὰ μανότητα τῶν ἄνω καὶ στενότητα τῶν κάτω πόρων, ὅταν οἱ μὲν μὴ ἐπιπέμπωσιν οἱ δὲ μὴ μὴ Vulcobius φυλάττωσιν ἀλλʼ ὀλίγην ὀλίγην W: ὀλίγον λαβόντες ἄθρουν em. R: ἄθρουν λαβόντες ἐκχέωσιν, ὥσπερ ἐν ἀνδήροις τισὶν οὐχ ὁμαλοῖς· τὰ δʼ ὑδρευόμενα ἀεὶ τὴν τροφὴν fort. τὰ δʼ ὑδευόμενα ἅτʼ ἔχοντα ἀεὶ τὴν τροφὴν κἑ διαρκῆ καὶ σύμμετρον ἀντέχει καὶ παραμένει ἀγήρω καὶ καὶ ἀγήρω ? χλοερά. ἀλλʼ ἐν Βαβυλῶνι φυτευόμενος ἐξίστατο καὶ ἀπηγόρευεν, εὖ γε ποιῶν ὁ γενναῖος οὗτος, ὅτι Βοιωτίου θεοῦ πελάτης καὶ παράσιτος ὢν οὐκ ἐβούλετο μετοικεῖν ἐν βαρβάροις, οὐδʼ Ἀλέξανδρον ἐζήλωσεν ἐξοικειούμενον ἐκείνοις τοῖς ἔθνεσιν, ἀλλʼ ἔφευγε καὶ διεμάχετο πρὸς τὴν ἀποξένωσιν. αἰτία δʼ οὐχ ἡ θερμότης ἦν, ἀλλὰ μᾶλλον ἡ ψυχρότης, οὐχ ὑποφέρουσα τὴν ἐναντίαν κρᾶσιν· οὐ γὰρ φθείρει τὸ οἰκεῖον, ἀλλὰ προσίεται καὶ φέφει φέρει ] malim τρέφει , καθάπερ τὸ θύμον ἡ ξηρὰ γῆ, καίτοι θερμὸν ὄν, τὴν δὲ Βαβυλωνίαν οὕτω φασὶν ἀέρα πνιγώδη καὶ βαρὺν περιέχειν, ὥστε πολλοὺς τῶν εὐπόρων, ὅταν ἐμπλήσωσιν ἀσκοὺς ὕδατος, ἐπὶ τούτων καθεύδειν ἀναψυχομένους.
3.3.1	 ἐθαύμαζε δὲ Φλῶρος, εἰ γεγραφὼς Ἀριστοτέλης Ἀριστοτέλης ] Fragm. 108 ἐν τῷ περὶ μέθης, ὅτι μάλιστα μὲν οἱ γέροντες ἣκιστα δʼ αἱ γυναῖκες ὑπὸ μέθης ἁλίσκονται, τὴν αἰτίαν οὐκ ἐξειργάσατο, μηδὲν εἰωθὼς προΐεσθαι τῶν τοιούτων. εἶτα μέντοι προὔβαλεν ἐν μέσῳ σκοπεῖν τοῖς παροῦσιν. ἦν δὲ τῶν συνήθων τὸ δεῖπνον. ἔφη τοίνυν ὁ Σύλλας θατέρῳ θάτερον ἐμφαίνεσθαι· κἂν εἰ περὶ τῶν γυναικῶν ὀρθῶς τὴν αἰτίαν λάβοιμεν, οὐκ ἔτι πολλοῦ λόγου δεήσεσθαι περὶ τῶν γερόντων· ἐναντίας γὰρ εἶναι μάλιστα τὰς φύσεις τῇ θʼ ὑγρότητι καὶ ξηρότητι καὶ λειότητι καὶ λειότηττι ] om. mei καὶ τραχύτητι καὶ μαλακότητι καὶ σκληρότητι. καὶ τοῦτʼ ἔφη λαμβάνειν em. R: λαμβάνει κατὰ τῶν γυναικῶν πρῶτον, ὅτι τὴν κρᾶσιν ὑγρὰν ἔχουσιν, ἣ καὶ τὴν ἁπαλότητα τῆς σαρκὸς ἐμμεμιγμένη em. W: ἐμμεμιγμένην παρέχει καὶ τὸ στίλβον ἐπὶ λειότητι καὶ τὰς καθάρσεις· ὅταν οὖν ὁ οἶνος εἰς ὑγρότητα πολλὴν ἐμπέσῃ, κρατούμενος ἀποβάλλει τὴν βαφὴν καὶ γίγνεται παντάπασιν ἀβαφὴς em. S: ἀναφὴς καὶ ὑδατώδης. ἔστι δέ τι καὶ παρʼ αὐτοῦ λαβεῖν Ἀριστοτέλους Ἀριστοτέλους ] Fragm. 109 · τοὺς γὰρ ἄθρουν καὶ ἀπνευστὶ πίνοντας, ὅπερ ἀμυστίζειν ὠνόμασαν οἱ παλαιοί, φησὶν ἥκιστα περιπίπτειν μέθαις· οὐ γὰρ ἐνδιατρίβειν τὸν ἄκρατον αὐτοῖς αὐτοῖς Turnebus: αὐτὸν , ἀλλʼ ἐξωθούμενον ῥύμῃ ῥύμῃ ] ῥύδην R διαπορεύεσθαι διὰ τοῦ σώματος. ἐπιεικῶς δὲ τὰς γυναῖκας ὁρῶμεν οὕτω πινούσας. εἰκὸς δʼ αὐτῶν καὶ τὸ σῶμα, διὰ τὸν ἐνδελεχῆ τῶν ὑγρῶν κατασπασμὸν ἐπὶ τὰς ἀποκαθάρσεις ἀποκαθάρσεις S: ἀπο 5-6 Vd 9 E πολύπορον γεγονέναι καὶ τετμῆσθαι καθάπερ ἀνδήροις καὶ ὀχετοῖς· εἰς οὓς ἐμπίπτοντα τὸν ἄκρατον ὑπάγειν ταχέως καὶ μὴ προσίστασθαι τοῖς κυρίοις μέρεσιν, ὧν διαταραττομένων συμβαίνει τὸ μεθύειν. οἱ δὲ γέροντες ὅτι μέν εἰσιν ἐνδεεῖς ἰκμάδος οἰκείας, τοὔνομά μοι δοκεῖ φράζειν πρῶτον· οὐ γὰρ ὡς ῥέοντες εἰς γῆν, ἀλλʼ ὡς γεώδεις καὶ γεηροί τινες·, ἤδη γιγνόμενοι τὴν ἕξιν οὕτω προσαγορεύονται. δηλοῖ δὲ καὶ τὸ δυσκαμπὲς αὐτῶν καὶ σκληρόν, ἔτι δʼ ἡ τραχύτης·, τὴν ξηρότητα τῆς φύσεως. ὅταν οὖν ἐμπίνωσιν, εἰκὸς ἀναλαμβάνεσθαι τὸν οἶνον, τοῦ σώματος σπογγώδους διὰ τὸν αὐχμὸν ὄντος· εἶτʼ ἐμμένοντα πληγὰς καὶ βαρύτητας ἐμποιεῖν. ὡς γὰρ τὰ ῥεύματα τῶν μὲν πυκνῶν ἀποκλύζεται χωρίων καὶ πηλὸν οὐ ποιεῖ τοῖς δʼ ἀραιοῖς ἀναμίγνυται μᾶλλον, οὕτως ὁ οἶνος ἐν τοῖς τῶν γερόντων σώμασιν ἔχει διατριβὴν ἑλκόμενος ὑπὸ τῆς ξηρότητος, ἄνευ δὲ τούτων ἰδεῖν ἔστι τὰ συμπτώματα τῆς μέθης τὴν τῶν γερόντων φύσιν ἐξ ἑαυτῆς ἔχουσαν · ἔστι γὰρ συμπτώματα μέθης ἐπιφανέστατα, τρόμοι μὲν ἄρθρων ψελλισμοὶ δὲ γλώσσης, πλεονασμοὶ δὲ λαλιᾶς ὀξύτητες δʼ ὀργῆς, λῆθαί τε καὶ παραφοραὶ διανοίας· ὧν τὰ πολλὰ καὶ περὶ τοὺς ὑγιαίνοντας ὄντα πρεσβύτας ὀλίγης ῥοπῆς δεῖται καὶ σάλου τοῦ τυχόντος· ὥστε μὴ γένεσιν ἰδίων ἀλλὰ κοινῶν ἐπίτασιν συμπτωμάτων γίγνεσθαι τὴν μέθην τῷ γέροντι· τεκμήριον δὲ τούτου τὸ τὸ S: τοῦ μηδὲν εἶναι γέροντι νέου μεθυσθέντος ὁμοιότερον. 
3.4.1	 ὁ μὲν οὖν Σύλλας Σύλας mei ταῦτʼ εἶπεν. ὁ δὲ τακτικὸς Ἀπολλωνίδης ἔφη τὸν μὲν περὶ τῶν γερόντων ἀποδέχεσθαι λόγον· ἐν δὲ ταῖς γυναιξὶν αὐτῷ δοκεῖν παραλελεῖφθαι τὸ τῆς ψυχρότητος, ᾗ ᾗ ] ἢ mei θερμότατον θερμότατον ] θερμὸν ὄντα W. malim θερμὸν ὄντα τὸν ἄκρατον ἀποσβέννυσθαι καὶ ἀποβάλλειν τὸ πλῆττον καὶ πυρῶδες. πιθανοῦ δὲ καὶ τούτου δοκοῦντος, Ἀθρΐλατος ἀθρύιτος Vd. Ἀουίτος (Avitus) R ὁ Θάσιος; ἰατρὸς ἐμβαλών τινα τῇ ζητήσει διατριβὴν εἶναί τινας ἔφησεν, οἳ τὰς γυναῖκας οὐ ψυχρὰς ἀλλὰ θερμοτέρας τῶν ἀνδρῶν ὑπολαμβάνουσιν, ἑτέρους δὲ μᾶλλον μᾶλλον ] post ψυχρὸν collocat W. πάλιν Emperius οἳ τὸν οἶνον οὐ θερμὸν ἀλλὰ καὶ ψυχρὸν ἡγοῦνται. 
3.4.2	 θαυμάσαντος δὲ τοῦ Φλώρου, τὸν μὲν περὶ τοῦ οἴνου λόγον εἶπεν ἀφίημι τούτῳ δείξας ἐμέ· καὶ γὰρ ἐτυγχάνομεν ὀλίγαις ἡμέραις πρότερον εἰς τοῦτο διειλεγμένοι· τῶν δὲ γυναικῶν ἔφη τὴν θερμότητα πρῶτον ἀπὸ τῆς ψιλότητος οἴονται δεικνύναι, καταναλισκομένου τοῦ περιττώματος ὑπὸ τῆς θερμότητος, ὃ πλεονάζον εἰς τρίχας τρέπεται· δεύτερον δὲ τῷ πλήθει τοῦ αἵματος, ὃ πηγὴ μὲν εἶναι ἔοικεν εἶναι ? τῆς ἐν τῷ σώματι θερμότητος, ἔστι δὲ τοσοῦτον ταῖς γυναιξίν, ὥστʼ αὐτὰς καταπιμπράναι καὶ περιφλέγειν, εἰ μὴ πολλαὶ καὶ ταχεῖαι συμβαίνοιεν καθάρσεις. τρίτον τοῦτο τὸ περὶ τὰς ταφὰς αἱρεῖ θερμότερα αἱρεῖ θερμότερα ] αἱ 5-6 Vd 10 E ρα τὰ θήλεα τῶν ἀρρένων εἶναι· λέγεται γὰρ ὑπὸ τῶν σκευωρουμένων τάδε τάδε M: τὰ μὲν συντίθεσθαι παρὰ δέκα δέκα Iunius: δὲ καὶ νεκροὺς; ἀνδρῶν ἕνα γυναικὸς καὶ συνεξάπτειν, δᾳδῶδές τι καὶ λιπαρὸν αὐτῶν τῆς σαρκὸς ἐχούσης, ὥσθʼ ὑπέκκαυμα γίγνεσθαι τῶν ἄλλων. ἔτι δʼ, εἰ θερμότερον τὸ γονιμώτερον αἱ δὲ παρθένοι τῶν παίδων ὀργῶσι πρότερον καὶ σαλεύονται πρὸς τὸ γεννᾶν, οὐδʼ αὕτη αὕτη R: αὐτὴ τις ἀσθενὴς ἀπόδειξις ἂν εἴη τῆς θερμότητος. ἔτι δὲ μείζων καὶ πιθανωτέρα τὸ πρὸς τὰ κρύη καὶ τοὺς χειμῶνας εὐφόρως ἔχειν· ἧττον γὰρ αἱ πλεῖσται ῥιγοῦσι τῶν ἀνδρῶν καὶ παντάπασιν ἱματίων ὀλίγων δέονται.
3.4.3	ἀλλʼ ἀπʼ αὐτῶν οἶμαι τούτων ὁ Φλῶρος ἔφη τῶν ἐπιχειρημάτων ἐλέγχεσθαι τὸ δόγμα. πρῶτον μὲν γὰρ ἀντέχουσι τῷ ψύχει μᾶλλον, ὅτι πολλάκις τὸ ὅμοιον ὑπὸ τοῦ ὁμοίου δυσπαθέστερόν ἐστιν· ἔπειτα μέντοι καὶ τὸ σπέρμα μὴ προγεγονέναι supplendum vid. aut προγεγονέναι φαίνεται aut ἀπὸ τοῦ ἄρρενος εἰκός τὸ γόνιμον διὰ κατάψυξιν, ἀλλʼ ὕλην μόνον καὶ τροφὴν παρέχειν τῷ ἀπὸ τοῦ ἄρρενος. ἔπειτα λήγουσι τίκτουσαι πολὺ πρότερον ἢ γεννῶντες οἱ ἄνδρες. κάονται δὲ βέλτιον ὑπὸ πιμελῆς, ὃ δοκεῖ ψυχρότερον ψυχρότατον R εἶναι τοῦ σώματος· ἥκιστα γοῦν οἱ νέοι· καὶ γυμναστικοὶ πιμελώδεις. ἡ δʼ ἔμμηνος ἔμμονος mei κάθαρσις οὐ πλήθους ἀλλὰ διαφθορᾶς καὶ φαυλότητὸς ἐστιν αἵματος· τὸ γὰρ ἄπεπτον αὐτοῦ καὶ περιττωματικὸν οὐκ ἔχον ἵδρυσιν οὐδὲ σύστασιν ἐν τῷ σώματι διʼ ἀσθένειαν ἐκπίπτει, παντάπασιν ἀμβλὺ καὶ θολερὸν ἀρρωστίᾳ τοῦ θερμοῦ γιγνόμενον. δηλοῖ γοῦν καὶ τὸ ῥιγοῦν καὶ τὸ ὑποφρίττειν ὡς ἐπὶ πολὺ τὰς καθαιρομένας, ὅτι ψυχρόν ἐστι καὶ ἄπεπτον τὸ κεκινημένον καὶ ἀποχωροῦν ἐκ τοῦ σώματος. τὴν δὲ ψιλότητα τίς ἂν εἴποι, ὅτι ὅτι * θερμότητος οὐχὶ καὶ οὐχὶ vel οὐχὶ δὲ R μᾶλλον ψυχρότητός ἐστι τὸ πάθος, ὁρῶν τὰ θερμότατα τοῦ σώματος μέρη δασυνόμενα; πάντα γὰρ ἐξωθεῖται ἐξανθεῖται *: ἐξωθεῖται Quod R proposuit ἐξανθεῖ apud Plut. plerumque transitivum est τὰ τοιαῦτα τῷ θερμῷ, χαράσσοντι καὶ ἀναστομοῦντι τὴν ἐπιφάνειαν. ἡ δὲ λειότης em. Leonicus: λούϊτε πυκνότητι γέγονεν ὑπὸ ψυχρότητος· ὅτι δʼ εἰσὶ πυκνότεραι τῶν ἀνδρῶν, ὦ φίλʼ Ἀθρυΐλατε, πυθοῦ παρὰ τῶν ἔτι συναναπαυομένων γυναιξὶν ἢ μύρον ἀληλιμμέναις ἢ ἔλαιον· ἀναπίμπλανται γὰρ αὐτοῦ τοῦ αὐτοῦ τοῦ ] αὐτοὶ τοῦ ? χρίσματος ἐν τῷ συγκαθεύδειν, κἂν μὴ θίγωσι μηδὲ προσάψωνται τῶν γυναικῶν, διὰ θερμότητα καὶ μανότητα τοῦ σώματος ἕλκοντος post ἕλκοντος in Vd P nulla est lac. sed in E 3-4 litt. Supplet τῶν ἀνδρῶν ἀπὸ πυκνοῦ καὶ ψυχροῦ τοῦ τῶν γυναικῶν W .
3.5.1	οὐ μὴν ἀλλὰ τὸ μὲν περὶ τῶν γυναικῶν ἔφη ἔφη X: ἔφην καὶ πρὸς τοὐναντίον ἀνδρικῶς ἐπικεχείρηται οὐ μὴν ἀλλὰ - ἐπικεχείρηται ] haec ex fine superioris quaestionis in huius principio collocavit W . τὸν δʼ οἶνον ἐπιθυμῶ μαθεῖν μαθεῖν ] μαθεῖν 11 E solus , ὁπόθεν ὑπόνοιαν ἡμῖν τοῦ τοῦ ] τὸ mei ψυχρὸς εἶναι παρέσχεν οἴει γάρ ἔφην ἐγὼ τοῦτον ἡμέτερον εἶναι τὸν λόγον; ἀλλὰ τίνος εἶπεν ἑτέρου; μέμνημαι μὲν οὖν ἔφην ἐγὼ καὶ Ἀριστοτέλους ἐντυχὼν οὐ νεωστὶ λόγῳ λόγῳ Basileensis: λόγου περὶ τούτου τοῦ προβλήματος ἀλλʼ ἱκανῶς πάλαι. διείλεκται δὲ καὶ Ἐπίκουρος ἐν τῷ Συμποσίῳ Ἐπίκουρος ἐν τῷ Συμποσίῳ ] vid. Usener. p. 116 πολλοὺς λόγους, ὧν τὸ κεφάλαιόν ἐστιν ὡς ἐγᾦμαι τοιόνδε. φησὶ γὰρ οὐκ εἶναι θερμὸν αὐτοτελῶς τὸν οἶνον, ἀλλʼ ἔχειν τινὰς ἀτόμους ἐν αὑτῷ θερμασίας ἀποτελεστικὰς ἑτέρας δʼ αὖ ψυχρότητος· ὧν τὰς μὲν ἀποβάλλειν, ὅταν εἰς τὸ σῶμα παραγένηται, τὰς δὲ προσλαμβάνειν ἐκ τοῦ σώματος, ὡς ἂν καὶ ὡς ἂν scripsit Usenerus cum Hutteno et deinde ἔχουσι cum aliis, quae ego non intellego. Ut locus fertur subiectum ἔχωσι verbi est αἱ ἄτομοι ἔχωσι κράσεως ἡμῖν ἢ φύσεως ὁμιλῆσαι, ὡς τοὺς μὲν ἐκθερμαίνεσθαι τοὺς δὲ τοὐναντίον πάσχειν μεθυσκομένους.
