0	
739	αἰπεινά τοι μαντεῖα· τοῦ γήρως δέ μοι
740	συνεκπονοῦσα κῶλον ἰατρὸς γενοῦ.
741	ἕπου νυν· ἴχνος δʼ ἐκφύλασσʼ ὅπου τίθης.
742	ἰδού.
742a	τὸ τοῦ ποδὸς μὲν βραδύ, τὸ τοῦ δὲ νοῦ ταχύ.
743	βάκτρῳ δʼ ἐρείδου περιφερῆ στίβον χθονός.
744	καὶ τοῦτο τυφλόν, ὅταν ἐγὼ βλέπω βραχύ.
745	ὀρθῶς ἔλεξας· ἀλλὰ μὴ παρῇς κόπῳ.
746	οὔκουν ἑκών γε· τοῦ δʼ ἀπόντος οὐ κρατῶ.
747	γυναῖκες, ἱστῶν τῶν ἐμῶν καὶ κερκίδος
748	δούλευμα πιστόν, τίνα τύχην λαβὼν πόσις
749	βέβηκε παίδων, ὧνπερ οὕνεχʼ ἥκομεν;
750	σημήνατʼ· εἰ γὰρ ἀγαθά μοι μηνύσετε,
751	οὐκ εἰς ἀπίστους δεσπότας βαλεῖς χάριν.
752	ἰὼ δαῖμον.
753	τὸ φροίμιον μὲν τῶν λόγων οὐκ εὐτυχές.
754	ἰὼ τλᾶμον.
755	ἀλλʼ ἦ τι θεσφάτοισι δεσποτῶν νοσῶ;
756	εἶἑν· τί δρῶμεν; θάνατος ὧν κεῖται πέρι 
757	τίς ἥδε μοῦσα, χὡ φόβος τίνων πέρι;
758	εἴπωμεν ἢ σιγῶμεν; ἢ τί δράσομεν;
759	εἴφʼ· ὡς ἔχεις γε συμφοράν τινʼ εἰς ἐμέ.
760	εἰρήσεταί τοι, κεἰ θανεῖν μέλλω διπλῇ.
761	οὐκ ἔστι σοι, δέσποινʼ, ἐπʼ ἀγκάλαις λαβεῖν
762	τέκνʼ, οὐδὲ μαστῷ σῷ προσαρμόσαι ποτέ.
762a	ὤμοι, θάνοιμι.
763	θύγατερ.
763b	ὦ τάλαινʼ
764	ἐγὼ συμφορᾶς, ἔλαβον ἔπαθον ἄχος
764a	ἀβίοτον, φίλαι.
764b	διοιχόμεσθα.
765	τέκνον.
765b	αἰαῖ αἰαῖ·
767	διανταῖος ἔτυπεν ὀδύνα με πλευ-
768	μόνων τῶνδʼ ἔσω.
769	μήπω στενάξῃς 
769b	ἀλλὰ πάρεισι γόοι.
770	πρὶν ἂν μάθωμεν 
770b	ἀγγελίαν τίνα μοι;
771	εἰ ταὐτὰ πράσσων δεσπότης τῆς συμφορᾶς
772	κοινωνός ἐστιν, ἢ μόνη σὺ δυστυχεῖς.
774	κείνῳ μέν, ὦ γεραιέ, παῖδα Λοξίας
775	ἔδωκεν, ἰδίᾳ δʼ εὐτυχεῖ ταύτης δίχα.
776	τόδʼ ἐπὶ τῷδε κακὸν ἄκρον ἔλακες
777	ἄχος ἐμοὶ στένειν.
778	πότερα δὲ φῦναι δεῖ γυναικὸς ἔκ τινος
779	τὸν παῖδʼ ὃν εἶπας, ἢ γεγῶτʼ ἐθέσπισεν;
780	ἤδη πεφυκότʼ ἐκτελῆ νεανίαν
781	δίδωσιν αὐτῷ Λοξίας· παρῆ δʼ ἐγώ.
782	πῶς φῄς; ἄφατον ἄφατον ἀναύδητον
783	λόγον ἐμοὶ θροεῖς.
785	κἄμοιγε. πῶς δʼ ὁ χρησμὸς ἐκπεραίνεται,
786	σαφέστερόν μοι φράζε, χὥστις ἔσθʼ ὁ παῖς.
787	ὅτῳ ξυναντήσειεν ἐκ θεοῦ συθεὶς
788	πρώτῳ πόσις σός, παῖδʼ ἔδωκʼ αὐτῷ θεός.
789	ὀττοτοττοτοῖ· τὸν δʼ ἐμὸν ἄτεκνον ἄτεκνον ἔλακεν
790	ἄρα βίοτον; ἐρημίᾳ δʼ ὀρφανοὺς
791	δόμους οἰκήσω.
792	τίς οὖν ἐχρήσθη; τῷ συνῆψʼ ἴχνος ποδὸς
793	πόσις ταλαίνης; πῶς δὲ ποῦ νιν εἰσιδών;
794	οἶσθʼ, ὦ φίλη δέσποινα, τὸν νεανίαν
795	ὃς τόνδʼ ἔσαιρε ναόν; οὗτος ἔσθʼ ὁ παῖς.
796	ἀνʼ ὑγρὸν ἀμπταίην αἰθέρα πόρσω γαί-
797	ας Ἑλλανίας, ἀστέρας ἑσπέρους,
799	οἷον οἷον ἄλγος ἔπαθον, φίλαι.
800	ὄνομα δὲ ποῖον αὐτὸν ὀνομάζει πατήρ;
801	οἶσθʼ, ἢ σιωπῇ τοῦτʼ ἀκύρωτον μένει;
802	Ἴωνʼ, ἐπείπερ πρῶτος ἤντησεν πατρί.
803	μητρὸς δʼ ὁποίας ἐστὶν — 
803b	οὐκ ἔχω φράσαι.
804	φροῦδος δʼ — ἵνʼ εἰδῇς πάντα τἀπʼ ἐμοῦ, γέρον — 
805	παιδὸς προθύσων ξένια καὶ γενέθλια
806	σκηνὰς ἐς ἱερὰς τῆσδε λαθραίως πόσις,
807	κοινὴν ξυνάψων δαῖτα παιδὶ τῷ νέῳ.
808	δέσποινα, προδεδόμεσθα — σὺν γάρ σοι νοσῶ — 
809	τοῦ σοῦ πρὸς ἀνδρός, καὶ μεμηχανημένως
810	ὑβριζόμεσθα δωμάτων τʼ Ἐρεχθέως
811	ἐκβαλλόμεσθα. καὶ σὸν οὐ στυγῶν πόσιν
812	λέγω, σὲ μέντοι μᾶλλον ἢ κεῖνον φιλῶν·
813	ὅστις σε γήμας ξένος ἐπεισελθὼν πόλιν
814	καὶ δῶμα καὶ σὴν παραλαβὼν παγκληρίαν,
815	ἄλλης γυναικὸς παῖδας ἐκκαρπούμενος
816	λάθρα πέφηνεν· ὡς λάθρα δʼ, ἐγὼ φράσω.
817	ἐπεί σʼ ἄτεκνον ᾔσθετʼ, οὐκ ἔστεργέ σοι
818	ὅμοιος εἶναι τῆς τύχης τʼ ἴσον φέρειν,
819	λαβὼν δὲ δοῦλα λέκτρα νυμφεύσας λάθρα
820	τὸν παῖδʼ ἔφυσεν, ἐξενωμένον δέ τῳ
821	Δελφῶν δίδωσιν ἐκτρέφειν. ὃ δʼ ἐν θεοῦ
822	δόμοισιν ἄφετος, ὡς λάθοι, παιδεύεται.
823	νεανίαν δʼ ὡς ᾔσθετʼ ἐκτεθραμμένον,
824	ἐλθεῖν σʼ ἔπεισε δεῦρʼ ἀπαιδίας χάριν.
825	κᾆθʼ ὁ θεὸς οὐκ ἐψεύσαθʼ, ὅδε δʼ ἐψεύσατο
826	πάλαι τρέφων τὸν παῖδα, κἄπλεκεν πλοκὰς
827	τοιάσδʼ· ἁλοὺς μὲν ἀνέφερʼ ἐς τὸν δαίμονα,
828	ἐλθὼν δὲ καὶ τὸν χρόνον ἀμύνεσθαι θέλων
829	τυραννίδʼ αὐτῷ περιβαλεῖν ἔμελλε γῆς.
830	καινὸν δὲ τοὔνομʼ ἀνὰ χρόνον πεπλασμένον
831	Ἴων, ἰόντι δῆθεν ὅτι συνήντετο.
832	οἴμοι, κακούργους ἄνδρας ὡς αἰεὶ στυγῶ,
833	οἳ συντιθέντες τἄδικʼ εἶτα μηχαναῖς
834	κοσμοῦσι. φαῦλον χρηστὸν ἂν λαβεῖν φίλον
835	θέλοιμι μᾶλλον ἢ κακὸν σοφώτερον.
836	καὶ τῶνδʼ ἁπάντων ἔσχατον πείσῃ κακόν·
837	ἀμήτορʼ, ἀναρίθμητον, ἐκ δούλης τινὸς
838	γυναικός, ἐς σὸν δῶμα δεσπότην ἄγειν.
839	ἁπλοῦν ἂν ἦν γὰρ τὸ κακόν, εἰ παρʼ εὐγενοῦς
840	μητρός, πιθών σε, σὴν λέγων ἀπαιδίαν,
841	ἐσῴκισʼ οἴκους· εἰ δὲ σοὶ τόδʼ ἦν πικρόν,
842	τῶν Αἰόλου νιν χρῆν ὀρεχθῆναι γάμων.
843	ἐκ τῶνδε δεῖ σε δὴ γυναικεῖόν τι δρᾶν·
844	ἢ γὰρ ξίφος λαβοῦσαν ἢ δόλῳ τινὶ
845	ἢ φαρμάκοισι σὸν κατακτεῖναι πόσιν
846	καὶ παῖδα, πρὶν σοὶ θάνατον ἐκ κείνων μολεῖν.
847	εἰ γάρ γʼ ὑφήσεις τοῦδʼ, ἀπαλλάξῃ βίου.
848	δυοῖν γὰρ ἐχθροῖν εἰς ἓν ἐλθόντοιν στέγος,
849	ἢ θάτερον δεῖ δυστυχεῖν ἢ θάτερον.
850	ἐγὼ μὲν οὖν σοι καὶ συνεκπονεῖν θέλω,
851	καὶ συμφονεύειν παῖδʼ ἐπεισελθὼν δόμους
852	οὗ δαῖθʼ ὁπλίζει, καὶ τροφεῖα δεσπόταις
853	ἀποδοὺς θανεῖν τε ζῶν τε φέγγος εἰσορᾶν.
854	ἓν γάρ τι τοῖς δούλοισιν αἰσχύνην φέρει,
855	τοὔνομα· τὰ δʼ ἄλλα πάντα τῶν ἐλευθέρων
856	οὐδὲν κακίων δοῦλος, ὅστις ἐσθλὸς ᾖ.
857	κἀγώ, φίλη δέσποινα, συμφορὰν θέλω
858	κοινουμένη τήνδʼ ἢ θανεῖν ἢ ζῆν καλῶς.
859	ὦ ψυχά, πῶς σιγάσω;
860	πῶς δὲ σκοτίας ἀναφήνω
861	εὐνάς, αἰδοῦς δʼ ἀπολειφθῶ;
862	τί γὰρ ἐμπόδιον κώλυμʼ ἔτι μοι;
863	πρὸς τίνʼ ἀγῶνας τιθέμεσθʼ ἀρετῆς;
864	οὐ πόσις ἡμῶν προδότης γέγονεν,
865	στέρομαι δʼ οἴκων, στέρομαι παίδων,
866	φροῦδαι δʼ ἐλπίδες, ἃς διαθέσθαι
867	χρῄζουσα καλῶς οὐκ ἐδυνήθην,
868	σιγῶσα γάμους,
869	σιγῶσα τόκους πολυκλαύτους;
870	ἀλλʼ οὐ τὸ Διὸς πολύαστρον ἕδος
871	καὶ τὴν ἐπʼ ἐμοῖς σκοπέλοισι θεὰν
872	λίμνης τʼ ἐνύδρου Τριτωνιάδος
873	πότνιαν ἀκτάν,
874	οὐκέτι κρύψω λέχος, ὡς στέρνων
875	ἀπονησαμένη ῥᾴων ἔσομαι.
876	στάζουσι κόραι δακρύοισιν ἐμαί,
877	ψυχὴ δʼ ἀλγεῖ κακοβουλευθεῖσʼ
878	ἔκ τʼ ἀνθρώπων ἔκ τʼ ἀθανάτων,
879	οὓς ἀποδείξω
880	λέκτρων προδότας ἀχαρίστους.
881	ὦ τᾶς ἑπταφθόγγου μέλπων
882	κιθάρας ἐνοπάν, ἅτʼ ἀγραύλοις
883	κέρασιν ἐν ἀψύχοις ἀχεῖ
884	μουσᾶν ὕμνους εὐαχήτους,
885	σοὶ μομφάν, ὦ Λατοῦς παῖ,
886	πρὸς τάνδʼ αὐγὰν αὐδάσω.
887	ἦλθές μοι χρυσῷ χαίταν
888	μαρμαίρων, εὖτʼ ἐς κόλπους
889	κρόκεα πέταλα φάρεσιν ἔδρεπον,
890	ἀνθίζειν χρυσανταυγῆ·
891	λευκοῖς δʼ ἐμφὺς καρποῖσιν
892	χειρῶν εἰς ἄντρου κοίτας
893	κραυγὰν Ὦ μᾶτέρ μʼ αὐδῶσαν
894	θεὸς ὁμευνέτας
895	ἆγες ἀναιδείᾳ
896	Κύπριδι χάριν πράσσων.
897	τίκτω δʼ ἁ δύστανός σοι
898	κοῦρον, τὸν φρίκᾳ ματρὸς
899	εἰς εὐνὰν βάλλω τὰν σάν,
900	ἵνα με λέχεσι μελέαν μελέοις
901	ἐζεύξω τὰν δύστανον.
902	οἴμοι μοι· καὶ νῦν ἔρρει
903	πτανοῖς ἁρπασθεὶς θοίνα
904	παῖς μοι καὶ σός, τλάμων·
905	σὺ δὲ κιθάρᾳ κλάζεις
906	παιᾶνας μέλπων.
907	ὠή,
907a	τὸν Λατοῦς αὐδῶ σʼ ,
908	ὅστʼ ὀμφὰν κληροῖς
909	πρὸς χρυσέους θάκους
910	καὶ γαίας μεσσήρεις ἕδρας,
911	εἰς οὖς αὐδὰν καρύξω·
912	Ἰὼ κακὸς εὐνάτωρ,
913	ὃς τῷ μὲν ἐμῷ νυμφεύτᾳ
914	χάριν οὐ προλαβὼν
915	παῖδʼ εἰς οἴκους οἰκίζεις·
916	ὁ δʼ ἐμὸς γενέτας καὶ σός γʼ, ἀμαθής,
917	οἰωνοῖς ἔρρει συλαθείς,
918	σπάργανα ματέρος ἐξαλλάξας.
919	μισεῖ σʼ ἁ Δᾶλος καὶ δάφνας
920	ἔρνεα φοίνικα παρʼ ἁβροκόμαν,
921	ἔνθα λοχεύματα σέμνʼ ἐλοχεύσατο
922	Λατὼ Δίοισί σε καρποῖς.
923	οἴμοι, μέγας θησαυρὸς ὡς ἀνοίγνυται
924	κακῶν, ἐφʼ οἷσι πᾶς ἂν ἐκβάλοι δάκρυ.
925	ὦ θύγατερ, οὔτοι σὸν βλέπων ἐμπίμπλαμαι
926	πρόσωπον, ἔξω δʼ ἐγενόμην γνώμης ἐμῆς.
927	κακῶν γὰρ ἄρτι κῦμʼ ὑπεξαντλῶν φρενί,
928	πρύμνηθεν αἴρει μʼ ἄλλο σῶν λόγων ὕπο,
929	οὓς ἐκβαλοῦσα τῶν παρεστώτων κακῶν
930	μετῆλθες ἄλλων πημάτων κακὰς ὁδούς.
931	τί φῄς; τίνα λόγον Λοξίου κατηγορεῖς;
932	ποῖον τεκεῖν φῂς παῖδα; ποῦ θεῖναι πόλεως
933	θηρσὶν φίλον τύμβευμʼ; ἄνελθέ μοι πάλιν.
934	αἰσχύνομαι μέν σʼ, ὦ γέρον, λέξω δʼ ὅμως.
935	ὡς συστενάζειν γʼ οἶδα γενναίως φίλοις.
936	ἄκουε τοίνυν· οἶσθα Κεκροπίας πέτρας
937	πρόσβορρον ἄντρον, ἃς Μακρὰς κικλήσκομεν;
938	οἶδʼ, ἔνθα Πανὸς ἄδυτα καὶ βωμοὶ πέλας.
939	ἐνταῦθʼ ἀγῶνα δεινὸν ἠγωνίσμεθα.
940	τίνʼ; ὡς ἀπαντᾷ δάκρυά μοι τοῖς σοῖς λόγοις.
941	Φοίβῳ ξυνῆψʼ ἄκουσα δύστηνον γάμον.
942	ὦ θύγατερ, ἆρʼ ἦν ταῦθʼ ἅ γʼ ᾐσθόμην ἐγώ;
943	οὐκ οἶδʼ· ἀληθῆ δʼ εἰ λέγεις φαίημεν ἄν.
944	νόσον κρυφαίαν ἡνίκʼ ἔστενες λάθρα;
945	τότʼ ἦν ἃ νῦν σοι φανερὰ σημαίνω κακά.
946	κᾆτʼ ἐξέκλεψας πῶς Ἀπόλλωνος γάμους;
947	ἔτεκον — ἀνάσχου ταῦτʼ ἐμοῦ κλύων, γέρον.
948	ποῦ; τίς λοχεύει σʼ; ἢ μόνη μοχθεῖς τάδε;
949	μόνη κατʼ ἄντρον οὗπερ ἐζεύχθην γάμοις.
950	ὁ παῖς δὲ ποῦ ʼστιν; ἵνα σὺ μηκέτʼ ᾖς ἄπαις.
951	τέθνηκεν, ὦ γεραιέ, θηρσὶν ἐκτεθείς.
952	τέθνηκʼ; Ἀπόλλων δʼ ὁ κακὸς οὐδὲν ἤρκεσεν;
953	οὐκ ἤρκεσʼ· Ἅιδου δʼ ἐν δόμοις παιδεύεται.
954	τίς γάρ νιν ἐξέθηκεν; οὐ γὰρ δὴ σύ γε.
955	ἡμεῖς, ἐν ὄρφνῃ σπαργανώσαντες πέπλοις.
956	οὐδὲ ξυνῄδει σοί τις ἔκθεσιν τέκνου;
957	αἱ ξυμφοραί γε καὶ τὸ λανθάνειν μόνον.
958	καὶ πῶς ἐν ἄντρῳ παῖδα σὸν λιπεῖν ἔτλης;
959	πῶς δʼ οἰκτρὰ πολλὰ στόματος ἐκβαλοῦσʼ ἔπη — 
960	φεῦ·
960a	τλήμων σὺ τόλμης, ὁ δὲ θεὸς μᾶλλον σέθεν.
961	εἰ παῖδά γʼ εἶδες χεῖρας ἐκτείνοντά μοι.
962	μαστὸν διώκοντʼ ἦ πρὸς ἀγκάλαις πεσεῖν;
963	ἐνταῦθʼ, ἵνʼ οὐκ ὢν ἄδικʼ ἔπασχεν ἐξ ἐμοῦ.
964	σοὶ δʼ ἐς τί δόξʼ ἐσῆλθεν ἐκβαλεῖν τέκνον;
965	ὡς τὸν θεὸν σῴζοντα τόν γʼ αὑτοῦ γόνον.
966	οἴμοι, δόμων σῶν ὄλβος ὡς χειμάζεται.
967	τί κρᾶτα κρύψας, ὦ γέρον, δακρυρροεῖς;
968	σὲ καὶ πατέρα σὸν δυστυχοῦντας εἰσορῶ.
969	τὰ θνητὰ τοιαῦτʼ· οὐδὲν ἐν ταὐτῷ μένει.
970	μή νυν ἔτʼ οἴκτων, θύγατερ, ἀντεχώμεθα.
971	τί γάρ με χρὴ δρᾶν; ἀπορία τὸ δυστυχεῖν.
972	τὸν πρῶτον ἀδικήσαντά σʼ ἀποτίνου θεόν.
973	καὶ πῶς τὰ κρείσσω θνητὸς οὖσʼ ὑπερδράμω;
974	πίμπρη τὰ σεμνὰ Λοξίου χρηστήρια.
975	δέδοικα· καὶ νῦν πημάτων ἄδην ἔχω.
976	τὰ δυνατά νυν τόλμησον, ἄνδρα σὸν κτανεῖν.
977	αἰδούμεθʼ εὐνὰς τὰς τόθʼ ἡνίκʼ ἐσθλὸς ἦν.
978	νῦν δʼ ἀλλὰ παῖδα τὸν ἐπὶ σοὶ πεφηνότα.
979	πῶς; εἰ γὰρ εἴη δυνατόν· ὡς θέλοιμί γʼ ἄν.
980	ξιφηφόρους σοὺς ὁπλίσασʼ ὀπάονας.
981	στείχοιμʼ ἄν· ἀλλὰ ποῦ γενήσεται τόδε;
982	ἱεραῖσιν ἐν σκηναῖσιν, οὗ θοινᾷ φίλους.
983	ἐπίσημον ὁ φόνος, καὶ τὸ δοῦλον ἀσθενές.
984	ὤμοι, κακίζῃ· φέρε, σὺ νῦν βούλευέ τι.
985	καὶ μὴν ἔχω γε δόλια καὶ δραστήρια.
986	ἀμφοῖν ἂν εἴην τοῖνδʼ ὑπηρέτης ἐγώ.
987	ἄκουε τοίνυν· οἶσθα γηγενῆ μάχην;
988	οἶδʼ, ἣν Φλέγρᾳ Γίγαντες ἔστησαν θεοῖς.
989	ἐνταῦθα Γοργόνʼ ἔτεκε Γῆ, δεινὸν τέρας.
990	ἦ παισὶν αὑτῆς σύμμαχον, θεῶν πόνον;
991	ναί· καί νιν ἔκτεινʼ ἡ Διὸς Παλλὰς θεά.
992	ποῖόν τι μορφῆς σχῆμʼ ἔχουσαν ἀγρίας;
993	θώρακʼ ἐχίδνης περιβόλοις ὡπλισμένον.
994	ἆρʼ οὗτός ἐσθʼ ὁ μῦθος ὃν κλύω πάλαι;
995	ταύτης Ἀθάναν δέρος ἐπὶ στέρνοις ἔχειν.
996	ἣν αἰγίδʼ ὀνομάζουσι, Παλλάδος στολήν;
997	τόδʼ ἔσχεν ὄνομα θεῶν ὅτʼ ᾖξεν ἐς δόρυ.
998	τί δῆτα, θύγατερ, τοῦτο σοῖς ἐχθροῖς βλάβος;
999	Ἐριχθόνιον οἶσθʼ, ἢ — ; τί δʼ οὐ μέλλεις, γέρον;
1000	ὃν πρῶτον ὑμῶν πρόγονον ἐξανῆκε γῆ;
1001	τούτῳ δίδωσι Παλλὰς ὄντι νεογόνῳ 
1002	τί χρῆμα; μέλλον γάρ τι προσφέρεις ἔπος.
1003	δισσοὺς σταλαγμοὺς αἵματος Γοργοῦς ἄπο.
1004	ἰσχὺν ἔχοντας τίνα πρὸς ἀνθρώπου φύσιν;
1005	τὸν μὲν θανάσιμον, τὸν δʼ ἀκεσφόρον νόσων.
1006	ἐν τῷ καθάψασʼ ἀμφὶ παιδὶ σώματος;
1007	χρυσοῖσι δεσμοῖς· ὁ δὲ δίδωσʼ ἐμῷ πατρί.
1008	κείνου δὲ κατθανόντος ἐς σὲ ἀφίκετο;
1009	ναί· κἀπὶ καρπῷ γʼ αὔτʼ ἐγὼ χερὸς φέρω.
1010	πῶς οὖν κέκρανται δίπτυχον δῶρον θεᾶς;
1011	κοίλης μὲν ὅστις φλεβὸς ἀπέσταξεν φόνῳ 
1012	τί τῷδε χρῆσθαι; δύνασιν ἐκφέρει τίνα;
1013	νόσους ἀπείργει καὶ τροφὰς ἔχει βίου.
1014	ὁ δεύτερος δʼ ἀριθμὸς ὧν λέγεις τί δρᾷ;
1015	κτείνει, δρακόντων ἰὸς ὢν τῶν Γοργόνος.
1016	ἐς ἓν δὲ κραθέντʼ αὐτὸν ἢ χωρὶς φορεῖς;
1017	χωρίς· κακῷ γὰρ ἐσθλὸν οὐ συμμείγνυται.
1018	ὦ φιλτάτη παῖ, πάντʼ ἔχεις ὅσων σε δεῖ.
1019	τούτῳ θανεῖται παῖς· σὺ δʼ ὁ κτείνων ἔσῃ.
1020	ποῦ καὶ τί δράσας; σὸν λέγειν, τολμᾶν δʼ ἐμόν.
1021	ἐν ταῖς Ἀθήναις, δῶμʼ ὅταν τοὐμὸν μόλῃ.
1022	οὐκ εὖ τόδʼ εἶπας· καὶ σὺ γὰρ τοὐμὸν ψέγεις.
1023	πῶς; ἆρʼ ὑπείδου τοῦθʼ ὃ κἄμʼ ἐσέρχεται;
1024	σὺ παῖδα δόξεις διολέσαι, κεἰ μὴ κτενεῖς.
1025	ὀρθῶς· φθονεῖν γάρ φασι μητρυιὰς τέκνοις.
1026	αὐτοῦ νυν αὐτὸν κτεῖνʼ, ἵνʼ ἀρνήσῃ φόνους.
1027	προλάζυμαι γοῦν τῷ χρόνῳ τῆς ἡδονῆς.
1028	καὶ σόν γε λήσεις πόσιν ἅ σε σπεύδει λαθεῖν.
1029	οἶσθʼ οὖν ὃ δρᾶσον; χειρὸς ἐξ ἐμῆς λαβὼν
1030	χρύσωμʼ Ἀθάνας τόδε, παλαιὸν ὄργανον,
1031	ἐλθὼν ἵνʼ ἡμῖν βουθυτεῖ λάθρα πόσις,
1032	δείπνων ὅταν λήγωσι καὶ σπονδὰς θεοῖς
1033	μέλλωσι λείβειν, ἐν πέπλοις ἔχων τόδε
1034	κάθες βαλὼν ἐς πῶμα τῷ νεανίᾳ 
1035	ἰδίᾳ δέ, μή τι πᾶσι, χωρίσας ποτὸν
1036	τῷ τῶν ἐμῶν μέλλοντι δεσπόζειν δόμων.
1037	κἄνπερ διέλθῃ λαιμόν, οὔποθʼ ἵξεται
1038	κλεινὰς Ἀθήνας, κατθανὼν δʼ αὐτοῦ μενεῖ.
1039	σὺ μέν νυν εἴσω προξένων μέθες πόδα·
1040	ἡμεῖς δʼ ἐφʼ ᾧ τετάγμεθʼ ἐκπονήσομεν.
1041	ἄγʼ, ὦ γεραιὲ πούς, νεανίας γενοῦ
1042	ἔργοισι, κεἰ μὴ τῷ χρόνῳ πάρεστί σοι.
1043	ἐχθρὸν δʼ ἐπʼ ἄνδρα στεῖχε δεσποτῶν μέτα,
1044	καὶ συμφόνευε καὶ συνεξαίρει δόμων.
1045	τὴν δʼ εὐσέβειαν εὐτυχοῦσι μὲν καλὸν
1046	τιμᾶν· ὅταν δὲ πολεμίους δρᾶσαι κακῶς
1047	θέλῃ τις, οὐδεὶς ἐμποδὼν κεῖται νόμος.
1048	Εἰνοδία θύγατερ Δάματρος, ἃ τῶν
1049	νυκτιπόλων ἐφόδων ἀνάσσεις
1050	καὶ μεθαμερίων, ὅδωσον
1051	δυσθανάτων κρατήρων πλη-
1052	ρώματʼ ἐφʼ οἷσι πέμπει
1053	πότνια πότνιʼ ἐμὰ χθονίας
1054	Γοργοῦς λαιμοτόμων ἀπὸ
1055	σταλαγμῶν
1056	τῷ τῶν Ἐρεχθεϊδᾶν
1057	δόμων ἐφαπτομένῳ·
1058	μηδέ ποτʼ ἄλλος ἄλλων ἀπʼ οἴ-
1059	κων πόλεως ἀνάσσοι
1060	πλὴν τῶν εὐγενετᾶν Ἐρεχθειδᾶν.
1061	εἰ δʼ ἀτελὴς θάνατος σπουδαί τε δεσποί-
1062	νας, ὅ τε καιρὸς ἄπεισι τόλμας,
1063	ᾇ νῦν ἐλπὶς ἐφαίνετʼ, ἢ θη-
1064	κτὸν ξίφος ἢ δαίμων ἐξά-
1065	ψει βρόχον ἀμφὶ δειρήν,
1066	πάθεσι πάθεα δʼ ἐξανύτουσʼ
1067	εἰς ἄλλας βιότου κάτει-
1068	σι μορφάς.
1069	οὐ γὰρ δόμων γʼ ἑτέρους
1070	ἄρχοντας ἀλλοδαποὺς
1071	ζῶσά ποτʼ ὄμμασι ἐν φαεν-
1072	ναῖς ἀνέχοιτʼ ἂν αὐγαῖς
1073	ἁ τῶν εὐπατριδᾶν γεγῶσʼ οἴκων.
1074	αἰσχύνομαι τὸν πολύυ-
1075	μνον θεόν, εἰ παρὰ καλλιχόροισι παγαῖς
1076	λαμπάδα θεωρὸν εἰκάδων
1077	ὄψεται ἐννύχιος ἄυπνος ὤν, ὅτε
1078	καὶ Διὸς ἀστερωπὸς
1079	ἀνεχόρευσεν αἰθήρ,
1080	χορεύει δὲ σελάνα
1081	καὶ πεντήκοντα κόραι
1082	Νηρέος, αἱ κατὰ πόντον
1083	ἀενάων τε ποταμῶν
1084	δίνας, χορευόμεναι
1085	τὰν χρυσοστέφανον κόραν
1086	καὶ ματέρα σεμνάν·
1087	ἵνʼ ἐλπίζει βασιλεύ-
1088	σειν ἄλλων πόνον ἐσπεσὼν
1089	ὁ Φοίβειος ἀλάτας.
1090	ὁρᾶθʼ ὅσοι δυσκελάδοι-
1091	σιν κατὰ μοῦσαν ἰόντες ἀείδεθʼ ὕμνοις
1092	ἁμέτερα λέχεα καὶ γάμους
1093	Κύπριδος ἀθέμιτας ἀνοσίους, ὅσον
1094	εὐσεβίᾳ κρατοῦμεν
1095	ἄδικον ἄροτον ἀνδρῶν.
1096	παλίμφαμος ἀοιδὰ
1097	καὶ μοῦσʼ εἰς ἄνδρας ἴτω
1098	δυσκέλαδος ἀμφὶ λέκτρων.
1099	δείκνυσι γὰρ ὁ Διὸς ἐκ
1100	παίδων ἀμνημοσύναν,
1101	οὐ κοινὰν τεκέων τύχαν
1102	οἴκοισι φυτεύσας
1103	δεσποίνᾳ· πρὸς δʼ Ἀφροδί-
1104	ταν ἄλλαν θέμενος χάριν
1105	νόθου παιδὸς ἔκυρσεν.
1106	κλειναὶ γυναῖκες, ποῦ κόρην Ἐρεχθέως,
1107	δέσποιναν εὕρω; πανταχῇ γὰρ ἄστεως
1108	ζητῶν νιν ἐξέπλησα κοὐκ ἔχω λαβεῖν.
1109	τί δʼ ἔστιν, ὦ ξύνδουλε; τίς προθυμία
1110	ποδῶν ἔχει σε, καὶ λόγους τίνας φέρεις;
1111	θηρώμεθʼ· ἀρχαὶ δʼ ἁπιχώριοι χθονὸς
1112	ζητοῦσιν αὐτήν, ὡς θάνῃ πετρουμένη.
1113	οἴμοι, τί λέξεις; οὔτι που λελήμμεθα
1114	κρυφαῖον ἐς παῖδʼ ἐκπορίζουσαι φόνον;
1115	ἔγνως; — μεθέξεις οὐκ ἐν ὑστάτοις κακοῦ.
