0	
1116	ὤφθη δὲ πῶς τὰ κρυπτὰ μηχανήματα;
1117	τὸ μὴ δίκαιον τῆς δίκης ἡσσώμενον
1118	ἐξηῦρεν ὁ θεός, οὐ μιανθῆναι θέλων.
1119	πῶς; ἀντιάζω σʼ ἱκέτις ἐξειπεῖν τάδε.
1120	πεπυσμέναι γάρ, εἰ θανεῖν ὅμως χρεών,
1121	ἥδιον ἂν θάνοιμεν, εἴθʼ ὁρᾶν φάος.
1122	ἐπεὶ θεοῦ μαντεῖον ᾤχετʼ ἐκλιπὼν
1123	πόσις Κρεούσης, παῖδα τὸν καινὸν λαβὼν
1124	πρὸς δεῖπνα θυσίας θʼ ἃς θεοῖς ὡπλίζετο,
1125	Ξοῦθος μὲν ᾤχετʼ ἔνθα πῦρ πηδᾷ θεοῦ
1126	βακχεῖον, ὡς σφαγαῖσι Διονύσου πέτρας
1127	δεύσειε δισσὰς παιδὸς ἀντʼ ὀπτηρίων,
1128	λέξας· Σὺ μὲν νῦν, τέκνον, ἀμφήρεις μένων
1129	σκηνὰς ἀνίστη τεκτόνων μοχθήμασι.
1130	θύσας δὲ Γενέταις Θεοῖσιν ἢν μακρὸν χρόνον
1131	μένω, παροῦσι δαῖτες ἔστωσαν φίλοις.
1132	λαβὼν δὲ μόσχους ᾤχεθʼ· ὁ δὲ νεανίας
1133	σεμνῶς ἀτοίχους περιβολὰς σκηνωμάτων
1134	ὀρθοστάταις ἱδρύεθʼ, ἡλίου βολὰς
1135	καλῶς φυλάξας, οὔτε πρὸς μέσας φλογὸς
1136	ἀκτῖνας, οὔτʼ αὖ πρὸς τελευτώσας βίον,
1137	πλέθρου σταθμήσας μῆκος εἰς εὐγωνίαν,
1138	μέτρημʼ ἔχουσαν τοὐν μέσῳ γε μυρίων
1139	ποδῶν ἀριθμόν, ὡς λέγουσιν οἱ σοφοί,
1140	ὡς πάντα Δελφῶν λαὸν ἐς θοίνην καλῶν.
1141	λαβὼν δʼ ὑφάσμαθʼ ἱερὰ θησαυρῶν πάρα
1142	κατεσκίαζε, θαύματʼ ἀνθρώποις ὁρᾶν.
1143	πρῶτον μὲν ὀρόφῳ πτέρυγα περιβάλλει πέπλων,
1144	ἀνάθημα Δίου παιδός, οὓς Ἡρακλέης
1145	Ἀμαζόνων σκυλεύματʼ ἤνεγκεν θεῷ.
1146	ἐνῆν δʼ ὑφανταὶ γράμμασιν τοιαίδʼ ὑφαί,
1147	Οὐρανὸς ἀθροίζων ἄστρʼ ἐν αἰθέρος κύκλῳ.
1148	ἵππους μὲν ἤλαυνʼ ἐς τελευταίαν φλόγα
1149	Ἥλιος, ἐφέλκων λαμπρὸν Ἑσπέρου φάος·
1150	μελάμπεπλος δὲ Νὺξ ἀσείρωτον ζυγοῖς
1151	ὄχημʼ ἔπαλλεν, ἄστρα δʼ ὡμάρτει θεᾷ·
1152	Πλειὰς μὲν ᾔει μεσοπόρου διʼ αἰθέρος
1153	ὅ τε ξιφήρης Ὠρίων, ὕπερθε δὲ
1154	Ἄρκτος στρέφουσʼ οὐραῖα χρυσήρη πόλῳ·
1155	κύκλος δὲ πανσέληνος ἠκόντιζʼ ἄνω
1156	μηνὸς διχήρης, Ὑάδες τε, ναυτίλοις
1157	σαφέστατον σημεῖον, ἥ τε φωσφόρος
1158	Ἕως διώκουσʼ ἄστρα. τοίχοισιν δʼ ἔπι
1159	ἤμπισχεν ἄλλα βαρβάρων ὑφάσματα·
1160	εὐηρέτμους ναῦς ἀντίας Ἑλληνίσιν,
1161	καὶ μιξόθηρας φῶτας, ἱππείας τʼ ἄγρας
1162	ἐλάφων, λεόντων τʼ ἀγρίων θηράματα.
1163	κατʼ εἰσόδους δὲ Κέκροπα θυγατέρων πέλας
1164	σπείραισιν εἱλίσσοντʼ, Ἀθηναίων τινὸς
1165	ἀνάθημα· χρυσέους τʼ ἐν μέσῳ συσσιτίῳ
1166	κρατῆρας ἔστησʼ. ἐν δʼ ἄκροισι βὰς ποσὶ
1167	κῆρυξ ἀνεῖπε τὸν θέλοντʼ ἐγχωρίων
1168	ἐς δαῖτα χωρεῖν. ὡς δʼ ἐπληρώθη στέγη,
1169	στεφάνοισι κοσμηθέντες εὐόχθου βορᾶς
1170	ψυχὴν ἐπλήρουν. ὡς δʼ ἀνεῖσαν ἡδονήν,
1171	 παρελθὼν πρέσβυς ἐς μέσον πέδον
1172	ἔστη, γέλων δʼ ἔθηκε συνδείπνοις πολύν,
1173	πρόθυμα πράσσων· ἔκ τε γὰρ κρωσσῶν ὕδωρ
1174	χεροῖν ἔπεμπε νίπτρα, κἀξεθυμία
1175	σμύρνης ἱδρῶτα, χρυσέων τʼ ἐκπωμάτων
1176	ἦρχʼ, αὐτὸς αὑτῷ τόνδε προστάξας πόνον.
1177	ἐπεὶ δʼ ἐς αὐλοὺς ἧκον ἐς κρατῆρά τε
1178	κοινόν, γέρων ἔλεξʼ· Ἀφαρπάζειν χρεὼν
1179	οἰνηρὰ τεύχη σμικρά, μεγάλα δʼ ἐσφέρειν,
1180	ὡς θᾶσσον ἔλθωσʼ οἵδʼ ἐς ἡδονὰς φρενῶν.
1181	ἦν δὴ φερόντων μόχθος ἀργυρηλάτους
1182	χρυσέας τε φιάλας· ὃ δὲ λαβὼν ἐξαίρετον,
1183	ὡς τῷ νέῳ δὴ δεσπότῃ χάριν φέρων,
1184	ἔδωκε πλῆρες τεῦχος, εἰς οἶνον βαλὼν
1185	ὅ φασι δοῦναι φάρμακον δραστήριον
1186	δέσποιναν, ὡς παῖς ὁ νέος ἐκλίποι φάος·
1187	κοὐδεὶς τάδʼ ᾔδειν. ἐν χεροῖν ἔχοντι δὲ
1188	σπονδὰς μετʼ ἄλλων παιδὶ τῷ πεφηνότι
1189	βλασφημίαν τις οἰκετῶν ἐφθέγξατο·
1190	ὁ δʼ, ὡς ἐν ἱερῷ μάντεσίν τʼ ἐσθλοῖς τραφείς,
1191	οἰωνὸν ἔθετο, κἀκέλευσʼ ἄλλον νέον
1192	κρατῆρα πληροῦν· τὰς δὲ πρὶν σπονδὰς θεοῦ
1193	δίδωσι γαίᾳ, πᾶσί τʼ ἐκσπένδειν λέγει.
1194	σιγὴ δʼ ὑπῆλθεν. ἐκ δʼ ἐπίμπλαμεν δρόσου
1195	κρατῆρας ἱεροὺς Βυβλίνου τε πώματος.
1196	κἀν τῷδε μόχθῳ πτηνὸς ἐσπίπτει δόμοις
1197	κῶμος πελειῶν — Λοξίου γὰρ ἐν δόμοις
1198	ἄτρεστα ναίουσʼ — ὡς δʼ ἀπέσπεισαν μέθυ,
1199	ἐς αὐτὸ χείλη πώματος κεχρημέναι
1200	καθῆκαν, εἷλκον δʼ εὐπτέρους ἐς αὐχένας.
1201	καὶ ταῖς μὲν ἄλλαις ἄνοσος ἦν λοιβὴ θεοῦ·
1202	ἣ δʼ ἕζετʼ ἔνθʼ ὁ καινὸς ἔσπεισεν γόνος,
1203	ποτοῦ τʼ ἐγεύσατʼ, εὐθὺς εὔπτερον δέμας
1204	ἔσεισε κἀβάκχευσεν, ἐκ δʼ ἔκλαγξʼ ὄπα
1205	ἀξύνετον αἰάζουσʼ· ἐθάμβησεν δὲ πᾶς
1206	θοινατόρων ὅμιλος ὄρνιθος πόνους.
1207	θνῄσκει δʼ ἀπασπαίρουσα, φοινικοσκελεῖς
1208	χηλὰς παρεῖσα. γυμνὰ δʼ ἐκ πέπλων μέλη
1209	ὑπὲρ τραπέζης ἧχʼ ὁ μαντευτὸς γόνος,
1210	βοᾷ δέ· Τίς μʼ ἔμελλεν ἀνθρώπων κτενεῖν;
1211	σήμαινε, πρέσβυ· σὴ γὰρ ἡ προθυμία,
1212	καὶ πῶμα χειρὸς σῆς ἐδεξάμην πάρα.
1213	εὐθὺς δʼ ἐρευνᾷ γραῖαν ὠλένην λαβών,
1214	ἐπʼ αὐτοφώρῳ πρέσβυν ὡς ἔχονθʼ ἕλοι.
1215	ὤφθη δὲ καὶ κατεῖπʼ ἀναγκασθεὶς μόγις
1216	τόλμας Κρεούσης πώματός τε μηχανάς.
1217	θεῖ δʼ εὐθὺς ἔξω συλλαβὼν θοινάτορας
1218	ὁ πυθόχρηστος Λοξίου νεανίας,
1219	κἀν κοιράνοισι Πυθικοῖς σταθεὶς λέγει·
1220	Ὦ Γαῖα σεμνή, τῆς Ἐρεχθέως ὕπο,
1221	ξένης γυναικός, φαρμάκοισι θνῄσκομεν.
1222	Δελφῶν δʼ ἄνακτες ὥρισαν πετρορριφῆ
1223	θανεῖν ἐμὴν δέσποιναν οὐ ψήφῳ μιᾷ,
1224	τὸν ἱερὸν ὡς κτείνουσαν ἔν τʼ ἀνακτόροις
1225	φόνον τιθεῖσαν. πᾶσα δὲ ζητεῖ πόλις
1226	τὴν ἀθλίως σπεύσασαν ἀθλίαν ὁδόν·
1227	παίδων γὰρ ἐλθοῦσʼ εἰς ἔρον Φοίβου πάρα,
1228	τὸ σῶμα κοινῇ τοῖς τέκνοις ἀπώλεσεν.
1229	οὐκ ἔστʼ οὐκ ἔστιν θανάτου
1230	παρατροπὰ μελέᾳ μοι·
1231	φανερὰ γὰρ φανερὰ τάδʼ ἤδη,
1232	σπονδᾶς ἐκ Διονύσου,
1233	βοτρύων θοᾶς ἐχίδνας
1234	σταγόσι μειγνυμένας φόνῳ 
1235	φανερὰ θύματα νερτέρων,
1236	συμφοραὶ μὲν ἐμῷ βίῳ,
1237	λεύσιμοι δὲ καταφθοραὶ δεσποίνᾳ.
1238	τίνα φυγὰν πτερόεσσαν ἢ
1239	χθονὸς ὑπὸ σκοτίων μυχῶν πορευθῶ,
1240	θανάτου λεύσιμον ἄταν
1241	ἀποφεύγουσα, τεθρίππων
1242	ὠκιστᾶν χαλᾶν ἐπιβᾶσʼ,
1243	ἢ πρύμνας ἐπὶ ναῶν;
1244	οὐκ ἔστι λαθεῖν, ὅτε μὴ χρῄζων
1245	θεὸς ἐκκλέπτει.
1246	τί ποτʼ, ὦ μελέα δέσποινα, μένει
1247	ψυχῇ σε παθεῖν; ἆρα θέλουσαι
1248	δρᾶσαί τι κακὸν τοὺς πέλας αὐταὶ
1249	πεισόμεθʼ, ὥσπερ τὸ δίκαιον;
1250	πρόσπολοι, διωκόμεσθα θανασίμους ἐπὶ σφαγάς,
1251	Πυθίᾳ ψήφῳ κρατηθεῖσʼ, ἔκδοτος δὲ γίγνομαι.
1252	ἴσμεν, ὦ τάλαινα, τὰς σὰς συμφοράς, ἵνʼ εἶ τύχης.
1253	ποῖ φύγω δῆτʼ; ἐκ γὰρ οἴκων προύλαβον μόγις πόδα
1254	μὴ θανεῖν, κλοπῇ δʼ ἀφῖγμαι διαφυγοῦσα πολεμίους.
1255	ποῖ δʼ ἂν ἄλλοσʼ ἢ ʼπὶ βωμόν;
1255b	καὶ τί μοι πλέον τόδε;
1256	ἱκέτιν οὐ θέμις φονεύειν.
1256b	τῷ νόμῳ δέ γʼ ὄλλυμαι.
1257	χειρία γʼ ἁλοῦσα.
1257b	καὶ μὴν οἵδʼ ἀγωνισταὶ πικροὶ
1258	δεῦρʼ ἐπείγονται ξιφήρεις.
1258b	ἵζε νυν πυρᾶς ἔπι.
1259	κἂν θάνῃς γὰρ ἐνθάδʼ οὖσα, τοῖς ἀποκτείνασί σε
1260	προστρόπαιον αἷμα θήσεις· οἰστέον δὲ τὴν τύχην.
1261	ὦ ταυρόμορφον ὄμμα Κηφισοῦ πατρός,
1262	οἵαν ἔχιδναν τήνδʼ ἔφυσας ἢ πυρὸς
1263	δράκοντʼ ἀναβλέποντα φοινίαν φλόγα,
1264	ᾗ τόλμα πᾶσʼ ἔνεστιν, οὐδʼ ἥσσων ἔφυ
1265	Γοργοῦς σταλαγμῶν, οἷς ἔμελλέ με κτενεῖν.
1266	λάζυσθʼ, ἵνʼ αὐτῆς τοὺς ἀκηράτους πλόκους
1267	κόμης καταξήνωσι Παρνασοῦ πλάκες,
1268	ὅθεν πετραῖον ἅλμα δισκηθήσεται.
1269	ἐσθλοῦ δʼ ἔκυρσα δαίμονος, πρὶν ἐς πόλιν
1270	μολεῖν Ἀθηνῶν χὑπὸ μητρυιὰν πεσεῖν.
1271	ἐν συμμάχοις γὰρ ἀνεμετρησάμην φρένας
1272	τὰς σάς, ὅσον μοι πῆμα δυσμενής τʼ ἔφυς·
1273	ἔσω γὰρ ἄν με περιβαλοῦσα δωμάτων
1274	ἄρδην ἂν ἐξέπεμψας εἰς Ἅιδου δόμους.
1275	ἀλλʼ οὔτε βωμὸς οὔτʼ Ἀπόλλωνος δόμος
1276	σώσει σʼ· ὁ δʼ οἶκτος ὁ σὸς ἐμοὶ κρείσσων πάρα
1277	καὶ μητρὶ τἠμῇ· καὶ γὰρ εἰ τὸ σῶμά μοι
1278	ἄπεστιν αὐτῆς, τοὔνομʼ οὐκ ἄπεστί πω.
1279	ἴδεσθε τὴν πανοῦργον, ἐκ τέχνης τέχνην
1280	οἵαν ἔπλεξε· βωμὸν ἔπτηξεν θεοῦ,
1281	ὡς οὐ δίκην δώσουσα τῶν εἰργασμένων.
1282	ἀπεννέπω σε μὴ κατακτείνειν ἐμὲ
1283	ὑπέρ τʼ ἐμαυτῆς τοῦ θεοῦ θʼ ἵνʼ ἕσταμεν.
1284	τί δʼ ἐστὶ Φοίβῳ σοί τε κοινὸν ἐν μέσῳ;
1285	ἱερὸν τὸ σῶμα τῷ θεῷ δίδωμʼ ἔχειν.
1286	κἄπειτʼ ἔκαινες φαρμάκοις τὸν τοῦ θεοῦ;
1287	ἀλλʼ οὐκέτʼ ἦσθα Λοξίου, πατρὸς δὲ σοῦ.
1288	ἀλλʼ ἐγενόμεσθα πατρός· οὐσίαν λέγω.
1289	οὐκοῦν τότʼ ἦσθα· νῦν δʼ ἐγώ, σὺ δʼ οὐκέτι.
1290	οὐκ εὐσεβεῖς γε· τἀμὰ δʼ εὐσεβῆ τότʼ ἦν.
1291	ἔκτεινά σʼ ὄντα πολέμιον δόμοις ἐμοῖς.
1292	οὔτοι σὺν ὅπλοις ἦλθον ἐς τὴν σὴν χθόνα.
1293	μάλιστα· κἀπίμπρης γʼ Ἐρεχθέως δόμους.
1294	ποίοισι πανοῖς ἢ πυρὸς ποίᾳ φλογί;
1295	ἔμελλες οἰκεῖν τἄμʼ, ἐμοῦ βίᾳ λαβών.
1296	πατρός γε γῆν διδόντος ἣν ἐκτήσατο.
1297	τοῖς Αἰόλου δὲ πῶς μετῆν τῶν Παλλάδος;
1298	ὅπλοισιν αὐτήν, οὐ λόγοις ἐρρύσατο.
1299	ἐπίκουρος οἰκήτωρ γʼ ἂν οὐκ εἴη χθονός.
1300	κἄπειτα τοῦ μέλλειν μʼ ἀπέκτεινες φόβῳ;
1301	ὡς μὴ θάνοιμί γʼ, εἰ σὺ μὴ μέλλων τύχοις.
1302	φθονεῖς ἄπαις οὖσʼ, εἰ πατὴρ ἐξηῦρέ με.
1303	σὺ τῶν ἀτέκνων δῆτʼ ἀναρπάσεις δόμους;
1304	ἡμῖν δέ γʼ ἀλλὰ πατρικῆς οὐκ ἦν μέρος;
1305	ὅσʼ ἀσπὶς ἔγχος θʼ· ἥδε σοι παμπησία.
1306	ἔκλειπε βωμὸν καὶ θεηλάτους ἕδρας.
1307	τὴν σὴν ὅπου σοι μητέρʼ ἐστὶ νουθέτει.
1308	σὺ δʼ οὐχ ὑφέξεις ζημίαν, κτείνουσʼ ἐμέ;
1309	ἤν γʼ ἐντὸς ἀδύτων τῶνδέ με σφάξαι θέλῃς.
1310	τίς ἡδονή σοι θεοῦ θανεῖν ἐν στέμμασι;
1311	λυπήσομέν τινʼ, ὧν λελυπήμεσθʼ ὕπο.
1312	φεῦ.
1312a	δεινόν γε, θνητοῖς τοὺς νόμους ὡς οὐ καλῶς
1313	ἔθηκεν ὁ θεὸς οὐδʼ ἀπὸ γνώμης σοφῆς·
1314	τοὺς μὲν γὰρ ἀδίκους βωμὸν οὐχ ἵζειν ἐχρῆν,
1315	ἀλλʼ ἐξελαύνειν· οὐδὲ γὰρ ψαύειν καλὸν
1316	θεῶν πονηρὰν χεῖρα· τοῖσι δʼ ἐνδίκοις — 
1317	ἱερὰ καθίζειν, ὅστις ἠδικεῖτʼ, ἐχρῆν·
1318	καὶ μὴ ʼπὶ ταὐτὸ τοῦτʼ ἰόντʼ ἔχειν ἴσον
1319	τόν τʼ ἐσθλὸν ὄντα τόν τε μὴ θεῶν πάρα.
1320	ἐπίσχες, ὦ παῖ· τρίποδα γὰρ χρηστήριον
1321	λιποῦσα θριγκοῦ τοῦδʼ ὑπερβάλλω πόδα
1322	Φοίβου προφῆτις, τρίποδος ἀρχαῖον νόμον
1323	σῴζουσα, πασῶν Δελφίδων ἐξαίρετος.
1324	χαῖρʼ, ὦ φίλη μοι μῆτερ, οὐ τεκοῦσά περ.
1325	ἀλλʼ οὖν λεγώμεθʼ· ἡ φάτις δʼ οὔ μοι πικρά.
1326	ἤκουσας ὥς μʼ ἔκτεινεν ἥδε μηχαναῖς;
1327	ἤκουσα· καὶ σὺ δʼ ὠμὸς ὢν ἁμαρτάνεις.
1328	οὐ χρή με τοὺς κτείνοντας ἀνταπολλύναι;
1329	προγονοῖς δάμαρτες δυσμενεῖς ἀεί ποτε.
1330	ἡμεῖς δὲ μητρυιαῖς γε πάσχοντες κακῶς.
1331	μὴ ταῦτα· λείπων ἱερὰ καὶ στείχων πάτραν 
1332	τί δή με δρᾶσαι νουθετούμενον χρεών;
1333	καθαρὸς Ἀθήνας ἔλθʼ ὑπʼ οἰωνῶν καλῶν.
1334	καθαρὸς ἅπας τοι πολεμίους ὃς ἂν κτάνῃ.
1335	μὴ σύ γε· παρʼ ἡμῶν δʼ ἔκλαβʼ οὓς ἔχω λόγους.
1336	λέγοις ἄν· εὔνους δʼ οὖσʼ ἐρεῖς ὅσʼ ἂν λέγῃς.
1337	ὁρᾷς τόδʼ ἄγγος χερὸς ὑπʼ ἀγκάλαις ἐμαῖς;
1338	ὁρῶ παλαιὰν ἀντίπηγʼ ἐν στέμμασιν.
1339	ἐν τῇδέ σʼ ἔλαβον νεόγονον βρέφος ποτέ.
1340	τί φῄς; ὁ μῦθος εἰσενήνεκται νέος.
1341	σιγῇ γὰρ εἶχον αὐτά· νῦν δὲ δείκνυμεν.
1342	πῶς οὖν ἔκρυπτες τόδε λαβοῦσʼ ἡμᾶς πάλαι;
1343	ὁ θεός σʼ ἐβούλετʼ ἐν δόμοις ἔχειν λάτριν.
1344	νῦν δʼ οὐχὶ χρῄζει; τῷ τόδε γνῶναί με χρή;
1345	πατέρα κατειπὼν τῆσδέ σʼ ἐκπέμπει χθονός.
1346	σὺ δʼ ἐκ κελευσμῶν ἢ πόθεν σῴζεις τάδε;
1347	ἐνθύμιόν μοι τότε τίθησι Λοξίας 
1348	τί χρῆμα δρᾶσαι; λέγε, πέραινε σοὺς λόγους.
1349	σῶσαι τόδʼ εὕρημʼ ἐς τὸν ὄντα νῦν χρόνον.
1350	ἔχει δέ μοι τί κέρδος ἢ τίνα βλάβην;
1351	ἐνθάδε κέκρυπται σπάργανʼ οἷς ἐνῆσθα σύ.
1352	μητρὸς τάδʼ ἡμῖν ἐκφέρεις ζητήματα;
1353	ἐπεί γʼ ὁ δαίμων βούλεται· πάροιθε δʼ οὔ.
1354	ὦ μακαρίων μοι φασμάτων ἥδʼ ἡμέρα.
1355	λαβών νυν αὐτὰ τὴν τεκοῦσαν ἐκπόνει.
1356	πᾶσάν γʼ ἐπελθὼν Ἀσιάδʼ Εὐρώπης θʼ ὅρους.
1357	γνώσῃ τάδʼ αὐτός. τοῦ θεοῦ δʼ ἕκατί σε
1358	ἔθρεψά τʼ, ὦ παῖ, καὶ τάδʼ ἀποδίδωμί σοι,
1359	ἃ κεῖνος ἀκέλευστόν μʼ ἐβουλήθη λαβεῖν
1360	σῶσαί θʼ· ὅτου δʼ ἐβούλεθʼ οὕνεκʼ, οὐκ ἔχω λέγειν .
1361	ᾔδει δὲ θνητῶν οὔτις ἀνθρώπων τάδε
1362	ἔχοντας ἡμᾶς, οὐδʼ ἵνʼ ἦν κεκρυμμένα.
1363	καὶ χαῖρʼ· ἴσον γάρ σʼ ὡς τεκοῦσʼ ἀσπάζομαι.
1364	ἄρξαι δʼ ὅθεν σὴν μητέρα ζητεῖν σε χρή·
1365	πρῶτον μὲν εἴ τις Δελφίδων τεκοῦσά σε
1366	ἐς τούσδε ναοὺς ἐξέθηκε παρθένος,
1367	ἔπειτα δʼ εἴ τις Ἑλλάς. — ἐξ ἡμῶν δʼ ἔχεις
1368	ἅπαντα Φοίβου θʼ, ὃς μετέσχε τῆς τύχης.
1369	φεῦ φεῦ· κατʼ ὄσσων ὡς ὑγρὸν βάλλω δάκρυ,
1370	ἐκεῖσε τὸν νοῦν δούς, ὅθʼ ἡ τεκοῦσά με
1371	κρυφαῖα νυμφευθεῖσʼ ἀπημπόλα λάθρα
1372	καὶ μαστὸν οὐκ ὑπέσχεν· ἀλλʼ ἀνώνυμος
1373	ἐν θεοῦ μελάθροις εἶχον οἰκέτην βίον.
1374	τὰ τοῦ θεοῦ μὲν χρηστά, τοῦ δὲ δαίμονος
1375	βαρέα· χρόνον γὰρ ὅν με χρῆν ἐν ἀγκάλαις
1376	μητρὸς τρυφῆσαι καί τι τερφθῆναι βίου,
1377	ἀπεστερήθην φιλτάτης μητρὸς τροφῆς.
1378	τλήμων δὲ χἡ τεκοῦσά μʼ· ὡς ταὐτὸν πάθος
1379	πέπονθε, παιδὸς ἀπολέσασα χαρμονάς.
1380	καὶ νῦν λαβὼν τήνδʼ ἀντίπηγʼ οἴσω θεῷ
1381	ἀνάθημʼ, ἵνʼ εὕρω μηδὲν ὧν οὐ βούλομαι.
1382	εἰ γάρ με δούλη τυγχάνει τεκοῦσά τις,
1383	εὑρεῖν κάκιον μητέρʼ ἢ σιγῶντʼ ἐᾶν.
1384	ὦ Φοῖβε, ναοῖς ἀνατίθημι τήνδε σοῖς 
1385	καίτοι τί πάσχω; τοῦ θεοῦ προθυμίᾳ
1386	πολεμῶ, τὰ μητρὸς σύμβολʼ ὃς σέσωκέ μοι.
1387	ἀνοικτέον τάδʼ ἐστὶ καὶ τολμητέον·
1388	τὰ γὰρ πεπρωμένʼ οὐχ ὑπερβαίην ποτʼ ἄν.
1389	ὦ στέμμαθʼ ἱερά, τί ποτέ μοι κεκεύθατε,
1390	καὶ σύνδεθʼ, οἷσι τἄμʼ ἐφρουρήθη φίλα;
1391	ἰδοὺ περίπτυγμʼ ἀντίπηγος εὐκύκλου
1392	ὡς οὐ γεγήρακʼ ἔκ τινος θεηλάτου,
1393	εὐρώς τʼ ἄπεστι πλεγμάτων· ὁ δʼ ἐν μέσῳ
1394	χρόνος πολὺς δὴ τοῖσδε θησαυρίσμασιν.
1395	τί δῆτα φάσμα τῶν ἀνελπίστων ὁρῶ;
1396	σίγα σύ· πολλὰ καὶ πάροιθεν οἶσθά μοι 
1397	οὐκ ἐν σιωπῇ τἀμά· μή με νουθέτει.
1398	ὁρῶ γὰρ ἄγγος οὗ ʼξέθηκʼ ἐγώ ποτε 
1399	σέ γʼ, ὦ τέκνον μοι, βρέφος ἔτʼ ὄντα νήπιον,
1400	Κέκροπος ἐς ἄντρα καὶ Μακρὰς πετρηρεφεῖς.
1401	λείψω δὲ βωμὸν τόνδε, κεἰ θανεῖν με χρή.
1402	λάζυσθε τήνδε· θεομανὴς γὰρ ἥλατο
1403	βωμοῦ λιποῦσα ξόανα· δεῖτε δʼ ὠλένας.
1404	σφάζοντες οὐ λήγοιτʼ ἄν· ὡς ἀνθέξομαι
1405	καὶ τῆσδε καὶ σοῦ τῶν τε σῶν κεκρυμμένων.
1406	τάδʼ οὐχὶ δεινά; ῥυσιάζομαι λόγῳ.
1407	οὔκ, ἀλλὰ σοῖς φίλοισιν εὑρίσκῃ φίλος.
1408	ἐγὼ φίλος σός; κᾆτά μʼ ἔκτεινες λάθρα;
1409	παῖς γʼ, εἰ τόδʼ ἐστὶ τοῖς τεκοῦσι φίλτατον.
1410	παῦσαι πλέκουσα. — λήψομαί σʼ ἐγὼ καλῶς.
1411	ἐς τοῦθʼ ἱκοίμην, τοῦδε τοξεύω, τέκνον.
1412	κενὸν τόδʼ ἄγγος ἢ στέγει πλήρωμά τι;
1413	σά γʼ ἔνδυθʼ, οἷσί σʼ ἐξέθηκʼ ἐγώ ποτε.
1414	καὶ τοὔνομʼ αὐτῶν ἐξερεῖς πρὶν εἰσιδεῖν;
1415	κἂν μὴ φράσω γε, κατθανεῖν ὑφίσταμαι.
1416	λέγʼ· ὡς ἔχει τι δεινὸν ἥ γε τόλμα σου.
1417	σκέψασθʼ· ὃ παῖς ποτʼ οὖσʼ ὕφασμʼ ὕφηνʼ ἐγὼ 
1418	ποῖόν τι; πολλὰ παρθένων ὑφάσματα.
1419	οὐ τέλεον, οἷον δʼ ἐκδίδαγμα κερκίδος.
1420	μορφὴν ἔχον τίνʼ; ὥς με μὴ ταύτῃ λάβῃς.
1421	Γοργὼ μὲν ἐν μέσοισιν ἠτρίοις πέπλων.
1422	ὦ Ζεῦ, τίς ἡμᾶς ἐκκυνηγετεῖ πότμος;
1423	κεκρασπέδωται δʼ ὄφεσιν αἰγίδος τρόπον.
1424	ἰδού·
1424a	τόδʼ ἔσθʼ ὕφασμα, θέσφαθʼ ὡς εὑρίσκομεν.
1425	ὦ χρόνιον ἱστῶν παρθένευμα τῶν ἐμῶν.
1426	ἔστιν τι πρὸς τῷδʼ, ἢ μόνῳ τῷδʼ εὐτυχεῖς;
1427	δράκοντες· ἀρχαῖόν τι παγχρύσῳ γένει
1428	δώρημʼ Ἀθάνας, ἣ τέκνʼ ἐντρέφειν λέγει 
1429	Ἐριχθονίου γε τοῦ πάλαι μιμήματα.
1430	τί δρᾶν, τί χρῆσθαι, φράζε μοι, χρυσώματι;
1431	δέραια παιδὶ νεογόνῳ φέρειν, τέκνον.
1432	ἔνεισιν οἵδε· τὸ δὲ τρίτον ποθῶ μαθεῖν.
1433	στέφανον ἐλαίας ἀμφέθηκά σοι τότε,
1434	ἣν πρῶτʼ Ἀθάνα σκόπελον εἰσηνέγκατο,
1435	ὅς, εἴπερ ἔστιν, οὔποτʼ ἐκλείπει χλόην,
1436	θάλλει δʼ, ἐλαίας ἐξ ἀκηράτου γεγώς.
1437	ὦ φιλτάτη μοι μῆτερ, ἄσμενός σʼ ἰδὼν
1438	πρὸς ἀσμένας πέπτωκα σὰς παρηίδας.
1439	ὦ τέκνον, ὦ φῶς μητρὶ κρεῖσσον ἡλίου — 
1440	συγγνώσεται γὰρ ὁ θεός — ἐν χεροῖν σʼ ἔχω,
1441	ἄελπτον εὕρημʼ, ὃν κατὰ γᾶς ἐνέρων
1442	χθόνιον μετὰ Περσεφόνας τʼ ἐδόκουν ναίειν.
1443	ἀλλʼ, ὦ φίλη μοι μῆτερ, ἐν χεροῖν σέθεν
1444	ὁ κατθανών τε κοὐ θανὼν φαντάζομαι.
1445	ἰὼ ἰώ, λαμπρᾶς αἰθέρος ἀμπτυχαί,
1446	τίνʼ αὐδὰν ἀύσω,
1447	βοάσω; πόθεν μοι
1448	συνέκυρσʼ ἀδόκητος ἡδονά; πόθεν
1449	ἐλάβομεν χαράν;
1450	ἐμοὶ γενέσθαι πάντα μᾶλλον ἄν ποτε,
