0	
1	Ἄτλας, ὁ χαλκέοισι νώτοις οὐρανὸν
2	θεῶν παλαιὸν οἶκον ἐκτρίβων, θεῶν
3	μιᾶς ἔφυσε Μαῖαν, ἣ ʼμʼ ἐγείνατο
4	Ἑρμῆν μεγίστῳ Ζηνί, δαιμόνων λάτριν.
5	ἥκω δὲ Δελφῶν τήνδε γῆν, ἵνʼ ὀμφαλὸν
6	μέσον καθίζων Φοῖβος ὑμνῳδεῖ βροτοῖς
7	τά τʼ ὄντα καὶ μέλλοντα θεσπίζων ἀεί.
8	ἔστιν γὰρ οὐκ ἄσημος Ἑλλήνων πόλις,
9	τῆς χρυσολόγχου Παλλάδος κεκλημένη,
10	οὗ παῖδʼ Ἐρεχθέως Φοῖβος ἔζευξεν γάμοις
11	βίᾳ Κρέουσαν, ἔνθα προσβόρρους πέτρας
12	Παλλάδος ὑπʼ ὄχθῳ τῆς Ἀθηναίων χθονὸς
13	Μακρὰς καλοῦσι γῆς ἄνακτες Ἀτθίδος.
14	ἀγνὼς δὲ πατρί — τῷ θεῷ γὰρ ἦν φίλον — 
15	γαστρὸς διήνεγκʼ ὄγκον. ὡς δʼ ἦλθεν χρόνος,
16	τεκοῦσʼ ἐν οἴκοις παῖδʼ ἀπήνεγκεν βρέφος
17	ἐς ταὐτὸν ἄντρον οὗπερ ηὐνάσθη θεῷ
18	Κρέουσα, κἀκτίθησιν ὡς θανούμενον
19	κοίλης ἐν ἀντίπηγος εὐτρόχῳ κύκλῳ,
20	προγόνων νόμον σῴζουσα τοῦ τε γηγενοῦς
21	Ἐριχθονίου. κείνῳ γὰρ ἡ Διὸς κόρη
22	φρουρὼ παραζεύξασα φύλακε σώματος
23	δισσὼ δράκοντε, παρθένοις Ἀγλαυρίσι
24	δίδωσι σῴζειν· ὅθεν Ἐρεχθείδαις ἐκεῖ
25	νόμος τις ἔστιν ὄφεσιν ἐν χρυσηλάτοις
26	τρέφειν τέκνα. ἀλλʼ ἣν εἶχε παρθένος χλιδὴν
27	τέκνῳ προσάψασʼ ἔλιπεν ὡς θανουμένῳ.
28	κἄμʼ ὢν ἀδελφὸς Φοῖβος αἰτεῖται τάδε·
29	ὦ σύγγονʼ, ἐλθὼν λαὸν εἰς αὐτόχθονα
30	κλεινῶν Ἀθηνῶν — οἶσθα γὰρ θεᾶς πόλιν — 
31	λαβὼν βρέφος νεογνὸν ἐκ κοίλης πέτρας
32	αὐτῷ σὺν ἄγγει σπαργάνοισί θʼ οἷς ἔχει
33	ἔνεγκε Δελφῶν τἀμὰ πρὸς χρηστήρια,
34	καὶ θὲς πρὸς αὐταῖς εἰσόδοις δόμων ἐμῶν.
35	τὰ δʼ ἄλλʼ — ἐμὸς γάρ ἐστιν, ὡς εἰδῇς, ὁ παῖς — 
36	ἡμῖν μελήσει. Λοξίᾳ δʼ ἐγὼ χάριν
37	πράσσων ἀδελφῷ πλεκτὸν ἐξάρας κύτος
38	ἤνεγκα, καὶ τὸν παῖδα κρηπίδων ἔπι
39	τίθημι ναοῦ τοῦδʼ, ἀναπτύξας κύτος
40	ἑλικτὸν ἀντίπηγος, ὡς ὁρῷθʼ ὁ παῖς.
41	κυρεῖ δʼ ἅμʼ ἱππεύοντος ἡλίου κύκλῳ
42	προφῆτις ἐσβαίνουσα μαντεῖον θεοῦ·
43	ὄψιν δὲ προσβαλοῦσα παιδὶ νηπίῳ
44	ἐθαύμασʼ εἴ τις Δελφίδων τλαίη κόρη
45	λαθραῖον ὠδῖνʼ ἐς θεοῦ ῥῖψαι δόμον,
46	ὑπέρ τε θυμέλας διορίσαι πρόθυμος ἦν·
47	οἴκτῳ δʼ ἀφῆκεν ὠμότητα — καὶ θεὸς
48	συνεργὸς ἦν τῷ παιδὶ μὴ ʼκπεσεῖν δόμων — 
49	τρέφει δέ νιν λαβοῦσα. τὸν σπείραντα δὲ
50	οὐκ οἶδε Φοῖβον οὐδὲ μητέρʼ ἧς ἔφυ,
51	ὁ παῖς τε τοὺς τεκόντας οὐκ ἐπίσταται.
52	νέος μὲν οὖν ὢν ἀμφὶ βωμίους τροφὰς
53	ἠλᾶτʼ ἀθύρων· ὡς δʼ ἀπηνδρώθη δέμας,
54	Δελφοί σφʼ ἔθεντο χρυσοφύλακα τοῦ θεοῦ
55	ταμίαν τε πάντων πιστόν, ἐν δʼ ἀνακτόροις
56	θεοῦ καταζῇ δεῦρʼ ἀεὶ σεμνὸν βίον.
57	Κρέουσα δʼ ἡ τεκοῦσα τὸν νεανίαν
58	Ξούθῳ γαμεῖται συμφορᾶς τοιᾶσδʼ ὕπο·
59	ἦν ταῖς Ἀθήναις τοῖς τε Χαλκωδοντίδαις,
60	οἳ γῆν ἔχουσʼ Εὐβοῖδα, πολέμιος κλύδων·
61	ὃν συμπονήσας καὶ συνεξελὼν δορὶ
62	γάμων Κρεούσης ἀξίωμʼ ἐδέξατο,
63	οὐκ ἐγγενὴς ὤν, Αἰόλου δὲ τοῦ Διὸς
64	γεγὼς Ἀχαιός. χρόνια δὲ σπείρας λέχη
65	ἄτεκνός ἐστι, καὶ Κρέουσʼ· ὧν οὕνεκα
66	ἥκουσι πρὸς μαντεῖʼ Ἀπόλλωνος τάδε
67	ἔρωτι παίδων. Λοξίας δὲ τὴν τύχην
68	ἐς τοῦτʼ ἐλαύνει, κοὐ λέληθεν, ὡς δοκεῖ.
69	δώσει γὰρ εἰσελθόντι μαντεῖον τόδε
70	Ξούθῳ τὸν αὑτοῦ παῖδα, καὶ πεφυκέναι
71	κείνου σφε φήσει, μητρὸς ὡς ἐλθὼν δόμους
72	γνωσθῇ Κρεούσῃ, καὶ γάμοι τε Λοξίου
73	κρυπτοὶ γένωνται παῖς τʼ ἔχῃ τὰ πρόσφορα.
74	Ἴωνα δʼ αὐτόν, κτίστορʼ Ἀσιάδος χθονός,
75	ὄνομα κεκλῆσθαι θήσεται καθʼ Ἑλλάδα.
76	ἀλλʼ ἐς δαφνώδη γύαλα βήσομαι τάδε,
77	τὸ κρανθὲν ὡς ἂν ἐκμάθω παιδὸς πέρι.
78	ὁρῶ γὰρ ἐκβαίνοντα Λοξίου γόνον
79	τόνδʼ, ὡς πρὸ ναοῦ λαμπρὰ θῇ πυλώματα
80	δάφνης κλάδοισιν. ὄνομα δʼ, οὗ μέλλει τυχεῖν,
81	Ἴωνʼ ἐγώ νιν πρῶτος ὀνομάζω θεῶν.
82	ἅρματα μὲν τάδε λαμπρὰ τεθρίππων
83	Ἥλιος ἤδη λάμπει κατὰ γῆν,
84	ἄστρα δὲ φεύγει πυρὶ τῷδʼ αἰθέρος
85	ἐς νύχθʼ ἱεράν·
86	Παρνησιάδες δʼ ἄβατοι κορυφαὶ
87	καταλαμπόμεναι τὴν ἡμερίαν
88	ἁψῖδα βροτοῖσι δέχονται.
89	σμύρνης δʼ ἀνύδρου καπνὸς εἰς ὀρόφους
90	Φοίβου πέταται.
91	θάσσει δὲ γυνὴ τρίποδα ζάθεον
92	Δελφίς, ἀείδουσʼ Ἕλλησι βοάς,
93	ἃς ἂν Ἀπόλλων κελαδήσῃ.
94	ἀλλʼ, ὦ Φοίβου Δελφοὶ θέραπες,
95	τὰς Κασταλίας ἀργυροειδεῖς
96	βαίνετε δίνας, καθαραῖς δὲ δρόσοις
97	ἀφυδρανάμενοι στείχετε ναούς·
98	στόμα τʼ εὔφημον φρουρεῖν ἀγαθόν,
99	φήμας τʼ ἀγαθὰς
100	τοῖς ἐθέλουσιν μαντεύεσθαι
101	γλώσσης ἰδίας ἀποφαίνειν.
102	ἡμεῖς δέ, πόνους οὓς ἐκ παιδὸς
103	μοχθοῦμεν ἀεί, πτόρθοισι δάφνης
104	στέφεσίν θʼ ἱεροῖς ἐσόδους Φοίβου
105	καθαρὰς θήσομεν, ὑγραῖς τε πέδον
106	ῥανίσιν νοτερόν· πτηνῶν τʼ ἀγέλας,
107	αἳ βλάπτουσιν σέμνʼ ἀναθήματα,
108	τόξοισιν ἐμοῖς φυγάδας θήσομεν·
109	ὡς γὰρ ἀμήτωρ ἀπάτωρ τε γεγὼς
110	τοὺς θρέψαντας
111	Φοίβου ναοὺς θεραπεύω.
112	ἄγʼ, ὦ νεηθαλὲς ὦ
113	καλλίστας προπόλευμα δά-
114	φνας, ἃ τὰν Φοίβου θυμέλαν
115	σαίρεις ὑπὸ ναοῖς,
116	κήπων ἐξ ἀθανάτων,
117	ἵνα δρόσοι τέγγουσʼ ἱεραί,
118	ῥοὰν ἀέναον
119	παγᾶν ἐκπροϊεῖσαι,
120	μυρσίνας ἱερὰν φόβαν·
121	ᾇ σαίρω δάπεδον θεοῦ
122	παναμέριος ἅμʼ ἁλίου
123	πτέρυγι θοᾷ
124	λατρεύων τὸ κατʼ ἦμαρ.
125	ὦ Παιὰν ὦ Παιάν,
126	εὐαίων εὐαίων
127	εἴης, ὦ Λατοῦς παῖ.
128	καλόν γε τὸν πόνον, ὦ
129	Φοῖβε, σοὶ πρὸ δόμων λατρεύ-
130	ω τιμῶν μαντεῖον ἕδραν·
131	κλεινὸς δʼ ὁ πόνος μοι
132	θεοῖσιν δούλαν χέρʼ ἔχειν
133	οὐ θνατοῖς, ἀλλʼ ἀθανάτοις·
134	εὐφάμους δὲ πόνους
135	μοχθεῖν οὐκ ἀποκάμνω.
136	Φοῖβός μοι γενέτωρ πατήρ·
137	τὸν βόσκοντα γὰρ εὐλογῶ,
138	τὸ δʼ ὠφέλιμον ἐμοὶ πατέρος
139	ὄνομα λέγω
140	Φοίβου τοῦ κατὰ ναόν.
141	ὦ Παιὰν ὦ Παιάν,
142	εὐαίων εὐαίων
143	εἴης, ὦ Λατοῦς παῖ.
144	ἀλλʼ ἐκπαύσω γὰρ μόχθους
145	δάφνας ὁλκοῖς,
146	χρυσέων δʼ ἐκ τευχέων ῥίψω
147	Γαίας παγάν,
148	ἃν ἀποχεύονται
149	Κασταλίας δῖναι,
149a	νοτερὸν ὕδωρ βάλλων,
150	ὅσιος ἀπʼ εὐνᾶς ὤν.
151	εἴθʼ οὕτως αἰεὶ Φοίβῳ
152	λατρεύων μὴ παυσαίμαν,
153	ἢ παυσαίμαν ἀγαθᾷ μοίρᾳ.
154	ἔα ἔα·
154a	φοιτῶσʼ ἤδη λείπουσίν τε
155	πτανοὶ Παρνασοῦ κοίτας·
156	αὐδῶ μὴ χρίμπτειν θριγκοῖς
157	μηδʼ ἐς χρυσήρεις οἴκους — 
158	μάρψω σʼ αὖ τόξοις, ὦ Ζηνὸς
159	κῆρυξ, ὀρνίθων γαμφηλαῖς
160	ἰσχὺν νικῶν.
161	ὅδε πρὸς θυμέλας ἄλλος ἐρέσσει
162	κύκνος. οὐκ ἄλλᾳ
163	φοινικοφαῆ πόδα κινήσεις;
164	οὐδέν σʼ ἁ φόρμιγξ ἁ Φοίβου
165	σύμμολπος τόξων ῥύσαιτʼ ἄν.
166	πάραγε πτέρυγας·
167	λίμνας ἐπίβα τᾶς Δηλιάδος·
168	αἱμάξεις, εἰ μὴ πείσῃ,
169	τὰς καλλιφθόγγους ᾠδάς.
170	ἔα ἔα·
170a	τίς ὅδʼ ὀρνίθων καινὸς προσέβα;
171	μῶν ὑπὸ θριγκοὺς εὐναίας
172	καρφυρὰς θήσων τέκνοις;
173	ψαλμοί σʼ εἴρξουσιν τόξων.
174	οὐ πείσῃ; χωρῶν δίναις
175	ταῖς Ἀλφειοῦ παιδούργει,
176	ἢ νάπος Ἴσθμιον,
177	ὡς ἀναθήματα μὴ βλάπτηται
178	ναοί θʼ οἱ Φοίβου 
179	κτείνειν δʼ ὑμᾶς αἰδοῦμαι
180	τοὺς θεῶν ἀγγέλλοντας φήμας
181	θνατοῖς· οἷς δʼ ἔγκειμαι μόχθοις,
182	Φοίβῳ δουλεύσω, κοὐ λήξω
183	τοὺς βόσκοντας θεραπεύων.
184	— οὐκ ἐν ταῖς ζαθέαις Ἀθά-
185	ναις εὐκίονες ἦσαν αὐ-
186	λαὶ θεῶν μόνον, οὐδʼ ἀγυι-
186a	άτιδες θεραπεῖαι·
187	ἀλλὰ καὶ παρὰ Λοξίᾳ
188	τῷ Λατοῦς διδύμων προσώ-
189	πων καλλιβλέφαρον φῶς.
190	— ἰδοὺ τάνδʼ, ἄθρησον,
191	Λερναῖον ὕδραν ἐναίρει
192	χρυσέαις ἅρπαις ὁ Διὸς παῖς·
193	φίλα, πρόσιδʼ ὄσσοις.
194	— ὁρῶ. καὶ πέλας ἄλλος αὐ-
195	τοῦ πανὸν πυρίφλεκτον αἴ-
196	ρει τις — ἆρʼ ὃς ἐμαῖσι μυ-
197	θεύεται παρὰ πήναις,
198	ἀσπιστὰς Ἰόλαος, ὃς
199	κοινοὺς αἰρόμενος πόνους
200	Δίῳ παιδὶ συναντλεῖ;
201	— καὶ μὰν τόνδʼ ἄθρησον
202	πτεροῦντος ἔφεδρον ἵππου·
203	τὰν πῦρ πνέουσαν ἐναίρει
204	τρισώματον ἀλκάν.
205	— πάντᾳ τοι βλέφαρον διώ-
206	κω. σκέψαι κλόνον ἐν τείχεσ-
207	σι λαΐνοισι Γιγάντων.
208	— ὦ φίλαι, ὧδε δερκόμεσθα.
209	— λεύσσεις οὖν ἐπʼ Ἐγκελάδῳ
210	γοργωπὸν πάλλουσαν ἴτυν — 
211	— λεύσσω Παλλάδʼ, ἐμὰν θεόν.
212	— τί γάρ; κεραυνὸν ἀμφίπυρον
213	ὄβριμον ἐν Διὸς
214	ἑκηβόλοισι χερσίν;
215	— ὁρῶ· τὸν δάϊον
216	Μίμαντα πυρὶ καταιθαλοῖ.
217	— καὶ Βρόμιος ἄλλον ἀπολέμοι-
217a	σι κισσίνοισι βάκτροις
218	ἐναίρει Γᾶς τέκνων ὁ Βακχεύς.
219	σέ τοι, τὸν παρὰ ναὸν αὐ-
220	δῶ· θέμις γυάλων ὑπερ-
221	βῆναι, λευκῷ ποδί γʼ — ;
222	οὐ θέμις, ὦ ξέναι.
222a	οὐδʼ ἂν
223	ἐκ σέθεν ἂν πυθοίμεθʼ αὐδάν;
223a	τίνα τήνδε θέλεις;
223b	ἆρʼ ὄντως μέσον ὀμφαλὸν
224	γᾶς Φοίβου κατέχει δόμος;
224a	στέμμασί γʼ ἐνδυτόν, ἀμφὶ δὲ Γοργόνες.
225	οὕτω καὶ φάτις αὐδᾷ.
226	εἰ μὲν ἐθύσατε πέλανον πρὸ δόμων
227	καί τι πυθέσθαι χρῄζετε Φοίβου,
228	πάριτʼ ἐς θυμέλας· ἐπὶ δʼ ἀσφάκτοις
229	μήλοισι δόμων μὴ πάριτʼ ἐς μυχόν.
230	ἔχω μαθοῦσα· θεοῦ δὲ νόμον
231	οὐ παραβαίνομεν,
232	ἃ δʼ ἐκτός, ὄμμα τέρψει.
233	πάντα θεᾶσθʼ, ὅ τι καὶ θέμις, ὄμμασι.
233a	μεθεῖσαν δεσπόται
234	με θεοῦ γύαλα τάδʼ εἰσιδεῖν.
234a	δμῳαὶ δὲ τίνων κλῄζεσθε δόμων;
235	Παλλάδι σύνοικα τρόφιμα μέλα-
235a	θρα τῶν ἐμῶν τυράννων·
236	παρούσας δʼ ἀμφὶ τᾶσδʼ ἐρωτᾷς.
237	γενναιότης σοι, καὶ τρόπων τεκμήριον
238	τὸ σχῆμʼ ἔχεις τόδʼ, ἥτις εἶ ποτʼ, ὦ γύναι.
239	γνοίη δʼ ἂν ὡς τὰ πολλά γʼ ἀνθρώπου πέρι
240	τὸ σχῆμʼ ἰδών τις εἰ πέφυκεν εὐγενής.
240a	ἔα·
241	ἀλλʼ ἐξέπληξάς μʼ, ὄμμα συγκλῄσασα σὸν
242	δακρύοις θʼ ὑγράνασʼ εὐγενῆ παρηίδα,
243	ὡς εἶδες ἁγνὰ Λοξίου χρηστήρια.
244	τί ποτε μερίμνης ἐς τόδʼ ἦλθες, ὦ γύναι;
245	ὃ πάντες ἄλλοι γύαλα λεύσσοντες θεοῦ
246	χαίρουσιν, ἐνταῦθʼ ὄμμα σὸν δακρυρροεῖ;
247	ὦ ξένε, τὸ μὲν σὸν οὐκ ἀπαιδεύτως ἔχει
248	ἐς θαύματʼ ἐλθεῖν δακρύων ἐμῶν πέρι·
249	ἐγὼ δʼ ἰδοῦσα τούσδʼ Ἀπόλλωνος δόμους
250	μνήμην παλαιὰν ἀνεμετρησάμην τινά·
251	οἴκοι δὲ τὸν νοῦν ἔσχον ἐνθάδʼ οὖσά που.
252	ὦ τλήμονες γυναῖκες· ὦ τολμήματα
253	θεῶν. τί δῆτα; ποῖ δίκην ἀνοίσομεν,
254	εἰ τῶν κρατούντων ἀδικίαις ὀλούμεθα;
255	τί χρῆμʼ ἀνερμήνευτα δυσθυμῇ, γύναι;
256	οὐδέν· μεθῆκα τόξα· τἀπὶ τῷδε δὲ
257	ἐγώ τε σιγῶ, καὶ σὺ μὴ φρόντιζʼ ἔτι.
258	τίς δʼ εἶ; πόθεν γῆς ἦλθες; ἐκ ποίας πάτρας
259	πέφυκας; ὄνομα τί σε καλεῖν ἡμᾶς χρεών;
260	Κρέουσα μέν μοι τοὔνομʼ, ἐκ δʼ Ἐρεχθέως
261	πέφυκα, πατρὶς γῆ δʼ Ἀθηναίων πόλις.
262	ὦ κλεινὸν οἰκοῦσʼ ἄστυ γενναίων τʼ ἄπο
263	τραφεῖσα πατέρων, ὥς σε θαυμάζω, γύναι.
264	τοσαῦτα κεὐτυχοῦμεν, ὦ ξένʼ, οὐ πέρα.
265	πρὸς θεῶν ἀληθῶς, ὡς μεμύθευται βροτοῖς ;
266	τί χρῆμʼ ἐρωτᾷς, ὦ ξένʼ, ἐκμαθεῖν θέλων;
267	ἐκ γῆς πατρός σου πρόγονος ἔβλαστεν πατήρ;
268	Ἐριχθόνιός γε· τὸ δὲ γένος μʼ οὐκ ὠφελεῖ.
269	ἦ καί σφʼ Ἀθάνα γῆθεν ἐξανείλετο;
270	ἐς παρθένους γε χεῖρας, οὐ τεκοῦσά νιν.
271	δίδωσι δʼ, ὥσπερ ἐν γραφῇ νομίζεται ;
272	Κέκροπός γε σῴζειν παισὶν οὐχ ὁρώμενον.
273	ἤκουσα λῦσαι παρθένους τεῦχος θεᾶς.
274	τοιγὰρ θανοῦσαι σκόπελον ᾕμαξαν πέτρας.
275	εἶἑν·
275a	τί δαὶ τόδʼ; ἆρʼ ἀληθὲς ἢ μάτην λόγος 
276	τί χρῆμʼ ἐρωτᾷς; καὶ γὰρ οὐ κάμνω σχολῇ.
277	πατὴρ Ἐρεχθεὺς σὰς ἔθυσε συγγόνους;
278	ἔτλη πρὸ γαίας σφάγια παρθένους κτανεῖν.
279	σὺ δʼ ἐξεσώθης πῶς κασιγνήτων μόνη;
280	βρέφος νεογνὸν μητρὸς ἦν ἐν ἀγκάλαις.
281	πατέρα δʼ ἀληθῶς χάσμα σὸν κρύπτει χθονός;
282	πληγαὶ τριαίνης ποντίου σφʼ ἀπώλεσαν.
283	Μακραὶ δὲ χῶρός ἐστʼ ἐκεῖ κεκλημένος;
284	τί δʼ ἱστορεῖς τόδʼ; ὥς μʼ ἀνέμνησάς τινος.
285	τιμᾷ σφε Πύθιος ἀστραπαί τε Πύθιαι.
286	τιμᾶ τιμᾶ · ὡς μήποτʼ ὤφελόν σφʼ ἰδεῖν.
287	τί δὲ στυγεῖς σὺ τοῦ θεοῦ τὰ φίλτατα;
288	οὐδέν· ξύνοιδʼ ἄντροισιν αἰσχύνην τινά.
289	πόσις δὲ τίς σʼ ἔγημʼ Ἀθηναίων, γύναι;
290	οὐκ ἀστός, ἀλλʼ ἐπακτὸς ἐξ ἄλλης χθονός.
291	τίς; εὐγενῆ νιν δεῖ πεφυκέναι τινά.
292	Ξοῦθος, πεφυκὼς Αἰόλου Διός τʼ ἄπο.
293	καὶ πῶς ξένος σʼ ὢν ἔσχεν οὖσαν ἐγγενῆ;
294	Εὔβοιʼ Ἀθήναις ἔστι τις γείτων πόλις 
295	ὅροις ὑγροῖσιν, ὡς λέγουσʼ, ὡρισμένη.
296	ταύτην ἔπερσε Κεκροπίδαις κοινῷ δορί.
297	ἐπίκουρος ἐλθών; κᾆτα σὸν γαμεῖ λέχος;
298	φερνάς γε πολέμου καὶ δορὸς λαβὼν γέρας.
299	σὺν ἀνδρὶ δʼ ἥκεις ἢ μόνη χρηστήρια;
300	σὺν ἀνδρί. σηκοὺς δʼ ἐκστρέφει Τροφωνίου.
301	πότερα θεατὴς ἢ χάριν μαντευμάτων;
302	κείνου τε Φοίβου θʼ ἓν θέλων μαθεῖν ἔπος.
303	καρποῦ δʼ ὕπερ γῆς ἥκετʼ, ἢ παίδων πέρι;
304	ἄπαιδές ἐσμεν, χρόνιʼ ἔχοντʼ εὐνήματα.
305	οὐδʼ ἔτεκες οὐδὲν πώποτʼ, ἀλλʼ ἄτεκνος εἶ;
306	ὁ Φοῖβος οἶδε τὴν ἐμὴν ἀπαιδίαν.
307	ὦ τλῆμον, ὡς τἄλλʼ εὐτυχοῦσʼ οὐκ εὐτυχεῖς.
308	σὺ δʼ εἶ τίς; ὥς σου τὴν τεκοῦσαν ὤλβισα.
309	τοῦ θεοῦ καλοῦμαι δοῦλος εἰμί τʼ, ὦ γύναι.
310	ἀνάθημα πόλεως, ἤ τινος πραθεὶς ὕπο;
311	οὐκ οἶδα πλὴν ἕν· Λοξίου κεκλήμεθα.
312	ἡμεῖς σʼ ἄρʼ αὖθις, ὦ ξένʼ, ἀντοικτίρομεν.
313	ὡς μὴ εἰδόθʼ ἥτις μʼ ἔτεκεν ἐξ ὅτου τʼ ἔφυν.
314	ναοῖσι δʼ οἰκεῖς τοισίδʼ ἢ κατὰ στέγας;
315	ἅπαν θεοῦ μοι δῶμʼ, ἵνʼ ἂν λάβῃ μʼ ὕπνος.
316	παῖς δʼ ὢν ἀφίκου ναὸν ἢ νεανίας;
317	βρέφος λέγουσιν οἱ δοκοῦντες εἰδέναι.
318	καὶ τίς γάλακτί σʼ ἐξέθρεψε Δελφίδων;
319	οὐπώποτʼ ἔγνων μαστόν· ἣ δʼ ἔθρεψέ με 
320	τίς, ὦ ταλαίπωρʼ; ὡς νοσοῦσʼ ηὗρον νόσους.
321	Φοίβου προφῆτις, μητέρʼ ὣς νομίζομεν.
322	ἐς δʼ ἄνδρʼ ἀφίκου τίνα τροφὴν κεκτημένος;
323	βωμοί μʼ ἔφερβον οὑπιών τʼ ἀεὶ ξένος.
324	τάλαινά σʼ ἡ τεκοῦσα· τίς ποτʼ ἦν ἄρα;
325	ἀδίκημά του γυναικὸς ἐγενόμην ἴσως.
326	ἔχεις δὲ βίοτον· εὖ γὰρ ἤσκησαι πέπλοις.
327	τοῖς τοῦ θεοῦ κοσμούμεθʼ, ᾧ δουλεύομεν.
328	οὐδʼ ᾖξας εἰς ἔρευναν ἐξευρεῖν γονάς;
329	ἔχω γὰρ οὐδέν, ὦ γύναι, τεκμήριον.
330	φεῦ·
330a	πέπονθέ τις σῇ μητρὶ ταὔτʼ ἄλλη γυνή.
331	τίς; εἰ πόνου μοι ξυλλάβοι, χαίροιμεν ἄν.
332	ἧς οὕνεκʼ ἦλθον δεῦρο πρὶν πόσιν μολεῖν.
333	ποῖόν τι χρῄζουσʼ; ὡς ὑπουργήσω, γύναι.
334	μάντευμα κρυπτὸν δεομένη Φοίβου μαθεῖν.
335	λέγοις ἄν· ἡμεῖς τἄλλα προξενήσομεν.
336	ἄκουε δὴ τὸν μῦθον. — ἀλλʼ αἰδούμεθα.
337	οὔ τἄρα πράξεις οὐδέν· ἀργὸς ἡ θεός.
338	Φοίβῳ μιγῆναί φησί τις φίλων ἐμῶν.
339	Φοίβῳ γυνὴ γεγῶσα; μὴ λέγʼ, ὦ ξένη.
340	καὶ παῖδά γʼ ἔτεκε τῷ θεῷ λάθρα πατρός.
341	οὐκ ἔστιν· ἀνδρὸς ἀδικίαν αἰσχύνεται.
342	οὔ φησιν αὐτή, καὶ πέπονθεν ἄθλια.
343	τί χρῆμα δράσασʼ, εἰ θεῷ συνεζύγη;
344	τὸν παῖδʼ ὃν ἔτεκεν ἐξέθηκε δωμάτων.
345	ὁ δʼ ἐκτεθεὶς παῖς ποῦ ʼστιν; εἰσορᾷ φάος;
346	οὐκ οἶδεν οὐδείς. ταῦτα καὶ μαντεύομαι.
347	εἰ δʼ οὐκέτʼ ἔστι, τίνι τρόπῳ διεφθάρη;
348	θῆράς σφε τὸν δύστηνον ἐλπίζει κτανεῖν.
349	ποίῳ τόδʼ ἔγνω χρωμένη τεκμηρίῳ;
350	ἐλθοῦσʼ ἵνʼ αὐτὸν ἐξέθηκʼ οὐχ ηὗρʼ ἔτι.
351	ἦν δὲ σταλαγμὸς ἐν στίβῳ τις αἵματος;
352	οὔ φησι. καίτοι πόλλʼ ἐπεστράφη πέδον.
353	χρόνος δὲ τίς τῷ παιδὶ διαπεπραγμένῳ;
354	σοὶ ταὐτὸν ἥβης, εἴπερ, εἶχεν ἂν μέτρον.
355	ἀδικεῖ νιν ὁ θεός· ἡ τεκοῦσα δʼ ἀθλία.
356	οὔκουν ἔτʼ ἄλλον γʼ ὕστερον τίκτει γόνον.
357	τί δʼ, εἰ λάθρα νιν Φοῖβος ἐκτρέφει λαβών;
358	τὰ κοινὰ χαίρων οὐ δίκαια δρᾷ μόνος.
359	οἴμοι· προσῳδὸς ἡ τύχη τὠμῷ πάθει.
360	καὶ σέ, ὦ ξένʼ, οἶμαι μητέρʼ ἀθλίαν ποθεῖν.
361	καὶ μή γʼ ἐπʼ οἶκτόν μʼ ἔξαγʼ οὗ ʼλελήσμεθα.
362	σιγῶ· πέραινε δʼ ὧν σʼ ἀνιστορῶ πέρι.
363	οἶσθʼ οὖν ὃ κάμνει τοῦ λόγου μάλιστά σοι;
364	τί δʼ οὐκ ἐκείνῃ τῇ ταλαιπώρῳ νοσεῖ;
365	πῶς ὁ θεὸς ὃ λαθεῖν βούλεται μαντεύσεται;
366	εἴπερ καθίζει τρίποδα κοινὸν Ἑλλάδος.
367	αἰσχύνεται τὸ πρᾶγμα· μὴ ʼξέλεγχέ νιν.
368	ἀλγύνεται δέ γʼ ἡ παθοῦσα τῇ τύχῃ.
369	οὐκ ἔστιν ὅστις σοι προφητεύσει τάδε.
370	ἐν τοῖς γὰρ αὑτοῦ δώμασιν κακὸς φανεὶς
371	Φοῖβος δικαίως τὸν θεμιστεύοντά σοι
372	δράσειεν ἄν τι πῆμα. ἀπαλλάσσου, γύναι.
373	τῷ γὰρ θεῷ τἀναντίʼ οὐ μαντευτέον.
374	ἐς γὰρ τοσοῦτον ἀμαθίας ἔλθοιμεν ἄν,
375	εἰ τοὺς θεοὺς ἄκοντας ἐκπονήσομεν
376	φράζειν ἃ μὴ θέλουσιν, ἢ προβωμίοις
377	σφαγαῖσι μήλων ἢ διʼ οἰωνῶν πτεροῖς.
378	ἃν γὰρ βίᾳ σπεύδωμεν ἀκόντων θεῶν,
379	ἄκοντα κεκτήμεσθα τἀγάθʼ, ὦ γύναι·
380	ἃ δʼ ἂν διδῶσʼ ἑκόντες, ὠφελούμεθα.
381	πολλαί γε πολλοῖς εἰσι συμφοραὶ βροτῶν,
382	μορφαὶ δὲ διαφέρουσιν· ἓν δʼ ἂν εὐτυχὲς
