0	
383	μόλις ποτʼ ἐξεύροι τις ἀνθρώπων βίῳ.
384	ὦ Φοῖβε, κἀκεῖ κἀνθάδʼ οὐ δίκαιος εἶ
385	ἐς τὴν ἀποῦσαν, ἧς πάρεισιν οἱ λόγοι·
386	ὃς οὔτʼ ἔσωσας τὸν σὸν ὃν σῶσαί σʼ ἐχρῆν,
387	οὔθʼ ἱστορούσῃ μητρὶ μάντις ὢν ἐρεῖς,
388	ὡς, εἰ μὲν οὐκέτʼ ἔστιν, ὀγκωθῇ τάφῳ,
389	εἰ δʼ ἔστιν 
390	ἀλλʼ ἐᾶν χρὴ τάδʼ, εἰ πρὸς τοῦ θεοῦ
391	κωλυόμεσθα μὴ μαθεῖν ἃ βούλομαι.
392	ἀλλʼ, ὦ ξένʼ, εἰσορῶ γὰρ εὐγενῆ πόσιν
393	Ξοῦθον πέλας δὴ τόνδε, τὰς Τροφωνίου
394	λιπόντα θαλάμας, τοὺς λελεγμένους λόγους
395	σίγα πρὸς ἄνδρα, μή τινʼ αἰσχύνην λάβω
396	διακονοῦσα κρυπτά, καὶ προβῇ λόγος
397	οὐχ ᾗπερ ἡμεῖς αὐτὸν ἐξειλίσσομεν.
398	τὰ γὰρ γυναικῶν δυσχερῆ πρὸς ἄρσενας,
399	κἀν ταῖς κακαῖσιν ἁγαθαὶ μεμειγμέναι
400	μισούμεθʼ· οὕτω δυστυχεῖς πεφύκαμεν.
401	πρῶτον μὲν ὁ θεὸς τῶν ἐμῶν προσφθεγμάτων
402	λαβὼν ἀπαρχὰς χαιρέτω, σύ τʼ, ὦ γύναι.
403	μῶν χρόνιος ἐλθών σʼ ἐξέπληξʼ ὀρρωδίᾳ;
404	οὐδέν γʼ· ἀφίκου δʼ ἐς μέριμναν. ἀλλά μοι
405	λέξον, τί θέσπισμʼ ἐκ Τροφωνίου φέρεις,
406	παίδων ὅπως νῷν σπέρμα συγκραθήσεται;
407	οὐκ ἠξίωσε τοῦ θεοῦ προλαμβάνειν
408	μαντεύμαθʼ· ἓν δʼ οὖν εἶπεν· οὐκ ἄπαιδά με
409	πρὸς οἶκον ἥξειν οὐδὲ σὲ ἐκ χρηστηρίων.
410	ὦ πότνια Φοίβου μῆτερ, εἰ γὰρ αἰσίως
411	ἔλθοιμεν, ἅ τε νῷν συμβόλαια πρόσθεν ἦν
412	ἐς παῖδα τὸν σόν, μεταπέσοι βελτίονα.
413	ἔσται τάδʼ· ἀλλὰ τίς προφητεύει θεοῦ;
414	ἡμεῖς τά γʼ ἔξω, τῶν ἔσω δʼ ἄλλοις μέλει,
415	οἳ πλησίον θάσσουσι τρίποδος, ὦ ξένε,
416	Δελφῶν ἀριστῆς, οὓς ἐκλήρωσεν πάλος.
417	καλῶς· ἔχω δὴ πάνθʼ ὅσων ἐχρῄζομεν.
418	στείχοιμʼ ἂν εἴσω· καὶ γάρ, ὡς ἐγὼ κλύω,
419	χρηστήριον πέπτωκε τοῖς ἐπήλυσι
420	κοινὸν πρὸ ναοῦ· βούλομαι δʼ ἐν ἡμέρᾳ
421	τῇδʼ — αἰσία γάρ — θεοῦ λαβεῖν μαντεύματα.
422	σὺ δʼ ἀμφὶ βωμούς, ὦ γύναι, δαφνηφόρους
423	λαβοῦσα κλῶνας, εὐτέκνους εὔχου θεοῖς
424	χρησμούς μʼ ἐνεγκεῖν ἐξ Ἀπόλλωνος δόμων.
425	ἔσται τάδʼ, ἔσται. Λοξίας δʼ ἐὰν θέλῃ
426	νῦν ἀλλὰ τὰς πρὶν ἀναλαβεῖν ἁμαρτίας,
427	ἅπας μὲν οὐ γένοιτʼ ἂν εἰς ἡμᾶς φίλος,
428	ὅσον δὲ χρῄζει — θεὸς γάρ ἐστι — δέξομαι.
429	τί ποτε λόγοισιν ἡ ξένη πρὸς τὸν θεὸν
430	κρυπτοῖσιν αἰεὶ λοιδοροῦσʼ αἰνίσσεται;
431	ἤτοι φιλοῦσά γʼ ἧς ὕπερ μαντεύεται,
432	ἢ καί τι σιγῶσʼ ὧν σιωπᾶσθαι χρεών;
433	ἀτὰρ θυγατρὸς τῆς Ἐρεχθέως τί μοι
434	μέλει; προσήκει γʼ οὐδέν. ἀλλὰ χρυσέαις
435	πρόχοισιν ἐλθὼν εἰς ἀπορραντήρια
436	δρόσον καθήσω. νουθετητέος δέ μοι
437	Φοῖβος, τί πάσχει· παρθένους βίᾳ γαμῶν
438	προδίδωσι; παῖδας ἐκτεκνούμενος λάθρᾳ
439	θνῄσκοντας ἀμελεῖ; μὴ σύ γʼ· ἀλλʼ, ἐπεὶ κρατεῖς,
440	ἀρετὰς δίωκε. καὶ γὰρ ὅστις ἂν βροτῶν
441	κακὸς πεφύκῃ, ζημιοῦσιν οἱ θεοί.
442	πῶς οὖν δίκαιον τοὺς νόμους ὑμᾶς βροτοῖς
443	γράψαντας, αὐτοὺς ἀνομίαν ὀφλισκάνειν;
444	εἰ δʼ — οὐ γὰρ ἔσται, τῷ λόγῳ δὲ χρήσομαι — 
445	δίκας βιαίων δώσετʼ ἀνθρώποις γάμων,
446	σὺ καὶ Ποσειδῶν Ζεύς θʼ ὃς οὐρανοῦ κρατεῖ,
447	ναοὺς τίνοντες ἀδικίας κενώσετε.
448	τὰς ἡδονὰς γὰρ τῆς προμηθίας πάρος
449	σπεύδοντες ἀδικεῖτʼ. οὐκέτʼ ἀνθρώπους κακῶς
450	λέγειν δίκαιον, εἰ τὰ τῶν θεῶν καλὰ
451	μιμούμεθʼ, ἀλλὰ τοὺς διδάσκοντας τάδε.
452	σὲ τὰν ὠδίνων λοχιᾶν
453	ἀνειλείθυιαν, ἐμὰν
454	Ἀθάναν, ἱκετεύω,
455	Προμηθεῖ Τιτᾶνι λοχευ-
456	θεῖσαν κατʼ ἀκροτάτας
457	κορυφᾶς Διός, ὦ μάκαιρα Νίκα,
458	μόλε Πύθιον οἶκον,
459	Ὀλύμπου χρυσέων θαλάμων
460	πταμένα πρὸς ἀγυιάς,
461	Φοιβήιος ἔνθα γᾶς
462	μεσσόμφαλος ἑστία
463	παρὰ χορευομένῳ τρίποδι
464	μαντεύματα κραίνει,
465	σὺ καὶ παῖς ἁ Λατογενής,
466	δύο θεαὶ δύο παρθένοι,
467	κασίγνηται σεμναὶ Φοίβου.
468	ἱκετεύσατε δʼ, ὦ κόραι,
469	τὸ παλαιὸν Ἐρεχθέως
470	γένος εὐτεκνίας χρονίου καθαροῖς
471	μαντεύμασι κῦρσαι.
472	ὑπερβαλλούσας γὰρ ἔχει
473	θνατοῖς εὐδαιμονίας
474	ἀκίνητον ἀφορμάν,
475	τέκνων οἷς ἂν καρποτρόφοι
476	λάμπωσιν ἐν θαλάμοις
477	πατρίοισι νεάνιδες ἧβαι,
478	διαδέκτορα πλοῦτον
479	ὡς ἕξοντες ἐκ πατέρων
480	ἑτέροις ἐπὶ τέκνοις.
481	ἀλκά τε γὰρ ἐν κακοῖς
482	σύν τʼ εὐτυχίαις φίλον,
483	δορί τε γᾷ πατρίᾳ φέρει
484	σωτήριον ἀλκάν.
485	ἐμοὶ μὲν πλούτου τε πάρος
486	βασιλικῶν τʼ εἶεν θαλάμων
487	τροφαὶ κήδειοι κεδνῶν γε τέκνων.
488	τὸν ἄπαιδα δʼ ἀποστυγῶ
489	βίον, ᾧ τε δοκεῖ ψέγω·
490	μετὰ δὲ κτεάνων μετρίων βιοτᾶς
491	εὔπαιδος ἐχοίμαν.
492	ὦ Πανὸς θακήματα καὶ
493	παραυλίζουσα πέτρα
494	μυχώδεσι Μακραῖς,
495	ἵνα χοροὺς στείβουσι ποδοῖν
496	Ἀγλαύρου κόραι τρίγονοι
497	στάδια χλοερὰ πρὸ Παλλάδος
498	ναῶν, συρίγγων
499	ὑπʼ αἰόλας ἰαχᾶς
500	ὕμνων, ὅτʼ ἀναλίοις
501	συρίζεις, ὦ Πάν,
502	τοῖς σοῖσιν ἐν ἄντροις,
503	ἵνα τεκοῦσά τις Φοίβῳ
504	παρθένος, ὦ μελέα, βρέφος,
504a	πτανοῖς ἐξόρισεν θοίναν
505	θηρσί τε φοινίαν δαῖτα, πικρῶν γάμων
506	ὕβριν· οὔτʼ ἐπὶ κερκίσιν οὔτε λόγοις
507	φάτιν ἄιον εὐτυχίας μετέχειν
508	θεόθεν τέκνα θνατοῖς.
510	πρόσπολοι γυναῖκες, αἳ τῶνδʼ ἀμφὶ κρηπῖδας δόμων
511	θυοδόκων φρούρημʼ ἔχουσαι δεσπότιν φυλάσσετε,
512	ἐκλέλοιπʼ ἤδη τὸν ἱερὸν τρίποδα καὶ χρηστήριον
513	Ξοῦθος, ἢ μίμνει κατʼ οἶκον ἱστορῶν ἀπαιδίαν;
514	ἐν δόμοις ἔστʼ, ὦ ξένʼ· οὔπω δῶμʼ ὑπερβαίνει τόδε.
515	ὡς δʼ ἐπʼ ἐξόδοισιν ὄντος, τῶνδʼ ἀκούομεν πυλῶν
516	δοῦπον, ἐξιόντα τʼ ἤδη δεσπότην ὁρᾶν πάρα.
517	ὦ τέκνον, χαῖρʼ· ἡ γὰρ ἀρχὴ τοῦ λόγου πρέπουσά μοι.
518	χαίρομεν· σὺ δʼ εὖ φρόνει γε, καὶ δύʼ ὄντʼ εὖ πράξομεν.
519	δὸς χερὸς φίλημά μοι σῆς σώματός τʼ ἀμφιπτυχάς.
520	εὖ φρονεῖς μέν; ἤ σʼ ἔμηνε θεοῦ τις, ὦ ξένε, βλάβη;
521	σωφρονῶ· τὰ φίλταθʼ εὑρὼν οὐ φυγεῖν ἐφίεμαι.
522	παῦε, μὴ ψαύσας τὰ τοῦ θεοῦ στέμματα ῥήξῃς χερί.
523	ἅψομαι· κοὐ ῥυσιάζω, τἀμὰ δʼ εὑρίσκω φίλα.
524	οὐκ ἀπαλλάξῃ, πρὶν εἴσω τόξα πλευμόνων λαβεῖν;
525	ὡς τί δὴ φεύγεις με; σαυτοῦ γνωρίσας τὰ φίλτατα — 
526	οὐ φιλῶ φρενοῦν ἀμούσους καὶ μεμηνότας ξένους.
527	κτεῖνε καὶ πίμπρη· πατρὸς γάρ, ἢν κτάνῃς, ἔσῃ φονεύς.
528	ποῦ δέ μοι πατὴρ σύ; ταῦτʼ οὖν οὐ γέλως κλύειν ἐμοῦ;
529	οὔ· τρέχων ὁ μῦθος ἄν σοι τἀμὰ σημήνειεν ἄν.
530	καὶ τί μοι λέξεις;
530b	πατὴρ σός εἰμι καὶ σὺ παῖς ἐμός.
531	τίς λέγει τάδε;
531b	ὅς σʼ ἔθρεψεν ὄντα Λοξίας ἐμόν.
532	μαρτυρεῖς σαυτῷ.
532b	τὰ τοῦ θεοῦ γʼ ἐκμαθὼν χρηστήρια.
533	ἐσφάλης αἴνιγμʼ ἀκούσας.
533b	οὐκ ἄρʼ ὄρθʼ ἀκούομεν.
534	ὁ δὲ λόγος τίς ἐστι Φοίβου;
534b	τὸν συναντήσαντά μοι — 
535	τίνα συνάντησιν;
535b	δόμων τῶνδʼ ἐξιόντι τοῦ θεοῦ
536	συμφορᾶς τίνος κυρῆσαι;
536b	παῖδʼ ἐμὸν πεφυκέναι.
537	σὸν γεγῶτʼ, ἢ δῶρον ἄλλως;
537b	δῶρον, ὄντα δʼ ἐξ ἐμοῦ.
538	πρῶτα δῆτʼ ἐμοὶ ξυνάπτεις πόδα σόν;
538b	οὐκ ἄλλῳ, τέκνον.
539	ἡ τύχη πόθεν ποθʼ ἥκει;
539b	δύο μίαν θαυμάζομεν.
540	ἔα. τίνος δέ σοι πέφυκα μητρός;
540b	οὐκ ἔχω φράσαι.
541	οὐδὲ Φοῖβος εἶπε;
541b	τερφθεὶς τοῦτο, κεῖνʼ οὐκ ἠρόμην.
542	γῆς ἄρʼ ἐκπέφυκα μητρός.
542b	οὐ πέδον τίκτει τέκνα.
543	πῶς ἂν οὖν εἴην σός;
543b	οὐκ οἶδʼ, ἀναφέρω δʼ ἐς τὸν θεόν.
544	φέρε λόγων ἁψώμεθʼ ἄλλων.
544b	ταῦτʼ ἀμείνονʼ, ὦ τέκνον.
545	ἦλθες ἐς νόθον τι λέκτρον;
545b	μωρίᾳ γε τοῦ νέου.
546	πρὶν κόρην λαβεῖν Ἐρεχθέως;
546b	οὐ γὰρ ὕστερόν γέ πω.
547	ἆρα δῆτʼ ἐκεῖ μʼ ἔφυσας;
547b	τῷ χρόνῳ γε συντρέχει.
548	κᾆτα πῶς ἀφικόμεσθα δεῦρο — 
548b	ταῦτʼ ἀμηχανῶ.
549	διὰ μακρᾶς ἐλθὼν κελεύθου;
549b	τοῦτο κἄμʼ ἀπαιολεῖ.
550	Πυθίαν δʼ ἦλθες πέτραν πρίν;
550b	ἐς φανάς γε Βακχίου.
551	προξένων δʼ ἔν του κατέσχες;
551b	ὅς με Δελφίσιν κόραις 
552	ἐθιάσευσʼ, ἢ πῶς τάδʼ αὐδᾷς;
552b	Μαινάσιν γε Βακχίου.
553	ἔμφρονʼ ἢ κάτοινον ὄντα;
553b	Βακχίου πρὸς ἡδοναῖς.
554	τοῦτʼ ἐκεῖνʼ ἵνʼ ἐσπάρημεν.
554b	ὁ πότμος ἐξηῦρεν, τέκνον.
555	πῶς δʼ ἀφικόμεσθα ναούς;
555b	ἔκβολον κόρης ἴσως.
556	ἐκπεφεύγαμεν τὸ δοῦλον.
556b	πατέρα νυν δέχου, τέκνον.
557	τῷ θεῷ γοῦν οὐκ ἀπιστεῖν εἰκός.
557b	εὖ φρονεῖς ἄρα.
558	καὶ τί βουλόμεσθά γʼ ἄλλο — 
558b	νῦν ὁρᾷς ἃ χρή σʼ ὁρᾶν.
559	ἢ Διὸς παιδὸς γενέσθαι παῖς;
559b	ὃ σοί γε γίγνεται.
560	ἦ θίγω δῆθʼ οἵ μʼ ἔφυσαν;
560b	πιθόμενός γε τῷ θεῷ.
561	χαῖρέ μοι, πάτερ — 
561b	φίλον γε φθέγμʼ ἐδεξάμην τόδε.
562	ἡμέρα θʼ ἡ νῦν παροῦσα.
562b	μακάριόν γʼ ἔθηκέ με.
563	ὦ φίλη μῆτερ, πότʼ ἆρα καὶ σὸν ὄψομαι δέμας;
564	νῦν ποθῶ σε μᾶλλον ἢ πρίν, ἥτις εἶ ποτʼ, εἰσιδεῖν.
565	ἀλλʼ ἴσως τέθνηκας, ἡμεῖς δʼ οὐδὲν ἂν δυναίμεθα.
566	κοιναὶ μὲν ἡμῖν δωμάτων εὐπραξίαι·
567	ὅμως δὲ καὶ δέσποιναν ἐς τέκνʼ εὐτυχεῖν
568	ἐβουλόμην ἂν τούς τʼ Ἐρεχθέως δόμους.
569	ὦ τέκνον, ἐς μὲν σὴν ἀνεύρεσιν θεὸς
570	ὀρθῶς ἔκρανε, καὶ συνῆψʼ ἐμοί τε σέ,
571	σύ τʼ αὖ τὰ φίλταθʼ ηὗρες οὐκ εἰδὼς πάρος.
572	ὃ δʼ ᾖξας ὀρθῶς, τοῦτο κἄμʼ ἔχει πόθος,
573	ὅπως σύ τʼ, ὦ παῖ, μητέρʼ εὑρήσεις σέθεν,
574	ἐγώ θʼ ὁποίας μοι γυναικὸς ἐξέφυς.
575	χρόνῳ δὲ δόντες ταῦτʼ ἴσως εὕροιμεν ἄν.
576	ἀλλʼ ἐκλιπὼν θεοῦ δάπεδʼ ἀλητείαν τε σὴν
577	ἐς τὰς Ἀθήνας στεῖχε κοινόφρων πατρί,
578	οὗ σʼ ὄλβιον μὲν σκῆπτρον ἀναμένει πατρός,
579	πολὺς δὲ πλοῦτος· οὐδὲ θάτερον νοσῶν
580	δυοῖν κεκλήσῃ δυσγενὴς πένης θʼ ἅμα,
581	ἀλλʼ εὐγενής τε καὶ πολυκτήμων βίου.
582	σιγᾷς; τί πρὸς γῆν ὄμμα σὸν βαλὼν ἔχεις;
583	ἐς φροντίδας δʼ ἀπῆλθες, ἐκ δὲ χαρμονῆς
584	πάλιν μεταστὰς δεῖμα προσβάλλεις πατρί.
585	οὐ ταὐτὸν εἶδος φαίνεται τῶν πραγμάτων
586	πρόσωθεν ὄντων ἐγγύθεν θʼ ὁρωμένων.
587	ἐγὼ δὲ τὴν μὲν συμφορὰν ἀσπάζομαι,
588	πατέρα σʼ ἀνευρών· ὧν δὲ γιγνώσκω, πάτερ,
589	ἄκουσον. εἶναί φασι τὰς αὐτόχθονας
590	κλεινὰς Ἀθήνας οὐκ ἐπείσακτον γένος,
591	ἵνʼ ἐσπεσοῦμαι δύο νόσω κεκτημένος,
592	πατρός τʼ ἐπακτοῦ καὐτὸς ὢν νοθαγενής.
593	καὶ τοῦτʼ ἔχων τοὔνειδος, ἀσθενὴς μὲν ὤν — 
594	μηδὲν καὶ οὐδὲν ὢν κεκλήσομαι·
595	ἢν δʼ ἐς τὸ πρῶτον πόλεος ὁρμηθεὶς ζυγὸν
596	ζητῶ τις εἶναι, τῶν μὲν ἀδυνάτων ὕπο
597	μισησόμεσθα· λυπρὰ γὰρ τὰ κρείσσονα·
598	ὅσοι δέ, χρηστοὶ δυνάμενοί τʼ εἶναι σοφοί,
599	σιγῶσι κοὐ σπεύδουσιν ἐς τὰ πράγματα,
600	γέλωτʼ ἐν αὐτοῖς μωρίαν τε λήψομαι
601	οὐχ ἡσυχάζων ἐν πόλει φόβου πλέᾳ.
602	τῶν δʼ αὖ λογίων τε χρωμένων τε τῇ πόλει
603	ἐς ἀξίωμα βὰς πλέον φρουρήσομαι
604	ψήφοισιν. οὕτω γὰρ τάδʼ, ὦ πάτερ, φιλεῖ·
605	οἳ τὰς πόλεις ἔχουσι κἀξιώματα,
606	τοῖς ἀνθαμίλλοις εἰσὶ πολεμιώτατοι.
607	ἐλθὼν δʼ ἐς οἶκον ἀλλότριον ἔπηλυς ὢν
608	γυναῖκά θʼ ὡς ἄτεκνον, ἣ κοινουμένη
609	τὰς συμφοράς σοι πρόσθεν, ἀπολαχοῦσα νῦν
610	αὐτὴ καθʼ αὑτὴν τὴν τύχην οἴσει πικρῶς,
611	πῶς οὐχ ὑπʼ αὐτῆς εἰκότως μισήσομαι,
612	ὅταν παραστῶ σοὶ μὲν ἐγγύθεν ποδός,
613	ἣ δʼ οὖσʼ ἄτεκνος τὰ σὰ φίλʼ εἰσορᾷ πικρῶς,
614	κᾆτʼ ἢ προδοὺς σύ μʼ ἐς δάμαρτα σὴν βλέπῃς
615	ἢ τἀμὰ τιμῶν δῶμα συγχέας ἔχῃς;
616	ὅσας σφαγὰς δὴ φαρμάκων τε θανασίμων
617	γυναῖκες ηὗρον ἀνδράσιν διαφθοράς.
618	ἄλλως τε τὴν σὴν ἄλοχον οἰκτίρω, πάτερ,
619	ἄπαιδα γηράσκουσαν· οὐ γὰρ ἀξία
620	πατέρων ἀπʼ ἐσθλῶν οὖσʼ ἀπαιδίᾳ νοσεῖν.
621	τυραννίδος δὲ τῆς μάτην αἰνουμένης
622	τὸ μὲν πρόσωπον ἡδύ, τἀν δόμοισι δὲ
623	λυπηρά· τίς γὰρ μακάριος, τίς εὐτυχής,
624	ὅστις δεδοικὼς καὶ παραβλέπων βίον
625	αἰῶνα τείνει; δημότης ἂν εὐτυχὴς
626	ζῆν ἂν θέλοιμι μᾶλλον ἢ τύραννος ὤν,
627	ᾧ τοὺς πονηροὺς ἡδονὴ φίλους ἔχειν,
628	ἐσθλοὺς δὲ μισεῖ κατθανεῖν φοβούμενος.
629	εἴποις ἂν ὡς ὁ χρυσὸς ἐκνικᾷ τάδε,
630	πλουτεῖν τε τερπνόν; οὐ φιλῶ ψόφους κλύειν
631	ἐν χερσὶ σῴζων ὄλβον οὐδʼ ἔχειν πόνους·
632	εἴη γʼ ἐμοὶ μὲν μέτρια μὴ λυπουμένῳ.
633	ἃ δʼ ἐνθάδʼ εἶχον ἀγάθʼ ἄκουσόν μου, πάτερ·
634	τὴν φιλτάτην μὲν πρῶτον ἀνθρώπῳ σχολὴν
635	ὄχλον τε μέτριον, οὐδέ μʼ ἐξέπληξʼ ὁδοῦ
636	πονηρὸς οὐδείς· κεῖνο δʼ οὐκ ἀνασχετόν,
637	εἴκειν ὁδοῦ χαλῶντα τοῖς κακίοσιν.
638	θεῶν δʼ ἐν εὐχαῖς ἢ γόοισιν ἦ βροτῶν,
639	ὑπηρετῶν χαίρουσιν, οὐ γοωμένοις.
640	καὶ τοὺς μὲν ἐξέπεμπον, οἳ δʼ ἧκον ξένοι,
641	ὥσθʼ ἡδὺς αἰεὶ καινὸς ἐν καινοῖσιν ἦ.
642	ὃ δʼ εὐκτὸν ἀνθρώποισι, κἂν ἄκουσιν ᾖ,
643	δίκαιον εἶναί μʼ ὁ νόμος ἡ φύσις θʼ ἅμα
644	παρεῖχε τῷ θεῷ. ταῦτα συννοούμενος
645	κρείσσω νομίζω τἀνθάδʼ ἢ τἀκεῖ, πάτερ.
646	ἔα δʼ ἔμʼ αὐτοῦ ζῆν· ἴση γὰρ ἡ χάρις,
647	μεγάλοισι χαίρειν σμικρά θʼ ἡδέως ἔχειν.
648	καλῶς ἔλεξας, εἴπερ οὓς ἐγὼ φιλῶ
649	ἐν τοῖσι σοῖσιν εὐτυχήσουσιν φίλοις.
650	παῦσαι λόγων τῶνδʼ, εὐτυχεῖν δʼ ἐπίστασο·
651	θέλω γὰρ οὗπέρ σʼ ηὗρον ἄρξασθαι, τέκνον,
652	κοινῆς τραπέζης, δαῖτα πρὸς κοινὴν πεσών,
653	θῦσαί θʼ ἅ σου πρὶν γενέθλιʼ οὐκ ἐθύσαμεν.
654	καὶ νῦν μὲν ὡς δὴ ξένον ἄγων σʼ ἐφέστιον
655	δείπνοισι τέρψω, τῆς δʼ Ἀθηναίων χθονὸς
656	ἄξω θεατὴν δῆθεν, ὡς οὐκ ὄντʼ ἐμόν.
657	καὶ γὰρ γυναῖκα τὴν ἐμὴν οὐ βούλομαι
658	λυπεῖν ἄτεκνον οὖσαν αὐτὸς εὐτυχῶν.
659	χρόνῳ δὲ καιρὸν λαμβάνων προσάξομαι
660	δάμαρτʼ ἐᾶν σε σκῆπτρα τἄμʼ ἔχειν χθονός.
661	Ἴωνα δʼ ὀνομάζω σε τῇ τύχῃ πρέπον,
662	ὁθούνεκʼ ἀδύτων ἐξιόντι μοι θεοῦ
663	ἴχνος συνῆψας πρῶτος. ἀλλὰ τῶν φίλων
664	πλήρωμʼ ἀθροίσας βουθύτῳ σὺν ἡδονῇ
665	πρόσειπε, μέλλων Δελφίδʼ ἐκλιπεῖν πόλιν.
666	ὑμῖν δὲ σιγᾶν, δμωΐδες, λέγω τάδε,
667	ἢ θάνατον εἰπούσαισι πρὸς δάμαρτʼ ἐμήν.
668	στείχοιμʼ ἄν. ἓν δὲ τῆς τύχης ἄπεστί μοι·
669	εἰ μὴ γὰρ ἥτις μʼ ἔτεκεν εὑρήσω, πάτερ,
670	ἀβίωτον ἡμῖν. εἰ δʼ ἐπεύξασθαι χρεών,
671	ἐκ τῶν Ἀθηνῶν μʼ ἡ τεκοῦσʼ εἴη γυνή,
672	ὥς μοι γένηται μητρόθεν παρρησία.
673	καθαρὰν γὰρ ἤν τις ἐς πόλιν πέσῃ ξένος,
674	κἂν τοῖς λόγοισιν ἀστὸς ᾖ, τό γε στόμα
675	δοῦλον πέπαται κοὐκ ἔχει παρρησίαν.
676	ὁρῶ δάκρυα καὶ πενθίμους
677	ἀλαλαγὰς στεναγμάτων τʼ ἐσβολάς,
678	ὅταν ἐμὰ τύραννος εὐπαιδίαν
679	πόσιν ἔχοντʼ εἰδῇ,
680	αὐτὴ δʼ ἄπαις ᾖ καὶ λελειμμένη τέκνων.
681	τίνʼ, ὦ παῖ πρόμαντι Λατοῦς, ἔχρη-
682	σας ὑμνῳδίαν;
683	πόθεν ὁ παῖς ὅδʼ ἀμφὶ ναοὺς σέθεν
684	τρόφιμος ἐξέβα; γυναικῶν τίνος;
685	οὐ γάρ με σαίνει θέσφατα μή τινʼ ἔχῃ δόλον.
688	δειμαίνω συμφοράν,
689	ἐφʼ ὅ ποτε βάσεται.
690	ἄτοπος ἄτοπα γὰρ δίδωσί μοι,
691	τὸ δʼ ἔτʼ εὔφημʼ ἔχει,
692	δόλον τύχαν θʼ, ὁ παῖς 
693	ἄλλων τραφεὶς ἐξ αἱμάτων.
694	τίς οὐ τάδε ξυνοίσεται;
695	— φίλαι, πότερʼ ἐμᾷ δεσποίνᾳ
696	τάδε τορῶς ἐς οὖς γεγωνήσομεν;
697	πόσιν, ἐν ᾧ τὰ πάντʼ ἔχουσʼ ἐλπίδων
698	μέτοχος ἦν, τλάμων, 
699	— νῦν δʼ ἣ μὲν ἔρρει συμφοραῖς, ὃ δʼ εὐτυχεῖ.
700	— πολιὸν ἐσπεσοῦσα γῆρας, πόσις δʼ 
701	— ἀτίετος φίλων.
702	— μέλεος, ὃς θυραῖος ἐλθὼν δόμους,
703	μέγαν ἐς ὄλβον, οὐκ ἴσωσεν τύχης 
704	(— ὄλοιτʼ, ὄλοιτο) πότνιαν ἐξαπαφὼν ἐμάν.
705	— καὶ θεοῖσιν μὴ τύχοι
706	καλλίφλογα πέλανον ἐπὶ
707	πυρὶ καθαγνίσας· τὸ δʼ ἐμὸν εἴσεται,
708	ὅσον ἀμᾶς ἔφυν
710	τυραννίδος φίλα.
711	— ἦ δὴ πέλας δείπνων κυρεῖ
713	παῖς καὶ πατὴρ νέος νέων.
714	ἰὼ δειράδες Παρνασοῦ πέτρας
715	ἔχουσαι σκόπελον οὐράνιόν θʼ ἕδραν,
716	ἵνα Βάκχιος ἀμφιπύρους ἀνέχων πεύκας
717	λαιψηρὰ πηδᾷ νυκτιπόλοις ἅμα σὺν Βάκχαις,
719	μή ποτʼ εἰς ἐμὰν πόλιν ἵκοιθʼ ὁ παῖς,
720	νέαν δʼ ἁμέραν ἀπολιπὼν θάνοι.
721	στενομένα γὰρ ἂν πόλις ἔχοι σκῆψιν
722	ξενικὸν ἐσβολὰν 
722a	
723	ἁλίσας ὁ πάρος ἀρχαγὸς ὢν
724	Ἐρεχθεὺς ἄναξ.
725	ὦ πρέσβυ παιδαγώγʼ Ἐρεχθέως πατρὸς
726	τοὐμοῦ ποτʼ ὄντος, ἡνίκʼ ἦν ἔτʼ ἐν φάει,
727	ἔπαιρε σαυτὸν πρὸς θεοῦ χρηστήρια,
728	ὥς μοι συνησθῇς, εἴ τι Λοξίας ἄναξ
729	θέσπισμα παίδων ἐς γονὰς ἐφθέγξατο.
730	σὺν τοῖς φίλοις γὰρ ἡδὺ μὲν πράσσειν καλῶς·
731	ἃ μὴ γένοιτο δʼ, εἴ τι τυγχάνοι κακόν,
732	ἐς ὄμματʼ εὔνου φωτὸς ἐμβλέψαι γλυκύ.
733	ἐγὼ δέ σʼ, ὥσπερ καὶ σὺ πατέρʼ ἐμόν ποτε,
734	δέσποινʼ ὅμως οὖσʼ ἀντικηδεύω πατρός.
735	ὦ θύγατερ, ἄξιʼ ἀξίων γεννητόρων
736	ἤθη φυλάσσεις, κοὐ καταισχύνασʼ ἔχεις
737	τοὺς σοὺς παλαιούς, ἐκγόνους αὐτόχθονας.
738	ἕλχʼ ἕλκε πρὸς μέλαθρα καὶ κόμιζέ με.
